7.202015 ARP, Request who-has 192.168.1.1 (ff:ff:ff:ff:ff:ff) tell 192.168.1.5, length 50
7.202015 ARP, Reply 192.168.1.1 is-at 00:00:00:00:00:01, length 50
7.202040 IP 203.82.48.2.49153 > 192.168.1.1.80: Flags [S], seq 0, win 65535, length 0
7.202040 ARP, Request who-has 192.168.1.5 (ff:ff:ff:ff:ff:ff) tell 192.168.1.1, length 50
7.202084 IP 203.82.48.2.49154 > 192.168.1.1.80: Flags [S], seq 0, win 65535, length 0
7.202097 IP 203.82.48.2.49155 > 192.168.1.1.80: Flags [S], seq 0, win 65535, length 0
7.202112 ARP, Reply 192.168.1.5 is-at 00:00:00:00:00:05, length 50
7.202112 IP 192.168.1.1.80 > 203.82.48.2.49153: Flags [S.], seq 0, ack 1, win 65535, length 0
7.202119 IP 192.168.1.1.80 > 203.82.48.2.49154: Flags [S.], seq 0, ack 1, win 65535, length 0
7.202142 IP 192.168.1.1.80 > 203.82.48.2.49155: Flags [S.], seq 0, ack 1, win 65535, length 0
7.206143 IP 203.82.48.2.49153 > 192.168.1.1.80: Flags [.], ack 1, win 65535, length 0
7.206143 IP 192.168.1.1.49153 > 203.82.48.1.9: UDP, length 3
7.206167 IP 203.82.48.2.49154 > 192.168.1.1.80: Flags [.], ack 1, win 65535, length 0
7.206167 IP 192.168.1.1.49153 > 203.82.48.1.9: UDP, length 3
7.206202 IP 203.82.48.2.49155 > 192.168.1.1.80: Flags [.], ack 1, win 65535, length 0
7.206202 IP 192.168.1.1.49153 > 203.82.48.1.9: UDP, length 3
7.210288 IP 203.82.48.2.49153 > 192.168.1.1.80: Flags [.], seq 1:513, ack 1, win 65535, length 512
7.210288 IP 192.168.1.1.80 > 203.82.48.2.49153: Flags [.], ack 513, win 65535, length 0
7.210353 IP 203.82.48.2.49154 > 192.168.1.1.80: Flags [.], seq 1:513, ack 1, win 65535, length 512
7.210353 IP 192.168.1.1.80 > 203.82.48.2.49154: Flags [.], ack 513, win 65535, length 0
7.210442 IP 203.82.48.2.49155 > 192.168.1.1.80: Flags [.], seq 1:513, ack 1, win 65535, length 512
7.210442 IP 192.168.1.1.80 > 203.82.48.2.49155: Flags [.], ack 513, win 65535, length 0
7.218480 IP 203.82.48.2.49153 > 192.168.1.1.80: Flags [.], seq 513:1025, ack 1, win 65535, length 512
7.218544 IP 203.82.48.2.49154 > 192.168.1.1.80: Flags [.], seq 513:1025, ack 1, win 65535, length 512
7.218598 IP 203.82.48.2.49155 > 192.168.1.1.80: Flags [.], seq 513:1025, ack 1, win 65535, length 512
7.226672 IP 203.82.48.2.49153 > 192.168.1.1.80: Flags [.], seq 1025:1537, ack 1, win 65535, length 512
7.226672 IP 192.168.1.1.80 > 203.82.48.2.49153: Flags [.], ack 1537, win 65535, length 0
7.226737 IP 203.82.48.2.49154 > 192.168.1.1.80: Flags [.], seq 1025:1537, ack 1, win 65535, length 512
7.226737 IP 192.168.1.1.80 > 203.82.48.2.49154: Flags [.], ack 1537, win 65535, length 0
7.226804 IP 203.82.48.2.49155 > 192.168.1.1.80: Flags [.], seq 1025:1537, ack 1, win 65535, length 512
7.226804 IP 192.168.1.1.80 > 203.82.48.2.49155: Flags [.], ack 1537, win 65535, length 0
7.234864 IP 203.82.48.2.49153 > 192.168.1.1.80: Flags [.], seq 1537:2049, ack 1, win 65535, length 512
7.234930 IP 203.82.48.2.49154 > 192.168.1.1.80: Flags [.], seq 1537:2049, ack 1, win 65535, length 512
7.234983 IP 203.82.48.2.49155 > 192.168.1.1.80: Flags [.], seq 1537:2049, ack 1, win 65535, length 512
7.243056 IP 203.82.48.2.49153 > 192.168.1.1.80: Flags [.], seq 2049:2561, ack 1, win 65535, length 512
7.243056 IP 192.168.1.1.80 > 203.82.48.2.49153: Flags [.], ack 2561, win 65535, length 0
7.243142 IP 203.82.48.2.49154 > 192.168.1.1.80: Flags [.], seq 2049:2561, ack 1, win 65535, length 512
7.243142 IP 192.168.1.1.80 > 203.82.48.2.49154: Flags [.], ack 2561, win 65535, length 0
7.243234 IP 203.82.48.2.49155 > 192.168.1.1.80: Flags [.], seq 2049:2561, ack 1, win 65535, length 512
7.243234 IP 192.168.1.1.80 > 203.82.48.2.49155: Flags [.], ack 2561, win 65535, length 0
7.251248 IP 203.82.48.2.49153 > 192.168.1.1.80: Flags [.], seq 2561:3073, ack 1, win 65535, length 512
7.251303 IP 203.82.48.2.49154 > 192.168.1.1.80: Flags [.], seq 2561:3073, ack 1, win 65535, length 512
7.251357 IP 203.82.48.2.49155 > 192.168.1.1.80: Flags [.], seq 2561:3073, ack 1, win 65535, length 512
7.259440 IP 203.82.48.2.49153 > 192.168.1.1.80: Flags [.], seq 3073:3585, ack 1, win 65535, length 512
7.259440 IP 192.168.1.1.80 > 203.82.48.2.49153: Flags [.], ack 3585, win 65535, length 0
7.259506 IP 203.82.48.2.49154 > 192.168.1.1.80: Flags [.], seq 3073:3585, ack 1, win 65535, length 512
7.259506 IP 192.168.1.1.80 > 203.82.48.2.49154: Flags [.], ack 3585, win 65535, length 0
7.259581 IP 203.82.48.2.49155 > 192.168.1.1.80: Flags [.], seq 3073:3585, ack 1, win 65535, length 512
7.259581 IP 192.168.1.1.80 > 203.82.48.2.49155: Flags [.], ack 3585, win 65535, length 0
7.267632 IP 203.82.48.2.49153 > 192.168.1.1.80: Flags [.], seq 3585:4097, ack 1, win 65535, length 512
7.267695 IP 203.82.48.2.49154 > 192.168.1.1.80: Flags [.], seq 3585:4097, ack 1, win 65535, length 512
7.267749 IP 203.82.48.2.49155 > 192.168.1.1.80: Flags [.], seq 3585:4097, ack 1, win 65535, length 512
7.275824 IP 203.82.48.2.49153 > 192.168.1.1.80: Flags [.], seq 4097:4609, ack 1, win 65535, length 512
7.275824 IP 192.168.1.1.80 > 203.82.48.2.49153: Flags [.], ack 4609, win 65535, length 0
7.275896 IP 203.82.48.2.49154 > 192.168.1.1.80: Flags [.], seq 4097:4609, ack 1, win 65535, length 512
7.275896 IP 192.168.1.1.80 > 203.82.48.2.49154: Flags [.], ack 4609, win 65535, length 0
7.275965 IP 203.82.48.2.49155 > 192.168.1.1.80: Flags [.], seq 4097:4609, ack 1, win 65535, length 512
7.275965 IP 192.168.1.1.80 > 203.82.48.2.49155: Flags [.], ack 4609, win 65535, length 0
7.284016 IP 203.82.48.2.49153 > 192.168.1.1.80: Flags [.], seq 4609:5121, ack 1, win 65535, length 512
7.284069 IP 203.82.48.2.49154 > 192.168.1.1.80: Flags [.], seq 4609:5121, ack 1, win 65535, length 512
7.284124 IP 203.82.48.2.49155 > 192.168.1.1.80: Flags [.], seq 4609:5121, ack 1, win 65535, length 512
7.292208 IP 203.82.48.2.49153 > 192.168.1.1.80: Flags [.], seq 5121:5633, ack 1, win 65535, length 512
7.292208 IP 192.168.1.1.80 > 203.82.48.2.49153: Flags [.], ack 5633, win 65535, length 0
7.292282 IP 203.82.48.2.49154 > 192.168.1.1.80: Flags [.], seq 5121:5633, ack 1, win 65535, length 512
7.292282 IP 192.168.1.1.80 > 203.82.48.2.49154: Flags [.], ack 5633, win 65535, length 0
7.292352 IP 203.82.48.2.49155 > 192.168.1.1.80: Flags [.], seq 5121:5633, ack 1, win 65535, length 512
7.292352 IP 192.168.1.1.80 > 203.82.48.2.49155: Flags [.], ack 5633, win 65535, length 0
7.300400 IP 203.82.48.2.49153 > 192.168.1.1.80: Flags [.], seq 5633:6145, ack 1, win 65535, length 512
7.300453 IP 203.82.48.2.49154 > 192.168.1.1.80: Flags [.], seq 5633:6145, ack 1, win 65535, length 512
7.300508 IP 203.82.48.2.49155 > 192.168.1.1.80: Flags [.], seq 5633:6145, ack 1, win 65535, length 512
7.308592 IP 203.82.48.2.49153 > 192.168.1.1.80: Flags [.], seq 6145:6657, ack 1, win 65535, length 512
7.308592 IP 192.168.1.1.80 > 203.82.48.2.49153: Flags [.], ack 6657, win 65535, length 0
7.308684 IP 203.82.48.2.49154 > 192.168.1.1.80: Flags [.], seq 6145:6657, ack 1, win 65535, length 512
7.308684 IP 192.168.1.1.80 > 203.82.48.2.49154: Flags [.], ack 6657, win 65535, length 0
7.308759 IP 203.82.48.2.49155 > 192.168.1.1.80: Flags [.], seq 6145:6657, ack 1, win 65535, length 512
7.308759 IP 192.168.1.1.80 > 203.82.48.2.49155: Flags [.], ack 6657, win 65535, length 0
7.316784 IP 203.82.48.2.49153 > 192.168.1.1.80: Flags [.], seq 6657:7169, ack 1, win 65535, length 512
7.316837 IP 203.82.48.2.49154 > 192.168.1.1.80: Flags [.], seq 6657:7169, ack 1, win 65535, length 512
7.316891 IP 203.82.48.2.49155 > 192.168.1.1.80: Flags [.], seq 6657:7169, ack 1, win 65535, length 512
7.324976 IP 203.82.48.2.49153 > 192.168.1.1.80: Flags [.], seq 7169:7681, ack 1, win 65535, length 512
7.324976 IP 192.168.1.1.80 > 203.82.48.2.49153: Flags [.], ack 7681, win 65535, length 0
7.325062 IP 203.82.48.2.49154 > 192.168.1.1.80: Flags [.], seq 7169:7681, ack 1, win 65535, length 512
7.325062 IP 192.168.1.1.80 > 203.82.48.2.49154: Flags [.], ack 7681, win 65535, length 0
7.325136 IP 203.82.48.2.49155 > 192.168.1.1.80: Flags [.], seq 7169:7681, ack 1, win 65535, length 512
7.325136 IP 192.168.1.1.80 > 203.82.48.2.49155: Flags [.], ack 7681, win 65535, length 0
7.333168 IP 203.82.48.2.49153 > 192.168.1.1.80: Flags [.], seq 7681:8193, ack 1, win 65535, length 512
7.333223 IP 203.82.48.2.49154 > 192.168.1.1.80: Flags [.], seq 7681:8193, ack 1, win 65535, length 512
7.333279 IP 203.82.48.2.49155 > 192.168.1.1.80: Flags [.], seq 7681:8193, ack 1, win 65535, length 512
7.341360 IP 203.82.48.2.49153 > 192.168.1.1.80: Flags [.], seq 8193:8705, ack 1, win 65535, length 512
7.341360 IP 192.168.1.1.80 > 203.82.48.2.49153: Flags [.], ack 8705, win 65535, length 0
7.341437 IP 203.82.48.2.49154 > 192.168.1.1.80: Flags [.], seq 8193:8705, ack 1, win 65535, length 512
7.341437 IP 192.168.1.1.80 > 203.82.48.2.49154: Flags [.], ack 8705, win 65535, length 0
7.341519 IP 203.82.48.2.49155 > 192.168.1.1.80: Flags [.], seq 8193:8705, ack 1, win 65535, length 512
7.341519 IP 192.168.1.1.80 > 203.82.48.2.49155: Flags [.], ack 8705, win 65535, length 0
7.349552 IP 203.82.48.2.49153 > 192.168.1.1.80: Flags [.], seq 8705:9217, ack 1, win 65535, length 512
7.349607 IP 203.82.48.2.49154 > 192.168.1.1.80: Flags [.], seq 8705:9217, ack 1, win 65535, length 512
7.349660 IP 203.82.48.2.49155 > 192.168.1.1.80: Flags [.], seq 8705:9217, ack 1, win 65535, length 512
7.357744 IP 203.82.48.2.49153 > 192.168.1.1.80: Flags [.], seq 9217:9729, ack 1, win 65535, length 512
7.357744 IP 192.168.1.1.80 > 203.82.48.2.49153: Flags [.], ack 9729, win 65535, length 0
7.357809 IP 203.82.48.2.49154 > 192.168.1.1.80: Flags [.], seq 9217:9729, ack 1, win 65535, length 512
7.357809 IP 192.168.1.1.80 > 203.82.48.2.49154: Flags [.], ack 9729, win 65535, length 0
7.357873 IP 203.82.48.2.49155 > 192.168.1.1.80: Flags [.], seq 9217:9729, ack 1, win 65535, length 512
7.357873 IP 192.168.1.1.80 > 203.82.48.2.49155: Flags [.], ack 9729, win 65535, length 0
7.365936 IP 203.82.48.2.49153 > 192.168.1.1.80: Flags [.], seq 9729:10241, ack 1, win 65535, length 512
7.365999 IP 203.82.48.2.49154 > 192.168.1.1.80: Flags [.], seq 9729:10241, ack 1, win 65535, length 512
7.366051 IP 203.82.48.2.49155 > 192.168.1.1.80: Flags [.], seq 9729:10241, ack 1, win 65535, length 512
7.374128 IP 203.82.48.2.49153 > 192.168.1.1.80: Flags [.], seq 10241:10753, ack 1, win 65535, length 512
7.374128 IP 192.168.1.1.80 > 203.82.48.2.49153: Flags [.], ack 10753, win 65535, length 0
7.374207 IP 203.82.48.2.49154 > 192.168.1.1.80: Flags [.], seq 10241:10753, ack 1, win 65535, length 512
7.374207 IP 192.168.1.1.80 > 203.82.48.2.49154: Flags [.], ack 10753, win 65535, length 0
7.374299 IP 203.82.48.2.49155 > 192.168.1.1.80: Flags [.], seq 10241:10753, ack 1, win 65535, length 512
7.374299 IP 192.168.1.1.80 > 203.82.48.2.49155: Flags [.], ack 10753, win 65535, length 0
7.382320 IP 203.82.48.2.49153 > 192.168.1.1.80: Flags [.], seq 10753:11265, ack 1, win 65535, length 512
7.382374 IP 203.82.48.2.49154 > 192.168.1.1.80: Flags [.], seq 10753:11265, ack 1, win 65535, length 512
7.382433 IP 203.82.48.2.49155 > 192.168.1.1.80: Flags [.], seq 10753:11265, ack 1, win 65535, length 512
7.390512 IP 203.82.48.2.49153 > 192.168.1.1.80: Flags [.], seq 11265:11777, ack 1, win 65535, length 512
7.390512 IP 192.168.1.1.80 > 203.82.48.2.49153: Flags [.], ack 11777, win 65535, length 0
7.390589 IP 203.82.48.2.49154 > 192.168.1.1.80: Flags [.], seq 11265:11777, ack 1, win 65535, length 512
7.390589 IP 192.168.1.1.80 > 203.82.48.2.49154: Flags [.], ack 11777, win 65535, length 0
7.390659 IP 203.82.48.2.49155 > 192.168.1.1.80: Flags [.], seq 11265:11777, ack 1, win 65535, length 512
7.390659 IP 192.168.1.1.80 > 203.82.48.2.49155: Flags [.], ack 11777, win 65535, length 0
7.398704 IP 203.82.48.2.49153 > 192.168.1.1.80: Flags [.], seq 11777:12289, ack 1, win 65535, length 512
7.398757 IP 203.82.48.2.49154 > 192.168.1.1.80: Flags [.], seq 11777:12289, ack 1, win 65535, length 512
7.398816 IP 203.82.48.2.49155 > 192.168.1.1.80: Flags [.], seq 11777:12289, ack 1, win 65535, length 512
7.406896 IP 203.82.48.2.49153 > 192.168.1.1.80: Flags [.], seq 12289:12801, ack 1, win 65535, length 512
7.406896 IP 192.168.1.1.80 > 203.82.48.2.49153: Flags [.], ack 12801, win 65535, length 0
7.406964 IP 203.82.48.2.49154 > 192.168.1.1.80: Flags [.], seq 12289:12801, ack 1, win 65535, length 512
7.406964 IP 192.168.1.1.80 > 203.82.48.2.49154: Flags [.], ack 12801, win 65535, length 0
7.407028 IP 203.82.48.2.49155 > 192.168.1.1.80: Flags [.], seq 12289:12801, ack 1, win 65535, length 512
7.407028 IP 192.168.1.1.80 > 203.82.48.2.49155: Flags [.], ack 12801, win 65535, length 0
7.415088 IP 203.82.48.2.49153 > 192.168.1.1.80: Flags [.], seq 12801:13313, ack 1, win 65535, length 512
7.415141 IP 203.82.48.2.49154 > 192.168.1.1.80: Flags [.], seq 12801:13313, ack 1, win 65535, length 512
7.415196 IP 203.82.48.2.49155 > 192.168.1.1.80: Flags [.], seq 12801:13313, ack 1, win 65535, length 512
7.423280 IP 203.82.48.2.49153 > 192.168.1.1.80: Flags [.], seq 13313:13825, ack 1, win 65535, length 512
7.423280 IP 192.168.1.1.80 > 203.82.48.2.49153: Flags [.], ack 13825, win 65535, length 0
7.423348 IP 203.82.48.2.49154 > 192.168.1.1.80: Flags [.], seq 13313:13825, ack 1, win 65535, length 512
7.423348 IP 192.168.1.1.80 > 203.82.48.2.49154: Flags [.], ack 13825, win 65535, length 0
7.423415 IP 203.82.48.2.49155 > 192.168.1.1.80: Flags [.], seq 13313:13825, ack 1, win 65535, length 512
7.423415 IP 192.168.1.1.80 > 203.82.48.2.49155: Flags [.], ack 13825, win 65535, length 0
7.431472 IP 203.82.48.2.49153 > 192.168.1.1.80: Flags [.], seq 13825:14337, ack 1, win 65535, length 512
7.431527 IP 203.82.48.2.49154 > 192.168.1.1.80: Flags [.], seq 13825:14337, ack 1, win 65535, length 512
7.431582 IP 203.82.48.2.49155 > 192.168.1.1.80: Flags [.], seq 13825:14337, ack 1, win 65535, length 512
7.439664 IP 203.82.48.2.49153 > 192.168.1.1.80: Flags [.], seq 14337:14849, ack 1, win 65535, length 512
7.439664 IP 192.168.1.1.80 > 203.82.48.2.49153: Flags [.], ack 14849, win 65535, length 0
7.439732 IP 203.82.48.2.49154 > 192.168.1.1.80: Flags [.], seq 14337:14849, ack 1, win 65535, length 512
7.439732 IP 192.168.1.1.80 > 203.82.48.2.49154: Flags [.], ack 14849, win 65535, length 0
7.439806 IP 203.82.48.2.49155 > 192.168.1.1.80: Flags [.], seq 14337:14849, ack 1, win 65535, length 512
7.439806 IP 192.168.1.1.80 > 203.82.48.2.49155: Flags [.], ack 14849, win 65535, length 0
7.447856 IP 203.82.48.2.49153 > 192.168.1.1.80: Flags [.], seq 14849:15361, ack 1, win 65535, length 512
7.447911 IP 203.82.48.2.49154 > 192.168.1.1.80: Flags [.], seq 14849:15361, ack 1, win 65535, length 512
7.447963 IP 203.82.48.2.49155 > 192.168.1.1.80: Flags [.], seq 14849:15361, ack 1, win 65535, length 512
7.456048 IP 203.82.48.2.49153 > 192.168.1.1.80: Flags [.], seq 15361:15873, ack 1, win 65535, length 512
7.456048 IP 192.168.1.1.80 > 203.82.48.2.49153: Flags [.], ack 15873, win 65535, length 0
7.456125 IP 203.82.48.2.49154 > 192.168.1.1.80: Flags [.], seq 15361:15873, ack 1, win 65535, length 512
7.456125 IP 192.168.1.1.80 > 203.82.48.2.49154: Flags [.], ack 15873, win 65535, length 0
7.456213 IP 203.82.48.2.49155 > 192.168.1.1.80: Flags [.], seq 15361:15873, ack 1, win 65535, length 512
7.456213 IP 192.168.1.1.80 > 203.82.48.2.49155: Flags [.], ack 15873, win 65535, length 0
7.464240 IP 203.82.48.2.49153 > 192.168.1.1.80: Flags [.], seq 15873:16385, ack 1, win 65535, length 512
7.464294 IP 203.82.48.2.49154 > 192.168.1.1.80: Flags [.], seq 15873:16385, ack 1, win 65535, length 512
7.464347 IP 203.82.48.2.49155 > 192.168.1.1.80: Flags [.], seq 15873:16385, ack 1, win 65535, length 512
7.472432 IP 203.82.48.2.49153 > 192.168.1.1.80: Flags [.], seq 16385:16897, ack 1, win 65535, length 512
7.472432 IP 192.168.1.1.80 > 203.82.48.2.49153: Flags [.], ack 16897, win 65535, length 0
7.472519 IP 203.82.48.2.49154 > 192.168.1.1.80: Flags [.], seq 16385:16897, ack 1, win 65535, length 512
7.472519 IP 192.168.1.1.80 > 203.82.48.2.49154: Flags [.], ack 16897, win 65535, length 0
7.472599 IP 203.82.48.2.49155 > 192.168.1.1.80: Flags [.], seq 16385:16897, ack 1, win 65535, length 512
7.472599 IP 192.168.1.1.80 > 203.82.48.2.49155: Flags [.], ack 16897, win 65535, length 0
7.480624 IP 203.82.48.2.49153 > 192.168.1.1.80: Flags [.], seq 16897:17409, ack 1, win 65535, length 512
7.480678 IP 203.82.48.2.49154 > 192.168.1.1.80: Flags [.], seq 16897:17409, ack 1, win 65535, length 512
7.480731 IP 203.82.48.2.49155 > 192.168.1.1.80: Flags [.], seq 16897:17409, ack 1, win 65535, length 512
7.488816 IP 203.82.48.2.49153 > 192.168.1.1.80: Flags [.], seq 17409:17921, ack 1, win 65535, length 512
7.488816 IP 192.168.1.1.80 > 203.82.48.2.49153: Flags [.], ack 17921, win 65535, length 0
7.488890 IP 203.82.48.2.49154 > 192.168.1.1.80: Flags [.], seq 17409:17921, ack 1, win 65535, length 512
7.488890 IP 192.168.1.1.80 > 203.82.48.2.49154: Flags [.], ack 17921, win 65535, length 0
7.488961 IP 203.82.48.2.49155 > 192.168.1.1.80: Flags [.], seq 17409:17921, ack 1, win 65535, length 512
7.488961 IP 192.168.1.1.80 > 203.82.48.2.49155: Flags [.], ack 17921, win 65535, length 0
7.497008 IP 203.82.48.2.49153 > 192.168.1.1.80: Flags [.], seq 17921:18433, ack 1, win 65535, length 512
7.497064 IP 203.82.48.2.49154 > 192.168.1.1.80: Flags [.], seq 17921:18433, ack 1, win 65535, length 512
7.497116 IP 203.82.48.2.49155 > 192.168.1.1.80: Flags [.], seq 17921:18433, ack 1, win 65535, length 512
7.505200 IP 203.82.48.2.49153 > 192.168.1.1.80: Flags [.], seq 18433:18945, ack 1, win 65535, length 512
7.505200 IP 192.168.1.1.80 > 203.82.48.2.49153: Flags [.], ack 18945, win 65535, length 0
7.505276 IP 203.82.48.2.49154 > 192.168.1.1.80: Flags [.], seq 18433:18945, ack 1, win 65535, length 512
7.505276 IP 192.168.1.1.80 > 203.82.48.2.49154: Flags [.], ack 18945, win 65535, length 0
7.505358 IP 203.82.48.2.49155 > 192.168.1.1.80: Flags [.], seq 18433:18945, ack 1, win 65535, length 512
7.505358 IP 192.168.1.1.80 > 203.82.48.2.49155: Flags [.], ack 18945, win 65535, length 0
7.513392 IP 203.82.48.2.49153 > 192.168.1.1.80: Flags [.], seq 18945:19457, ack 1, win 65535, length 512
7.513446 IP 203.82.48.2.49154 > 192.168.1.1.80: Flags [.], seq 18945:19457, ack 1, win 65535, length 512
7.513499 IP 203.82.48.2.49155 > 192.168.1.1.80: Flags [.], seq 18945:19457, ack 1, win 65535, length 512
7.521584 IP 203.82.48.2.49153 > 192.168.1.1.80: Flags [.], seq 19457:19969, ack 1, win 65535, length 512
7.521584 IP 192.168.1.1.80 > 203.82.48.2.49153: Flags [.], ack 19969, win 65535, length 0
7.521669 IP 203.82.48.2.49154 > 192.168.1.1.80: Flags [.], seq 19457:19969, ack 1, win 65535, length 512
7.521669 IP 192.168.1.1.80 > 203.82.48.2.49154: Flags [.], ack 19969, win 65535, length 0
7.521755 IP 203.82.48.2.49155 > 192.168.1.1.80: Flags [.], seq 19457:19969, ack 1, win 65535, length 512
7.521755 IP 192.168.1.1.80 > 203.82.48.2.49155: Flags [.], ack 19969, win 65535, length 0
7.529776 IP 203.82.48.2.49153 > 192.168.1.1.80: Flags [.], seq 19969:20481, ack 1, win 65535, length 512
7.529829 IP 203.82.48.2.49154 > 192.168.1.1.80: Flags [.], seq 19969:20481, ack 1, win 65535, length 512
7.529882 IP 203.82.48.2.49155 > 192.168.1.1.80: Flags [.], seq 19969:20481, ack 1, win 65535, length 512
7.537968 IP 203.82.48.2.49153 > 192.168.1.1.80: Flags [.], seq 20481:20993, ack 1, win 65535, length 512
7.537968 IP 192.168.1.1.80 > 203.82.48.2.49153: Flags [.], ack 20993, win 65535, length 0
7.538035 IP 203.82.48.2.49154 > 192.168.1.1.80: Flags [.], seq 20481:20993, ack 1, win 65535, length 512
7.538035 IP 192.168.1.1.80 > 203.82.48.2.49154: Flags [.], ack 20993, win 65535, length 0
7.538117 IP 203.82.48.2.49155 > 192.168.1.1.80: Flags [.], seq 20481:20993, ack 1, win 65535, length 512
7.538117 IP 192.168.1.1.80 > 203.82.48.2.49155: Flags [.], ack 20993, win 65535, length 0
7.546160 IP 203.82.48.2.49153 > 192.168.1.1.80: Flags [.], seq 20993:21505, ack 1, win 65535, length 512
7.546214 IP 203.82.48.2.49154 > 192.168.1.1.80: Flags [.], seq 20993:21505, ack 1, win 65535, length 512
7.546269 IP 203.82.48.2.49155 > 192.168.1.1.80: Flags [.], seq 20993:21505, ack 1, win 65535, length 512
7.554352 IP 203.82.48.2.49153 > 192.168.1.1.80: Flags [.], seq 21505:22017, ack 1, win 65535, length 512
7.554352 IP 192.168.1.1.80 > 203.82.48.2.49153: Flags [.], ack 22017, win 65535, length 0
7.554428 IP 203.82.48.2.49154 > 192.168.1.1.80: Flags [.], seq 21505:22017, ack 1, win 65535, length 512
7.554428 IP 192.168.1.1.80 > 203.82.48.2.49154: Flags [.], ack 22017, win 65535, length 0
7.554509 IP 203.82.48.2.49155 > 192.168.1.1.80: Flags [.], seq 21505:22017, ack 1, win 65535, length 512
7.554509 IP 192.168.1.1.80 > 203.82.48.2.49155: Flags [.], ack 22017, win 65535, length 0
7.562544 IP 203.82.48.2.49153 > 192.168.1.1.80: Flags [.], seq 22017:22529, ack 1, win 65535, length 512
7.562602 IP 203.82.48.2.49154 > 192.168.1.1.80: Flags [.], seq 22017:22529, ack 1, win 65535, length 512
7.562656 IP 203.82.48.2.49155 > 192.168.1.1.80: Flags [.], seq 22017:22529, ack 1, win 65535, length 512
7.570736 IP 203.82.48.2.49153 > 192.168.1.1.80: Flags [.], seq 22529:23041, ack 1, win 65535, length 512
7.570736 IP 192.168.1.1.80 > 203.82.48.2.49153: Flags [.], ack 23041, win 65535, length 0
7.570819 IP 203.82.48.2.49154 > 192.168.1.1.80: Flags [.], seq 22529:23041, ack 1, win 65535, length 512
7.570819 IP 192.168.1.1.80 > 203.82.48.2.49154: Flags [.], ack 23041, win 65535, length 0
7.570901 IP 203.82.48.2.49155 > 192.168.1.1.80: Flags [.], seq 22529:23041, ack 1, win 65535, length 512
7.570901 IP 192.168.1.1.80 > 203.82.48.2.49155: Flags [.], ack 23041, win 65535, length 0
7.578928 IP 203.82.48.2.49153 > 192.168.1.1.80: Flags [.], seq 23041:23553, ack 1, win 65535, length 512
7.578982 IP 203.82.48.2.49154 > 192.168.1.1.80: Flags [.], seq 23041:23553, ack 1, win 65535, length 512
7.579038 IP 203.82.48.2.49155 > 192.168.1.1.80: Flags [.], seq 23041:23553, ack 1, win 65535, length 512
7.587120 IP 203.82.48.2.49153 > 192.168.1.1.80: Flags [.], seq 23553:24065, ack 1, win 65535, length 512
7.587120 IP 192.168.1.1.80 > 203.82.48.2.49153: Flags [.], ack 24065, win 65535, length 0
7.587185 IP 203.82.48.2.49154 > 192.168.1.1.80: Flags [.], seq 23553:24065, ack 1, win 65535, length 512
7.587185 IP 192.168.1.1.80 > 203.82.48.2.49154: Flags [.], ack 24065, win 65535, length 0
7.587261 IP 203.82.48.2.49155 > 192.168.1.1.80: Flags [.], seq 23553:24065, ack 1, win 65535, length 512
7.587261 IP 192.168.1.1.80 > 203.82.48.2.49155: Flags [.], ack 24065, win 65535, length 0
7.595312 IP 203.82.48.2.49153 > 192.168.1.1.80: Flags [.], seq 24065:24577, ack 1, win 65535, length 512
7.595364 IP 203.82.48.2.49154 > 192.168.1.1.80: Flags [.], seq 24065:24577, ack 1, win 65535, length 512
7.595417 IP 203.82.48.2.49155 > 192.168.1.1.80: Flags [.], seq 24065:24577, ack 1, win 65535, length 512
7.603504 IP 203.82.48.2.49153 > 192.168.1.1.80: Flags [.], seq 24577:25089, ack 1, win 65535, length 512
7.603504 IP 192.168.1.1.80 > 203.82.48.2.49153: Flags [.], ack 25089, win 65535, length 0
7.603623 IP 203.82.48.2.49154 > 192.168.1.1.80: Flags [.], seq 24577:25089, ack 1, win 65535, length 512
7.603623 IP 192.168.1.1.80 > 203.82.48.2.49154: Flags [.], ack 25089, win 65535, length 0
7.603698 IP 203.82.48.2.49155 > 192.168.1.1.80: Flags [.], seq 24577:25089, ack 1, win 65535, length 512
7.603698 IP 192.168.1.1.80 > 203.82.48.2.49155: Flags [.], ack 25089, win 65535, length 0
7.611696 IP 203.82.48.2.49153 > 192.168.1.1.80: Flags [.], seq 25089:25601, ack 1, win 65535, length 512
7.611750 IP 203.82.48.2.49154 > 192.168.1.1.80: Flags [.], seq 25089:25601, ack 1, win 65535, length 512
7.611811 IP 203.82.48.2.49155 > 192.168.1.1.80: Flags [.], seq 25089:25601, ack 1, win 65535, length 512
7.619888 IP 203.82.48.2.49153 > 192.168.1.1.80: Flags [.], seq 25601:26113, ack 1, win 65535, length 512
7.619888 IP 192.168.1.1.80 > 203.82.48.2.49153: Flags [.], ack 26113, win 65535, length 0
7.619959 IP 203.82.48.2.49154 > 192.168.1.1.80: Flags [.], seq 25601:26113, ack 1, win 65535, length 512
7.619959 IP 192.168.1.1.80 > 203.82.48.2.49154: Flags [.], ack 26113, win 65535, length 0
7.620024 IP 203.82.48.2.49155 > 192.168.1.1.80: Flags [.], seq 25601:26113, ack 1, win 65535, length 512
7.620024 IP 192.168.1.1.80 > 203.82.48.2.49155: Flags [.], ack 26113, win 65535, length 0
7.628080 IP 203.82.48.2.49153 > 192.168.1.1.80: Flags [.], seq 26113:26625, ack 1, win 65535, length 512
7.628132 IP 203.82.48.2.49154 > 192.168.1.1.80: Flags [.], seq 26113:26625, ack 1, win 65535, length 512
7.628187 IP 203.82.48.2.49155 > 192.168.1.1.80: Flags [.], seq 26113:26625, ack 1, win 65535, length 512
7.636272 IP 203.82.48.2.49153 > 192.168.1.1.80: Flags [.], seq 26625:27137, ack 1, win 65535, length 512
7.636272 IP 192.168.1.1.80 > 203.82.48.2.49153: Flags [.], ack 27137, win 65535, length 0
7.636341 IP 203.82.48.2.49154 > 192.168.1.1.80: Flags [.], seq 26625:27137, ack 1, win 65535, length 512
7.636341 IP 192.168.1.1.80 > 203.82.48.2.49154: Flags [.], ack 27137, win 65535, length 0
7.636417 IP 203.82.48.2.49155 > 192.168.1.1.80: Flags [.], seq 26625:27137, ack 1, win 65535, length 512
7.636417 IP 192.168.1.1.80 > 203.82.48.2.49155: Flags [.], ack 27137, win 65535, length 0
7.644464 IP 203.82.48.2.49153 > 192.168.1.1.80: Flags [.], seq 27137:27649, ack 1, win 65535, length 512
7.644525 IP 203.82.48.2.49154 > 192.168.1.1.80: Flags [.], seq 27137:27649, ack 1, win 65535, length 512
7.644578 IP 203.82.48.2.49155 > 192.168.1.1.80: Flags [.], seq 27137:27649, ack 1, win 65535, length 512
7.652656 IP 203.82.48.2.49153 > 192.168.1.1.80: Flags [.], seq 27649:28161, ack 1, win 65535, length 512
7.652656 IP 192.168.1.1.80 > 203.82.48.2.49153: Flags [.], ack 28161, win 65535, length 0
7.652771 IP 203.82.48.2.49154 > 192.168.1.1.80: Flags [.], seq 27649:28161, ack 1, win 65535, length 512
7.652771 IP 192.168.1.1.80 > 203.82.48.2.49154: Flags [.], ack 28161, win 65535, length 0
7.652945 IP 203.82.48.2.49155 > 192.168.1.1.80: Flags [.], seq 27649:28161, ack 1, win 65535, length 512
7.652945 IP 192.168.1.1.80 > 203.82.48.2.49155: Flags [.], ack 28161, win 65535, length 0
7.660848 IP 203.82.48.2.49153 > 192.168.1.1.80: Flags [.], seq 28161:28673, ack 1, win 65535, length 512
7.660901 IP 203.82.48.2.49154 > 192.168.1.1.80: Flags [.], seq 28161:28673, ack 1, win 65535, length 512
7.660956 IP 203.82.48.2.49155 > 192.168.1.1.80: Flags [.], seq 28161:28673, ack 1, win 65535, length 512
7.669040 IP 203.82.48.2.49153 > 192.168.1.1.80: Flags [.], seq 28673:29185, ack 1, win 65535, length 512
7.669040 IP 192.168.1.1.80 > 203.82.48.2.49153: Flags [.], ack 29185, win 65535, length 0
7.669148 IP 203.82.48.2.49154 > 192.168.1.1.80: Flags [.], seq 28673:29185, ack 1, win 65535, length 512
7.669148 IP 192.168.1.1.80 > 203.82.48.2.49154: Flags [.], ack 29185, win 65535, length 0
7.669238 IP 203.82.48.2.49155 > 192.168.1.1.80: Flags [.], seq 28673:29185, ack 1, win 65535, length 512
7.669238 IP 192.168.1.1.80 > 203.82.48.2.49155: Flags [.], ack 29185, win 65535, length 0
7.677232 IP 203.82.48.2.49153 > 192.168.1.1.80: Flags [.], seq 29185:29697, ack 1, win 65535, length 512
7.677286 IP 203.82.48.2.49154 > 192.168.1.1.80: Flags [.], seq 29185:29697, ack 1, win 65535, length 512
7.677341 IP 203.82.48.2.49155 > 192.168.1.1.80: Flags [.], seq 29185:29697, ack 1, win 65535, length 512
7.685424 IP 203.82.48.2.49153 > 192.168.1.1.80: Flags [.], seq 29697:30209, ack 1, win 65535, length 512
7.685424 IP 192.168.1.1.80 > 203.82.48.2.49153: Flags [.], ack 30209, win 65535, length 0
7.685523 IP 203.82.48.2.49154 > 192.168.1.1.80: Flags [.], seq 29697:30209, ack 1, win 65535, length 512
7.685523 IP 192.168.1.1.80 > 203.82.48.2.49154: Flags [.], ack 30209, win 65535, length 0
7.685594 IP 203.82.48.2.49155 > 192.168.1.1.80: Flags [.], seq 29697:30209, ack 1, win 65535, length 512
7.685594 IP 192.168.1.1.80 > 203.82.48.2.49155: Flags [.], ack 30209, win 65535, length 0
7.693616 IP 203.82.48.2.49153 > 192.168.1.1.80: Flags [.], seq 30209:30721, ack 1, win 65535, length 512
7.693668 IP 203.82.48.2.49154 > 192.168.1.1.80: Flags [.], seq 30209:30721, ack 1, win 65535, length 512
7.693732 IP 203.82.48.2.49155 > 192.168.1.1.80: Flags [.], seq 30209:30721, ack 1, win 65535, length 512
7.701808 IP 203.82.48.2.49153 > 192.168.1.1.80: Flags [.], seq 30721:31233, ack 1, win 65535, length 512
7.701808 IP 192.168.1.1.80 > 203.82.48.2.49153: Flags [.], ack 31233, win 65535, length 0
7.701893 IP 203.82.48.2.49154 > 192.168.1.1.80: Flags [.], seq 30721:31233, ack 1, win 65535, length 512
7.701893 IP 192.168.1.1.80 > 203.82.48.2.49154: Flags [.], ack 31233, win 65535, length 0
7.701959 IP 203.82.48.2.49155 > 192.168.1.1.80: Flags [.], seq 30721:31233, ack 1, win 65535, length 512
7.701959 IP 192.168.1.1.80 > 203.82.48.2.49155: Flags [.], ack 31233, win 65535, length 0
7.710000 IP 203.82.48.2.49153 > 192.168.1.1.80: Flags [.], seq 31233:31745, ack 1, win 65535, length 512
7.710053 IP 203.82.48.2.49154 > 192.168.1.1.80: Flags [.], seq 31233:31745, ack 1, win 65535, length 512
7.710106 IP 203.82.48.2.49155 > 192.168.1.1.80: Flags [.], seq 31233:31745, ack 1, win 65535, length 512
7.718192 IP 203.82.48.2.49153 > 192.168.1.1.80: Flags [.], seq 31745:32257, ack 1, win 65535, length 512
7.718192 IP 192.168.1.1.80 > 203.82.48.2.49153: Flags [.], ack 32257, win 65535, length 0
7.718274 IP 203.82.48.2.49154 > 192.168.1.1.80: Flags [.], seq 31745:32257, ack 1, win 65535, length 512
7.718274 IP 192.168.1.1.80 > 203.82.48.2.49154: Flags [.], ack 32257, win 65535, length 0
7.718339 IP 203.82.48.2.49155 > 192.168.1.1.80: Flags [.], seq 31745:32257, ack 1, win 65535, length 512
7.718339 IP 192.168.1.1.80 > 203.82.48.2.49155: Flags [.], ack 32257, win 65535, length 0
7.726384 IP 203.82.48.2.49153 > 192.168.1.1.80: Flags [.], seq 32257:32769, ack 1, win 65535, length 512
7.726444 IP 203.82.48.2.49154 > 192.168.1.1.80: Flags [.], seq 32257:32769, ack 1, win 65535, length 512
7.726507 IP 203.82.48.2.49155 > 192.168.1.1.80: Flags [.], seq 32257:32769, ack 1, win 65535, length 512
7.734576 IP 203.82.48.2.49153 > 192.168.1.1.80: Flags [.], seq 32769:33281, ack 1, win 65535, length 512
7.734576 IP 192.168.1.1.80 > 203.82.48.2.49153: Flags [.], ack 33281, win 65535, length 0
7.734669 IP 203.82.48.2.49154 > 192.168.1.1.80: Flags [.], seq 32769:33281, ack 1, win 65535, length 512
7.734669 IP 192.168.1.1.80 > 203.82.48.2.49154: Flags [.], ack 33281, win 65535, length 0
7.734743 IP 203.82.48.2.49155 > 192.168.1.1.80: Flags [.], seq 32769:33281, ack 1, win 65535, length 512
7.734743 IP 192.168.1.1.80 > 203.82.48.2.49155: Flags [.], ack 33281, win 65535, length 0
7.742768 IP 203.82.48.2.49153 > 192.168.1.1.80: Flags [.], seq 33281:33793, ack 1, win 65535, length 512
7.742821 IP 203.82.48.2.49154 > 192.168.1.1.80: Flags [.], seq 33281:33793, ack 1, win 65535, length 512
7.742874 IP 203.82.48.2.49155 > 192.168.1.1.80: Flags [.], seq 33281:33793, ack 1, win 65535, length 512
7.750960 IP 203.82.48.2.49153 > 192.168.1.1.80: Flags [.], seq 33793:34305, ack 1, win 65535, length 512
7.750960 IP 192.168.1.1.80 > 203.82.48.2.49153: Flags [.], ack 34305, win 65535, length 0
7.751040 IP 203.82.48.2.49154 > 192.168.1.1.80: Flags [.], seq 33793:34305, ack 1, win 65535, length 512
7.751040 IP 192.168.1.1.80 > 203.82.48.2.49154: Flags [.], ack 34305, win 65535, length 0
7.751106 IP 203.82.48.2.49155 > 192.168.1.1.80: Flags [.], seq 33793:34305, ack 1, win 65535, length 512
7.751106 IP 192.168.1.1.80 > 203.82.48.2.49155: Flags [.], ack 34305, win 65535, length 0
7.759152 IP 203.82.48.2.49153 > 192.168.1.1.80: Flags [.], seq 34305:34817, ack 1, win 65535, length 512
7.759211 IP 203.82.48.2.49154 > 192.168.1.1.80: Flags [.], seq 34305:34817, ack 1, win 65535, length 512
7.759264 IP 203.82.48.2.49155 > 192.168.1.1.80: Flags [.], seq 34305:34817, ack 1, win 65535, length 512
7.767344 IP 203.82.48.2.49153 > 192.168.1.1.80: Flags [.], seq 34817:35329, ack 1, win 65535, length 512
7.767344 IP 192.168.1.1.80 > 203.82.48.2.49153: Flags [.], ack 35329, win 65535, length 0
7.767425 IP 203.82.48.2.49154 > 192.168.1.1.80: Flags [.], seq 34817:35329, ack 1, win 65535, length 512
7.767425 IP 192.168.1.1.80 > 203.82.48.2.49154: Flags [.], ack 35329, win 65535, length 0
7.767493 IP 203.82.48.2.49155 > 192.168.1.1.80: Flags [.], seq 34817:35329, ack 1, win 65535, length 512
7.767493 IP 192.168.1.1.80 > 203.82.48.2.49155: Flags [.], ack 35329, win 65535, length 0
7.775536 IP 203.82.48.2.49153 > 192.168.1.1.80: Flags [.], seq 35329:35841, ack 1, win 65535, length 512
7.775589 IP 203.82.48.2.49154 > 192.168.1.1.80: Flags [.], seq 35329:35841, ack 1, win 65535, length 512
7.775642 IP 203.82.48.2.49155 > 192.168.1.1.80: Flags [.], seq 35329:35841, ack 1, win 65535, length 512
7.783728 IP 203.82.48.2.49153 > 192.168.1.1.80: Flags [.], seq 35841:36353, ack 1, win 65535, length 512
7.783728 IP 192.168.1.1.80 > 203.82.48.2.49153: Flags [.], ack 36353, win 65535, length 0
7.783800 IP 203.82.48.2.49154 > 192.168.1.1.80: Flags [.], seq 35841:36353, ack 1, win 65535, length 512
7.783800 IP 192.168.1.1.80 > 203.82.48.2.49154: Flags [.], ack 36353, win 65535, length 0
7.783891 IP 203.82.48.2.49155 > 192.168.1.1.80: Flags [.], seq 35841:36353, ack 1, win 65535, length 512
7.783891 IP 192.168.1.1.80 > 203.82.48.2.49155: Flags [.], ack 36353, win 65535, length 0
7.791920 IP 203.82.48.2.49153 > 192.168.1.1.80: Flags [.], seq 36353:36865, ack 1, win 65535, length 512
7.791979 IP 203.82.48.2.49154 > 192.168.1.1.80: Flags [.], seq 36353:36865, ack 1, win 65535, length 512
7.792034 IP 203.82.48.2.49155 > 192.168.1.1.80: Flags [.], seq 36353:36865, ack 1, win 65535, length 512
7.800112 IP 203.82.48.2.49153 > 192.168.1.1.80: Flags [.], seq 36865:37377, ack 1, win 65535, length 512
7.800112 IP 192.168.1.1.80 > 203.82.48.2.49153: Flags [.], ack 37377, win 65535, length 0
7.800178 IP 203.82.48.2.49154 > 192.168.1.1.80: Flags [.], seq 36865:37377, ack 1, win 65535, length 512
7.800178 IP 192.168.1.1.80 > 203.82.48.2.49154: Flags [.], ack 37377, win 65535, length 0
7.800252 IP 203.82.48.2.49155 > 192.168.1.1.80: Flags [.], seq 36865:37377, ack 1, win 65535, length 512
7.800252 IP 192.168.1.1.80 > 203.82.48.2.49155: Flags [.], ack 37377, win 65535, length 0
7.808304 IP 203.82.48.2.49153 > 192.168.1.1.80: Flags [.], seq 37377:37889, ack 1, win 65535, length 512
7.808363 IP 203.82.48.2.49154 > 192.168.1.1.80: Flags [.], seq 37377:37889, ack 1, win 65535, length 512
7.808416 IP 203.82.48.2.49155 > 192.168.1.1.80: Flags [.], seq 37377:37889, ack 1, win 65535, length 512
7.816496 IP 203.82.48.2.49153 > 192.168.1.1.80: Flags [.], seq 37889:38401, ack 1, win 65535, length 512
7.816496 IP 192.168.1.1.80 > 203.82.48.2.49153: Flags [.], ack 38401, win 65535, length 0
7.816588 IP 203.82.48.2.49154 > 192.168.1.1.80: Flags [.], seq 37889:38401, ack 1, win 65535, length 512
7.816588 IP 192.168.1.1.80 > 203.82.48.2.49154: Flags [.], ack 38401, win 65535, length 0
7.816678 IP 203.82.48.2.49155 > 192.168.1.1.80: Flags [.], seq 37889:38401, ack 1, win 65535, length 512
7.816678 IP 192.168.1.1.80 > 203.82.48.2.49155: Flags [.], ack 38401, win 65535, length 0
7.824688 IP 203.82.48.2.49153 > 192.168.1.1.80: Flags [.], seq 38401:38913, ack 1, win 65535, length 512
7.824742 IP 203.82.48.2.49154 > 192.168.1.1.80: Flags [.], seq 38401:38913, ack 1, win 65535, length 512
7.824796 IP 203.82.48.2.49155 > 192.168.1.1.80: Flags [.], seq 38401:38913, ack 1, win 65535, length 512
7.832880 IP 203.82.48.2.49153 > 192.168.1.1.80: Flags [.], seq 38913:39425, ack 1, win 65535, length 512
7.832880 IP 192.168.1.1.80 > 203.82.48.2.49153: Flags [.], ack 39425, win 65535, length 0
7.832986 IP 203.82.48.2.49154 > 192.168.1.1.80: Flags [.], seq 38913:39425, ack 1, win 65535, length 512
7.832986 IP 192.168.1.1.80 > 203.82.48.2.49154: Flags [.], ack 39425, win 65535, length 0
7.833060 IP 203.82.48.2.49155 > 192.168.1.1.80: Flags [.], seq 38913:39425, ack 1, win 65535, length 512
7.833060 IP 192.168.1.1.80 > 203.82.48.2.49155: Flags [.], ack 39425, win 65535, length 0
7.841072 IP 203.82.48.2.49153 > 192.168.1.1.80: Flags [.], seq 39425:39937, ack 1, win 65535, length 512
7.841124 IP 203.82.48.2.49154 > 192.168.1.1.80: Flags [.], seq 39425:39937, ack 1, win 65535, length 512
7.841179 IP 203.82.48.2.49155 > 192.168.1.1.80: Flags [.], seq 39425:39937, ack 1, win 65535, length 512
7.849264 IP 203.82.48.2.49153 > 192.168.1.1.80: Flags [.], seq 39937:40449, ack 1, win 65535, length 512
7.849264 IP 192.168.1.1.80 > 203.82.48.2.49153: Flags [.], ack 40449, win 65535, length 0
7.849328 IP 203.82.48.2.49154 > 192.168.1.1.80: Flags [.], seq 39937:40449, ack 1, win 65535, length 512
7.849328 IP 192.168.1.1.80 > 203.82.48.2.49154: Flags [.], ack 40449, win 65535, length 0
7.849396 IP 203.82.48.2.49155 > 192.168.1.1.80: Flags [.], seq 39937:40449, ack 1, win 65535, length 512
7.849396 IP 192.168.1.1.80 > 203.82.48.2.49155: Flags [.], ack 40449, win 65535, length 0
7.857456 IP 203.82.48.2.49153 > 192.168.1.1.80: Flags [.], seq 40449:40961, ack 1, win 65535, length 512
7.857513 IP 203.82.48.2.49154 > 192.168.1.1.80: Flags [.], seq 40449:40961, ack 1, win 65535, length 512
7.857568 IP 203.82.48.2.49155 > 192.168.1.1.80: Flags [.], seq 40449:40961, ack 1, win 65535, length 512
7.865648 IP 203.82.48.2.49153 > 192.168.1.1.80: Flags [.], seq 40961:41473, ack 1, win 65535, length 512
7.865648 IP 192.168.1.1.80 > 203.82.48.2.49153: Flags [.], ack 41473, win 65535, length 0
7.865731 IP 203.82.48.2.49154 > 192.168.1.1.80: Flags [.], seq 40961:41473, ack 1, win 65535, length 512
7.865731 IP 192.168.1.1.80 > 203.82.48.2.49154: Flags [.], ack 41473, win 65535, length 0
7.865845 IP 203.82.48.2.49155 > 192.168.1.1.80: Flags [.], seq 40961:41473, ack 1, win 65535, length 512
7.865845 IP 192.168.1.1.80 > 203.82.48.2.49155: Flags [.], ack 41473, win 65535, length 0
7.873840 IP 203.82.48.2.49153 > 192.168.1.1.80: Flags [.], seq 41473:41985, ack 1, win 65535, length 512
7.873894 IP 203.82.48.2.49154 > 192.168.1.1.80: Flags [.], seq 41473:41985, ack 1, win 65535, length 512
7.873949 IP 203.82.48.2.49155 > 192.168.1.1.80: Flags [.], seq 41473:41985, ack 1, win 65535, length 512
7.882032 IP 203.82.48.2.49153 > 192.168.1.1.80: Flags [.], seq 41985:42497, ack 1, win 65535, length 512
7.882032 IP 192.168.1.1.80 > 203.82.48.2.49153: Flags [.], ack 42497, win 65535, length 0
7.882096 IP 203.82.48.2.49154 > 192.168.1.1.80: Flags [.], seq 41985:42497, ack 1, win 65535, length 512
7.882096 IP 192.168.1.1.80 > 203.82.48.2.49154: Flags [.], ack 42497, win 65535, length 0
7.882165 IP 203.82.48.2.49155 > 192.168.1.1.80: Flags [.], seq 41985:42497, ack 1, win 65535, length 512
7.882165 IP 192.168.1.1.80 > 203.82.48.2.49155: Flags [.], ack 42497, win 65535, length 0
7.890224 IP 203.82.48.2.49153 > 192.168.1.1.80: Flags [.], seq 42497:43009, ack 1, win 65535, length 512
7.890284 IP 203.82.48.2.49154 > 192.168.1.1.80: Flags [.], seq 42497:43009, ack 1, win 65535, length 512
7.890337 IP 203.82.48.2.49155 > 192.168.1.1.80: Flags [.], seq 42497:43009, ack 1, win 65535, length 512
7.898416 IP 203.82.48.2.49153 > 192.168.1.1.80: Flags [.], seq 43009:43521, ack 1, win 65535, length 512
7.898416 IP 192.168.1.1.80 > 203.82.48.2.49153: Flags [.], ack 43521, win 65535, length 0
7.898480 IP 203.82.48.2.49154 > 192.168.1.1.80: Flags [.], seq 43009:43521, ack 1, win 65535, length 512
7.898480 IP 192.168.1.1.80 > 203.82.48.2.49154: Flags [.], ack 43521, win 65535, length 0
7.898552 IP 203.82.48.2.49155 > 192.168.1.1.80: Flags [.], seq 43009:43521, ack 1, win 65535, length 512
7.898552 IP 192.168.1.1.80 > 203.82.48.2.49155: Flags [.], ack 43521, win 65535, length 0
7.906608 IP 203.82.48.2.49153 > 192.168.1.1.80: Flags [.], seq 43521:44033, ack 1, win 65535, length 512
7.906663 IP 203.82.48.2.49154 > 192.168.1.1.80: Flags [.], seq 43521:44033, ack 1, win 65535, length 512
7.906721 IP 203.82.48.2.49155 > 192.168.1.1.80: Flags [.], seq 43521:44033, ack 1, win 65535, length 512
7.914800 IP 203.82.48.2.49153 > 192.168.1.1.80: Flags [.], seq 44033:44545, ack 1, win 65535, length 512
7.914800 IP 192.168.1.1.80 > 203.82.48.2.49153: Flags [.], ack 44545, win 65535, length 0
7.914864 IP 203.82.48.2.49154 > 192.168.1.1.80: Flags [.], seq 44033:44545, ack 1, win 65535, length 512
7.914864 IP 192.168.1.1.80 > 203.82.48.2.49154: Flags [.], ack 44545, win 65535, length 0
7.914950 IP 203.82.48.2.49155 > 192.168.1.1.80: Flags [.], seq 44033:44545, ack 1, win 65535, length 512
7.914950 IP 192.168.1.1.80 > 203.82.48.2.49155: Flags [.], ack 44545, win 65535, length 0
7.922992 IP 203.82.48.2.49153 > 192.168.1.1.80: Flags [.], seq 44545:45057, ack 1, win 65535, length 512
7.923046 IP 203.82.48.2.49154 > 192.168.1.1.80: Flags [.], seq 44545:45057, ack 1, win 65535, length 512
7.923101 IP 203.82.48.2.49155 > 192.168.1.1.80: Flags [.], seq 44545:45057, ack 1, win 65535, length 512
7.931184 IP 203.82.48.2.49153 > 192.168.1.1.80: Flags [.], seq 45057:45569, ack 1, win 65535, length 512
7.931184 IP 192.168.1.1.80 > 203.82.48.2.49153: Flags [.], ack 45569, win 65535, length 0
7.931265 IP 203.82.48.2.49154 > 192.168.1.1.80: Flags [.], seq 45057:45569, ack 1, win 65535, length 512
7.931265 IP 192.168.1.1.80 > 203.82.48.2.49154: Flags [.], ack 45569, win 65535, length 0
7.931344 IP 203.82.48.2.49155 > 192.168.1.1.80: Flags [.], seq 45057:45569, ack 1, win 65535, length 512
7.931344 IP 192.168.1.1.80 > 203.82.48.2.49155: Flags [.], ack 45569, win 65535, length 0
7.939376 IP 203.82.48.2.49153 > 192.168.1.1.80: Flags [.], seq 45569:46081, ack 1, win 65535, length 512
7.939429 IP 203.82.48.2.49154 > 192.168.1.1.80: Flags [.], seq 45569:46081, ack 1, win 65535, length 512
7.939493 IP 203.82.48.2.49155 > 192.168.1.1.80: Flags [.], seq 45569:46081, ack 1, win 65535, length 512
7.947568 IP 203.82.48.2.49153 > 192.168.1.1.80: Flags [.], seq 46081:46593, ack 1, win 65535, length 512
7.947568 IP 192.168.1.1.80 > 203.82.48.2.49153: Flags [.], ack 46593, win 65535, length 0
7.947640 IP 203.82.48.2.49154 > 192.168.1.1.80: Flags [.], seq 46081:46593, ack 1, win 65535, length 512
7.947640 IP 192.168.1.1.80 > 203.82.48.2.49154: Flags [.], ack 46593, win 65535, length 0
7.947724 IP 203.82.48.2.49155 > 192.168.1.1.80: Flags [.], seq 46081:46593, ack 1, win 65535, length 512
7.947724 IP 192.168.1.1.80 > 203.82.48.2.49155: Flags [.], ack 46593, win 65535, length 0
7.955760 IP 203.82.48.2.49153 > 192.168.1.1.80: Flags [.], seq 46593:47105, ack 1, win 65535, length 512
7.955813 IP 203.82.48.2.49154 > 192.168.1.1.80: Flags [.], seq 46593:47105, ack 1, win 65535, length 512
7.955866 IP 203.82.48.2.49155 > 192.168.1.1.80: Flags [.], seq 46593:47105, ack 1, win 65535, length 512
7.963952 IP 203.82.48.2.49153 > 192.168.1.1.80: Flags [.], seq 47105:47617, ack 1, win 65535, length 512
7.963952 IP 192.168.1.1.80 > 203.82.48.2.49153: Flags [.], ack 47617, win 65535, length 0
7.964018 IP 203.82.48.2.49154 > 192.168.1.1.80: Flags [.], seq 47105:47617, ack 1, win 65535, length 512
7.964018 IP 192.168.1.1.80 > 203.82.48.2.49154: Flags [.], ack 47617, win 65535, length 0
7.964091 IP 203.82.48.2.49155 > 192.168.1.1.80: Flags [.], seq 47105:47617, ack 1, win 65535, length 512
7.964091 IP 192.168.1.1.80 > 203.82.48.2.49155: Flags [.], ack 47617, win 65535, length 0
7.972144 IP 203.82.48.2.49153 > 192.168.1.1.80: Flags [.], seq 47617:48129, ack 1, win 65535, length 512
7.972224 IP 203.82.48.2.49154 > 192.168.1.1.80: Flags [.], seq 47617:48129, ack 1, win 65535, length 512
7.972284 IP 203.82.48.2.49155 > 192.168.1.1.80: Flags [.], seq 47617:48129, ack 1, win 65535, length 512
7.980336 IP 203.82.48.2.49153 > 192.168.1.1.80: Flags [.], seq 48129:48641, ack 1, win 65535, length 512
7.980336 IP 192.168.1.1.80 > 203.82.48.2.49153: Flags [.], ack 48641, win 65535, length 0
7.980415 IP 203.82.48.2.49154 > 192.168.1.1.80: Flags [.], seq 48129:48641, ack 1, win 65535, length 512
7.980415 IP 192.168.1.1.80 > 203.82.48.2.49154: Flags [.], ack 48641, win 65535, length 0
7.980493 IP 203.82.48.2.49155 > 192.168.1.1.80: Flags [.], seq 48129:48641, ack 1, win 65535, length 512
7.980493 IP 192.168.1.1.80 > 203.82.48.2.49155: Flags [.], ack 48641, win 65535, length 0
7.988528 IP 203.82.48.2.49153 > 192.168.1.1.80: Flags [.], seq 48641:49153, ack 1, win 65535, length 512
7.988582 IP 203.82.48.2.49154 > 192.168.1.1.80: Flags [.], seq 48641:49153, ack 1, win 65535, length 512
7.988635 IP 203.82.48.2.49155 > 192.168.1.1.80: Flags [.], seq 48641:49153, ack 1, win 65535, length 512
7.996720 IP 203.82.48.2.49153 > 192.168.1.1.80: Flags [.], seq 49153:49665, ack 1, win 65535, length 512
7.996720 IP 192.168.1.1.80 > 203.82.48.2.49153: Flags [.], ack 49665, win 65535, length 0
7.996812 IP 203.82.48.2.49154 > 192.168.1.1.80: Flags [.], seq 49153:49665, ack 1, win 65535, length 512
7.996812 IP 192.168.1.1.80 > 203.82.48.2.49154: Flags [.], ack 49665, win 65535, length 0
7.996879 IP 203.82.48.2.49155 > 192.168.1.1.80: Flags [.], seq 49153:49665, ack 1, win 65535, length 512
7.996879 IP 192.168.1.1.80 > 203.82.48.2.49155: Flags [.], ack 49665, win 65535, length 0
8.002015 IP 203.82.48.2.49153 > 192.168.1.1.80: Flags [F.], seq 49665, ack 1, win 65535, length 0
8.002015 IP 192.168.1.1.49153 > 203.82.48.1.9: UDP, length 5
8.002021 IP 192.168.1.1.80 > 203.82.48.2.49153: Flags [F.], seq 1, ack 49666, win 65535, length 0
8.002066 IP 203.82.48.2.49154 > 192.168.1.1.80: Flags [F.], seq 49665, ack 1, win 65535, length 0
8.002066 IP 192.168.1.1.49153 > 203.82.48.1.9: UDP, length 5
8.002072 IP 192.168.1.1.80 > 203.82.48.2.49154: Flags [F.], seq 1, ack 49666, win 65535, length 0
8.002138 IP 203.82.48.2.49155 > 192.168.1.1.80: Flags [F.], seq 49665, ack 1, win 65535, length 0
8.002138 IP 192.168.1.1.49153 > 203.82.48.1.9: UDP, length 5
8.002144 IP 192.168.1.1.80 > 203.82.48.2.49155: Flags [F.], seq 1, ack 49666, win 65535, length 0
8.006058 IP 203.82.48.2.49153 > 192.168.1.1.80: Flags [.], ack 2, win 65535, length 0
8.006118 IP 203.82.48.2.49154 > 192.168.1.1.80: Flags [.], ack 2, win 65535, length 0
8.006186 IP 203.82.48.2.49155 > 192.168.1.1.80: Flags [.], ack 2, win 65535, length 0
10.202015 IP 203.82.48.2.49156 > 192.168.1.1.80: Flags [S], seq 0, win 65535, length 0
10.202015 IP 192.168.1.1.80 > 203.82.48.2.49156: Flags [S.], seq 0, ack 1, win 65535, length 0
10.206045 IP 203.82.48.2.49156 > 192.168.1.1.80: Flags [.], ack 1, win 65535, length 0
10.206045 IP 192.168.1.1.49153 > 203.82.48.1.9: UDP, length 3
10.206133 IP 203.82.48.2.49156 > 192.168.1.1.80: Flags [.], seq 1:537, ack 1, win 65535, length 536
10.206133 IP 192.168.1.1.80 > 203.82.48.2.49156: Flags [.], ack 537, win 65535, length 0
10.210249 IP 203.82.48.2.49156 > 192.168.1.1.80: Flags [.], seq 537:1073, ack 1, win 65535, length 536
10.210305 IP 203.82.48.2.49156 > 192.168.1.1.80: Flags [.], seq 1073:1609, ack 1, win 65535, length 536
10.210305 IP 192.168.1.1.80 > 203.82.48.2.49156: Flags [.], ack 1609, win 65535, length 0
10.214420 IP 203.82.48.2.49156 > 192.168.1.1.80: Flags [.], seq 1609:2145, ack 1, win 65535, length 536
10.214476 IP 203.82.48.2.49156 > 192.168.1.1.80: Flags [.], seq 2145:2681, ack 1, win 65535, length 536
10.214476 IP 192.168.1.1.80 > 203.82.48.2.49156: Flags [.], ack 2681, win 65535, length 0
10.214546 IP 203.82.48.2.49156 > 192.168.1.1.80: Flags [.], seq 2681:3217, ack 1, win 65535, length 536
10.218591 IP 203.82.48.2.49156 > 192.168.1.1.80: Flags [.], seq 3217:3753, ack 1, win 65535, length 536
10.218591 IP 192.168.1.1.80 > 203.82.48.2.49156: Flags [.], ack 3753, win 65535, length 0
10.218663 IP 203.82.48.2.49156 > 192.168.1.1.80: Flags [.], seq 3753:4289, ack 1, win 65535, length 536
10.218728 IP 203.82.48.2.49156 > 192.168.1.1.80: Flags [.], seq 4289:4825, ack 1, win 65535, length 536
10.218728 IP 192.168.1.1.80 > 203.82.48.2.49156: Flags [.], ack 4825, win 65535, length 0
10.222707 IP 203.82.48.2.49156 > 192.168.1.1.80: Flags [.], seq 4825:5361, ack 1, win 65535, length 536
10.222764 IP 203.82.48.2.49156 > 192.168.1.1.80: Flags [.], seq 5361:5897, ack 1, win 65535, length 536
10.222764 IP 192.168.1.1.80 > 203.82.48.2.49156: Flags [.], ack 5897, win 65535, length 0
10.222850 IP 203.82.48.2.49156 > 192.168.1.1.80: Flags [.], seq 5897:6433, ack 1, win 65535, length 536
10.222907 IP 203.82.48.2.49156 > 192.168.1.1.80: Flags [.], seq 6433:6969, ack 1, win 65535, length 536
10.222907 IP 192.168.1.1.80 > 203.82.48.2.49156: Flags [.], ack 6969, win 65535, length 0
10.222982 IP 203.82.48.2.49156 > 192.168.1.1.80: Flags [.], seq 6969:7505, ack 1, win 65535, length 536
10.223036 IP 203.82.48.2.49156 > 192.168.1.1.80: Flags [.], seq 7505:8041, ack 1, win 65535, length 536
10.223036 IP 192.168.1.1.80 > 203.82.48.2.49156: Flags [.], ack 8041, win 65535, length 0
10.226879 IP 203.82.48.2.49156 > 192.168.1.1.80: Flags [.], seq 8041:8577, ack 1, win 65535, length 536
10.226936 IP 203.82.48.2.49156 > 192.168.1.1.80: Flags [.], seq 8577:9113, ack 1, win 65535, length 536
10.226936 IP 192.168.1.1.80 > 203.82.48.2.49156: Flags [.], ack 9113, win 65535, length 0
10.227084 IP 203.82.48.2.49156 > 192.168.1.1.80: Flags [.], seq 9113:9649, ack 1, win 65535, length 536
10.227141 IP 203.82.48.2.49156 > 192.168.1.1.80: Flags [.], seq 9649:10185, ack 1, win 65535, length 536
10.227141 IP 192.168.1.1.80 > 203.82.48.2.49156: Flags [.], ack 10185, win 65535, length 0
10.227216 IP 203.82.48.2.49156 > 192.168.1.1.80: Flags [.], seq 10185:10721, ack 1, win 65535, length 536
10.227273 IP 203.82.48.2.49156 > 192.168.1.1.80: Flags [.], seq 10721:11257, ack 1, win 65535, length 536
10.227273 IP 192.168.1.1.80 > 203.82.48.2.49156: Flags [.], ack 11257, win 65535, length 0
10.227409 IP 203.82.48.2.49156 > 192.168.1.1.80: Flags [.], seq 11257:11793, ack 1, win 65535, length 536
10.227477 IP 203.82.48.2.49156 > 192.168.1.1.80: Flags [.], seq 11793:12329, ack 1, win 65535, length 536
10.227477 IP 192.168.1.1.80 > 203.82.48.2.49156: Flags [.], ack 12329, win 65535, length 0
10.227558 IP 203.82.48.2.49156 > 192.168.1.1.80: Flags [.], seq 12329:12865, ack 1, win 65535, length 536
10.231051 IP 203.82.48.2.49156 > 192.168.1.1.80: Flags [.], seq 12865:13401, ack 1, win 65535, length 536
10.231051 IP 192.168.1.1.80 > 203.82.48.2.49156: Flags [.], ack 13401, win 65535, length 0
10.231143 IP 203.82.48.2.49156 > 192.168.1.1.80: Flags [.], seq 13401:13937, ack 1, win 65535, length 536
10.231209 IP 203.82.48.2.49156 > 192.168.1.1.80: Flags [.], seq 13937:14473, ack 1, win 65535, length 536
10.231209 IP 192.168.1.1.80 > 203.82.48.2.49156: Flags [.], ack 14473, win 65535, length 0
10.231277 IP 203.82.48.2.49156 > 192.168.1.1.80: Flags [.], seq 14473:15009, ack 1, win 65535, length 536
10.231344 IP 203.82.48.2.49156 > 192.168.1.1.80: Flags [.], seq 15009:15545, ack 1, win 65535, length 536
10.231344 IP 192.168.1.1.80 > 203.82.48.2.49156: Flags [.], ack 15545, win 65535, length 0
10.231461 IP 203.82.48.2.49156 > 192.168.1.1.80: Flags [.], seq 15545:16081, ack 1, win 65535, length 536
10.231519 IP 203.82.48.2.49156 > 192.168.1.1.80: Flags [.], seq 16081:16617, ack 1, win 65535, length 536
10.231519 IP 192.168.1.1.80 > 203.82.48.2.49156: Flags [.], ack 16617, win 65535, length 0
10.231601 IP 203.82.48.2.49156 > 192.168.1.1.80: Flags [.], seq 16617:17153, ack 1, win 65535, length 536
10.231657 IP 203.82.48.2.49156 > 192.168.1.1.80: Flags [.], seq 17153:17689, ack 1, win 65535, length 536
10.231657 IP 192.168.1.1.80 > 203.82.48.2.49156: Flags [.], ack 17689, win 65535, length 0
10.231732 IP 203.82.48.2.49156 > 192.168.1.1.80: Flags [.], seq 17689:18225, ack 1, win 65535, length 536
10.231790 IP 203.82.48.2.49156 > 192.168.1.1.80: Flags [.], seq 18225:18761, ack 1, win 65535, length 536
10.231790 IP 192.168.1.1.80 > 203.82.48.2.49156: Flags [.], ack 18761, win 65535, length 0
10.231865 IP 203.82.48.2.49156 > 192.168.1.1.80: Flags [.], seq 18761:19297, ack 1, win 65535, length 536
10.235167 IP 203.82.48.2.49156 > 192.168.1.1.80: Flags [.], seq 19297:19833, ack 1, win 65535, length 536
10.235167 IP 192.168.1.1.80 > 203.82.48.2.49156: Flags [.], ack 19833, win 65535, length 0
10.235234 IP 203.82.48.2.49156 > 192.168.1.1.80: Flags [.], seq 19833:20369, ack 1, win 65535, length 536
10.235289 IP 203.82.48.2.49156 > 192.168.1.1.80: Flags [.], seq 20369:20905, ack 1, win 65535, length 536
10.235289 IP 192.168.1.1.80 > 203.82.48.2.49156: Flags [.], ack 20905, win 65535, length 0
10.235355 IP 203.82.48.2.49156 > 192.168.1.1.80: Flags [.], seq 20905:21441, ack 1, win 65535, length 536
10.235410 IP 203.82.48.2.49156 > 192.168.1.1.80: Flags [.], seq 21441:21977, ack 1, win 65535, length 536
10.235410 IP 192.168.1.1.80 > 203.82.48.2.49156: Flags [.], ack 21977, win 65535, length 0
10.235482 IP 203.82.48.2.49156 > 192.168.1.1.80: Flags [.], seq 21977:22513, ack 1, win 65535, length 536
10.235539 IP 203.82.48.2.49156 > 192.168.1.1.80: Flags [.], seq 22513:23049, ack 1, win 65535, length 536
10.235539 IP 192.168.1.1.80 > 203.82.48.2.49156: Flags [.], ack 23049, win 65535, length 0
10.235654 IP 203.82.48.2.49156 > 192.168.1.1.80: Flags [.], seq 23049:23585, ack 1, win 65535, length 536
10.235710 IP 203.82.48.2.49156 > 192.168.1.1.80: Flags [.], seq 23585:24121, ack 1, win 65535, length 536
10.235710 IP 192.168.1.1.80 > 203.82.48.2.49156: Flags [.], ack 24121, win 65535, length 0
10.235786 IP 203.82.48.2.49156 > 192.168.1.1.80: Flags [.], seq 24121:24657, ack 1, win 65535, length 536
10.235842 IP 203.82.48.2.49156 > 192.168.1.1.80: Flags [.], seq 24657:25193, ack 1, win 65535, length 536
10.235842 IP 192.168.1.1.80 > 203.82.48.2.49156: Flags [.], ack 25193, win 65535, length 0
10.235934 IP 203.82.48.2.49156 > 192.168.1.1.80: Flags [.], seq 25193:25729, ack 1, win 65535, length 536
10.235998 IP 203.82.48.2.49156 > 192.168.1.1.80: Flags [.], seq 25729:26265, ack 1, win 65535, length 536
10.235998 IP 192.168.1.1.80 > 203.82.48.2.49156: Flags [.], ack 26265, win 65535, length 0
10.236069 IP 203.82.48.2.49156 > 192.168.1.1.80: Flags [.], seq 26265:26801, ack 1, win 65535, length 536
10.236123 IP 203.82.48.2.49156 > 192.168.1.1.80: Flags [.], seq 26801:27337, ack 1, win 65535, length 536
10.236123 IP 192.168.1.1.80 > 203.82.48.2.49156: Flags [.], ack 27337, win 65535, length 0
10.236199 IP 203.82.48.2.49156 > 192.168.1.1.80: Flags [.], seq 27337:27873, ack 1, win 65535, length 536
10.236253 IP 203.82.48.2.49156 > 192.168.1.1.80: Flags [.], seq 27873:28409, ack 1, win 65535, length 536
10.236253 IP 192.168.1.1.80 > 203.82.48.2.49156: Flags [.], ack 28409, win 65535, length 0
10.236330 IP 203.82.48.2.49156 > 192.168.1.1.80: Flags [.], seq 28409:28945, ack 1, win 65535, length 536
10.239282 IP 203.82.48.2.49156 > 192.168.1.1.80: Flags [.], seq 28945:29481, ack 1, win 65535, length 536
10.239282 IP 192.168.1.1.80 > 203.82.48.2.49156: Flags [.], ack 29481, win 65535, length 0
10.239356 IP 203.82.48.2.49156 > 192.168.1.1.80: Flags [.], seq 29481:30017, ack 1, win 65535, length 536
10.239418 IP 203.82.48.2.49156 > 192.168.1.1.80: Flags [.], seq 30017:30553, ack 1, win 65535, length 536
10.239418 IP 192.168.1.1.80 > 203.82.48.2.49156: Flags [.], ack 30553, win 65535, length 0
10.239489 IP 203.82.48.2.49156 > 192.168.1.1.80: Flags [.], seq 30553:31089, ack 1, win 65535, length 536
10.239547 IP 203.82.48.2.49156 > 192.168.1.1.80: Flags [.], seq 31089:31625, ack 1, win 65535, length 536
10.239547 IP 192.168.1.1.80 > 203.82.48.2.49156: Flags [.], ack 31625, win 65535, length 0
10.239617 IP 203.82.48.2.49156 > 192.168.1.1.80: Flags [.], seq 31625:32161, ack 1, win 65535, length 536
10.239673 IP 203.82.48.2.49156 > 192.168.1.1.80: Flags [.], seq 32161:32697, ack 1, win 65535, length 536
10.239673 IP 192.168.1.1.80 > 203.82.48.2.49156: Flags [.], ack 32697, win 65535, length 0
10.239759 IP 203.82.48.2.49156 > 192.168.1.1.80: Flags [.], seq 32697:33233, ack 1, win 65535, length 536
10.239819 IP 203.82.48.2.49156 > 192.168.1.1.80: Flags [.], seq 33233:33769, ack 1, win 65535, length 536
10.239819 IP 192.168.1.1.80 > 203.82.48.2.49156: Flags [.], ack 33769, win 65535, length 0
10.239885 IP 203.82.48.2.49156 > 192.168.1.1.80: Flags [.], seq 33769:34305, ack 1, win 65535, length 536
10.239940 IP 203.82.48.2.49156 > 192.168.1.1.80: Flags [.], seq 34305:34841, ack 1, win 65535, length 536
10.239940 IP 192.168.1.1.80 > 203.82.48.2.49156: Flags [.], ack 34841, win 65535, length 0
10.240007 IP 203.82.48.2.49156 > 192.168.1.1.80: Flags [.], seq 34841:35377, ack 1, win 65535, length 536
10.240063 IP 203.82.48.2.49156 > 192.168.1.1.80: Flags [.], seq 35377:35913, ack 1, win 65535, length 536
10.240063 IP 192.168.1.1.80 > 203.82.48.2.49156: Flags [.], ack 35913, win 65535, length 0
10.240131 IP 203.82.48.2.49156 > 192.168.1.1.80: Flags [.], seq 35913:36449, ack 1, win 65535, length 536
10.240194 IP 203.82.48.2.49156 > 192.168.1.1.80: Flags [.], seq 36449:36985, ack 1, win 65535, length 536
10.240194 IP 192.168.1.1.80 > 203.82.48.2.49156: Flags [.], ack 36985, win 65535, length 0
10.240270 IP 203.82.48.2.49156 > 192.168.1.1.80: Flags [.], seq 36985:37521, ack 1, win 65535, length 536
10.240327 IP 203.82.48.2.49156 > 192.168.1.1.80: Flags [.], seq 37521:38057, ack 1, win 65535, length 536
10.240327 IP 192.168.1.1.80 > 203.82.48.2.49156: Flags [.], ack 38057, win 65535, length 0
10.240395 IP 203.82.48.2.49156 > 192.168.1.1.80: Flags [.], seq 38057:38593, ack 1, win 65535, length 536
10.240452 IP 203.82.48.2.49156 > 192.168.1.1.80: Flags [.], seq 38593:39129, ack 1, win 65535, length 536
10.240452 IP 192.168.1.1.80 > 203.82.48.2.49156: Flags [.], ack 39129, win 65535, length 0
10.240533 IP 203.82.48.2.49156 > 192.168.1.1.80: Flags [.], seq 39129:39665, ack 1, win 65535, length 536
10.240600 IP 203.82.48.2.49156 > 192.168.1.1.80: Flags [.], seq 39665:40201, ack 1, win 65535, length 536
10.240600 IP 192.168.1.1.80 > 203.82.48.2.49156: Flags [.], ack 40201, win 65535, length 0
10.240693 IP 203.82.48.2.49156 > 192.168.1.1.80: Flags [.], seq 40201:40737, ack 1, win 65535, length 536
10.240748 IP 203.82.48.2.49156 > 192.168.1.1.80: Flags [.], seq 40737:41273, ack 1, win 65535, length 536
10.240748 IP 192.168.1.1.80 > 203.82.48.2.49156: Flags [.], ack 41273, win 65535, length 0
10.240819 IP 203.82.48.2.49156 > 192.168.1.1.80: Flags [.], seq 41273:41809, ack 1, win 65535, length 536
10.240875 IP 203.82.48.2.49156 > 192.168.1.1.80: Flags [.], seq 41809:42345, ack 1, win 65535, length 536
10.240875 IP 192.168.1.1.80 > 203.82.48.2.49156: Flags [.], ack 42345, win 65535, length 0
10.240947 IP 203.82.48.2.49156 > 192.168.1.1.80: Flags [.], seq 42345:42881, ack 1, win 65535, length 536
10.241008 IP 203.82.48.2.49156 > 192.168.1.1.80: Flags [.], seq 42881:43417, ack 1, win 65535, length 536
10.241008 IP 192.168.1.1.80 > 203.82.48.2.49156: Flags [.], ack 43417, win 65535, length 0
10.243397 IP 203.82.48.2.49156 > 192.168.1.1.80: Flags [.], seq 43417:43953, ack 1, win 65535, length 536
10.243453 IP 203.82.48.2.49156 > 192.168.1.1.80: Flags [.], seq 43953:44489, ack 1, win 65535, length 536
10.243453 IP 192.168.1.1.80 > 203.82.48.2.49156: Flags [.], ack 44489, win 65535, length 0
10.243522 IP 203.82.48.2.49156 > 192.168.1.1.80: Flags [.], seq 44489:45025, ack 1, win 65535, length 536
10.243584 IP 203.82.48.2.49156 > 192.168.1.1.80: Flags [.], seq 45025:45561, ack 1, win 65535, length 536
10.243584 IP 192.168.1.1.80 > 203.82.48.2.49156: Flags [.], ack 45561, win 65535, length 0
10.243686 IP 203.82.48.2.49156 > 192.168.1.1.80: Flags [.], seq 45561:46097, ack 1, win 65535, length 536
10.243741 IP 203.82.48.2.49156 > 192.168.1.1.80: Flags [.], seq 46097:46633, ack 1, win 65535, length 536
10.243741 IP 192.168.1.1.80 > 203.82.48.2.49156: Flags [.], ack 46633, win 65535, length 0
10.243808 IP 203.82.48.2.49156 > 192.168.1.1.80: Flags [.], seq 46633:47169, ack 1, win 65535, length 536
10.243863 IP 203.82.48.2.49156 > 192.168.1.1.80: Flags [.], seq 47169:47705, ack 1, win 65535, length 536
10.243863 IP 192.168.1.1.80 > 203.82.48.2.49156: Flags [.], ack 47705, win 65535, length 0
10.243930 IP 203.82.48.2.49156 > 192.168.1.1.80: Flags [.], seq 47705:48241, ack 1, win 65535, length 536
10.243988 IP 203.82.48.2.49156 > 192.168.1.1.80: Flags [.], seq 48241:48777, ack 1, win 65535, length 536
10.243988 IP 192.168.1.1.80 > 203.82.48.2.49156: Flags [.], ack 48777, win 65535, length 0
10.244070 IP 203.82.48.2.49156 > 192.168.1.1.80: Flags [.], seq 48777:49313, ack 1, win 65535, length 536
10.244111 IP 203.82.48.2.49156 > 192.168.1.1.80: Flags [F.], seq 49313:49665, ack 1, win 65535, length 352
10.244111 IP 192.168.1.1.80 > 203.82.48.2.49156: Flags [.], ack 49666, win 65535, length 0
10.244117 IP 192.168.1.1.49153 > 203.82.48.1.9: UDP, length 5
10.244134 IP 192.168.1.1.80 > 203.82.48.2.49156: Flags [F.], seq 1, ack 49666, win 65535, length 0
10.248174 IP 203.82.48.2.49156 > 192.168.1.1.80: Flags [.], ack 2, win 65535, length 0
20.000000 IP 192.168.1.1.49153 > 203.82.48.1.9: UDP, length 5
20.000025 ARP, Request who-has 192.168.1.5 (ff:ff:ff:ff:ff:ff) tell 192.168.1.2, length 50
20.000094 ARP, Request who-has 192.168.1.5 (ff:ff:ff:ff:ff:ff) tell 192.168.1.4, length 50
20.000208 ARP, Request who-has 192.168.1.5 (ff:ff:ff:ff:ff:ff) tell 192.168.1.3, length 50
