1.010125 ARP, Request who-has 192.168.1.5 (ff:ff:ff:ff:ff:ff) tell 192.168.1.1, length 50
1.010200 ARP, Request who-has 192.168.1.2 (ff:ff:ff:ff:ff:ff) tell 192.168.1.1, length 50
1.010200 ARP, Reply 192.168.1.2 is-at 00:00:00:00:00:05, length 50
1.010339 ARP, Request who-has 192.168.1.4 (ff:ff:ff:ff:ff:ff) tell 192.168.1.1, length 50
1.010627 ARP, Request who-has 192.168.1.3 (ff:ff:ff:ff:ff:ff) tell 192.168.1.1, length 50
1.010853 ARP, Request who-has 192.168.1.1 (ff:ff:ff:ff:ff:ff) tell 192.168.1.5, length 50
1.011291 IP 203.82.48.2.49154 > 192.168.1.2.80: Flags [S], seq 0, win 65535, length 0
1.011291 ARP, Request who-has 192.168.1.1 (ff:ff:ff:ff:ff:ff) tell 192.168.1.2, length 50
1.011555 IP 203.82.48.2.49165 > 192.168.1.2.80: Flags [S], seq 0, win 65535, length 0
1.011635 IP 203.82.48.2.49167 > 192.168.1.2.80: Flags [S], seq 0, win 65535, length 0
1.011846 ARP, Request who-has 192.168.1.1 (ff:ff:ff:ff:ff:ff) tell 192.168.1.4, length 50
1.012390 ARP, Request who-has 192.168.1.1 (ff:ff:ff:ff:ff:ff) tell 192.168.1.3, length 50
1.012982 ARP, Reply 192.168.1.1 is-at 00:00:00:00:00:03, length 50
1.012982 IP 192.168.1.2.80 > 203.82.48.2.49154: Flags [S.], seq 0, ack 1, win 65535, length 0
1.012989 IP 192.168.1.2.80 > 203.82.48.2.49165: Flags [S.], seq 0, ack 1, win 65535, length 0
1.013055 IP 192.168.1.2.80 > 203.82.48.2.49167: Flags [S.], seq 0, ack 1, win 65535, length 0
1.033873 IP 203.82.48.2.49154 > 192.168.1.2.80: Flags [.], ack 1, win 65535, length 0
1.033873 IP 192.168.1.2.49153 > 192.168.1.1.9: UDP, length 3
1.034234 IP 203.82.48.2.49154 > 192.168.1.2.80: Flags [.], seq 1:1461, ack 1, win 65535, length 1460
1.034234 IP 192.168.1.2.80 > 203.82.48.2.49154: Flags [.], ack 1461, win 65535, length 0
1.035059 IP 203.82.48.2.49165 > 192.168.1.2.80: Flags [.], ack 1, win 65535, length 0
1.035059 IP 192.168.1.2.49153 > 192.168.1.1.9: UDP, length 3
1.035309 IP 203.82.48.2.49165 > 192.168.1.2.80: Flags [.], seq 1:1461, ack 1, win 65535, length 1460
1.035309 IP 192.168.1.2.80 > 203.82.48.2.49165: Flags [.], ack 1461, win 65535, length 0
1.035441 IP 203.82.48.2.49167 > 192.168.1.2.80: Flags [.], ack 1, win 65535, length 0
1.035441 IP 192.168.1.2.49153 > 192.168.1.1.9: UDP, length 3
1.035720 IP 203.82.48.2.49167 > 192.168.1.2.80: Flags [.], seq 1:1461, ack 1, win 65535, length 1460
1.035720 IP 192.168.1.2.80 > 203.82.48.2.49167: Flags [.], ack 1461, win 65535, length 0
1.054675 IP 203.82.48.2.49154 > 192.168.1.2.80: Flags [.], seq 1461:2921, ack 1, win 65535, length 1460
1.054675 IP 192.168.1.2.80 > 203.82.48.2.49154: Flags [.], ack 2921, win 65535, length 0
1.054963 IP 203.82.48.2.49154 > 192.168.1.2.80: Flags [.], seq 2921:4381, ack 1, win 65535, length 1460
1.054963 IP 192.168.1.2.80 > 203.82.48.2.49154: Flags [.], ack 4381, win 65535, length 0
1.055826 IP 203.82.48.2.49165 > 192.168.1.2.80: Flags [.], seq 1461:2921, ack 1, win 65535, length 1460
1.055826 IP 192.168.1.2.80 > 203.82.48.2.49165: Flags [.], ack 2921, win 65535, length 0
1.056095 IP 203.82.48.2.49165 > 192.168.1.2.80: Flags [.], seq 2921:4381, ack 1, win 65535, length 1460
1.056095 IP 192.168.1.2.80 > 203.82.48.2.49165: Flags [.], ack 4381, win 65535, length 0
1.056388 IP 203.82.48.2.49167 > 192.168.1.2.80: Flags [.], seq 1461:2921, ack 1, win 65535, length 1460
1.056388 IP 192.168.1.2.80 > 203.82.48.2.49167: Flags [.], ack 2921, win 65535, length 0
1.056659 IP 203.82.48.2.49167 > 192.168.1.2.80: Flags [.], seq 2921:4381, ack 1, win 65535, length 1460
1.056659 IP 192.168.1.2.80 > 203.82.48.2.49167: Flags [.], ack 4381, win 65535, length 0
1.076100 IP 203.82.48.2.49154 > 192.168.1.2.80: Flags [.], seq 4381:5841, ack 1, win 65535, length 1460
1.076100 IP 192.168.1.2.80 > 203.82.48.2.49154: Flags [.], ack 5841, win 65535, length 0
1.076364 IP 203.82.48.2.49154 > 192.168.1.2.80: Flags [.], seq 5841:7301, ack 1, win 65535, length 1460
1.076364 IP 192.168.1.2.80 > 203.82.48.2.49154: Flags [.], ack 7301, win 65535, length 0
1.076691 IP 203.82.48.2.49154 > 192.168.1.2.80: Flags [.], seq 7301:8761, ack 1, win 65535, length 1460
1.076691 IP 192.168.1.2.80 > 203.82.48.2.49154: Flags [.], ack 8761, win 65535, length 0
1.077007 IP 203.82.48.2.49154 > 192.168.1.2.80: Flags [.], seq 8761:10221, ack 1, win 65535, length 1460
1.077007 IP 192.168.1.2.80 > 203.82.48.2.49154: Flags [.], ack 10221, win 65535, length 0
1.077265 IP 203.82.48.2.49165 > 192.168.1.2.80: Flags [.], seq 4381:5841, ack 1, win 65535, length 1460
1.077265 IP 192.168.1.2.80 > 203.82.48.2.49165: Flags [.], ack 5841, win 65535, length 0
1.077577 IP 203.82.48.2.49165 > 192.168.1.2.80: Flags [.], seq 5841:7301, ack 1, win 65535, length 1460
1.077577 IP 192.168.1.2.80 > 203.82.48.2.49165: Flags [.], ack 7301, win 65535, length 0
1.077864 IP 203.82.48.2.49165 > 192.168.1.2.80: Flags [.], seq 7301:8761, ack 1, win 65535, length 1460
1.077864 IP 192.168.1.2.80 > 203.82.48.2.49165: Flags [.], ack 8761, win 65535, length 0
1.078317 IP 203.82.48.2.49165 > 192.168.1.2.80: Flags [.], seq 8761:10221, ack 1, win 65535, length 1460
1.078317 IP 192.168.1.2.80 > 203.82.48.2.49165: Flags [.], ack 10221, win 65535, length 0
1.078588 IP 203.82.48.2.49167 > 192.168.1.2.80: Flags [.], seq 4381:5841, ack 1, win 65535, length 1460
1.078588 IP 192.168.1.2.80 > 203.82.48.2.49167: Flags [.], ack 5841, win 65535, length 0
1.078888 IP 203.82.48.2.49167 > 192.168.1.2.80: Flags [.], seq 5841:7301, ack 1, win 65535, length 1460
1.078888 IP 192.168.1.2.80 > 203.82.48.2.49167: Flags [.], ack 7301, win 65535, length 0
1.079270 IP 203.82.48.2.49167 > 192.168.1.2.80: Flags [.], seq 7301:8761, ack 1, win 65535, length 1460
1.079270 IP 192.168.1.2.80 > 203.82.48.2.49167: Flags [.], ack 8761, win 65535, length 0
1.079565 IP 203.82.48.2.49167 > 192.168.1.2.80: Flags [.], seq 8761:10221, ack 1, win 65535, length 1460
1.079565 IP 192.168.1.2.80 > 203.82.48.2.49167: Flags [.], ack 10221, win 65535, length 0
1.096472 IP 203.82.48.2.49154 > 192.168.1.2.80: Flags [.], seq 10221:11681, ack 1, win 65535, length 1460
1.096472 IP 192.168.1.2.80 > 203.82.48.2.49154: Flags [.], ack 11681, win 65535, length 0
1.096719 IP 203.82.48.2.49154 > 192.168.1.2.80: Flags [.], seq 11681:13141, ack 1, win 65535, length 1460
1.096719 IP 192.168.1.2.80 > 203.82.48.2.49154: Flags [.], ack 13141, win 65535, length 0
1.097251 IP 203.82.48.2.49154 > 192.168.1.2.80: Flags [.], seq 13141:14601, ack 1, win 65535, length 1460
1.097251 IP 192.168.1.2.80 > 203.82.48.2.49154: Flags [.], ack 14601, win 65535, length 0
1.097516 IP 203.82.48.2.49154 > 192.168.1.2.80: Flags [.], seq 14601:16061, ack 1, win 65535, length 1460
1.097516 IP 192.168.1.2.80 > 203.82.48.2.49154: Flags [.], ack 16061, win 65535, length 0
1.098678 IP 203.82.48.2.49154 > 192.168.1.2.80: Flags [.], seq 16061:17521, ack 1, win 65535, length 1460
1.098678 IP 192.168.1.2.80 > 203.82.48.2.49154: Flags [.], ack 17521, win 65535, length 0
1.098962 IP 203.82.48.2.49154 > 192.168.1.2.80: Flags [.], seq 17521:18981, ack 1, win 65535, length 1460
1.098962 IP 192.168.1.2.80 > 203.82.48.2.49154: Flags [.], ack 18981, win 65535, length 0
1.099364 IP 203.82.48.2.49154 > 192.168.1.2.80: Flags [.], seq 18981:20441, ack 1, win 65535, length 1460
1.099364 IP 192.168.1.2.80 > 203.82.48.2.49154: Flags [.], ack 20441, win 65535, length 0
1.099641 IP 203.82.48.2.49154 > 192.168.1.2.80: Flags [.], seq 20441:21901, ack 1, win 65535, length 1460
1.099641 IP 192.168.1.2.80 > 203.82.48.2.49154: Flags [.], ack 21901, win 65535, length 0
1.099956 IP 203.82.48.2.49165 > 192.168.1.2.80: Flags [.], seq 10221:11681, ack 1, win 65535, length 1460
1.099956 IP 192.168.1.2.80 > 203.82.48.2.49165: Flags [.], ack 11681, win 65535, length 0
1.100277 IP 203.82.48.2.49165 > 192.168.1.2.80: Flags [.], seq 11681:13141, ack 1, win 65535, length 1460
1.100277 IP 192.168.1.2.80 > 203.82.48.2.49165: Flags [.], ack 13141, win 65535, length 0
1.100760 IP 203.82.48.2.49165 > 192.168.1.2.80: Flags [.], seq 13141:14601, ack 1, win 65535, length 1460
1.100760 IP 192.168.1.2.80 > 203.82.48.2.49165: Flags [.], ack 14601, win 65535, length 0
1.101040 IP 203.82.48.2.49165 > 192.168.1.2.80: Flags [.], seq 14601:16061, ack 1, win 65535, length 1460
1.101040 IP 192.168.1.2.80 > 203.82.48.2.49165: Flags [.], ack 16061, win 65535, length 0
1.101421 IP 203.82.48.2.49165 > 192.168.1.2.80: Flags [.], seq 16061:17521, ack 1, win 65535, length 1460
1.101421 IP 192.168.1.2.80 > 203.82.48.2.49165: Flags [.], ack 17521, win 65535, length 0
1.101783 IP 203.82.48.2.49165 > 192.168.1.2.80: Flags [.], seq 17521:18981, ack 1, win 65535, length 1460
1.101783 IP 192.168.1.2.80 > 203.82.48.2.49165: Flags [.], ack 18981, win 65535, length 0
1.102051 IP 203.82.48.2.49165 > 192.168.1.2.80: Flags [.], seq 18981:20441, ack 1, win 65535, length 1460
1.102051 IP 192.168.1.2.80 > 203.82.48.2.49165: Flags [.], ack 20441, win 65535, length 0
1.102464 IP 203.82.48.2.49165 > 192.168.1.2.80: Flags [.], seq 20441:21901, ack 1, win 65535, length 1460
1.102464 IP 192.168.1.2.80 > 203.82.48.2.49165: Flags [.], ack 21901, win 65535, length 0
1.103193 IP 203.82.48.2.49167 > 192.168.1.2.80: Flags [.], seq 10221:11681, ack 1, win 65535, length 1460
1.103193 IP 192.168.1.2.80 > 203.82.48.2.49167: Flags [.], ack 11681, win 65535, length 0
1.103449 IP 203.82.48.2.49167 > 192.168.1.2.80: Flags [.], seq 11681:13141, ack 1, win 65535, length 1460
1.103449 IP 192.168.1.2.80 > 203.82.48.2.49167: Flags [.], ack 13141, win 65535, length 0
1.103734 IP 203.82.48.2.49167 > 192.168.1.2.80: Flags [.], seq 13141:14601, ack 1, win 65535, length 1460
1.103734 IP 192.168.1.2.80 > 203.82.48.2.49167: Flags [.], ack 14601, win 65535, length 0
1.104062 IP 203.82.48.2.49167 > 192.168.1.2.80: Flags [.], seq 14601:16061, ack 1, win 65535, length 1460
1.104062 IP 192.168.1.2.80 > 203.82.48.2.49167: Flags [.], ack 16061, win 65535, length 0
1.104345 IP 203.82.48.2.49167 > 192.168.1.2.80: Flags [.], seq 16061:17521, ack 1, win 65535, length 1460
1.104345 IP 192.168.1.2.80 > 203.82.48.2.49167: Flags [.], ack 17521, win 65535, length 0
1.104752 IP 203.82.48.2.49167 > 192.168.1.2.80: Flags [.], seq 17521:18981, ack 1, win 65535, length 1460
1.104752 IP 192.168.1.2.80 > 203.82.48.2.49167: Flags [.], ack 18981, win 65535, length 0
1.105165 IP 203.82.48.2.49167 > 192.168.1.2.80: Flags [.], seq 18981:20441, ack 1, win 65535, length 1460
1.105165 IP 192.168.1.2.80 > 203.82.48.2.49167: Flags [.], ack 20441, win 65535, length 0
1.105452 IP 203.82.48.2.49167 > 192.168.1.2.80: Flags [.], seq 20441:21901, ack 1, win 65535, length 1460
1.105452 IP 192.168.1.2.80 > 203.82.48.2.49167: Flags [.], ack 21901, win 65535, length 0
1.116864 IP 203.82.48.2.49154 > 192.168.1.2.80: Flags [.], seq 21901:23361, ack 1, win 65535, length 1460
1.116864 IP 192.168.1.2.80 > 203.82.48.2.49154: Flags [.], ack 23361, win 65535, length 0
1.117188 IP 203.82.48.2.49154 > 192.168.1.2.80: Flags [.], seq 23361:24821, ack 1, win 65535, length 1460
1.117188 IP 192.168.1.2.80 > 203.82.48.2.49154: Flags [.], ack 24821, win 65535, length 0
1.118076 IP 203.82.48.2.49154 > 192.168.1.2.80: Flags [.], seq 24821:26281, ack 1, win 65535, length 1460
1.118076 IP 192.168.1.2.80 > 203.82.48.2.49154: Flags [.], ack 26281, win 65535, length 0
1.118580 IP 203.82.48.2.49154 > 192.168.1.2.80: Flags [.], seq 26281:27741, ack 1, win 65535, length 1460
1.118580 IP 192.168.1.2.80 > 203.82.48.2.49154: Flags [.], ack 27741, win 65535, length 0
1.119136 IP 203.82.48.2.49154 > 192.168.1.2.80: Flags [.], seq 27741:29201, ack 1, win 65535, length 1460
1.119136 IP 192.168.1.2.80 > 203.82.48.2.49154: Flags [.], ack 29201, win 65535, length 0
1.119442 IP 203.82.48.2.49154 > 192.168.1.2.80: Flags [.], seq 29201:30661, ack 1, win 65535, length 1460
1.119442 IP 192.168.1.2.80 > 203.82.48.2.49154: Flags [.], ack 30661, win 65535, length 0
1.119817 IP 203.82.48.2.49154 > 192.168.1.2.80: Flags [.], seq 30661:32121, ack 1, win 65535, length 1460
1.119817 IP 192.168.1.2.80 > 203.82.48.2.49154: Flags [.], ack 32121, win 65535, length 0
1.120106 IP 203.82.48.2.49154 > 192.168.1.2.80: Flags [.], seq 32121:33581, ack 1, win 65535, length 1460
1.120106 IP 192.168.1.2.80 > 203.82.48.2.49154: Flags [.], ack 33581, win 65535, length 0
1.122056 IP 203.82.48.2.49154 > 192.168.1.2.80: Flags [.], seq 33581:35041, ack 1, win 65535, length 1460
1.122056 IP 192.168.1.2.80 > 203.82.48.2.49154: Flags [.], ack 35041, win 65535, length 0
1.122315 IP 203.82.48.2.49154 > 192.168.1.2.80: Flags [.], seq 35041:36501, ack 1, win 65535, length 1460
1.122315 IP 192.168.1.2.80 > 203.82.48.2.49154: Flags [.], ack 36501, win 65535, length 0
1.124397 IP 203.82.48.2.49154 > 192.168.1.2.80: Flags [.], seq 36501:37961, ack 1, win 65535, length 1460
1.124397 IP 192.168.1.2.80 > 203.82.48.2.49154: Flags [.], ack 37961, win 65535, length 0
1.124653 IP 203.82.48.2.49154 > 192.168.1.2.80: Flags [.], seq 37961:39421, ack 1, win 65535, length 1460
1.124653 IP 192.168.1.2.80 > 203.82.48.2.49154: Flags [.], ack 39421, win 65535, length 0
1.124930 IP 203.82.48.2.49154 > 192.168.1.2.80: Flags [.], seq 39421:40881, ack 1, win 65535, length 1460
1.124930 IP 192.168.1.2.80 > 203.82.48.2.49154: Flags [.], ack 40881, win 65535, length 0
1.125404 IP 203.82.48.2.49154 > 192.168.1.2.80: Flags [.], seq 40881:42341, ack 1, win 65535, length 1460
1.125404 IP 192.168.1.2.80 > 203.82.48.2.49154: Flags [.], ack 42341, win 65535, length 0
1.125706 IP 203.82.48.2.49154 > 192.168.1.2.80: Flags [.], seq 42341:43801, ack 1, win 65535, length 1460
1.125706 IP 192.168.1.2.80 > 203.82.48.2.49154: Flags [.], ack 43801, win 65535, length 0
1.125962 IP 203.82.48.2.49154 > 192.168.1.2.80: Flags [.], seq 43801:45261, ack 1, win 65535, length 1460
1.125962 IP 192.168.1.2.80 > 203.82.48.2.49154: Flags [.], ack 45261, win 65535, length 0
1.126287 IP 203.82.48.2.49165 > 192.168.1.2.80: Flags [.], seq 21901:23361, ack 1, win 65535, length 1460
1.126287 IP 192.168.1.2.80 > 203.82.48.2.49165: Flags [.], ack 23361, win 65535, length 0
1.126816 IP 203.82.48.2.49165 > 192.168.1.2.80: Flags [.], seq 23361:24821, ack 1, win 65535, length 1460
1.126816 IP 192.168.1.2.80 > 203.82.48.2.49165: Flags [.], ack 24821, win 65535, length 0
1.127437 IP 203.82.48.2.49165 > 192.168.1.2.80: Flags [.], seq 24821:26281, ack 1, win 65535, length 1460
1.127437 IP 192.168.1.2.80 > 203.82.48.2.49165: Flags [.], ack 26281, win 65535, length 0
1.127766 IP 203.82.48.2.49165 > 192.168.1.2.80: Flags [.], seq 26281:27741, ack 1, win 65535, length 1460
1.127766 IP 192.168.1.2.80 > 203.82.48.2.49165: Flags [.], ack 27741, win 65535, length 0
1.128043 IP 203.82.48.2.49165 > 192.168.1.2.80: Flags [.], seq 27741:29201, ack 1, win 65535, length 1460
1.128043 IP 192.168.1.2.80 > 203.82.48.2.49165: Flags [.], ack 29201, win 65535, length 0
1.128437 IP 203.82.48.2.49165 > 192.168.1.2.80: Flags [.], seq 29201:30661, ack 1, win 65535, length 1460
1.128437 IP 192.168.1.2.80 > 203.82.48.2.49165: Flags [.], ack 30661, win 65535, length 0
1.128787 IP 203.82.48.2.49165 > 192.168.1.2.80: Flags [.], seq 30661:32121, ack 1, win 65535, length 1460
1.128787 IP 192.168.1.2.80 > 203.82.48.2.49165: Flags [.], ack 32121, win 65535, length 0
1.129087 IP 203.82.48.2.49165 > 192.168.1.2.80: Flags [.], seq 32121:33581, ack 1, win 65535, length 1460
1.129087 IP 192.168.1.2.80 > 203.82.48.2.49165: Flags [.], ack 33581, win 65535, length 0
1.129459 IP 203.82.48.2.49165 > 192.168.1.2.80: Flags [.], seq 33581:35041, ack 1, win 65535, length 1460
1.129459 IP 192.168.1.2.80 > 203.82.48.2.49165: Flags [.], ack 35041, win 65535, length 0
1.129715 IP 203.82.48.2.49165 > 192.168.1.2.80: Flags [.], seq 35041:36501, ack 1, win 65535, length 1460
1.129715 IP 192.168.1.2.80 > 203.82.48.2.49165: Flags [.], ack 36501, win 65535, length 0
1.130068 IP 203.82.48.2.49165 > 192.168.1.2.80: Flags [.], seq 36501:37961, ack 1, win 65535, length 1460
1.130068 IP 192.168.1.2.80 > 203.82.48.2.49165: Flags [.], ack 37961, win 65535, length 0
1.130794 IP 203.82.48.2.49165 > 192.168.1.2.80: Flags [.], seq 37961:39421, ack 1, win 65535, length 1460
1.130794 IP 192.168.1.2.80 > 203.82.48.2.49165: Flags [.], ack 39421, win 65535, length 0
1.131043 IP 203.82.48.2.49165 > 192.168.1.2.80: Flags [.], seq 39421:40881, ack 1, win 65535, length 1460
1.131043 IP 192.168.1.2.80 > 203.82.48.2.49165: Flags [.], ack 40881, win 65535, length 0
1.131344 IP 203.82.48.2.49165 > 192.168.1.2.80: Flags [.], seq 40881:42341, ack 1, win 65535, length 1460
1.131344 IP 192.168.1.2.80 > 203.82.48.2.49165: Flags [.], ack 42341, win 65535, length 0
1.131784 IP 203.82.48.2.49165 > 192.168.1.2.80: Flags [.], seq 42341:43801, ack 1, win 65535, length 1460
1.131784 IP 192.168.1.2.80 > 203.82.48.2.49165: Flags [.], ack 43801, win 65535, length 0
1.132060 IP 203.82.48.2.49165 > 192.168.1.2.80: Flags [.], seq 43801:45261, ack 1, win 65535, length 1460
1.132060 IP 192.168.1.2.80 > 203.82.48.2.49165: Flags [.], ack 45261, win 65535, length 0
1.132364 IP 203.82.48.2.49167 > 192.168.1.2.80: Flags [.], seq 21901:23361, ack 1, win 65535, length 1460
1.132364 IP 192.168.1.2.80 > 203.82.48.2.49167: Flags [.], ack 23361, win 65535, length 0
1.132621 IP 203.82.48.2.49167 > 192.168.1.2.80: Flags [.], seq 23361:24821, ack 1, win 65535, length 1460
1.132621 IP 192.168.1.2.80 > 203.82.48.2.49167: Flags [.], ack 24821, win 65535, length 0
1.132876 IP 203.82.48.2.49167 > 192.168.1.2.80: Flags [.], seq 24821:26281, ack 1, win 65535, length 1460
1.132876 IP 192.168.1.2.80 > 203.82.48.2.49167: Flags [.], ack 26281, win 65535, length 0
1.133227 IP 203.82.48.2.49167 > 192.168.1.2.80: Flags [.], seq 26281:27741, ack 1, win 65535, length 1460
1.133227 IP 192.168.1.2.80 > 203.82.48.2.49167: Flags [.], ack 27741, win 65535, length 0
1.133518 IP 203.82.48.2.49167 > 192.168.1.2.80: Flags [.], seq 27741:29201, ack 1, win 65535, length 1460
1.133518 IP 192.168.1.2.80 > 203.82.48.2.49167: Flags [.], ack 29201, win 65535, length 0
1.133835 IP 203.82.48.2.49167 > 192.168.1.2.80: Flags [.], seq 29201:30661, ack 1, win 65535, length 1460
1.133835 IP 192.168.1.2.80 > 203.82.48.2.49167: Flags [.], ack 30661, win 65535, length 0
1.134096 IP 203.82.48.2.49167 > 192.168.1.2.80: Flags [.], seq 30661:32121, ack 1, win 65535, length 1460
1.134096 IP 192.168.1.2.80 > 203.82.48.2.49167: Flags [.], ack 32121, win 65535, length 0
1.134346 IP 203.82.48.2.49167 > 192.168.1.2.80: Flags [.], seq 32121:33581, ack 1, win 65535, length 1460
1.134346 IP 192.168.1.2.80 > 203.82.48.2.49167: Flags [.], ack 33581, win 65535, length 0
1.134657 IP 203.82.48.2.49167 > 192.168.1.2.80: Flags [.], seq 33581:35041, ack 1, win 65535, length 1460
1.134657 IP 192.168.1.2.80 > 203.82.48.2.49167: Flags [.], ack 35041, win 65535, length 0
1.134953 IP 203.82.48.2.49167 > 192.168.1.2.80: Flags [.], seq 35041:36501, ack 1, win 65535, length 1460
1.134953 IP 192.168.1.2.80 > 203.82.48.2.49167: Flags [.], ack 36501, win 65535, length 0
1.135218 IP 203.82.48.2.49167 > 192.168.1.2.80: Flags [.], seq 36501:37961, ack 1, win 65535, length 1460
1.135218 IP 192.168.1.2.80 > 203.82.48.2.49167: Flags [.], ack 37961, win 65535, length 0
1.135641 IP 203.82.48.2.49167 > 192.168.1.2.80: Flags [.], seq 37961:39421, ack 1, win 65535, length 1460
1.135641 IP 192.168.1.2.80 > 203.82.48.2.49167: Flags [.], ack 39421, win 65535, length 0
1.135900 IP 203.82.48.2.49167 > 192.168.1.2.80: Flags [.], seq 39421:40881, ack 1, win 65535, length 1460
1.135900 IP 192.168.1.2.80 > 203.82.48.2.49167: Flags [.], ack 40881, win 65535, length 0
1.136269 IP 203.82.48.2.49167 > 192.168.1.2.80: Flags [.], seq 40881:42341, ack 1, win 65535, length 1460
1.136269 IP 192.168.1.2.80 > 203.82.48.2.49167: Flags [.], ack 42341, win 65535, length 0
1.136520 IP 203.82.48.2.49167 > 192.168.1.2.80: Flags [.], seq 42341:43801, ack 1, win 65535, length 1460
1.136520 IP 192.168.1.2.80 > 203.82.48.2.49167: Flags [.], ack 43801, win 65535, length 0
1.136791 IP 203.82.48.2.49167 > 192.168.1.2.80: Flags [.], seq 43801:45261, ack 1, win 65535, length 1460
1.136791 IP 192.168.1.2.80 > 203.82.48.2.49167: Flags [.], ack 45261, win 65535, length 0
1.147823 IP 203.82.48.2.49154 > 192.168.1.2.80: Flags [.], seq 45261:46721, ack 1, win 65535, length 1460
1.147823 IP 192.168.1.2.80 > 203.82.48.2.49154: Flags [.], ack 46721, win 65535, length 0
1.148078 IP 203.82.48.2.49154 > 192.168.1.2.80: Flags [.], seq 46721:48181, ack 1, win 65535, length 1460
1.148078 IP 192.168.1.2.80 > 203.82.48.2.49154: Flags [.], ack 48181, win 65535, length 0
1.151392 IP 203.82.48.2.49154 > 192.168.1.2.80: Flags [.], seq 48181:49641, ack 1, win 65535, length 1460
1.151392 IP 192.168.1.2.80 > 203.82.48.2.49154: Flags [.], ack 49641, win 65535, length 0
1.151655 IP 203.82.48.2.49154 > 192.168.1.2.80: Flags [.], seq 49641:51101, ack 1, win 65535, length 1460
1.151655 IP 192.168.1.2.80 > 203.82.48.2.49154: Flags [.], ack 51101, win 65535, length 0
1.152281 IP 203.82.48.2.49154 > 192.168.1.2.80: Flags [.], seq 51101:52561, ack 1, win 65535, length 1460
1.152281 IP 192.168.1.2.80 > 203.82.48.2.49154: Flags [.], ack 52561, win 65535, length 0
1.152586 IP 203.82.48.2.49154 > 192.168.1.2.80: Flags [.], seq 52561:54021, ack 1, win 65535, length 1460
1.152586 IP 192.168.1.2.80 > 203.82.48.2.49154: Flags [.], ack 54021, win 65535, length 0
1.153399 IP 203.82.48.2.49154 > 192.168.1.2.80: Flags [.], seq 54021:55481, ack 1, win 65535, length 1460
1.153399 IP 192.168.1.2.80 > 203.82.48.2.49154: Flags [.], ack 55481, win 65535, length 0
1.157607 IP 203.82.48.2.49154 > 192.168.1.2.80: Flags [.], seq 55481:56941, ack 1, win 65535, length 1460
1.157607 IP 192.168.1.2.80 > 203.82.48.2.49154: Flags [.], ack 56941, win 65535, length 0
1.157868 IP 203.82.48.2.49154 > 192.168.1.2.80: Flags [.], seq 56941:58401, ack 1, win 65535, length 1460
1.157868 IP 192.168.1.2.80 > 203.82.48.2.49154: Flags [.], ack 58401, win 65535, length 0
1.158136 IP 203.82.48.2.49154 > 192.168.1.2.80: Flags [.], seq 58401:59861, ack 1, win 65535, length 1460
1.158136 IP 192.168.1.2.80 > 203.82.48.2.49154: Flags [.], ack 59861, win 65535, length 0
1.158409 IP 203.82.48.2.49154 > 192.168.1.2.80: Flags [.], seq 59861:61321, ack 1, win 65535, length 1460
1.158409 IP 192.168.1.2.80 > 203.82.48.2.49154: Flags [.], ack 61321, win 65535, length 0
1.158710 IP 203.82.48.2.49154 > 192.168.1.2.80: Flags [.], seq 61321:62781, ack 1, win 65535, length 1460
1.158710 IP 192.168.1.2.80 > 203.82.48.2.49154: Flags [.], ack 62781, win 65535, length 0
1.158987 IP 203.82.48.2.49154 > 192.168.1.2.80: Flags [.], seq 62781:64241, ack 1, win 65535, length 1460
1.158987 IP 192.168.1.2.80 > 203.82.48.2.49154: Flags [.], ack 64241, win 65535, length 0
1.159402 IP 203.82.48.2.49154 > 192.168.1.2.80: Flags [.], seq 64241:65701, ack 1, win 65535, length 1460
1.159402 IP 192.168.1.2.80 > 203.82.48.2.49154: Flags [.], ack 65701, win 65535, length 0
1.159890 IP 203.82.48.2.49154 > 192.168.1.2.80: Flags [.], seq 65701:67161, ack 1, win 65535, length 1460
1.159890 IP 192.168.1.2.80 > 203.82.48.2.49154: Flags [.], ack 67161, win 65535, length 0
1.164252 IP 203.82.48.2.49154 > 192.168.1.2.80: Flags [.], seq 67161:68621, ack 1, win 65535, length 1460
1.164252 IP 192.168.1.2.80 > 203.82.48.2.49154: Flags [.], ack 68621, win 65535, length 0
1.165625 IP 203.82.48.2.49154 > 192.168.1.2.80: Flags [.], seq 68621:70081, ack 1, win 65535, length 1460
1.165625 IP 192.168.1.2.80 > 203.82.48.2.49154: Flags [.], ack 70081, win 65535, length 0
1.165933 IP 203.82.48.2.49154 > 192.168.1.2.80: Flags [.], seq 70081:71541, ack 1, win 65535, length 1460
1.165933 IP 192.168.1.2.80 > 203.82.48.2.49154: Flags [.], ack 71541, win 65535, length 0
1.166311 IP 203.82.48.2.49154 > 192.168.1.2.80: Flags [.], seq 71541:73001, ack 1, win 65535, length 1460
1.166311 IP 192.168.1.2.80 > 203.82.48.2.49154: Flags [.], ack 73001, win 65535, length 0
1.166719 IP 203.82.48.2.49154 > 192.168.1.2.80: Flags [.], seq 73001:74461, ack 1, win 65535, length 1460
1.166719 IP 192.168.1.2.80 > 203.82.48.2.49154: Flags [.], ack 74461, win 65535, length 0
1.168899 IP 203.82.48.2.49154 > 192.168.1.2.80: Flags [.], seq 74461:75921, ack 1, win 65535, length 1460
1.168899 IP 192.168.1.2.80 > 203.82.48.2.49154: Flags [.], ack 75921, win 65535, length 0
1.169186 IP 203.82.48.2.49154 > 192.168.1.2.80: Flags [.], seq 75921:77381, ack 1, win 65535, length 1460
1.169186 IP 192.168.1.2.80 > 203.82.48.2.49154: Flags [.], ack 77381, win 65535, length 0
1.169482 IP 203.82.48.2.49154 > 192.168.1.2.80: Flags [.], seq 77381:78841, ack 1, win 65535, length 1460
1.169482 IP 192.168.1.2.80 > 203.82.48.2.49154: Flags [.], ack 78841, win 65535, length 0
1.170128 IP 203.82.48.2.49154 > 192.168.1.2.80: Flags [.], seq 78841:80301, ack 1, win 65535, length 1460
1.170128 IP 192.168.1.2.80 > 203.82.48.2.49154: Flags [.], ack 80301, win 65535, length 0
1.170710 IP 203.82.48.2.49154 > 192.168.1.2.80: Flags [.], seq 80301:81761, ack 1, win 65535, length 1460
1.170710 IP 192.168.1.2.80 > 203.82.48.2.49154: Flags [.], ack 81761, win 65535, length 0
1.170986 IP 203.82.48.2.49154 > 192.168.1.2.80: Flags [.], seq 81761:83221, ack 1, win 65535, length 1460
1.170986 IP 192.168.1.2.80 > 203.82.48.2.49154: Flags [.], ack 83221, win 65535, length 0
1.171530 IP 203.82.48.2.49154 > 192.168.1.2.80: Flags [.], seq 83221:84681, ack 1, win 65535, length 1460
1.171530 IP 192.168.1.2.80 > 203.82.48.2.49154: Flags [.], ack 84681, win 65535, length 0
1.171809 IP 203.82.48.2.49154 > 192.168.1.2.80: Flags [.], seq 84681:86141, ack 1, win 65535, length 1460
1.171809 IP 192.168.1.2.80 > 203.82.48.2.49154: Flags [.], ack 86141, win 65535, length 0
1.172306 IP 203.82.48.2.49154 > 192.168.1.2.80: Flags [.], seq 86141:87601, ack 1, win 65535, length 1460
1.172306 IP 192.168.1.2.80 > 203.82.48.2.49154: Flags [.], ack 87601, win 65535, length 0
1.172653 IP 203.82.48.2.49154 > 192.168.1.2.80: Flags [.], seq 87601:89061, ack 1, win 65535, length 1460
1.172653 IP 192.168.1.2.80 > 203.82.48.2.49154: Flags [.], ack 89061, win 65535, length 0
1.173866 IP 203.82.48.2.49154 > 192.168.1.2.80: Flags [.], seq 89061:90521, ack 1, win 65535, length 1460
1.173866 IP 192.168.1.2.80 > 203.82.48.2.49154: Flags [.], ack 90521, win 65535, length 0
1.174125 IP 203.82.48.2.49154 > 192.168.1.2.80: Flags [.], seq 90521:91981, ack 1, win 65535, length 1460
1.174125 IP 192.168.1.2.80 > 203.82.48.2.49154: Flags [.], ack 91981, win 65535, length 0
1.175132 IP 203.82.48.2.49165 > 192.168.1.2.80: Flags [.], seq 45261:46721, ack 1, win 65535, length 1460
1.175132 IP 192.168.1.2.80 > 203.82.48.2.49165: Flags [.], ack 46721, win 65535, length 0
1.175398 IP 203.82.48.2.49165 > 192.168.1.2.80: Flags [.], seq 46721:48181, ack 1, win 65535, length 1460
1.175398 IP 192.168.1.2.80 > 203.82.48.2.49165: Flags [.], ack 48181, win 65535, length 0
1.175825 IP 203.82.48.2.49165 > 192.168.1.2.80: Flags [.], seq 48181:49641, ack 1, win 65535, length 1460
1.175825 IP 192.168.1.2.80 > 203.82.48.2.49165: Flags [.], ack 49641, win 65535, length 0
1.176104 IP 203.82.48.2.49165 > 192.168.1.2.80: Flags [.], seq 49641:51101, ack 1, win 65535, length 1460
1.176104 IP 192.168.1.2.80 > 203.82.48.2.49165: Flags [.], ack 51101, win 65535, length 0
1.176494 IP 203.82.48.2.49165 > 192.168.1.2.80: Flags [.], seq 51101:52561, ack 1, win 65535, length 1460
1.176494 IP 192.168.1.2.80 > 203.82.48.2.49165: Flags [.], ack 52561, win 65535, length 0
1.176829 IP 203.82.48.2.49165 > 192.168.1.2.80: Flags [.], seq 52561:54021, ack 1, win 65535, length 1460
1.176829 IP 192.168.1.2.80 > 203.82.48.2.49165: Flags [.], ack 54021, win 65535, length 0
1.177102 IP 203.82.48.2.49165 > 192.168.1.2.80: Flags [.], seq 54021:55481, ack 1, win 65535, length 1460
1.177102 IP 192.168.1.2.80 > 203.82.48.2.49165: Flags [.], ack 55481, win 65535, length 0
1.177402 IP 203.82.48.2.49165 > 192.168.1.2.80: Flags [.], seq 55481:56941, ack 1, win 65535, length 1460
1.177402 IP 192.168.1.2.80 > 203.82.48.2.49165: Flags [.], ack 56941, win 65535, length 0
1.177849 IP 203.82.48.2.49165 > 192.168.1.2.80: Flags [.], seq 56941:58401, ack 1, win 65535, length 1460
1.177849 IP 192.168.1.2.80 > 203.82.48.2.49165: Flags [.], ack 58401, win 65535, length 0
1.178178 IP 203.82.48.2.49165 > 192.168.1.2.80: Flags [.], seq 58401:59861, ack 1, win 65535, length 1460
1.178178 IP 192.168.1.2.80 > 203.82.48.2.49165: Flags [.], ack 59861, win 65535, length 0
1.178707 IP 203.82.48.2.49165 > 192.168.1.2.80: Flags [.], seq 59861:61321, ack 1, win 65535, length 1460
1.178707 IP 192.168.1.2.80 > 203.82.48.2.49165: Flags [.], ack 61321, win 65535, length 0
1.179139 IP 203.82.48.2.49165 > 192.168.1.2.80: Flags [.], seq 61321:62781, ack 1, win 65535, length 1460
1.179139 IP 192.168.1.2.80 > 203.82.48.2.49165: Flags [.], ack 62781, win 65535, length 0
1.179449 IP 203.82.48.2.49165 > 192.168.1.2.80: Flags [.], seq 77381:78841, ack 1, win 65535, length 1460
1.179449 IP 192.168.1.2.80 > 203.82.48.2.49165: Flags [.], ack 62781, win 65535, length 0
1.179767 IP 203.82.48.2.49165 > 192.168.1.2.80: Flags [.], seq 78841:80301, ack 1, win 65535, length 1460
1.179767 IP 192.168.1.2.80 > 203.82.48.2.49165: Flags [.], ack 62781, win 65535, length 0
1.180186 IP 203.82.48.2.49165 > 192.168.1.2.80: Flags [.], seq 80301:81761, ack 1, win 65535, length 1460
1.180186 IP 192.168.1.2.80 > 203.82.48.2.49165: Flags [.], ack 62781, win 65535, length 0
1.180472 IP 203.82.48.2.49165 > 192.168.1.2.80: Flags [.], seq 81761:83221, ack 1, win 65535, length 1460
1.180472 IP 192.168.1.2.80 > 203.82.48.2.49165: Flags [.], ack 62781, win 65535, length 0
1.180734 IP 203.82.48.2.49165 > 192.168.1.2.80: Flags [.], seq 83221:84681, ack 1, win 65535, length 1460
1.180734 IP 192.168.1.2.80 > 203.82.48.2.49165: Flags [.], ack 62781, win 65535, length 0
1.181024 IP 203.82.48.2.49165 > 192.168.1.2.80: Flags [.], seq 84681:86141, ack 1, win 65535, length 1460
1.181024 IP 192.168.1.2.80 > 203.82.48.2.49165: Flags [.], ack 62781, win 65535, length 0
1.181713 IP 203.82.48.2.49165 > 192.168.1.2.80: Flags [.], seq 86141:87601, ack 1, win 65535, length 1460
1.181713 IP 192.168.1.2.80 > 203.82.48.2.49165: Flags [.], ack 62781, win 65535, length 0
1.181992 IP 203.82.48.2.49165 > 192.168.1.2.80: Flags [.], seq 87601:89061, ack 1, win 65535, length 1460
1.181992 IP 192.168.1.2.80 > 203.82.48.2.49165: Flags [.], ack 62781, win 65535, length 0
1.185604 IP 203.82.48.2.49167 > 192.168.1.2.80: Flags [.], seq 54021:55481, ack 1, win 65535, length 1460
1.185604 IP 192.168.1.2.80 > 203.82.48.2.49167: Flags [.], ack 45261, win 65535, length 0
1.185878 IP 203.82.48.2.49167 > 192.168.1.2.80: Flags [.], seq 55481:56941, ack 1, win 65535, length 1460
1.185878 IP 192.168.1.2.80 > 203.82.48.2.49167: Flags [.], ack 45261, win 65535, length 0
1.186183 IP 203.82.48.2.49167 > 192.168.1.2.80: Flags [.], seq 56941:58401, ack 1, win 65535, length 1460
1.186183 IP 192.168.1.2.80 > 203.82.48.2.49167: Flags [.], ack 45261, win 65535, length 0
1.186491 IP 203.82.48.2.49167 > 192.168.1.2.80: Flags [.], seq 58401:59861, ack 1, win 65535, length 1460
1.186491 IP 192.168.1.2.80 > 203.82.48.2.49167: Flags [.], ack 45261, win 65535, length 0
1.186775 IP 203.82.48.2.49167 > 192.168.1.2.80: Flags [.], seq 59861:61321, ack 1, win 65535, length 1460
1.186775 IP 192.168.1.2.80 > 203.82.48.2.49167: Flags [.], ack 45261, win 65535, length 0
1.187028 IP 203.82.48.2.49167 > 192.168.1.2.80: Flags [.], seq 62781:64241, ack 1, win 65535, length 1460
1.187028 IP 192.168.1.2.80 > 203.82.48.2.49167: Flags [.], ack 45261, win 65535, length 0
1.187288 IP 203.82.48.2.49167 > 192.168.1.2.80: Flags [.], seq 64241:65701, ack 1, win 65535, length 1460
1.187288 IP 192.168.1.2.80 > 203.82.48.2.49167: Flags [.], ack 45261, win 65535, length 0
1.187537 IP 203.82.48.2.49167 > 192.168.1.2.80: Flags [.], seq 65701:67161, ack 1, win 65535, length 1460
1.187537 IP 192.168.1.2.80 > 203.82.48.2.49167: Flags [.], ack 45261, win 65535, length 0
1.188126 IP 203.82.48.2.49167 > 192.168.1.2.80: Flags [.], seq 68621:70081, ack 1, win 65535, length 1460
1.188126 IP 192.168.1.2.80 > 203.82.48.2.49167: Flags [.], ack 45261, win 65535, length 0
1.188424 IP 203.82.48.2.49167 > 192.168.1.2.80: Flags [.], seq 71541:73001, ack 1, win 65535, length 1460
1.188424 IP 192.168.1.2.80 > 203.82.48.2.49167: Flags [.], ack 45261, win 65535, length 0
1.188846 IP 203.82.48.2.49167 > 192.168.1.2.80: Flags [.], seq 74461:75921, ack 1, win 65535, length 1460
1.188846 IP 192.168.1.2.80 > 203.82.48.2.49167: Flags [.], ack 45261, win 65535, length 0
1.189241 IP 203.82.48.2.49167 > 192.168.1.2.80: Flags [.], seq 77381:78841, ack 1, win 65535, length 1460
1.189241 IP 192.168.1.2.80 > 203.82.48.2.49167: Flags [.], ack 45261, win 65535, length 0
1.189751 IP 203.82.48.2.49167 > 192.168.1.2.80: Flags [.], seq 80301:81761, ack 1, win 65535, length 1460
1.189751 IP 192.168.1.2.80 > 203.82.48.2.49167: Flags [.], ack 45261, win 65535, length 0
1.190350 IP 203.82.48.2.49167 > 192.168.1.2.80: Flags [.], seq 81761:83221, ack 1, win 65535, length 1460
1.190350 IP 192.168.1.2.80 > 203.82.48.2.49167: Flags [.], ack 45261, win 65535, length 0
1.196424 IP 203.82.48.2.49154 > 192.168.1.2.80: Flags [.], seq 91981:93441, ack 1, win 65535, length 1460
1.196424 IP 192.168.1.2.80 > 203.82.48.2.49154: Flags [.], ack 93441, win 65535, length 0
1.196670 IP 203.82.48.2.49154 > 192.168.1.2.80: Flags [.], seq 94901:96361, ack 1, win 65535, length 1460
1.196670 IP 192.168.1.2.80 > 203.82.48.2.49154: Flags [.], ack 93441, win 65535, length 0
1.196918 IP 203.82.48.2.49154 > 192.168.1.2.80: Flags [.], seq 96361:97821, ack 1, win 65535, length 1460
1.196918 IP 192.168.1.2.80 > 203.82.48.2.49154: Flags [.], ack 93441, win 65535, length 0
1.199729 IP 203.82.48.2.49154 > 192.168.1.2.80: Flags [.], seq 97821:99281, ack 1, win 65535, length 1460
1.199729 IP 192.168.1.2.80 > 203.82.48.2.49154: Flags [.], ack 93441, win 65535, length 0
1.200028 IP 203.82.48.2.49154 > 192.168.1.2.80: Flags [.], seq 99281:100741, ack 1, win 65535, length 1460
1.200028 IP 192.168.1.2.80 > 203.82.48.2.49154: Flags [.], ack 93441, win 65535, length 0
1.200278 IP 203.82.48.2.49154 > 192.168.1.2.80: Flags [.], seq 106581:108041, ack 1, win 65535, length 1460
1.200278 IP 192.168.1.2.80 > 203.82.48.2.49154: Flags [.], ack 93441, win 65535, length 0
1.200576 IP 203.82.48.2.49154 > 192.168.1.2.80: Flags [.], seq 108041:109501, ack 1, win 65535, length 1460
1.200576 IP 192.168.1.2.80 > 203.82.48.2.49154: Flags [.], ack 93441, win 65535, length 0
1.200868 IP 203.82.48.2.49154 > 192.168.1.2.80: Flags [.], seq 109501:110961, ack 1, win 65535, length 1460
1.200868 IP 192.168.1.2.80 > 203.82.48.2.49154: Flags [.], ack 93441, win 65535, length 0
1.201218 IP 203.82.48.2.49154 > 192.168.1.2.80: Flags [.], seq 110961:112421, ack 1, win 65535, length 1460
1.201218 IP 192.168.1.2.80 > 203.82.48.2.49154: Flags [.], ack 93441, win 65535, length 0
1.201921 IP 203.82.48.2.49154 > 192.168.1.2.80: Flags [.], seq 112421:113881, ack 1, win 65535, length 1460
1.201921 IP 192.168.1.2.80 > 203.82.48.2.49154: Flags [.], ack 93441, win 65535, length 0
1.202210 IP 203.82.48.2.49154 > 192.168.1.2.80: Flags [.], seq 113881:115341, ack 1, win 65535, length 1460
1.202210 IP 192.168.1.2.80 > 203.82.48.2.49154: Flags [.], ack 93441, win 65535, length 0
1.202604 IP 203.82.48.2.49154 > 192.168.1.2.80: Flags [.], seq 124101:125561, ack 1, win 65535, length 1460
1.202604 IP 192.168.1.2.80 > 203.82.48.2.49154: Flags [.], ack 93441, win 65535, length 0
1.203027 IP 203.82.48.2.49154 > 192.168.1.2.80: Flags [.], seq 132861:134321, ack 1, win 65535, length 1460
1.203027 IP 192.168.1.2.80 > 203.82.48.2.49154: Flags [.], ack 93441, win 65535, length 0
1.203391 IP 203.82.48.2.49154 > 192.168.1.2.80: Flags [.], seq 134321:135781, ack 1, win 65535, length 1460
1.203391 IP 192.168.1.2.80 > 203.82.48.2.49154: Flags [.], ack 93441, win 65535, length 0
1.203654 IP 203.82.48.2.49154 > 192.168.1.2.80: Flags [.], seq 135781:137241, ack 1, win 65535, length 1460
1.203654 IP 192.168.1.2.80 > 203.82.48.2.49154: Flags [.], ack 93441, win 65535, length 0
1.203971 IP 203.82.48.2.49154 > 192.168.1.2.80: Flags [.], seq 137241:138701, ack 1, win 65535, length 1460
1.203971 IP 192.168.1.2.80 > 203.82.48.2.49154: Flags [.], ack 93441, win 65535, length 0
1.204745 IP 203.82.48.2.49154 > 192.168.1.2.80: Flags [.], seq 138701:140161, ack 1, win 65535, length 1460
1.204745 IP 192.168.1.2.80 > 203.82.48.2.49154: Flags [.], ack 93441, win 65535, length 0
1.204999 IP 203.82.48.2.49154 > 192.168.1.2.80: Flags [.], seq 140161:141621, ack 1, win 65535, length 1460
1.204999 IP 192.168.1.2.80 > 203.82.48.2.49154: Flags [.], ack 93441, win 65535, length 0
1.205250 IP 203.82.48.2.49154 > 192.168.1.2.80: Flags [.], seq 141621:143081, ack 1, win 65535, length 1460
1.205250 IP 192.168.1.2.80 > 203.82.48.2.49154: Flags [.], ack 93441, win 65535, length 0
1.205550 IP 203.82.48.2.49154 > 192.168.1.2.80: Flags [.], seq 143081:144541, ack 1, win 65535, length 1460
1.205550 IP 192.168.1.2.80 > 203.82.48.2.49154: Flags [.], ack 93441, win 65535, length 0
1.205888 IP 203.82.48.2.49154 > 192.168.1.2.80: Flags [.], seq 144541:146001, ack 1, win 65535, length 1460
1.205888 IP 192.168.1.2.80 > 203.82.48.2.49154: Flags [.], ack 93441, win 65535, length 0
1.206157 IP 203.82.48.2.49154 > 192.168.1.2.80: Flags [.], seq 146001:147461, ack 1, win 65535, length 1460
1.206157 IP 192.168.1.2.80 > 203.82.48.2.49154: Flags [.], ack 93441, win 65535, length 0
1.206421 IP 203.82.48.2.49154 > 192.168.1.2.80: Flags [.], seq 147461:148921, ack 1, win 65535, length 1460
1.206421 IP 192.168.1.2.80 > 203.82.48.2.49154: Flags [.], ack 93441, win 65535, length 0
1.206843 IP 203.82.48.2.49154 > 192.168.1.2.80: Flags [.], seq 148921:150381, ack 1, win 65535, length 1460
1.206843 IP 192.168.1.2.80 > 203.82.48.2.49154: Flags [.], ack 93441, win 65535, length 0
1.207152 IP 203.82.48.2.49154 > 192.168.1.2.80: Flags [.], seq 150381:151841, ack 1, win 65535, length 1460
1.207152 IP 192.168.1.2.80 > 203.82.48.2.49154: Flags [.], ack 93441, win 65535, length 0
1.207447 IP 203.82.48.2.49154 > 192.168.1.2.80: Flags [.], seq 151841:153301, ack 1, win 65535, length 1460
1.207447 IP 192.168.1.2.80 > 203.82.48.2.49154: Flags [.], ack 93441, win 65535, length 0
1.207764 IP 203.82.48.2.49154 > 192.168.1.2.80: Flags [.], seq 153301:154761, ack 1, win 65535, length 1460
1.207764 IP 192.168.1.2.80 > 203.82.48.2.49154: Flags [.], ack 93441, win 65535, length 0
1.208195 IP 203.82.48.2.49154 > 192.168.1.2.80: Flags [.], seq 154761:156221, ack 1, win 65535, length 1460
1.208195 IP 192.168.1.2.80 > 203.82.48.2.49154: Flags [.], ack 93441, win 65535, length 0
1.210410 IP 203.82.48.2.49165 > 192.168.1.2.80: Flags [.], seq 91981:93441, ack 1, win 65535, length 1460
1.210410 IP 192.168.1.2.80 > 203.82.48.2.49165: Flags [.], ack 62781, win 65535, length 0
1.210804 IP 203.82.48.2.49165 > 192.168.1.2.80: Flags [.], seq 93441:94901, ack 1, win 65535, length 1460
1.210804 IP 192.168.1.2.80 > 203.82.48.2.49165: Flags [.], ack 62781, win 65535, length 0
1.211063 IP 203.82.48.2.49165 > 192.168.1.2.80: Flags [.], seq 94901:96361, ack 1, win 65535, length 1460
1.211063 IP 192.168.1.2.80 > 203.82.48.2.49165: Flags [.], ack 62781, win 65535, length 0
1.211531 IP 203.82.48.2.49165 > 192.168.1.2.80: Flags [.], seq 96361:97821, ack 1, win 65535, length 1460
1.211531 IP 192.168.1.2.80 > 203.82.48.2.49165: Flags [.], ack 62781, win 65535, length 0
1.211878 IP 203.82.48.2.49165 > 192.168.1.2.80: Flags [.], seq 97821:99281, ack 1, win 65535, length 1460
1.211878 IP 192.168.1.2.80 > 203.82.48.2.49165: Flags [.], ack 62781, win 65535, length 0
1.212172 IP 203.82.48.2.49165 > 192.168.1.2.80: Flags [.], seq 99281:100741, ack 1, win 65535, length 1460
1.212172 IP 192.168.1.2.80 > 203.82.48.2.49165: Flags [.], ack 62781, win 65535, length 0
1.212449 IP 203.82.48.2.49165 > 192.168.1.2.80: Flags [.], seq 100741:102201, ack 1, win 65535, length 1460
1.212449 IP 192.168.1.2.80 > 203.82.48.2.49165: Flags [.], ack 62781, win 65535, length 0
1.212704 IP 203.82.48.2.49165 > 192.168.1.2.80: Flags [.], seq 102201:103661, ack 1, win 65535, length 1460
