1.010125 ARP, Request who-has 192.168.1.2 (ff:ff:ff:ff:ff:ff) tell 192.168.1.1, length 50
1.010200 ARP, Request who-has 192.168.1.3 (ff:ff:ff:ff:ff:ff) tell 192.168.1.1, length 50
1.010278 ARP, Request who-has 192.168.1.4 (ff:ff:ff:ff:ff:ff) tell 192.168.1.1, length 50
1.010627 ARP, Request who-has 192.168.1.5 (ff:ff:ff:ff:ff:ff) tell 192.168.1.1, length 50
1.010722 ARP, Request who-has 192.168.1.6 (ff:ff:ff:ff:ff:ff) tell 192.168.1.1, length 50
1.011148 ARP, Request who-has 192.168.1.7 (ff:ff:ff:ff:ff:ff) tell 192.168.1.1, length 50
1.011225 ARP, Request who-has 192.168.1.8 (ff:ff:ff:ff:ff:ff) tell 192.168.1.1, length 50
1.011291 ARP, Request who-has 192.168.1.9 (ff:ff:ff:ff:ff:ff) tell 192.168.1.1, length 50
1.011555 ARP, Request who-has 192.168.1.10 (ff:ff:ff:ff:ff:ff) tell 192.168.1.1, length 50
1.011555 ARP, Reply 192.168.1.10 is-at 00:00:00:00:00:15, length 50
1.011694 ARP, Request who-has 192.168.1.11 (ff:ff:ff:ff:ff:ff) tell 192.168.1.1, length 50
1.011762 ARP, Request who-has 192.168.1.12 (ff:ff:ff:ff:ff:ff) tell 192.168.1.1, length 50
1.011849 ARP, Request who-has 192.168.1.13 (ff:ff:ff:ff:ff:ff) tell 192.168.1.1, length 50
1.012168 ARP, Request who-has 192.168.1.14 (ff:ff:ff:ff:ff:ff) tell 192.168.1.1, length 50
1.012259 ARP, Request who-has 192.168.1.15 (ff:ff:ff:ff:ff:ff) tell 192.168.1.1, length 50
1.012399 ARP, Request who-has 192.168.1.16 (ff:ff:ff:ff:ff:ff) tell 192.168.1.1, length 50
1.012491 ARP, Request who-has 192.168.1.17 (ff:ff:ff:ff:ff:ff) tell 192.168.1.1, length 50
1.012626 ARP, Request who-has 192.168.1.18 (ff:ff:ff:ff:ff:ff) tell 192.168.1.1, length 50
1.012843 ARP, Request who-has 192.168.1.19 (ff:ff:ff:ff:ff:ff) tell 192.168.1.1, length 50
1.012908 ARP, Request who-has 192.168.1.20 (ff:ff:ff:ff:ff:ff) tell 192.168.1.1, length 50
1.012990 ARP, Request who-has 192.168.1.21 (ff:ff:ff:ff:ff:ff) tell 192.168.1.1, length 50
1.013826 ARP, Request who-has 192.168.1.22 (ff:ff:ff:ff:ff:ff) tell 192.168.1.1, length 50
1.013906 ARP, Request who-has 192.168.1.23 (ff:ff:ff:ff:ff:ff) tell 192.168.1.1, length 50
1.013995 ARP, Request who-has 192.168.1.24 (ff:ff:ff:ff:ff:ff) tell 192.168.1.1, length 50
1.014484 ARP, Request who-has 192.168.1.25 (ff:ff:ff:ff:ff:ff) tell 192.168.1.1, length 50
1.014570 ARP, Request who-has 192.168.1.26 (ff:ff:ff:ff:ff:ff) tell 192.168.1.1, length 50
1.014650 ARP, Request who-has 192.168.1.27 (ff:ff:ff:ff:ff:ff) tell 192.168.1.1, length 50
1.015343 ARP, Request who-has 192.168.1.28 (ff:ff:ff:ff:ff:ff) tell 192.168.1.1, length 50
1.015483 ARP, Request who-has 192.168.1.29 (ff:ff:ff:ff:ff:ff) tell 192.168.1.1, length 50
1.015620 ARP, Request who-has 192.168.1.30 (ff:ff:ff:ff:ff:ff) tell 192.168.1.1, length 50
1.015876 ARP, Request who-has 192.168.1.31 (ff:ff:ff:ff:ff:ff) tell 192.168.1.1, length 50
1.015978 ARP, Request who-has 192.168.1.32 (ff:ff:ff:ff:ff:ff) tell 192.168.1.1, length 50
1.016129 ARP, Request who-has 192.168.1.33 (ff:ff:ff:ff:ff:ff) tell 192.168.1.1, length 50
1.016281 ARP, Request who-has 192.168.1.34 (ff:ff:ff:ff:ff:ff) tell 192.168.1.1, length 50
1.016623 ARP, Request who-has 192.168.1.35 (ff:ff:ff:ff:ff:ff) tell 192.168.1.1, length 50
1.016698 ARP, Request who-has 192.168.1.36 (ff:ff:ff:ff:ff:ff) tell 192.168.1.1, length 50
1.016766 ARP, Request who-has 192.168.1.37 (ff:ff:ff:ff:ff:ff) tell 192.168.1.1, length 50
1.017333 ARP, Request who-has 192.168.1.38 (ff:ff:ff:ff:ff:ff) tell 192.168.1.1, length 50
1.017408 ARP, Request who-has 192.168.1.39 (ff:ff:ff:ff:ff:ff) tell 192.168.1.1, length 50
1.017523 ARP, Request who-has 192.168.1.40 (ff:ff:ff:ff:ff:ff) tell 192.168.1.1, length 50
1.017588 ARP, Request who-has 192.168.1.41 (ff:ff:ff:ff:ff:ff) tell 192.168.1.1, length 50
1.017657 ARP, Request who-has 192.168.1.42 (ff:ff:ff:ff:ff:ff) tell 192.168.1.1, length 50
1.017760 ARP, Request who-has 192.168.1.43 (ff:ff:ff:ff:ff:ff) tell 192.168.1.1, length 50
1.017855 ARP, Request who-has 192.168.1.44 (ff:ff:ff:ff:ff:ff) tell 192.168.1.1, length 50
1.017939 ARP, Request who-has 192.168.1.45 (ff:ff:ff:ff:ff:ff) tell 192.168.1.1, length 50
1.018033 ARP, Request who-has 192.168.1.46 (ff:ff:ff:ff:ff:ff) tell 192.168.1.1, length 50
1.018106 ARP, Request who-has 192.168.1.47 (ff:ff:ff:ff:ff:ff) tell 192.168.1.1, length 50
1.018195 ARP, Request who-has 192.168.1.48 (ff:ff:ff:ff:ff:ff) tell 192.168.1.1, length 50
1.018269 ARP, Request who-has 192.168.1.49 (ff:ff:ff:ff:ff:ff) tell 192.168.1.1, length 50
1.018479 ARP, Request who-has 192.168.1.1 (ff:ff:ff:ff:ff:ff) tell 192.168.1.2, length 50
1.018834 ARP, Request who-has 192.168.1.1 (ff:ff:ff:ff:ff:ff) tell 192.168.1.3, length 50
1.019046 ARP, Request who-has 192.168.1.1 (ff:ff:ff:ff:ff:ff) tell 192.168.1.4, length 50
1.019657 ARP, Request who-has 192.168.1.1 (ff:ff:ff:ff:ff:ff) tell 192.168.1.5, length 50
1.019750 ARP, Request who-has 192.168.1.1 (ff:ff:ff:ff:ff:ff) tell 192.168.1.6, length 50
1.019999 ARP, Request who-has 192.168.1.1 (ff:ff:ff:ff:ff:ff) tell 192.168.1.7, length 50
1.020064 ARP, Request who-has 192.168.1.1 (ff:ff:ff:ff:ff:ff) tell 192.168.1.8, length 50
1.020203 IP 203.82.48.2.49161 > 192.168.1.10.80: Flags [S], seq 0, win 65535, length 0
1.020203 ARP, Request who-has 192.168.1.1 (ff:ff:ff:ff:ff:ff) tell 192.168.1.10, length 50
1.020364 ARP, Request who-has 192.168.1.1 (ff:ff:ff:ff:ff:ff) tell 192.168.1.9, length 50
1.020429 ARP, Request who-has 192.168.1.1 (ff:ff:ff:ff:ff:ff) tell 192.168.1.11, length 50
1.020535 ARP, Request who-has 192.168.1.1 (ff:ff:ff:ff:ff:ff) tell 192.168.1.12, length 50
1.022574 ARP, Request who-has 192.168.1.1 (ff:ff:ff:ff:ff:ff) tell 192.168.1.13, length 50
1.022651 ARP, Request who-has 192.168.1.1 (ff:ff:ff:ff:ff:ff) tell 192.168.1.14, length 50
1.022787 ARP, Request who-has 192.168.1.1 (ff:ff:ff:ff:ff:ff) tell 192.168.1.15, length 50
1.023257 ARP, Request who-has 192.168.1.1 (ff:ff:ff:ff:ff:ff) tell 192.168.1.16, length 50
1.023466 ARP, Request who-has 192.168.1.1 (ff:ff:ff:ff:ff:ff) tell 192.168.1.17, length 50
1.023572 ARP, Request who-has 192.168.1.1 (ff:ff:ff:ff:ff:ff) tell 192.168.1.18, length 50
1.023876 ARP, Request who-has 192.168.1.1 (ff:ff:ff:ff:ff:ff) tell 192.168.1.19, length 50
1.023950 ARP, Request who-has 192.168.1.1 (ff:ff:ff:ff:ff:ff) tell 192.168.1.20, length 50
1.024142 ARP, Request who-has 192.168.1.1 (ff:ff:ff:ff:ff:ff) tell 192.168.1.21, length 50
1.024232 ARP, Request who-has 192.168.1.1 (ff:ff:ff:ff:ff:ff) tell 192.168.1.22, length 50
1.024302 ARP, Request who-has 192.168.1.1 (ff:ff:ff:ff:ff:ff) tell 192.168.1.23, length 50
1.024636 ARP, Request who-has 192.168.1.1 (ff:ff:ff:ff:ff:ff) tell 192.168.1.24, length 50
1.024713 ARP, Request who-has 192.168.1.1 (ff:ff:ff:ff:ff:ff) tell 192.168.1.25, length 50
1.024863 ARP, Request who-has 192.168.1.1 (ff:ff:ff:ff:ff:ff) tell 192.168.1.26, length 50
1.024930 ARP, Request who-has 192.168.1.1 (ff:ff:ff:ff:ff:ff) tell 192.168.1.27, length 50
1.025164 ARP, Request who-has 192.168.1.1 (ff:ff:ff:ff:ff:ff) tell 192.168.1.28, length 50
1.025269 ARP, Request who-has 192.168.1.1 (ff:ff:ff:ff:ff:ff) tell 192.168.1.29, length 50
1.025691 ARP, Request who-has 192.168.1.1 (ff:ff:ff:ff:ff:ff) tell 192.168.1.30, length 50
1.025763 ARP, Request who-has 192.168.1.1 (ff:ff:ff:ff:ff:ff) tell 192.168.1.31, length 50
1.025993 ARP, Request who-has 192.168.1.1 (ff:ff:ff:ff:ff:ff) tell 192.168.1.32, length 50
1.026196 ARP, Request who-has 192.168.1.1 (ff:ff:ff:ff:ff:ff) tell 192.168.1.33, length 50
1.026301 ARP, Request who-has 192.168.1.1 (ff:ff:ff:ff:ff:ff) tell 192.168.1.34, length 50
1.026397 ARP, Request who-has 192.168.1.1 (ff:ff:ff:ff:ff:ff) tell 192.168.1.35, length 50
1.026594 ARP, Request who-has 192.168.1.1 (ff:ff:ff:ff:ff:ff) tell 192.168.1.36, length 50
1.026708 ARP, Request who-has 192.168.1.1 (ff:ff:ff:ff:ff:ff) tell 192.168.1.37, length 50
1.026816 ARP, Request who-has 192.168.1.1 (ff:ff:ff:ff:ff:ff) tell 192.168.1.38, length 50
1.027261 ARP, Request who-has 192.168.1.1 (ff:ff:ff:ff:ff:ff) tell 192.168.1.39, length 50
1.027383 ARP, Request who-has 192.168.1.1 (ff:ff:ff:ff:ff:ff) tell 192.168.1.41, length 50
1.027636 ARP, Request who-has 192.168.1.1 (ff:ff:ff:ff:ff:ff) tell 192.168.1.42, length 50
1.027718 ARP, Request who-has 192.168.1.1 (ff:ff:ff:ff:ff:ff) tell 192.168.1.43, length 50
1.027854 ARP, Request who-has 192.168.1.1 (ff:ff:ff:ff:ff:ff) tell 192.168.1.44, length 50
1.028055 ARP, Request who-has 192.168.1.1 (ff:ff:ff:ff:ff:ff) tell 192.168.1.45, length 50
1.028927 ARP, Request who-has 192.168.1.1 (ff:ff:ff:ff:ff:ff) tell 192.168.1.46, length 50
1.029153 ARP, Request who-has 192.168.1.1 (ff:ff:ff:ff:ff:ff) tell 192.168.1.47, length 50
1.029233 ARP, Request who-has 192.168.1.1 (ff:ff:ff:ff:ff:ff) tell 192.168.1.40, length 50
1.029370 ARP, Request who-has 192.168.1.1 (ff:ff:ff:ff:ff:ff) tell 192.168.1.48, length 50
1.029819 ARP, Request who-has 192.168.1.1 (ff:ff:ff:ff:ff:ff) tell 192.168.1.49, length 50
1.031155 ARP, Reply 192.168.1.1 is-at 00:00:00:00:00:03, length 50
1.031155 IP 192.168.1.10.80 > 203.82.48.2.49161: Flags [S.], seq 0, ack 1, win 65535, length 0
1.052842 IP 203.82.48.2.49161 > 192.168.1.10.80: Flags [.], ack 1, win 65535, length 0
1.052842 IP 192.168.1.10.49153 > 192.168.1.1.9: UDP, length 3
1.053168 IP 203.82.48.2.49161 > 192.168.1.10.80: Flags [.], seq 1:1461, ack 1, win 65535, length 1460
1.053168 IP 192.168.1.10.80 > 203.82.48.2.49161: Flags [.], ack 1461, win 65535, length 0
1.073663 IP 203.82.48.2.49161 > 192.168.1.10.80: Flags [.], seq 1461:2921, ack 1, win 65535, length 1460
1.073663 IP 192.168.1.10.80 > 203.82.48.2.49161: Flags [.], ack 2921, win 65535, length 0
1.073968 IP 203.82.48.2.49161 > 192.168.1.10.80: Flags [.], seq 2921:4381, ack 1, win 65535, length 1460
1.073968 IP 192.168.1.10.80 > 203.82.48.2.49161: Flags [.], ack 4381, win 65535, length 0
1.097112 IP 203.82.48.2.49161 > 192.168.1.10.80: Flags [.], seq 4381:5841, ack 1, win 65535, length 1460
1.097112 IP 192.168.1.10.80 > 203.82.48.2.49161: Flags [.], ack 5841, win 65535, length 0
1.097380 IP 203.82.48.2.49161 > 192.168.1.10.80: Flags [.], seq 5841:7301, ack 1, win 65535, length 1460
1.097380 IP 192.168.1.10.80 > 203.82.48.2.49161: Flags [.], ack 7301, win 65535, length 0
1.097770 IP 203.82.48.2.49161 > 192.168.1.10.80: Flags [.], seq 7301:8761, ack 1, win 65535, length 1460
1.097770 IP 192.168.1.10.80 > 203.82.48.2.49161: Flags [.], ack 8761, win 65535, length 0
1.098033 IP 203.82.48.2.49161 > 192.168.1.10.80: Flags [.], seq 8761:10221, ack 1, win 65535, length 1460
1.098033 IP 192.168.1.10.80 > 203.82.48.2.49161: Flags [.], ack 10221, win 65535, length 0
1.135104 IP 203.82.48.2.49161 > 192.168.1.10.80: Flags [.], seq 10221:11681, ack 1, win 65535, length 1460
1.135104 IP 192.168.1.10.80 > 203.82.48.2.49161: Flags [.], ack 11681, win 65535, length 0
1.135504 IP 203.82.48.2.49161 > 192.168.1.10.80: Flags [.], seq 11681:13141, ack 1, win 65535, length 1460
1.135504 IP 192.168.1.10.80 > 203.82.48.2.49161: Flags [.], ack 13141, win 65535, length 0
1.135831 IP 203.82.48.2.49161 > 192.168.1.10.80: Flags [.], seq 13141:14601, ack 1, win 65535, length 1460
1.135831 IP 192.168.1.10.80 > 203.82.48.2.49161: Flags [.], ack 14601, win 65535, length 0
1.136476 IP 203.82.48.2.49161 > 192.168.1.10.80: Flags [.], seq 14601:16061, ack 1, win 65535, length 1460
1.136476 IP 192.168.1.10.80 > 203.82.48.2.49161: Flags [.], ack 16061, win 65535, length 0
1.136947 IP 203.82.48.2.49161 > 192.168.1.10.80: Flags [.], seq 16061:17521, ack 1, win 65535, length 1460
1.136947 IP 192.168.1.10.80 > 203.82.48.2.49161: Flags [.], ack 17521, win 65535, length 0
1.137229 IP 203.82.48.2.49161 > 192.168.1.10.80: Flags [.], seq 17521:18981, ack 1, win 65535, length 1460
1.137229 IP 192.168.1.10.80 > 203.82.48.2.49161: Flags [.], ack 18981, win 65535, length 0
1.137516 IP 203.82.48.2.49161 > 192.168.1.10.80: Flags [.], seq 18981:20441, ack 1, win 65535, length 1460
1.137516 IP 192.168.1.10.80 > 203.82.48.2.49161: Flags [.], ack 20441, win 65535, length 0
1.137809 IP 203.82.48.2.49161 > 192.168.1.10.80: Flags [.], seq 20441:21901, ack 1, win 65535, length 1460
1.137809 IP 192.168.1.10.80 > 203.82.48.2.49161: Flags [.], ack 21901, win 65535, length 0
1.186411 IP 203.82.48.2.49161 > 192.168.1.10.80: Flags [.], seq 24821:26281, ack 1, win 65535, length 1460
1.186411 IP 192.168.1.10.80 > 203.82.48.2.49161: Flags [.], ack 21901, win 65535, length 0
1.186723 IP 203.82.48.2.49161 > 192.168.1.10.80: Flags [.], seq 26281:27741, ack 1, win 65535, length 1460
1.186723 IP 192.168.1.10.80 > 203.82.48.2.49161: Flags [.], ack 21901, win 65535, length 0
1.187920 IP 203.82.48.2.49161 > 192.168.1.10.80: Flags [.], seq 29201:30661, ack 1, win 65535, length 1460
1.187920 IP 192.168.1.10.80 > 203.82.48.2.49161: Flags [.], ack 21901, win 65535, length 0
1.188852 IP 203.82.48.2.49161 > 192.168.1.10.80: Flags [.], seq 33581:35041, ack 1, win 65535, length 1460
1.188852 IP 192.168.1.10.80 > 203.82.48.2.49161: Flags [.], ack 21901, win 65535, length 0
1.189164 IP 203.82.48.2.49161 > 192.168.1.10.80: Flags [.], seq 35041:36501, ack 1, win 65535, length 1460
1.189164 IP 192.168.1.10.80 > 203.82.48.2.49161: Flags [.], ack 21901, win 65535, length 0
1.189525 IP 203.82.48.2.49161 > 192.168.1.10.80: Flags [.], seq 36501:37961, ack 1, win 65535, length 1460
1.189525 IP 192.168.1.10.80 > 203.82.48.2.49161: Flags [.], ack 21901, win 65535, length 0
1.189856 IP 203.82.48.2.49161 > 192.168.1.10.80: Flags [.], seq 37961:39421, ack 1, win 65535, length 1460
1.189856 IP 192.168.1.10.80 > 203.82.48.2.49161: Flags [.], ack 21901, win 65535, length 0
1.190142 IP 203.82.48.2.49161 > 192.168.1.10.80: Flags [.], seq 39421:40881, ack 1, win 65535, length 1460
1.190142 IP 192.168.1.10.80 > 203.82.48.2.49161: Flags [.], ack 21901, win 65535, length 0
1.190454 IP 203.82.48.2.49161 > 192.168.1.10.80: Flags [.], seq 40881:42341, ack 1, win 65535, length 1460
1.190454 IP 192.168.1.10.80 > 203.82.48.2.49161: Flags [.], ack 21901, win 65535, length 0
1.190747 IP 203.82.48.2.49161 > 192.168.1.10.80: Flags [.], seq 42341:43801, ack 1, win 65535, length 1460
1.190747 IP 192.168.1.10.80 > 203.82.48.2.49161: Flags [.], ack 21901, win 65535, length 0
1.191094 IP 203.82.48.2.49161 > 192.168.1.10.80: Flags [.], seq 43801:45261, ack 1, win 65535, length 1460
1.191094 IP 192.168.1.10.80 > 203.82.48.2.49161: Flags [.], ack 21901, win 65535, length 0
1.229019 IP 203.82.48.2.49161 > 192.168.1.10.80: Flags [.], seq 21901:23361, ack 1, win 65535, length 1460
1.229019 IP 192.168.1.10.80 > 203.82.48.2.49161: Flags [.], ack 23361, win 65535, length 0
1.229913 IP 203.82.48.2.49161 > 192.168.1.10.80: Flags [.], seq 45261:46721, ack 1, win 65535, length 1460
1.229913 IP 192.168.1.10.80 > 203.82.48.2.49161: Flags [.], ack 23361, win 65535, length 0
1.230201 IP 203.82.48.2.49161 > 192.168.1.10.80: Flags [.], seq 46721:48181, ack 1, win 65535, length 1460
1.230201 IP 192.168.1.10.80 > 203.82.48.2.49161: Flags [.], ack 23361, win 65535, length 0
1.230979 IP 203.82.48.2.49161 > 192.168.1.10.80: Flags [.], seq 48181:49641, ack 1, win 65535, length 1460
1.230979 IP 192.168.1.10.80 > 203.82.48.2.49161: Flags [.], ack 23361, win 65535, length 0
1.250126 IP 203.82.48.2.49161 > 192.168.1.10.80: Flags [.], seq 49641:51101, ack 1, win 65535, length 1460
1.250126 IP 192.168.1.10.80 > 203.82.48.2.49161: Flags [.], ack 23361, win 65535, length 0
1.250384 IP 203.82.48.2.49161 > 192.168.1.10.80: Flags [.], seq 23361:24821, ack 1, win 65535, length 1460
1.250384 IP 192.168.1.10.80 > 203.82.48.2.49161: Flags [.], ack 27741, win 65535, length 0
1.250763 IP 203.82.48.2.49161 > 192.168.1.10.80: Flags [.], seq 51101:52561, ack 1, win 65535, length 1460
1.250763 IP 192.168.1.10.80 > 203.82.48.2.49161: Flags [.], ack 27741, win 65535, length 0
1.251088 IP 203.82.48.2.49161 > 192.168.1.10.80: Flags [.], seq 52561:54021, ack 1, win 65535, length 1460
1.251088 IP 192.168.1.10.80 > 203.82.48.2.49161: Flags [.], ack 27741, win 65535, length 0
1.256810 IP 203.82.48.2.49161 > 192.168.1.10.80: Flags [.], seq 54021:55481, ack 1, win 65535, length 1460
1.256810 IP 192.168.1.10.80 > 203.82.48.2.49161: Flags [.], ack 27741, win 65535, length 0
1.273338 IP 203.82.48.2.49161 > 192.168.1.10.80: Flags [.], seq 55481:56941, ack 1, win 65535, length 1460
1.273338 IP 192.168.1.10.80 > 203.82.48.2.49161: Flags [.], ack 27741, win 65535, length 0
1.273635 IP 203.82.48.2.49161 > 192.168.1.10.80: Flags [.], seq 56941:58401, ack 1, win 65535, length 1460
1.273635 IP 192.168.1.10.80 > 203.82.48.2.49161: Flags [.], ack 27741, win 65535, length 0
1.274025 IP 203.82.48.2.49161 > 192.168.1.10.80: Flags [.], seq 27741:29201, ack 1, win 65535, length 1460
1.274025 IP 192.168.1.10.80 > 203.82.48.2.49161: Flags [.], ack 30661, win 65535, length 0
1.274511 IP 203.82.48.2.49161 > 192.168.1.10.80: Flags [.], seq 58401:59861, ack 1, win 65535, length 1460
1.274511 IP 192.168.1.10.80 > 203.82.48.2.49161: Flags [.], ack 30661, win 65535, length 0
1.274760 IP 203.82.48.2.49161 > 192.168.1.10.80: Flags [.], seq 59861:61321, ack 1, win 65535, length 1460
1.274760 IP 192.168.1.10.80 > 203.82.48.2.49161: Flags [.], ack 30661, win 65535, length 0
1.277181 IP 203.82.48.2.49161 > 192.168.1.10.80: Flags [.], seq 61321:62781, ack 1, win 65535, length 1460
1.277181 IP 192.168.1.10.80 > 203.82.48.2.49161: Flags [.], ack 30661, win 65535, length 0
1.297149 IP 203.82.48.2.49161 > 192.168.1.10.80: Flags [.], seq 62781:64241, ack 1, win 65535, length 1460
1.297149 IP 192.168.1.10.80 > 203.82.48.2.49161: Flags [.], ack 30661, win 65535, length 0
1.297396 IP 203.82.48.2.49161 > 192.168.1.10.80: Flags [.], seq 64241:65701, ack 1, win 65535, length 1460
1.297396 IP 192.168.1.10.80 > 203.82.48.2.49161: Flags [.], ack 30661, win 65535, length 0
1.297644 IP 203.82.48.2.49161 > 192.168.1.10.80: Flags [.], seq 65701:67161, ack 1, win 65535, length 1460
1.297644 IP 192.168.1.10.80 > 203.82.48.2.49161: Flags [.], ack 30661, win 65535, length 0
1.297928 IP 203.82.48.2.49161 > 192.168.1.10.80: Flags [.], seq 30661:32121, ack 1, win 65535, length 1460
1.297928 IP 192.168.1.10.80 > 203.82.48.2.49161: Flags [.], ack 32121, win 65535, length 0
1.299464 IP 203.82.48.2.49161 > 192.168.1.10.80: Flags [.], seq 67161:68621, ack 1, win 65535, length 1460
1.299464 IP 192.168.1.10.80 > 203.82.48.2.49161: Flags [.], ack 32121, win 65535, length 0
1.299748 IP 203.82.48.2.49161 > 192.168.1.10.80: Flags [.], seq 68621:70081, ack 1, win 65535, length 1460
1.299748 IP 192.168.1.10.80 > 203.82.48.2.49161: Flags [.], ack 32121, win 65535, length 0
1.300661 IP 203.82.48.2.49161 > 192.168.1.10.80: Flags [.], seq 70081:71541, ack 1, win 65535, length 1460
1.300661 IP 192.168.1.10.80 > 203.82.48.2.49161: Flags [.], ack 32121, win 65535, length 0
1.323601 IP 203.82.48.2.49161 > 192.168.1.10.80: Flags [.], seq 71541:73001, ack 1, win 65535, length 1460
1.323601 IP 192.168.1.10.80 > 203.82.48.2.49161: Flags [.], ack 32121, win 65535, length 0
1.324954 IP 203.82.48.2.49161 > 192.168.1.10.80: Flags [.], seq 73001:74461, ack 1, win 65535, length 1460
1.324954 IP 192.168.1.10.80 > 203.82.48.2.49161: Flags [.], ack 32121, win 65535, length 0
1.325271 IP 203.82.48.2.49161 > 192.168.1.10.80: Flags [.], seq 74461:75921, ack 1, win 65535, length 1460
1.325271 IP 192.168.1.10.80 > 203.82.48.2.49161: Flags [.], ack 32121, win 65535, length 0
1.325528 IP 203.82.48.2.49161 > 192.168.1.10.80: Flags [.], seq 75921:77381, ack 1, win 65535, length 1460
1.325528 IP 192.168.1.10.80 > 203.82.48.2.49161: Flags [.], ack 32121, win 65535, length 0
1.325984 IP 203.82.48.2.49161 > 192.168.1.10.80: Flags [.], seq 32121:33581, ack 1, win 65535, length 1460
1.325984 IP 192.168.1.10.80 > 203.82.48.2.49161: Flags [.], ack 77381, win 65535, length 0
1.326232 IP 203.82.48.2.49161 > 192.168.1.10.80: Flags [.], seq 77381:78841, ack 1, win 65535, length 1460
1.326232 IP 192.168.1.10.80 > 203.82.48.2.49161: Flags [.], ack 78841, win 65535, length 0
1.326885 IP 203.82.48.2.49161 > 192.168.1.10.80: Flags [.], seq 78841:80301, ack 1, win 65535, length 1460
1.326885 IP 192.168.1.10.80 > 203.82.48.2.49161: Flags [.], ack 80301, win 65535, length 0
1.327661 IP 203.82.48.2.49161 > 192.168.1.10.80: Flags [.], seq 80301:81761, ack 1, win 65535, length 1460
1.327661 IP 192.168.1.10.80 > 203.82.48.2.49161: Flags [.], ack 81761, win 65535, length 0
1.352864 IP 203.82.48.2.49161 > 192.168.1.10.80: Flags [.], seq 81761:83221, ack 1, win 65535, length 1460
1.352864 IP 192.168.1.10.80 > 203.82.48.2.49161: Flags [.], ack 83221, win 65535, length 0
1.353128 IP 203.82.48.2.49161 > 192.168.1.10.80: Flags [.], seq 83221:84681, ack 1, win 65535, length 1460
1.353128 IP 192.168.1.10.80 > 203.82.48.2.49161: Flags [.], ack 84681, win 65535, length 0
1.353536 IP 203.82.48.2.49161 > 192.168.1.10.80: Flags [.], seq 84681:86141, ack 1, win 65535, length 1460
1.353536 IP 192.168.1.10.80 > 203.82.48.2.49161: Flags [.], ack 86141, win 65535, length 0
1.353856 IP 203.82.48.2.49161 > 192.168.1.10.80: Flags [.], seq 86141:87601, ack 1, win 65535, length 1460
1.353856 IP 192.168.1.10.80 > 203.82.48.2.49161: Flags [.], ack 87601, win 65535, length 0
1.354133 IP 203.82.48.2.49161 > 192.168.1.10.80: Flags [.], seq 87601:89061, ack 1, win 65535, length 1460
1.354133 IP 192.168.1.10.80 > 203.82.48.2.49161: Flags [.], ack 89061, win 65535, length 0
1.358010 IP 203.82.48.2.49161 > 192.168.1.10.80: Flags [.], seq 89061:90521, ack 1, win 65535, length 1460
1.358010 IP 192.168.1.10.80 > 203.82.48.2.49161: Flags [.], ack 90521, win 65535, length 0
1.358568 IP 203.82.48.2.49161 > 192.168.1.10.80: Flags [.], seq 90521:91981, ack 1, win 65535, length 1460
1.358568 IP 192.168.1.10.80 > 203.82.48.2.49161: Flags [.], ack 91981, win 65535, length 0
1.359428 IP 203.82.48.2.49161 > 192.168.1.10.80: Flags [.], seq 91981:93441, ack 1, win 65535, length 1460
1.359428 IP 192.168.1.10.80 > 203.82.48.2.49161: Flags [.], ack 93441, win 65535, length 0
1.385019 IP 203.82.48.2.49161 > 192.168.1.10.80: Flags [.], seq 93441:94901, ack 1, win 65535, length 1460
1.385019 IP 192.168.1.10.80 > 203.82.48.2.49161: Flags [.], ack 94901, win 65535, length 0
1.386281 IP 203.82.48.2.49161 > 192.168.1.10.80: Flags [.], seq 94901:96361, ack 1, win 65535, length 1460
1.386281 IP 192.168.1.10.80 > 203.82.48.2.49161: Flags [.], ack 96361, win 65535, length 0
1.386575 IP 203.82.48.2.49161 > 192.168.1.10.80: Flags [.], seq 96361:97821, ack 1, win 65535, length 1460
1.386575 IP 192.168.1.10.80 > 203.82.48.2.49161: Flags [.], ack 97821, win 65535, length 0
1.387032 IP 203.82.48.2.49161 > 192.168.1.10.80: Flags [.], seq 97821:99281, ack 1, win 65535, length 1460
1.387032 IP 192.168.1.10.80 > 203.82.48.2.49161: Flags [.], ack 99281, win 65535, length 0
1.387645 IP 203.82.48.2.49161 > 192.168.1.10.80: Flags [.], seq 99281:100741, ack 1, win 65535, length 1460
1.387645 IP 192.168.1.10.80 > 203.82.48.2.49161: Flags [.], ack 100741, win 65535, length 0
1.388031 IP 203.82.48.2.49161 > 192.168.1.10.80: Flags [.], seq 100741:102201, ack 1, win 65535, length 1460
1.388031 IP 192.168.1.10.80 > 203.82.48.2.49161: Flags [.], ack 102201, win 65535, length 0
1.388282 IP 203.82.48.2.49161 > 192.168.1.10.80: Flags [.], seq 102201:103661, ack 1, win 65535, length 1460
1.388282 IP 192.168.1.10.80 > 203.82.48.2.49161: Flags [.], ack 103661, win 65535, length 0
1.388744 IP 203.82.48.2.49161 > 192.168.1.10.80: Flags [.], seq 103661:105121, ack 1, win 65535, length 1460
1.388744 IP 192.168.1.10.80 > 203.82.48.2.49161: Flags [.], ack 105121, win 65535, length 0
1.389065 IP 203.82.48.2.49161 > 192.168.1.10.80: Flags [.], seq 105121:106581, ack 1, win 65535, length 1460
1.389065 IP 192.168.1.10.80 > 203.82.48.2.49161: Flags [.], ack 106581, win 65535, length 0
1.434865 IP 203.82.48.2.49161 > 192.168.1.10.80: Flags [.], seq 106581:108041, ack 1, win 65535, length 1460
1.434865 IP 192.168.1.10.80 > 203.82.48.2.49161: Flags [.], ack 108041, win 65535, length 0
1.436024 IP 203.82.48.2.49161 > 192.168.1.10.80: Flags [.], seq 108041:109501, ack 1, win 65535, length 1460
1.436024 IP 192.168.1.10.80 > 203.82.48.2.49161: Flags [.], ack 109501, win 65535, length 0
1.436864 IP 203.82.48.2.49161 > 192.168.1.10.80: Flags [.], seq 109501:110961, ack 1, win 65535, length 1460
1.436864 IP 192.168.1.10.80 > 203.82.48.2.49161: Flags [.], ack 110961, win 65535, length 0
1.437113 IP 203.82.48.2.49161 > 192.168.1.10.80: Flags [.], seq 110961:112421, ack 1, win 65535, length 1460
1.437113 IP 192.168.1.10.80 > 203.82.48.2.49161: Flags [.], ack 112421, win 65535, length 0
1.437371 IP 203.82.48.2.49161 > 192.168.1.10.80: Flags [.], seq 112421:113881, ack 1, win 65535, length 1460
1.437371 IP 192.168.1.10.80 > 203.82.48.2.49161: Flags [.], ack 113881, win 65535, length 0
1.437634 IP 203.82.48.2.49161 > 192.168.1.10.80: Flags [.], seq 113881:115341, ack 1, win 65535, length 1460
1.437634 IP 192.168.1.10.80 > 203.82.48.2.49161: Flags [.], ack 115341, win 65535, length 0
1.437933 IP 203.82.48.2.49161 > 192.168.1.10.80: Flags [.], seq 115341:116801, ack 1, win 65535, length 1460
1.437933 IP 192.168.1.10.80 > 203.82.48.2.49161: Flags [.], ack 116801, win 65535, length 0
1.438212 IP 203.82.48.2.49161 > 192.168.1.10.80: Flags [.], seq 116801:118261, ack 1, win 65535, length 1460
1.438212 IP 192.168.1.10.80 > 203.82.48.2.49161: Flags [.], ack 118261, win 65535, length 0
1.439295 IP 203.82.48.2.49161 > 192.168.1.10.80: Flags [.], seq 118261:119721, ack 1, win 65535, length 1460
1.439295 IP 192.168.1.10.80 > 203.82.48.2.49161: Flags [.], ack 119721, win 65535, length 0
1.439688 IP 203.82.48.2.49161 > 192.168.1.10.80: Flags [.], seq 119721:121181, ack 1, win 65535, length 1460
1.439688 IP 192.168.1.10.80 > 203.82.48.2.49161: Flags [.], ack 121181, win 65535, length 0
1.474256 IP 203.82.48.2.49161 > 192.168.1.10.80: Flags [.], seq 121181:122641, ack 1, win 65535, length 1460
1.474256 IP 192.168.1.10.80 > 203.82.48.2.49161: Flags [.], ack 122641, win 65535, length 0
1.474878 IP 203.82.48.2.49161 > 192.168.1.10.80: Flags [.], seq 122641:124101, ack 1, win 65535, length 1460
1.474878 IP 192.168.1.10.80 > 203.82.48.2.49161: Flags [.], ack 124101, win 65535, length 0
1.475126 IP 203.82.48.2.49161 > 192.168.1.10.80: Flags [.], seq 125561:127021, ack 1, win 65535, length 1460
1.475126 IP 192.168.1.10.80 > 203.82.48.2.49161: Flags [.], ack 124101, win 65535, length 0
1.475399 IP 203.82.48.2.49161 > 192.168.1.10.80: Flags [.], seq 131401:132861, ack 1, win 65535, length 1460
1.475399 IP 192.168.1.10.80 > 203.82.48.2.49161: Flags [.], ack 124101, win 65535, length 0
1.475807 IP 203.82.48.2.49161 > 192.168.1.10.80: Flags [.], seq 134321:135781, ack 1, win 65535, length 1460
1.475807 IP 192.168.1.10.80 > 203.82.48.2.49161: Flags [.], ack 124101, win 65535, length 0
1.476060 IP 203.82.48.2.49161 > 192.168.1.10.80: Flags [.], seq 135781:137241, ack 1, win 65535, length 1460
1.476060 IP 192.168.1.10.80 > 203.82.48.2.49161: Flags [.], ack 124101, win 65535, length 0
1.518422 IP 203.82.48.2.49161 > 192.168.1.10.80: Flags [.], seq 137241:138701, ack 1, win 65535, length 1460
1.518422 IP 192.168.1.10.80 > 203.82.48.2.49161: Flags [.], ack 124101, win 65535, length 0
1.519190 IP 203.82.48.2.49161 > 192.168.1.10.80: Flags [.], seq 138701:140161, ack 1, win 65535, length 1460
1.519190 IP 192.168.1.10.80 > 203.82.48.2.49161: Flags [.], ack 124101, win 65535, length 0
1.520645 IP 203.82.48.2.49161 > 192.168.1.10.80: Flags [.], seq 124101:125561, ack 1, win 65535, length 1460
1.520645 IP 192.168.1.10.80 > 203.82.48.2.49161: Flags [.], ack 127021, win 65535, length 0
1.563307 IP 203.82.48.2.49161 > 192.168.1.10.80: Flags [.], seq 140161:141621, ack 1, win 65535, length 1460
1.563307 IP 192.168.1.10.80 > 203.82.48.2.49161: Flags [.], ack 127021, win 65535, length 0
1.563567 IP 203.82.48.2.49161 > 192.168.1.10.80: Flags [.], seq 127021:128481, ack 1, win 65535, length 1460
1.563567 IP 192.168.1.10.80 > 203.82.48.2.49161: Flags [.], ack 128481, win 65535, length 0
1.595970 IP 203.82.48.2.49161 > 192.168.1.10.80: Flags [.], seq 141621:143081, ack 1, win 65535, length 1460
1.595970 IP 192.168.1.10.80 > 203.82.48.2.49161: Flags [.], ack 128481, win 65535, length 0
1.596304 IP 203.82.48.2.49161 > 192.168.1.10.80: Flags [.], seq 143081:144541, ack 1, win 65535, length 1460
1.596304 IP 192.168.1.10.80 > 203.82.48.2.49161: Flags [.], ack 128481, win 65535, length 0
1.596585 IP 203.82.48.2.49161 > 192.168.1.10.80: Flags [.], seq 128481:129941, ack 1, win 65535, length 1460
1.596585 IP 192.168.1.10.80 > 203.82.48.2.49161: Flags [.], ack 129941, win 65535, length 0
1.632861 IP 203.82.48.2.49161 > 192.168.1.10.80: Flags [.], seq 144541:146001, ack 1, win 65535, length 1460
1.632861 IP 192.168.1.10.80 > 203.82.48.2.49161: Flags [.], ack 129941, win 65535, length 0
1.633108 IP 203.82.48.2.49161 > 192.168.1.10.80: Flags [.], seq 146001:147461, ack 1, win 65535, length 1460
1.633108 IP 192.168.1.10.80 > 203.82.48.2.49161: Flags [.], ack 129941, win 65535, length 0
1.633659 IP 203.82.48.2.49161 > 192.168.1.10.80: Flags [.], seq 147461:148921, ack 1, win 65535, length 1460
1.633659 IP 192.168.1.10.80 > 203.82.48.2.49161: Flags [.], ack 129941, win 65535, length 0
1.634600 IP 203.82.48.2.49161 > 192.168.1.10.80: Flags [.], seq 129941:131401, ack 1, win 65535, length 1460
1.634600 IP 192.168.1.10.80 > 203.82.48.2.49161: Flags [.], ack 132861, win 65535, length 0
1.666540 IP 203.82.48.2.49161 > 192.168.1.10.80: Flags [.], seq 148921:150381, ack 1, win 65535, length 1460
1.666540 IP 192.168.1.10.80 > 203.82.48.2.49161: Flags [.], ack 132861, win 65535, length 0
1.666788 IP 203.82.48.2.49161 > 192.168.1.10.80: Flags [.], seq 150381:151841, ack 1, win 65535, length 1460
1.666788 IP 192.168.1.10.80 > 203.82.48.2.49161: Flags [.], ack 132861, win 65535, length 0
1.667150 IP 203.82.48.2.49161 > 192.168.1.10.80: Flags [.], seq 151841:153301, ack 1, win 65535, length 1460
1.667150 IP 192.168.1.10.80 > 203.82.48.2.49161: Flags [.], ack 132861, win 65535, length 0
1.667456 IP 203.82.48.2.49161 > 192.168.1.10.80: Flags [.], seq 153301:154761, ack 1, win 65535, length 1460
1.667456 IP 192.168.1.10.80 > 203.82.48.2.49161: Flags [.], ack 132861, win 65535, length 0
1.667712 IP 203.82.48.2.49161 > 192.168.1.10.80: Flags [.], seq 132861:134321, ack 1, win 65535, length 1460
1.667712 IP 192.168.1.10.80 > 203.82.48.2.49161: Flags [.], ack 154761, win 65535, length 0
1.703856 IP 203.82.48.2.49161 > 192.168.1.10.80: Flags [.], seq 154761:156221, ack 1, win 65535, length 1460
1.703856 IP 192.168.1.10.80 > 203.82.48.2.49161: Flags [.], ack 156221, win 65535, length 0
1.704113 IP 203.82.48.2.49161 > 192.168.1.10.80: Flags [.], seq 156221:157681, ack 1, win 65535, length 1460
1.704113 IP 192.168.1.10.80 > 203.82.48.2.49161: Flags [.], ack 157681, win 65535, length 0
1.704371 IP 203.82.48.2.49161 > 192.168.1.10.80: Flags [.], seq 157681:159141, ack 1, win 65535, length 1460
1.704371 IP 192.168.1.10.80 > 203.82.48.2.49161: Flags [.], ack 159141, win 65535, length 0
1.704974 IP 203.82.48.2.49161 > 192.168.1.10.80: Flags [.], seq 159141:160601, ack 1, win 65535, length 1460
1.704974 IP 192.168.1.10.80 > 203.82.48.2.49161: Flags [.], ack 160601, win 65535, length 0
1.705264 IP 203.82.48.2.49161 > 192.168.1.10.80: Flags [.], seq 160601:162061, ack 1, win 65535, length 1460
1.705264 IP 192.168.1.10.80 > 203.82.48.2.49161: Flags [.], ack 162061, win 65535, length 0
1.733449 IP 203.82.48.2.49161 > 192.168.1.10.80: Flags [.], seq 162061:163521, ack 1, win 65535, length 1460
1.733449 IP 192.168.1.10.80 > 203.82.48.2.49161: Flags [.], ack 163521, win 65535, length 0
1.736263 IP 203.82.48.2.49161 > 192.168.1.10.80: Flags [.], seq 163521:164981, ack 1, win 65535, length 1460
1.736263 IP 192.168.1.10.80 > 203.82.48.2.49161: Flags [.], ack 164981, win 65535, length 0
1.736649 IP 203.82.48.2.49161 > 192.168.1.10.80: Flags [.], seq 164981:166441, ack 1, win 65535, length 1460
1.736649 IP 192.168.1.10.80 > 203.82.48.2.49161: Flags [.], ack 166441, win 65535, length 0
1.736903 IP 203.82.48.2.49161 > 192.168.1.10.80: Flags [.], seq 166441:167901, ack 1, win 65535, length 1460
1.736903 IP 192.168.1.10.80 > 203.82.48.2.49161: Flags [.], ack 167901, win 65535, length 0
1.740873 IP 203.82.48.2.49161 > 192.168.1.10.80: Flags [.], seq 167901:169361, ack 1, win 65535, length 1460
1.740873 IP 192.168.1.10.80 > 203.82.48.2.49161: Flags [.], ack 169361, win 65535, length 0
1.741162 IP 203.82.48.2.49161 > 192.168.1.10.80: Flags [.], seq 169361:170821, ack 1, win 65535, length 1460
1.741162 IP 192.168.1.10.80 > 203.82.48.2.49161: Flags [.], ack 170821, win 65535, length 0
1.779492 IP 203.82.48.2.49161 > 192.168.1.10.80: Flags [.], seq 170821:172281, ack 1, win 65535, length 1460
1.779492 IP 192.168.1.10.80 > 203.82.48.2.49161: Flags [.], ack 172281, win 65535, length 0
1.780869 IP 203.82.48.2.49161 > 192.168.1.10.80: Flags [.], seq 172281:173741, ack 1, win 65535, length 1460
1.780869 IP 192.168.1.10.80 > 203.82.48.2.49161: Flags [.], ack 173741, win 65535, length 0
1.781375 IP 203.82.48.2.49161 > 192.168.1.10.80: Flags [.], seq 173741:175201, ack 1, win 65535, length 1460
1.781375 IP 192.168.1.10.80 > 203.82.48.2.49161: Flags [.], ack 175201, win 65535, length 0
1.782769 IP 203.82.48.2.49161 > 192.168.1.10.80: Flags [.], seq 175201:176661, ack 1, win 65535, length 1460
1.782769 IP 192.168.1.10.80 > 203.82.48.2.49161: Flags [.], ack 176661, win 65535, length 0
1.783062 IP 203.82.48.2.49161 > 192.168.1.10.80: Flags [.], seq 176661:178121, ack 1, win 65535, length 1460
1.783062 IP 192.168.1.10.80 > 203.82.48.2.49161: Flags [.], ack 178121, win 65535, length 0
1.783483 IP 203.82.48.2.49161 > 192.168.1.10.80: Flags [.], seq 178121:179581, ack 1, win 65535, length 1460
1.783483 IP 192.168.1.10.80 > 203.82.48.2.49161: Flags [.], ack 179581, win 65535, length 0
1.788357 IP 203.82.48.2.49161 > 192.168.1.10.80: Flags [.], seq 179581:181041, ack 1, win 65535, length 1460
1.788357 IP 192.168.1.10.80 > 203.82.48.2.49161: Flags [.], ack 181041, win 65535, length 0
1.831043 IP 203.82.48.2.49161 > 192.168.1.10.80: Flags [.], seq 181041:182501, ack 1, win 65535, length 1460
1.831043 IP 192.168.1.10.80 > 203.82.48.2.49161: Flags [.], ack 182501, win 65535, length 0
1.832870 IP 203.82.48.2.49161 > 192.168.1.10.80: Flags [.], seq 182501:183961, ack 1, win 65535, length 1460
1.832870 IP 192.168.1.10.80 > 203.82.48.2.49161: Flags [.], ack 183961, win 65535, length 0
1.833286 IP 203.82.48.2.49161 > 192.168.1.10.80: Flags [.], seq 183961:185421, ack 1, win 65535, length 1460
1.833286 IP 192.168.1.10.80 > 203.82.48.2.49161: Flags [.], ack 185421, win 65535, length 0
1.833999 IP 203.82.48.2.49161 > 192.168.1.10.80: Flags [.], seq 185421:186881, ack 1, win 65535, length 1460
1.833999 IP 192.168.1.10.80 > 203.82.48.2.49161: Flags [.], ack 186881, win 65535, length 0
1.834794 IP 203.82.48.2.49161 > 192.168.1.10.80: Flags [.], seq 189801:191261, ack 1, win 65535, length 1460
1.834794 IP 192.168.1.10.80 > 203.82.48.2.49161: Flags [.], ack 186881, win 65535, length 0
1.835051 IP 203.82.48.2.49161 > 192.168.1.10.80: Flags [.], seq 191261:192721, ack 1, win 65535, length 1460
1.835051 IP 192.168.1.10.80 > 203.82.48.2.49161: Flags [.], ack 186881, win 65535, length 0
1.873644 IP 203.82.48.2.49161 > 192.168.1.10.80: Flags [.], seq 192721:194181, ack 1, win 65535, length 1460
1.873644 IP 192.168.1.10.80 > 203.82.48.2.49161: Flags [.], ack 186881, win 65535, length 0
1.875276 IP 203.82.48.2.49161 > 192.168.1.10.80: Flags [.], seq 194181:195641, ack 1, win 65535, length 1460
1.875276 IP 192.168.1.10.80 > 203.82.48.2.49161: Flags [.], ack 186881, win 65535, length 0
1.875781 IP 203.82.48.2.49161 > 192.168.1.10.80: Flags [.], seq 195641:197101, ack 1, win 65535, length 1460
1.875781 IP 192.168.1.10.80 > 203.82.48.2.49161: Flags [.], ack 186881, win 65535, length 0
1.877668 IP 203.82.48.2.49161 > 192.168.1.10.80: Flags [.], seq 197101:198561, ack 1, win 65535, length 1460
1.877668 IP 192.168.1.10.80 > 203.82.48.2.49161: Flags [.], ack 186881, win 65535, length 0
1.905952 IP 203.82.48.2.49161 > 192.168.1.10.80: Flags [.], seq 186881:188341, ack 1, win 65535, length 1460
1.905952 IP 192.168.1.10.80 > 203.82.48.2.49161: Flags [.], ack 188341, win 65535, length 0
1.907665 IP 203.82.48.2.49161 > 192.168.1.10.80: Flags [.], seq 198561:200021, ack 1, win 65535, length 1460
1.907665 IP 192.168.1.10.80 > 203.82.48.2.49161: Flags [.], ack 188341, win 65535, length 0
1.910115 IP 203.82.48.2.49161 > 192.168.1.10.80: Flags [.], seq 200021:201481, ack 1, win 65535, length 1460
1.910115 IP 192.168.1.10.80 > 203.82.48.2.49161: Flags [.], ack 188341, win 65535, length 0
1.935881 IP 203.82.48.2.49161 > 192.168.1.10.80: Flags [.], seq 201481:202941, ack 1, win 65535, length 1460
1.935881 IP 192.168.1.10.80 > 203.82.48.2.49161: Flags [.], ack 188341, win 65535, length 0
1.936227 IP 203.82.48.2.49161 > 192.168.1.10.80: Flags [.], seq 188341:189801, ack 1, win 65535, length 1460
1.936227 IP 192.168.1.10.80 > 203.82.48.2.49161: Flags [.], ack 202941, win 65535, length 0
1.937944 IP 203.82.48.2.49161 > 192.168.1.10.80: Flags [.], seq 202941:204401, ack 1, win 65535, length 1460
1.937944 IP 192.168.1.10.80 > 203.82.48.2.49161: Flags [.], ack 204401, win 65535, length 0
1.941598 IP 203.82.48.2.49161 > 192.168.1.10.80: Flags [.], seq 204401:205861, ack 1, win 65535, length 1460
1.941598 IP 192.168.1.10.80 > 203.82.48.2.49161: Flags [.], ack 205861, win 65535, length 0
1.968243 IP 203.82.48.2.49161 > 192.168.1.10.80: Flags [.], seq 205861:207321, ack 1, win 65535, length 1460
1.968243 IP 192.168.1.10.80 > 203.82.48.2.49161: Flags [.], ack 207321, win 65535, length 0
1.968503 IP 203.82.48.2.49161 > 192.168.1.10.80: Flags [.], seq 207321:208781, ack 1, win 65535, length 1460
1.968503 IP 192.168.1.10.80 > 203.82.48.2.49161: Flags [.], ack 208781, win 65535, length 0
1.971403 IP 203.82.48.2.49161 > 192.168.1.10.80: Flags [.], seq 208781:210241, ack 1, win 65535, length 1460
1.971403 IP 192.168.1.10.80 > 203.82.48.2.49161: Flags [.], ack 210241, win 65535, length 0
1.972588 IP 203.82.48.2.49161 > 192.168.1.10.80: Flags [.], seq 210241:211701, ack 1, win 65535, length 1460
1.972588 IP 192.168.1.10.80 > 203.82.48.2.49161: Flags [.], ack 211701, win 65535, length 0
2.004645 IP 203.82.48.2.49161 > 192.168.1.10.80: Flags [.], seq 211701:213161, ack 1, win 65535, length 1460
2.004645 IP 192.168.1.10.80 > 203.82.48.2.49161: Flags [.], ack 213161, win 65535, length 0
2.005017 IP 203.82.48.2.49161 > 192.168.1.10.80: Flags [.], seq 213161:214621, ack 1, win 65535, length 1460
2.005017 IP 192.168.1.10.80 > 203.82.48.2.49161: Flags [.], ack 214621, win 65535, length 0
2.005342 IP 203.82.48.2.49161 > 192.168.1.10.80: Flags [.], seq 214621:216081, ack 1, win 65535, length 1460
2.005342 IP 192.168.1.10.80 > 203.82.48.2.49161: Flags [.], ack 216081, win 65535, length 0
2.007628 IP 203.82.48.2.49161 > 192.168.1.10.80: Flags [.], seq 216081:217541, ack 1, win 65535, length 1460
2.007628 IP 192.168.1.10.80 > 203.82.48.2.49161: Flags [.], ack 217541, win 65535, length 0
2.009087 IP 203.82.48.2.49161 > 192.168.1.10.80: Flags [.], seq 217541:219001, ack 1, win 65535, length 1460
2.009087 IP 192.168.1.10.80 > 203.82.48.2.49161: Flags [.], ack 219001, win 65535, length 0
2.038171 IP 203.82.48.2.49161 > 192.168.1.10.80: Flags [.], seq 219001:220461, ack 1, win 65535, length 1460
2.038171 IP 192.168.1.10.80 > 203.82.48.2.49161: Flags [.], ack 220461, win 65535, length 0
2.040408 IP 203.82.48.2.49161 > 192.168.1.10.80: Flags [.], seq 220461:221921, ack 1, win 65535, length 1460
2.040408 IP 192.168.1.10.80 > 203.82.48.2.49161: Flags [.], ack 221921, win 65535, length 0
2.040781 IP 203.82.48.2.49161 > 192.168.1.10.80: Flags [.], seq 221921:223381, ack 1, win 65535, length 1460
2.040781 IP 192.168.1.10.80 > 203.82.48.2.49161: Flags [.], ack 223381, win 65535, length 0
2.041089 IP 203.82.48.2.49161 > 192.168.1.10.80: Flags [.], seq 223381:224841, ack 1, win 65535, length 1460
2.041089 IP 192.168.1.10.80 > 203.82.48.2.49161: Flags [.], ack 224841, win 65535, length 0
2.042604 IP 203.82.48.2.49161 > 192.168.1.10.80: Flags [.], seq 224841:226301, ack 1, win 65535, length 1460
2.042604 IP 192.168.1.10.80 > 203.82.48.2.49161: Flags [.], ack 226301, win 65535, length 0
2.043826 IP 203.82.48.2.49161 > 192.168.1.10.80: Flags [.], seq 226301:227761, ack 1, win 65535, length 1460
2.043826 IP 192.168.1.10.80 > 203.82.48.2.49161: Flags [.], ack 227761, win 65535, length 0
2.085876 IP 203.82.48.2.49161 > 192.168.1.10.80: Flags [.], seq 227761:229221, ack 1, win 65535, length 1460
2.085876 IP 192.168.1.10.80 > 203.82.48.2.49161: Flags [.], ack 229221, win 65535, length 0
2.089856 IP 203.82.48.2.49161 > 192.168.1.10.80: Flags [.], seq 229221:230681, ack 1, win 65535, length 1460
2.089856 IP 192.168.1.10.80 > 203.82.48.2.49161: Flags [.], ack 230681, win 65535, length 0
2.090178 IP 203.82.48.2.49161 > 192.168.1.10.80: Flags [.], seq 230681:232141, ack 1, win 65535, length 1460
2.090178 IP 192.168.1.10.80 > 203.82.48.2.49161: Flags [.], ack 232141, win 65535, length 0
2.090561 IP 203.82.48.2.49161 > 192.168.1.10.80: Flags [.], seq 232141:233601, ack 1, win 65535, length 1460
2.090561 IP 192.168.1.10.80 > 203.82.48.2.49161: Flags [.], ack 233601, win 65535, length 0
2.134336 IP 203.82.48.2.49161 > 192.168.1.10.80: Flags [.], seq 233601:235061, ack 1, win 65535, length 1460
2.134336 IP 192.168.1.10.80 > 203.82.48.2.49161: Flags [.], ack 235061, win 65535, length 0
2.134603 IP 203.82.48.2.49161 > 192.168.1.10.80: Flags [.], seq 235061:236521, ack 1, win 65535, length 1460
2.134603 IP 192.168.1.10.80 > 203.82.48.2.49161: Flags [.], ack 236521, win 65535, length 0
2.134870 IP 203.82.48.2.49161 > 192.168.1.10.80: Flags [.], seq 236521:237981, ack 1, win 65535, length 1460
2.134870 IP 192.168.1.10.80 > 203.82.48.2.49161: Flags [.], ack 237981, win 65535, length 0
2.135143 IP 203.82.48.2.49161 > 192.168.1.10.80: Flags [.], seq 237981:239441, ack 1, win 65535, length 1460
2.135143 IP 192.168.1.10.80 > 203.82.48.2.49161: Flags [.], ack 239441, win 65535, length 0
2.136434 IP 203.82.48.2.49161 > 192.168.1.10.80: Flags [.], seq 239441:240901, ack 1, win 65535, length 1460
2.136434 IP 192.168.1.10.80 > 203.82.48.2.49161: Flags [.], ack 240901, win 65535, length 0
2.137375 IP 203.82.48.2.49161 > 192.168.1.10.80: Flags [.], seq 240901:242361, ack 1, win 65535, length 1460
2.137375 IP 192.168.1.10.80 > 203.82.48.2.49161: Flags [.], ack 242361, win 65535, length 0
2.138360 IP 203.82.48.2.49161 > 192.168.1.10.80: Flags [.], seq 242361:243821, ack 1, win 65535, length 1460
2.138360 IP 192.168.1.10.80 > 203.82.48.2.49161: Flags [.], ack 243821, win 65535, length 0
2.168505 IP 203.82.48.2.49161 > 192.168.1.10.80: Flags [.], seq 243821:245281, ack 1, win 65535, length 1460
2.168505 IP 192.168.1.10.80 > 203.82.48.2.49161: Flags [.], ack 245281, win 65535, length 0
2.168807 IP 203.82.48.2.49161 > 192.168.1.10.80: Flags [.], seq 245281:246741, ack 1, win 65535, length 1460
2.168807 IP 192.168.1.10.80 > 203.82.48.2.49161: Flags [.], ack 246741, win 65535, length 0
2.169120 IP 203.82.48.2.49161 > 192.168.1.10.80: Flags [.], seq 246741:248201, ack 1, win 65535, length 1460
2.169120 IP 192.168.1.10.80 > 203.82.48.2.49161: Flags [.], ack 248201, win 65535, length 0
2.169480 IP 203.82.48.2.49161 > 192.168.1.10.80: Flags [.], seq 248201:249661, ack 1, win 65535, length 1460
2.169480 IP 192.168.1.10.80 > 203.82.48.2.49161: Flags [.], ack 249661, win 65535, length 0
2.169886 IP 203.82.48.2.49161 > 192.168.1.10.80: Flags [.], seq 249661:251121, ack 1, win 65535, length 1460
2.169886 IP 192.168.1.10.80 > 203.82.48.2.49161: Flags [.], ack 251121, win 65535, length 0
2.170368 IP 203.82.48.2.49161 > 192.168.1.10.80: Flags [.], seq 251121:252581, ack 1, win 65535, length 1460
2.170368 IP 192.168.1.10.80 > 203.82.48.2.49161: Flags [.], ack 252581, win 65535, length 0
2.170636 IP 203.82.48.2.49161 > 192.168.1.10.80: Flags [.], seq 252581:254041, ack 1, win 65535, length 1460
2.170636 IP 192.168.1.10.80 > 203.82.48.2.49161: Flags [.], ack 254041, win 65535, length 0
2.170912 IP 203.82.48.2.49161 > 192.168.1.10.80: Flags [.], seq 254041:255501, ack 1, win 65535, length 1460
2.170912 IP 192.168.1.10.80 > 203.82.48.2.49161: Flags [.], ack 255501, win 65535, length 0
2.204311 IP 203.82.48.2.49161 > 192.168.1.10.80: Flags [.], seq 255501:256961, ack 1, win 65535, length 1460
2.204311 IP 192.168.1.10.80 > 203.82.48.2.49161: Flags [.], ack 256961, win 65535, length 0
2.204560 IP 203.82.48.2.49161 > 192.168.1.10.80: Flags [.], seq 256961:258421, ack 1, win 65535, length 1460
2.204560 IP 192.168.1.10.80 > 203.82.48.2.49161: Flags [.], ack 258421, win 65535, length 0
2.204831 IP 203.82.48.2.49161 > 192.168.1.10.80: Flags [.], seq 258421:259881, ack 1, win 65535, length 1460
2.204831 IP 192.168.1.10.80 > 203.82.48.2.49161: Flags [.], ack 259881, win 65535, length 0
2.205125 IP 203.82.48.2.49161 > 192.168.1.10.80: Flags [.], seq 259881:261341, ack 1, win 65535, length 1460
2.205125 IP 192.168.1.10.80 > 203.82.48.2.49161: Flags [.], ack 261341, win 65535, length 0
2.205816 IP 203.82.48.2.49161 > 192.168.1.10.80: Flags [.], seq 261341:262801, ack 1, win 65535, length 1460
2.205816 IP 192.168.1.10.80 > 203.82.48.2.49161: Flags [.], ack 262801, win 65535, length 0
2.206261 IP 203.82.48.2.49161 > 192.168.1.10.80: Flags [.], seq 262801:264261, ack 1, win 65535, length 1460
2.206261 IP 192.168.1.10.80 > 203.82.48.2.49161: Flags [.], ack 264261, win 65535, length 0
2.206536 IP 203.82.48.2.49161 > 192.168.1.10.80: Flags [.], seq 264261:265721, ack 1, win 65535, length 1460
2.206536 IP 192.168.1.10.80 > 203.82.48.2.49161: Flags [.], ack 265721, win 65535, length 0
2.206834 IP 203.82.48.2.49161 > 192.168.1.10.80: Flags [.], seq 265721:267181, ack 1, win 65535, length 1460
2.206834 IP 192.168.1.10.80 > 203.82.48.2.49161: Flags [.], ack 267181, win 65535, length 0
2.207123 IP 203.82.48.2.49161 > 192.168.1.10.80: Flags [.], seq 267181:268641, ack 1, win 65535, length 1460
2.207123 IP 192.168.1.10.80 > 203.82.48.2.49161: Flags [.], ack 268641, win 65535, length 0
2.234574 IP 203.82.48.2.49161 > 192.168.1.10.80: Flags [.], seq 268641:270101, ack 1, win 65535, length 1460
2.234574 IP 192.168.1.10.80 > 203.82.48.2.49161: Flags [.], ack 270101, win 65535, length 0
2.234821 IP 203.82.48.2.49161 > 192.168.1.10.80: Flags [.], seq 270101:271561, ack 1, win 65535, length 1460
2.234821 IP 192.168.1.10.80 > 203.82.48.2.49161: Flags [.], ack 271561, win 65535, length 0
2.235152 IP 203.82.48.2.49161 > 192.168.1.10.80: Flags [.], seq 271561:273021, ack 1, win 65535, length 1460
2.235152 IP 192.168.1.10.80 > 203.82.48.2.49161: Flags [.], ack 273021, win 65535, length 0
2.235438 IP 203.82.48.2.49161 > 192.168.1.10.80: Flags [.], seq 273021:274481, ack 1, win 65535, length 1460
2.235438 IP 192.168.1.10.80 > 203.82.48.2.49161: Flags [.], ack 274481, win 65535, length 0
2.235762 IP 203.82.48.2.49161 > 192.168.1.10.80: Flags [.], seq 274481:275941, ack 1, win 65535, length 1460
2.235762 IP 192.168.1.10.80 > 203.82.48.2.49161: Flags [.], ack 275941, win 65535, length 0
2.236266 IP 203.82.48.2.49161 > 192.168.1.10.80: Flags [.], seq 275941:277401, ack 1, win 65535, length 1460
2.236266 IP 192.168.1.10.80 > 203.82.48.2.49161: Flags [.], ack 277401, win 65535, length 0
2.236706 IP 203.82.48.2.49161 > 192.168.1.10.80: Flags [.], seq 277401:278861, ack 1, win 65535, length 1460
2.236706 IP 192.168.1.10.80 > 203.82.48.2.49161: Flags [.], ack 278861, win 65535, length 0
2.237023 IP 203.82.48.2.49161 > 192.168.1.10.80: Flags [.], seq 278861:280321, ack 1, win 65535, length 1460
2.237023 IP 192.168.1.10.80 > 203.82.48.2.49161: Flags [.], ack 280321, win 65535, length 0
2.237285 IP 203.82.48.2.49161 > 192.168.1.10.80: Flags [.], seq 280321:281781, ack 1, win 65535, length 1460
2.237285 IP 192.168.1.10.80 > 203.82.48.2.49161: Flags [.], ack 281781, win 65535, length 0
2.242942 IP 203.82.48.2.49161 > 192.168.1.10.80: Flags [.], seq 281781:283241, ack 1, win 65535, length 1460
2.242942 IP 192.168.1.10.80 > 203.82.48.2.49161: Flags [.], ack 283241, win 65535, length 0
2.277318 IP 203.82.48.2.49161 > 192.168.1.10.80: Flags [.], seq 283241:284701, ack 1, win 65535, length 1460
2.277318 IP 192.168.1.10.80 > 203.82.48.2.49161: Flags [.], ack 284701, win 65535, length 0
2.277646 IP 203.82.48.2.49161 > 192.168.1.10.80: Flags [.], seq 284701:286161, ack 1, win 65535, length 1460
2.277646 IP 192.168.1.10.80 > 203.82.48.2.49161: Flags [.], ack 286161, win 65535, length 0
2.277923 IP 203.82.48.2.49161 > 192.168.1.10.80: Flags [.], seq 286161:287621, ack 1, win 65535, length 1460
2.277923 IP 192.168.1.10.80 > 203.82.48.2.49161: Flags [.], ack 287621, win 65535, length 0
2.278387 IP 203.82.48.2.49161 > 192.168.1.10.80: Flags [.], seq 287621:289081, ack 1, win 65535, length 1460
2.278387 IP 192.168.1.10.80 > 203.82.48.2.49161: Flags [.], ack 289081, win 65535, length 0
2.278772 IP 203.82.48.2.49161 > 192.168.1.10.80: Flags [.], seq 289081:290541, ack 1, win 65535, length 1460
2.278772 IP 192.168.1.10.80 > 203.82.48.2.49161: Flags [.], ack 290541, win 65535, length 0
2.280735 IP 203.82.48.2.49161 > 192.168.1.10.80: Flags [.], seq 290541:292001, ack 1, win 65535, length 1460
2.280735 IP 192.168.1.10.80 > 203.82.48.2.49161: Flags [.], ack 292001, win 65535, length 0
2.281215 IP 203.82.48.2.49161 > 192.168.1.10.80: Flags [.], seq 292001:293461, ack 1, win 65535, length 1460
2.281215 IP 192.168.1.10.80 > 203.82.48.2.49161: Flags [.], ack 293461, win 65535, length 0
2.281474 IP 203.82.48.2.49161 > 192.168.1.10.80: Flags [.], seq 293461:294921, ack 1, win 65535, length 1460
2.281474 IP 192.168.1.10.80 > 203.82.48.2.49161: Flags [.], ack 294921, win 65535, length 0
2.281761 IP 203.82.48.2.49161 > 192.168.1.10.80: Flags [.], seq 294921:296381, ack 1, win 65535, length 1460
2.281761 IP 192.168.1.10.80 > 203.82.48.2.49161: Flags [.], ack 296381, win 65535, length 0
2.282017 IP 203.82.48.2.49161 > 192.168.1.10.80: Flags [.], seq 296381:297841, ack 1, win 65535, length 1460
2.282017 IP 192.168.1.10.80 > 203.82.48.2.49161: Flags [.], ack 297841, win 65535, length 0
2.285767 IP 203.82.48.2.49161 > 192.168.1.10.80: Flags [.], seq 297841:299301, ack 1, win 65535, length 1460
2.285767 IP 192.168.1.10.80 > 203.82.48.2.49161: Flags [.], ack 299301, win 65535, length 0
2.324890 IP 203.82.48.2.49161 > 192.168.1.10.80: Flags [.], seq 299301:300761, ack 1, win 65535, length 1460
2.324890 IP 192.168.1.10.80 > 203.82.48.2.49161: Flags [.], ack 300761, win 65535, length 0
2.325432 IP 203.82.48.2.49161 > 192.168.1.10.80: Flags [.], seq 300761:302221, ack 1, win 65535, length 1460
2.325432 IP 192.168.1.10.80 > 203.82.48.2.49161: Flags [.], ack 302221, win 65535, length 0
2.326432 IP 203.82.48.2.49161 > 192.168.1.10.80: Flags [.], seq 302221:303681, ack 1, win 65535, length 1460
2.326432 IP 192.168.1.10.80 > 203.82.48.2.49161: Flags [.], ack 303681, win 65535, length 0
2.327122 IP 203.82.48.2.49161 > 192.168.1.10.80: Flags [.], seq 303681:305141, ack 1, win 65535, length 1460
2.327122 IP 192.168.1.10.80 > 203.82.48.2.49161: Flags [.], ack 305141, win 65535, length 0
2.327589 IP 203.82.48.2.49161 > 192.168.1.10.80: Flags [.], seq 305141:306601, ack 1, win 65535, length 1460
2.327589 IP 192.168.1.10.80 > 203.82.48.2.49161: Flags [.], ack 306601, win 65535, length 0
2.327876 IP 203.82.48.2.49161 > 192.168.1.10.80: Flags [.], seq 312441:313901, ack 1, win 65535, length 1460
2.327876 IP 192.168.1.10.80 > 203.82.48.2.49161: Flags [.], ack 306601, win 65535, length 0
2.353592 IP 203.82.48.2.49161 > 192.168.1.10.80: Flags [.], seq 316821:318281, ack 1, win 65535, length 1460
2.353592 IP 192.168.1.10.80 > 203.82.48.2.49161: Flags [.], ack 306601, win 65535, length 0
2.353859 IP 203.82.48.2.49161 > 192.168.1.10.80: Flags [.], seq 318281:319741, ack 1, win 65535, length 1460
2.353859 IP 192.168.1.10.80 > 203.82.48.2.49161: Flags [.], ack 306601, win 65535, length 0
2.354108 IP 203.82.48.2.49161 > 192.168.1.10.80: Flags [.], seq 319741:321201, ack 1, win 65535, length 1460
2.354108 IP 192.168.1.10.80 > 203.82.48.2.49161: Flags [.], ack 306601, win 65535, length 0
2.354425 IP 203.82.48.2.49161 > 192.168.1.10.80: Flags [.], seq 321201:322661, ack 1, win 65535, length 1460
2.354425 IP 192.168.1.10.80 > 203.82.48.2.49161: Flags [.], ack 306601, win 65535, length 0
2.354688 IP 203.82.48.2.49161 > 192.168.1.10.80: Flags [.], seq 322661:324121, ack 1, win 65535, length 1460
2.354688 IP 192.168.1.10.80 > 203.82.48.2.49161: Flags [.], ack 306601, win 65535, length 0
2.390690 IP 203.82.48.2.49161 > 192.168.1.10.80: Flags [.], seq 306601:308061, ack 1, win 65535, length 1460
2.390690 IP 192.168.1.10.80 > 203.82.48.2.49161: Flags [.], ack 308061, win 65535, length 0
2.423032 IP 203.82.48.2.49161 > 192.168.1.10.80: Flags [.], seq 324121:325581, ack 1, win 65535, length 1460
2.423032 IP 192.168.1.10.80 > 203.82.48.2.49161: Flags [.], ack 308061, win 65535, length 0
2.423323 IP 203.82.48.2.49161 > 192.168.1.10.80: Flags [.], seq 308061:309521, ack 1, win 65535, length 1460
2.423323 IP 192.168.1.10.80 > 203.82.48.2.49161: Flags [.], ack 309521, win 65535, length 0
2.451266 IP 203.82.48.2.49161 > 192.168.1.10.80: Flags [.], seq 325581:327041, ack 1, win 65535, length 1460
2.451266 IP 192.168.1.10.80 > 203.82.48.2.49161: Flags [.], ack 309521, win 65535, length 0
2.451635 IP 203.82.48.2.49161 > 192.168.1.10.80: Flags [.], seq 327041:328501, ack 1, win 65535, length 1460
2.451635 IP 192.168.1.10.80 > 203.82.48.2.49161: Flags [.], ack 309521, win 65535, length 0
2.451948 IP 203.82.48.2.49161 > 192.168.1.10.80: Flags [.], seq 309521:310981, ack 1, win 65535, length 1460
2.451948 IP 192.168.1.10.80 > 203.82.48.2.49161: Flags [.], ack 310981, win 65535, length 0
2.494803 IP 203.82.48.2.49161 > 192.168.1.10.80: Flags [.], seq 328501:329961, ack 1, win 65535, length 1460
2.494803 IP 192.168.1.10.80 > 203.82.48.2.49161: Flags [.], ack 310981, win 65535, length 0
2.495302 IP 203.82.48.2.49161 > 192.168.1.10.80: Flags [.], seq 329961:331421, ack 1, win 65535, length 1460
2.495302 IP 192.168.1.10.80 > 203.82.48.2.49161: Flags [.], ack 310981, win 65535, length 0
2.495624 IP 203.82.48.2.49161 > 192.168.1.10.80: Flags [.], seq 331421:332881, ack 1, win 65535, length 1460
2.495624 IP 192.168.1.10.80 > 203.82.48.2.49161: Flags [.], ack 310981, win 65535, length 0
2.495890 IP 203.82.48.2.49161 > 192.168.1.10.80: Flags [.], seq 310981:312441, ack 1, win 65535, length 1460
2.495890 IP 192.168.1.10.80 > 203.82.48.2.49161: Flags [.], ack 313901, win 65535, length 0
2.537527 IP 203.82.48.2.49161 > 192.168.1.10.80: Flags [.], seq 332881:334341, ack 1, win 65535, length 1460
2.537527 IP 192.168.1.10.80 > 203.82.48.2.49161: Flags [.], ack 313901, win 65535, length 0
2.537980 IP 203.82.48.2.49161 > 192.168.1.10.80: Flags [.], seq 334341:335801, ack 1, win 65535, length 1460
2.537980 IP 192.168.1.10.80 > 203.82.48.2.49161: Flags [.], ack 313901, win 65535, length 0
2.538228 IP 203.82.48.2.49161 > 192.168.1.10.80: Flags [.], seq 335801:337261, ack 1, win 65535, length 1460
2.538228 IP 192.168.1.10.80 > 203.82.48.2.49161: Flags [.], ack 313901, win 65535, length 0
2.538886 IP 203.82.48.2.49161 > 192.168.1.10.80: Flags [.], seq 337261:338721, ack 1, win 65535, length 1460
2.538886 IP 192.168.1.10.80 > 203.82.48.2.49161: Flags [.], ack 313901, win 65535, length 0
2.539152 IP 203.82.48.2.49161 > 192.168.1.10.80: Flags [.], seq 313901:315361, ack 1, win 65535, length 1460
2.539152 IP 192.168.1.10.80 > 203.82.48.2.49161: Flags [.], ack 315361, win 65535, length 0
2.590483 IP 203.82.48.2.49161 > 192.168.1.10.80: Flags [.], seq 338721:340181, ack 1, win 65535, length 1460
2.590483 IP 192.168.1.10.80 > 203.82.48.2.49161: Flags [.], ack 315361, win 65535, length 0
2.591099 IP 203.82.48.2.49161 > 192.168.1.10.80: Flags [.], seq 340181:341641, ack 1, win 65535, length 1460
2.591099 IP 192.168.1.10.80 > 203.82.48.2.49161: Flags [.], ack 315361, win 65535, length 0
2.591428 IP 203.82.48.2.49161 > 192.168.1.10.80: Flags [.], seq 341641:343101, ack 1, win 65535, length 1460
2.591428 IP 192.168.1.10.80 > 203.82.48.2.49161: Flags [.], ack 315361, win 65535, length 0
2.592128 IP 203.82.48.2.49161 > 192.168.1.10.80: Flags [.], seq 343101:344561, ack 1, win 65535, length 1460
2.592128 IP 192.168.1.10.80 > 203.82.48.2.49161: Flags [.], ack 315361, win 65535, length 0
2.592571 IP 203.82.48.2.49161 > 192.168.1.10.80: Flags [.], seq 344561:346021, ack 1, win 65535, length 1460
2.592571 IP 192.168.1.10.80 > 203.82.48.2.49161: Flags [.], ack 315361, win 65535, length 0
2.592850 IP 203.82.48.2.49161 > 192.168.1.10.80: Flags [.], seq 315361:316821, ack 1, win 65535, length 1460
2.592850 IP 192.168.1.10.80 > 203.82.48.2.49161: Flags [.], ack 346021, win 65535, length 0
2.633799 IP 203.82.48.2.49161 > 192.168.1.10.80: Flags [.], seq 346021:347481, ack 1, win 65535, length 1460
2.633799 IP 192.168.1.10.80 > 203.82.48.2.49161: Flags [.], ack 347481, win 65535, length 0
2.635127 IP 203.82.48.2.49161 > 192.168.1.10.80: Flags [.], seq 347481:348941, ack 1, win 65535, length 1460
2.635127 IP 192.168.1.10.80 > 203.82.48.2.49161: Flags [.], ack 348941, win 65535, length 0
2.635466 IP 203.82.48.2.49161 > 192.168.1.10.80: Flags [.], seq 348941:350401, ack 1, win 65535, length 1460
2.635466 IP 192.168.1.10.80 > 203.82.48.2.49161: Flags [.], ack 350401, win 65535, length 0
2.636570 IP 203.82.48.2.49161 > 192.168.1.10.80: Flags [.], seq 350401:351861, ack 1, win 65535, length 1460
2.636570 IP 192.168.1.10.80 > 203.82.48.2.49161: Flags [.], ack 351861, win 65535, length 0
2.636857 IP 203.82.48.2.49161 > 192.168.1.10.80: Flags [.], seq 351861:353321, ack 1, win 65535, length 1460
2.636857 IP 192.168.1.10.80 > 203.82.48.2.49161: Flags [.], ack 353321, win 65535, length 0
2.638187 IP 203.82.48.2.49161 > 192.168.1.10.80: Flags [.], seq 353321:354781, ack 1, win 65535, length 1460
2.638187 IP 192.168.1.10.80 > 203.82.48.2.49161: Flags [.], ack 354781, win 65535, length 0
2.669682 IP 203.82.48.2.49161 > 192.168.1.10.80: Flags [.], seq 354781:356241, ack 1, win 65535, length 1460
2.669682 IP 192.168.1.10.80 > 203.82.48.2.49161: Flags [.], ack 356241, win 65535, length 0
2.670012 IP 203.82.48.2.49161 > 192.168.1.10.80: Flags [.], seq 356241:357701, ack 1, win 65535, length 1460
2.670012 IP 192.168.1.10.80 > 203.82.48.2.49161: Flags [.], ack 357701, win 65535, length 0
2.670269 IP 203.82.48.2.49161 > 192.168.1.10.80: Flags [.], seq 357701:359161, ack 1, win 65535, length 1460
2.670269 IP 192.168.1.10.80 > 203.82.48.2.49161: Flags [.], ack 359161, win 65535, length 0
2.670595 IP 203.82.48.2.49161 > 192.168.1.10.80: Flags [.], seq 359161:360621, ack 1, win 65535, length 1460
2.670595 IP 192.168.1.10.80 > 203.82.48.2.49161: Flags [.], ack 360621, win 65535, length 0
2.671069 IP 203.82.48.2.49161 > 192.168.1.10.80: Flags [.], seq 360621:362081, ack 1, win 65535, length 1460
2.671069 IP 192.168.1.10.80 > 203.82.48.2.49161: Flags [.], ack 362081, win 65535, length 0
2.671371 IP 203.82.48.2.49161 > 192.168.1.10.80: Flags [.], seq 362081:363541, ack 1, win 65535, length 1460
2.671371 IP 192.168.1.10.80 > 203.82.48.2.49161: Flags [.], ack 363541, win 65535, length 0
2.671632 IP 203.82.48.2.49161 > 192.168.1.10.80: Flags [.], seq 363541:365001, ack 1, win 65535, length 1460
2.671632 IP 192.168.1.10.80 > 203.82.48.2.49161: Flags [.], ack 365001, win 65535, length 0
2.703229 IP 203.82.48.2.49161 > 192.168.1.10.80: Flags [.], seq 365001:366461, ack 1, win 65535, length 1460
2.703229 IP 192.168.1.10.80 > 203.82.48.2.49161: Flags [.], ack 366461, win 65535, length 0
2.703532 IP 203.82.48.2.49161 > 192.168.1.10.80: Flags [.], seq 366461:367921, ack 1, win 65535, length 1460
2.703532 IP 192.168.1.10.80 > 203.82.48.2.49161: Flags [.], ack 367921, win 65535, length 0
2.703909 IP 203.82.48.2.49161 > 192.168.1.10.80: Flags [.], seq 367921:369381, ack 1, win 65535, length 1460
2.703909 IP 192.168.1.10.80 > 203.82.48.2.49161: Flags [.], ack 369381, win 65535, length 0
2.704332 IP 203.82.48.2.49161 > 192.168.1.10.80: Flags [.], seq 369381:370841, ack 1, win 65535, length 1460
2.704332 IP 192.168.1.10.80 > 203.82.48.2.49161: Flags [.], ack 370841, win 65535, length 0
2.704639 IP 203.82.48.2.49161 > 192.168.1.10.80: Flags [.], seq 370841:372301, ack 1, win 65535, length 1460
2.704639 IP 192.168.1.10.80 > 203.82.48.2.49161: Flags [.], ack 372301, win 65535, length 0
2.705169 IP 203.82.48.2.49161 > 192.168.1.10.80: Flags [.], seq 372301:373761, ack 1, win 65535, length 1460
2.705169 IP 192.168.1.10.80 > 203.82.48.2.49161: Flags [.], ack 373761, win 65535, length 0
2.705431 IP 203.82.48.2.49161 > 192.168.1.10.80: Flags [.], seq 373761:375221, ack 1, win 65535, length 1460
2.705431 IP 192.168.1.10.80 > 203.82.48.2.49161: Flags [.], ack 375221, win 65535, length 0
2.705682 IP 203.82.48.2.49161 > 192.168.1.10.80: Flags [.], seq 375221:376681, ack 1, win 65535, length 1460
2.705682 IP 192.168.1.10.80 > 203.82.48.2.49161: Flags [.], ack 376681, win 65535, length 0
2.743313 IP 203.82.48.2.49161 > 192.168.1.10.80: Flags [.], seq 376681:378141, ack 1, win 65535, length 1460
2.743313 IP 192.168.1.10.80 > 203.82.48.2.49161: Flags [.], ack 378141, win 65535, length 0
2.744337 IP 203.82.48.2.49161 > 192.168.1.10.80: Flags [.], seq 378141:379601, ack 1, win 65535, length 1460
2.744337 IP 192.168.1.10.80 > 203.82.48.2.49161: Flags [.], ack 379601, win 65535, length 0
2.744727 IP 203.82.48.2.49161 > 192.168.1.10.80: Flags [.], seq 379601:381061, ack 1, win 65535, length 1460
2.744727 IP 192.168.1.10.80 > 203.82.48.2.49161: Flags [.], ack 381061, win 65535, length 0
2.745031 IP 203.82.48.2.49161 > 192.168.1.10.80: Flags [.], seq 381061:382521, ack 1, win 65535, length 1460
2.745031 IP 192.168.1.10.80 > 203.82.48.2.49161: Flags [.], ack 382521, win 65535, length 0
2.746016 IP 203.82.48.2.49161 > 192.168.1.10.80: Flags [.], seq 382521:383981, ack 1, win 65535, length 1460
2.746016 IP 192.168.1.10.80 > 203.82.48.2.49161: Flags [.], ack 383981, win 65535, length 0
2.746616 IP 203.82.48.2.49161 > 192.168.1.10.80: Flags [.], seq 383981:385441, ack 1, win 65535, length 1460
2.746616 IP 192.168.1.10.80 > 203.82.48.2.49161: Flags [.], ack 385441, win 65535, length 0
2.747058 IP 203.82.48.2.49161 > 192.168.1.10.80: Flags [.], seq 385441:386901, ack 1, win 65535, length 1460
2.747058 IP 192.168.1.10.80 > 203.82.48.2.49161: Flags [.], ack 386901, win 65535, length 0
2.747481 IP 203.82.48.2.49161 > 192.168.1.10.80: Flags [.], seq 386901:388361, ack 1, win 65535, length 1460
2.747481 IP 192.168.1.10.80 > 203.82.48.2.49161: Flags [.], ack 388361, win 65535, length 0
2.783321 IP 203.82.48.2.49161 > 192.168.1.10.80: Flags [.], seq 388361:389821, ack 1, win 65535, length 1460
2.783321 IP 192.168.1.10.80 > 203.82.48.2.49161: Flags [.], ack 389821, win 65535, length 0
2.783651 IP 203.82.48.2.49161 > 192.168.1.10.80: Flags [.], seq 389821:391281, ack 1, win 65535, length 1460
2.783651 IP 192.168.1.10.80 > 203.82.48.2.49161: Flags [.], ack 391281, win 65535, length 0
2.784083 IP 203.82.48.2.49161 > 192.168.1.10.80: Flags [.], seq 391281:392741, ack 1, win 65535, length 1460
2.784083 IP 192.168.1.10.80 > 203.82.48.2.49161: Flags [.], ack 392741, win 65535, length 0
2.784506 IP 203.82.48.2.49161 > 192.168.1.10.80: Flags [.], seq 392741:394201, ack 1, win 65535, length 1460
2.784506 IP 192.168.1.10.80 > 203.82.48.2.49161: Flags [.], ack 394201, win 65535, length 0
2.784772 IP 203.82.48.2.49161 > 192.168.1.10.80: Flags [.], seq 394201:395661, ack 1, win 65535, length 1460
2.784772 IP 192.168.1.10.80 > 203.82.48.2.49161: Flags [.], ack 395661, win 65535, length 0
2.785057 IP 203.82.48.2.49161 > 192.168.1.10.80: Flags [.], seq 395661:397121, ack 1, win 65535, length 1460
2.785057 IP 192.168.1.10.80 > 203.82.48.2.49161: Flags [.], ack 397121, win 65535, length 0
2.785713 IP 203.82.48.2.49161 > 192.168.1.10.80: Flags [.], seq 397121:398581, ack 1, win 65535, length 1460
2.785713 IP 192.168.1.10.80 > 203.82.48.2.49161: Flags [.], ack 398581, win 65535, length 0
2.786192 IP 203.82.48.2.49161 > 192.168.1.10.80: Flags [.], seq 398581:400041, ack 1, win 65535, length 1460
2.786192 IP 192.168.1.10.80 > 203.82.48.2.49161: Flags [.], ack 400041, win 65535, length 0
2.786616 IP 203.82.48.2.49161 > 192.168.1.10.80: Flags [.], seq 400041:401501, ack 1, win 65535, length 1460
2.786616 IP 192.168.1.10.80 > 203.82.48.2.49161: Flags [.], ack 401501, win 65535, length 0
2.822814 IP 203.82.48.2.49161 > 192.168.1.10.80: Flags [.], seq 401501:402961, ack 1, win 65535, length 1460
2.822814 IP 192.168.1.10.80 > 203.82.48.2.49161: Flags [.], ack 402961, win 65535, length 0
2.823154 IP 203.82.48.2.49161 > 192.168.1.10.80: Flags [.], seq 402961:404421, ack 1, win 65535, length 1460
2.823154 IP 192.168.1.10.80 > 203.82.48.2.49161: Flags [.], ack 404421, win 65535, length 0
2.823476 IP 203.82.48.2.49161 > 192.168.1.10.80: Flags [.], seq 404421:405881, ack 1, win 65535, length 1460
2.823476 IP 192.168.1.10.80 > 203.82.48.2.49161: Flags [.], ack 405881, win 65535, length 0
2.823786 IP 203.82.48.2.49161 > 192.168.1.10.80: Flags [.], seq 405881:407341, ack 1, win 65535, length 1460
2.823786 IP 192.168.1.10.80 > 203.82.48.2.49161: Flags [.], ack 407341, win 65535, length 0
2.824047 IP 203.82.48.2.49161 > 192.168.1.10.80: Flags [.], seq 407341:408801, ack 1, win 65535, length 1460
2.824047 IP 192.168.1.10.80 > 203.82.48.2.49161: Flags [.], ack 408801, win 65535, length 0
2.824468 IP 203.82.48.2.49161 > 192.168.1.10.80: Flags [.], seq 408801:410261, ack 1, win 65535, length 1460
2.824468 IP 192.168.1.10.80 > 203.82.48.2.49161: Flags [.], ack 410261, win 65535, length 0
2.824764 IP 203.82.48.2.49161 > 192.168.1.10.80: Flags [.], seq 410261:411721, ack 1, win 65535, length 1460
2.824764 IP 192.168.1.10.80 > 203.82.48.2.49161: Flags [.], ack 411721, win 65535, length 0
2.827717 IP 203.82.48.2.49161 > 192.168.1.10.80: Flags [.], seq 411721:413181, ack 1, win 65535, length 1460
2.827717 IP 192.168.1.10.80 > 203.82.48.2.49161: Flags [.], ack 413181, win 65535, length 0
2.828504 IP 203.82.48.2.49161 > 192.168.1.10.80: Flags [.], seq 413181:414641, ack 1, win 65535, length 1460
2.828504 IP 192.168.1.10.80 > 203.82.48.2.49161: Flags [.], ack 414641, win 65535, length 0
2.828778 IP 203.82.48.2.49161 > 192.168.1.10.80: Flags [.], seq 414641:416101, ack 1, win 65535, length 1460
2.828778 IP 192.168.1.10.80 > 203.82.48.2.49161: Flags [.], ack 416101, win 65535, length 0
2.859254 IP 203.82.48.2.49161 > 192.168.1.10.80: Flags [.], seq 416101:417561, ack 1, win 65535, length 1460
2.859254 IP 192.168.1.10.80 > 203.82.48.2.49161: Flags [.], ack 417561, win 65535, length 0
2.859595 IP 203.82.48.2.49161 > 192.168.1.10.80: Flags [.], seq 417561:419021, ack 1, win 65535, length 1460
2.859595 IP 192.168.1.10.80 > 203.82.48.2.49161: Flags [.], ack 419021, win 65535, length 0
2.862174 IP 203.82.48.2.49161 > 192.168.1.10.80: Flags [.], seq 419021:420481, ack 1, win 65535, length 1460
2.862174 IP 192.168.1.10.80 > 203.82.48.2.49161: Flags [.], ack 420481, win 65535, length 0
2.863542 IP 203.82.48.2.49161 > 192.168.1.10.80: Flags [.], seq 420481:421941, ack 1, win 65535, length 1460
2.863542 IP 192.168.1.10.80 > 203.82.48.2.49161: Flags [.], ack 421941, win 65535, length 0
2.863836 IP 203.82.48.2.49161 > 192.168.1.10.80: Flags [.], seq 421941:423401, ack 1, win 65535, length 1460
2.863836 IP 192.168.1.10.80 > 203.82.48.2.49161: Flags [.], ack 423401, win 65535, length 0
2.864097 IP 203.82.48.2.49161 > 192.168.1.10.80: Flags [.], seq 423401:424861, ack 1, win 65535, length 1460
2.864097 IP 192.168.1.10.80 > 203.82.48.2.49161: Flags [.], ack 424861, win 65535, length 0
2.864491 IP 203.82.48.2.49161 > 192.168.1.10.80: Flags [.], seq 424861:426321, ack 1, win 65535, length 1460
2.864491 IP 192.168.1.10.80 > 203.82.48.2.49161: Flags [.], ack 426321, win 65535, length 0
2.864745 IP 203.82.48.2.49161 > 192.168.1.10.80: Flags [.], seq 427781:429241, ack 1, win 65535, length 1460
2.864745 IP 192.168.1.10.80 > 203.82.48.2.49161: Flags [.], ack 426321, win 65535, length 0
2.865712 IP 203.82.48.2.49161 > 192.168.1.10.80: Flags [.], seq 429241:430701, ack 1, win 65535, length 1460
2.865712 IP 192.168.1.10.80 > 203.82.48.2.49161: Flags [.], ack 426321, win 65535, length 0
2.865966 IP 203.82.48.2.49161 > 192.168.1.10.80: Flags [.], seq 430701:432161, ack 1, win 65535, length 1460
2.865966 IP 192.168.1.10.80 > 203.82.48.2.49161: Flags [.], ack 426321, win 65535, length 0
2.894845 IP 203.82.48.2.49161 > 192.168.1.10.80: Flags [.], seq 432161:433621, ack 1, win 65535, length 1460
2.894845 IP 192.168.1.10.80 > 203.82.48.2.49161: Flags [.], ack 426321, win 65535, length 0
2.895240 IP 203.82.48.2.49161 > 192.168.1.10.80: Flags [.], seq 433621:435081, ack 1, win 65535, length 1460
2.895240 IP 192.168.1.10.80 > 203.82.48.2.49161: Flags [.], ack 426321, win 65535, length 0
2.895865 IP 203.82.48.2.49161 > 192.168.1.10.80: Flags [.], seq 435081:436541, ack 1, win 65535, length 1460
2.895865 IP 192.168.1.10.80 > 203.82.48.2.49161: Flags [.], ack 426321, win 65535, length 0
2.897871 IP 203.82.48.2.49161 > 192.168.1.10.80: Flags [.], seq 436541:438001, ack 1, win 65535, length 1460
2.897871 IP 192.168.1.10.80 > 203.82.48.2.49161: Flags [.], ack 426321, win 65535, length 0
2.898121 IP 203.82.48.2.49161 > 192.168.1.10.80: Flags [.], seq 438001:439461, ack 1, win 65535, length 1460
2.898121 IP 192.168.1.10.80 > 203.82.48.2.49161: Flags [.], ack 426321, win 65535, length 0
2.898450 IP 203.82.48.2.49161 > 192.168.1.10.80: Flags [.], seq 439461:440921, ack 1, win 65535, length 1460
2.898450 IP 192.168.1.10.80 > 203.82.48.2.49161: Flags [.], ack 426321, win 65535, length 0
2.898781 IP 203.82.48.2.49161 > 192.168.1.10.80: Flags [.], seq 440921:442381, ack 1, win 65535, length 1460
2.898781 IP 192.168.1.10.80 > 203.82.48.2.49161: Flags [.], ack 426321, win 65535, length 0
2.899032 IP 203.82.48.2.49161 > 192.168.1.10.80: Flags [.], seq 442381:443841, ack 1, win 65535, length 1460
2.899032 IP 192.168.1.10.80 > 203.82.48.2.49161: Flags [.], ack 426321, win 65535, length 0
2.899823 IP 203.82.48.2.49161 > 192.168.1.10.80: Flags [.], seq 426321:427781, ack 1, win 65535, length 1460
2.899823 IP 192.168.1.10.80 > 203.82.48.2.49161: Flags [.], ack 443841, win 65535, length 0
2.940821 IP 203.82.48.2.49161 > 192.168.1.10.80: Flags [.], seq 443841:445301, ack 1, win 65535, length 1460
2.940821 IP 192.168.1.10.80 > 203.82.48.2.49161: Flags [.], ack 445301, win 65535, length 0
2.941442 IP 203.82.48.2.49161 > 192.168.1.10.80: Flags [.], seq 445301:446761, ack 1, win 65535, length 1460
2.941442 IP 192.168.1.10.80 > 203.82.48.2.49161: Flags [.], ack 446761, win 65535, length 0
2.941771 IP 203.82.48.2.49161 > 192.168.1.10.80: Flags [.], seq 446761:448221, ack 1, win 65535, length 1460
2.941771 IP 192.168.1.10.80 > 203.82.48.2.49161: Flags [.], ack 448221, win 65535, length 0
2.942067 IP 203.82.48.2.49161 > 192.168.1.10.80: Flags [.], seq 448221:449681, ack 1, win 65535, length 1460
2.942067 IP 192.168.1.10.80 > 203.82.48.2.49161: Flags [.], ack 449681, win 65535, length 0
2.942486 IP 203.82.48.2.49161 > 192.168.1.10.80: Flags [.], seq 449681:451141, ack 1, win 65535, length 1460
2.942486 IP 192.168.1.10.80 > 203.82.48.2.49161: Flags [.], ack 451141, win 65535, length 0
2.943235 IP 203.82.48.2.49161 > 192.168.1.10.80: Flags [.], seq 451141:452601, ack 1, win 65535, length 1460
2.943235 IP 192.168.1.10.80 > 203.82.48.2.49161: Flags [.], ack 452601, win 65535, length 0
2.984636 IP 203.82.48.2.49161 > 192.168.1.10.80: Flags [.], seq 452601:454061, ack 1, win 65535, length 1460
2.984636 IP 192.168.1.10.80 > 203.82.48.2.49161: Flags [.], ack 454061, win 65535, length 0
2.985196 IP 203.82.48.2.49161 > 192.168.1.10.80: Flags [.], seq 454061:455521, ack 1, win 65535, length 1460
2.985196 IP 192.168.1.10.80 > 203.82.48.2.49161: Flags [.], ack 455521, win 65535, length 0
2.985584 IP 203.82.48.2.49161 > 192.168.1.10.80: Flags [.], seq 455521:456981, ack 1, win 65535, length 1460
2.985584 IP 192.168.1.10.80 > 203.82.48.2.49161: Flags [.], ack 456981, win 65535, length 0
2.985868 IP 203.82.48.2.49161 > 192.168.1.10.80: Flags [.], seq 456981:458441, ack 1, win 65535, length 1460
2.985868 IP 192.168.1.10.80 > 203.82.48.2.49161: Flags [.], ack 458441, win 65535, length 0
2.987512 IP 203.82.48.2.49161 > 192.168.1.10.80: Flags [.], seq 458441:459901, ack 1, win 65535, length 1460
2.987512 IP 192.168.1.10.80 > 203.82.48.2.49161: Flags [.], ack 459901, win 65535, length 0
2.992067 IP 203.82.48.2.49161 > 192.168.1.10.80: Flags [.], seq 459901:461361, ack 1, win 65535, length 1460
2.992067 IP 192.168.1.10.80 > 203.82.48.2.49161: Flags [.], ack 461361, win 65535, length 0
2.992399 IP 203.82.48.2.49161 > 192.168.1.10.80: Flags [.], seq 461361:462821, ack 1, win 65535, length 1460
2.992399 IP 192.168.1.10.80 > 203.82.48.2.49161: Flags [.], ack 462821, win 65535, length 0
3.046451 IP 203.82.48.2.49161 > 192.168.1.10.80: Flags [.], seq 468661:470121, ack 1, win 65535, length 1460
3.046451 IP 192.168.1.10.80 > 203.82.48.2.49161: Flags [.], ack 462821, win 65535, length 0
3.049635 IP 203.82.48.2.49161 > 192.168.1.10.80: Flags [.], seq 470121:471581, ack 1, win 65535, length 1460
3.049635 IP 192.168.1.10.80 > 203.82.48.2.49161: Flags [.], ack 462821, win 65535, length 0
3.049929 IP 203.82.48.2.49161 > 192.168.1.10.80: Flags [.], seq 471581:473041, ack 1, win 65535, length 1460
3.049929 IP 192.168.1.10.80 > 203.82.48.2.49161: Flags [.], ack 462821, win 65535, length 0
3.050214 IP 203.82.48.2.49161 > 192.168.1.10.80: Flags [.], seq 473041:474501, ack 1, win 65535, length 1460
3.050214 IP 192.168.1.10.80 > 203.82.48.2.49161: Flags [.], ack 462821, win 65535, length 0
3.086298 IP 203.82.48.2.49161 > 192.168.1.10.80: Flags [.], seq 462821:464281, ack 1, win 65535, length 1460
3.086298 IP 192.168.1.10.80 > 203.82.48.2.49161: Flags [.], ack 464281, win 65535, length 0
3.117378 IP 203.82.48.2.49161 > 192.168.1.10.80: Flags [.], seq 474501:475961, ack 1, win 65535, length 1460
3.117378 IP 192.168.1.10.80 > 203.82.48.2.49161: Flags [.], ack 464281, win 65535, length 0
3.117660 IP 203.82.48.2.49161 > 192.168.1.10.80: Flags [.], seq 464281:465741, ack 1, win 65535, length 1460
3.117660 IP 192.168.1.10.80 > 203.82.48.2.49161: Flags [.], ack 465741, win 65535, length 0
3.152595 IP 203.82.48.2.49161 > 192.168.1.10.80: Flags [.], seq 475961:477421, ack 1, win 65535, length 1460
3.152595 IP 192.168.1.10.80 > 203.82.48.2.49161: Flags [.], ack 465741, win 65535, length 0
3.152896 IP 203.82.48.2.49161 > 192.168.1.10.80: Flags [.], seq 477421:478881, ack 1, win 65535, length 1460
3.152896 IP 192.168.1.10.80 > 203.82.48.2.49161: Flags [.], ack 465741, win 65535, length 0
3.153188 IP 203.82.48.2.49161 > 192.168.1.10.80: Flags [.], seq 465741:467201, ack 1, win 65535, length 1460
3.153188 IP 192.168.1.10.80 > 203.82.48.2.49161: Flags [.], ack 467201, win 65535, length 0
3.184873 IP 203.82.48.2.49161 > 192.168.1.10.80: Flags [.], seq 478881:480341, ack 1, win 65535, length 1460
3.184873 IP 192.168.1.10.80 > 203.82.48.2.49161: Flags [.], ack 467201, win 65535, length 0
3.185238 IP 203.82.48.2.49161 > 192.168.1.10.80: Flags [.], seq 480341:481801, ack 1, win 65535, length 1460
3.185238 IP 192.168.1.10.80 > 203.82.48.2.49161: Flags [.], ack 467201, win 65535, length 0
3.185565 IP 203.82.48.2.49161 > 192.168.1.10.80: Flags [.], seq 481801:483261, ack 1, win 65535, length 1460
3.185565 IP 192.168.1.10.80 > 203.82.48.2.49161: Flags [.], ack 467201, win 65535, length 0
3.185838 IP 203.82.48.2.49161 > 192.168.1.10.80: Flags [.], seq 467201:468661, ack 1, win 65535, length 1460
3.185838 IP 192.168.1.10.80 > 203.82.48.2.49161: Flags [.], ack 483261, win 65535, length 0
3.222951 IP 203.82.48.2.49161 > 192.168.1.10.80: Flags [.], seq 483261:484721, ack 1, win 65535, length 1460
3.222951 IP 192.168.1.10.80 > 203.82.48.2.49161: Flags [.], ack 484721, win 65535, length 0
3.223303 IP 203.82.48.2.49161 > 192.168.1.10.80: Flags [.], seq 484721:486181, ack 1, win 65535, length 1460
3.223303 IP 192.168.1.10.80 > 203.82.48.2.49161: Flags [.], ack 486181, win 65535, length 0
3.223958 IP 203.82.48.2.49161 > 192.168.1.10.80: Flags [.], seq 486181:487641, ack 1, win 65535, length 1460
3.223958 IP 192.168.1.10.80 > 203.82.48.2.49161: Flags [.], ack 487641, win 65535, length 0
3.224455 IP 203.82.48.2.49161 > 192.168.1.10.80: Flags [.], seq 487641:489101, ack 1, win 65535, length 1460
3.224455 IP 192.168.1.10.80 > 203.82.48.2.49161: Flags [.], ack 489101, win 65535, length 0
3.265449 IP 203.82.48.2.49161 > 192.168.1.10.80: Flags [.], seq 489101:490561, ack 1, win 65535, length 1460
3.265449 IP 192.168.1.10.80 > 203.82.48.2.49161: Flags [.], ack 490561, win 65535, length 0
3.271318 IP 203.82.48.2.49161 > 192.168.1.10.80: Flags [.], seq 490561:492021, ack 1, win 65535, length 1460
3.271318 IP 192.168.1.10.80 > 203.82.48.2.49161: Flags [.], ack 492021, win 65535, length 0
3.271613 IP 203.82.48.2.49161 > 192.168.1.10.80: Flags [.], seq 492021:493481, ack 1, win 65535, length 1460
3.271613 IP 192.168.1.10.80 > 203.82.48.2.49161: Flags [.], ack 493481, win 65535, length 0
3.314372 IP 203.82.48.2.49161 > 192.168.1.10.80: Flags [.], seq 496401:497861, ack 1, win 65535, length 1460
3.314372 IP 192.168.1.10.80 > 203.82.48.2.49161: Flags [.], ack 493481, win 65535, length 0
3.317216 IP 203.82.48.2.49161 > 192.168.1.10.80: Flags [.], seq 497861:499321, ack 1, win 65535, length 1460
3.317216 IP 192.168.1.10.80 > 203.82.48.2.49161: Flags [.], ack 493481, win 65535, length 0
3.318011 IP 203.82.48.2.49161 > 192.168.1.10.80: Flags [.], seq 499321:500781, ack 1, win 65535, length 1460
3.318011 IP 192.168.1.10.80 > 203.82.48.2.49161: Flags [.], ack 493481, win 65535, length 0
3.342822 IP 203.82.48.2.49161 > 192.168.1.10.80: Flags [.], seq 493481:494941, ack 1, win 65535, length 1460
3.342822 IP 192.168.1.10.80 > 203.82.48.2.49161: Flags [.], ack 494941, win 65535, length 0
3.379693 IP 203.82.48.2.49161 > 192.168.1.10.80: Flags [.], seq 500781:502241, ack 1, win 65535, length 1460
3.379693 IP 192.168.1.10.80 > 203.82.48.2.49161: Flags [.], ack 494941, win 65535, length 0
3.379959 IP 203.82.48.2.49161 > 192.168.1.10.80: Flags [.], seq 494941:496401, ack 1, win 65535, length 1460
3.379959 IP 192.168.1.10.80 > 203.82.48.2.49161: Flags [.], ack 502241, win 65535, length 0
3.425240 IP 203.82.48.2.49161 > 192.168.1.10.80: Flags [.], seq 502241:503701, ack 1, win 65535, length 1460
3.425240 IP 192.168.1.10.80 > 203.82.48.2.49161: Flags [.], ack 503701, win 65535, length 0
3.425551 IP 203.82.48.2.49161 > 192.168.1.10.80: Flags [.], seq 503701:505161, ack 1, win 65535, length 1460
3.425551 IP 192.168.1.10.80 > 203.82.48.2.49161: Flags [.], ack 505161, win 65535, length 0
3.454633 IP 203.82.48.2.49161 > 192.168.1.10.80: Flags [.], seq 505161:506621, ack 1, win 65535, length 1460
3.454633 IP 192.168.1.10.80 > 203.82.48.2.49161: Flags [.], ack 506621, win 65535, length 0
3.454966 IP 203.82.48.2.49161 > 192.168.1.10.80: Flags [.], seq 506621:508081, ack 1, win 65535, length 1460
3.454966 IP 192.168.1.10.80 > 203.82.48.2.49161: Flags [.], ack 508081, win 65535, length 0
3.455218 IP 203.82.48.2.49161 > 192.168.1.10.80: Flags [.], seq 508081:509541, ack 1, win 65535, length 1460
3.455218 IP 192.168.1.10.80 > 203.82.48.2.49161: Flags [.], ack 509541, win 65535, length 0
3.497627 IP 203.82.48.2.49161 > 192.168.1.10.80: Flags [.], seq 509541:511001, ack 1, win 65535, length 1460
3.497627 IP 192.168.1.10.80 > 203.82.48.2.49161: Flags [.], ack 511001, win 65535, length 0
3.541636 IP 203.82.48.2.49161 > 192.168.1.10.80: Flags [.], seq 511001:512461, ack 1, win 65535, length 1460
3.541636 IP 192.168.1.10.80 > 203.82.48.2.49161: Flags [.], ack 512461, win 65535, length 0
3.541944 IP 203.82.48.2.49161 > 192.168.1.10.80: Flags [.], seq 512461:513921, ack 1, win 65535, length 1460
3.541944 IP 192.168.1.10.80 > 203.82.48.2.49161: Flags [.], ack 513921, win 65535, length 0
3.542290 IP 203.82.48.2.49161 > 192.168.1.10.80: Flags [.], seq 513921:515381, ack 1, win 65535, length 1460
3.542290 IP 192.168.1.10.80 > 203.82.48.2.49161: Flags [.], ack 515381, win 65535, length 0
3.542685 IP 203.82.48.2.49161 > 192.168.1.10.80: Flags [.], seq 515381:516841, ack 1, win 65535, length 1460
3.542685 IP 192.168.1.10.80 > 203.82.48.2.49161: Flags [.], ack 516841, win 65535, length 0
3.578256 IP 203.82.48.2.49161 > 192.168.1.10.80: Flags [.], seq 516841:518301, ack 1, win 65535, length 1460
3.578256 IP 192.168.1.10.80 > 203.82.48.2.49161: Flags [.], ack 518301, win 65535, length 0
3.578726 IP 203.82.48.2.49161 > 192.168.1.10.80: Flags [.], seq 518301:519761, ack 1, win 65535, length 1460
3.578726 IP 192.168.1.10.80 > 203.82.48.2.49161: Flags [.], ack 519761, win 65535, length 0
3.579056 IP 203.82.48.2.49161 > 192.168.1.10.80: Flags [.], seq 519761:521221, ack 1, win 65535, length 1460
3.579056 IP 192.168.1.10.80 > 203.82.48.2.49161: Flags [.], ack 521221, win 65535, length 0
3.579315 IP 203.82.48.2.49161 > 192.168.1.10.80: Flags [.], seq 521221:522681, ack 1, win 65535, length 1460
3.579315 IP 192.168.1.10.80 > 203.82.48.2.49161: Flags [.], ack 522681, win 65535, length 0
3.608689 IP 203.82.48.2.49161 > 192.168.1.10.80: Flags [.], seq 522681:524141, ack 1, win 65535, length 1460
3.608689 IP 192.168.1.10.80 > 203.82.48.2.49161: Flags [.], ack 524141, win 65535, length 0
3.609025 IP 203.82.48.2.49161 > 192.168.1.10.80: Flags [.], seq 524141:525601, ack 1, win 65535, length 1460
3.609025 IP 192.168.1.10.80 > 203.82.48.2.49161: Flags [.], ack 525601, win 65535, length 0
3.609576 IP 203.82.48.2.49161 > 192.168.1.10.80: Flags [.], seq 525601:527061, ack 1, win 65535, length 1460
3.609576 IP 192.168.1.10.80 > 203.82.48.2.49161: Flags [.], ack 527061, win 65535, length 0
3.610046 IP 203.82.48.2.49161 > 192.168.1.10.80: Flags [.], seq 527061:528521, ack 1, win 65535, length 1460
3.610046 IP 192.168.1.10.80 > 203.82.48.2.49161: Flags [.], ack 528521, win 65535, length 0
3.610565 IP 203.82.48.2.49161 > 192.168.1.10.80: Flags [.], seq 528521:529981, ack 1, win 65535, length 1460
3.610565 IP 192.168.1.10.80 > 203.82.48.2.49161: Flags [.], ack 529981, win 65535, length 0
3.648734 IP 203.82.48.2.49161 > 192.168.1.10.80: Flags [.], seq 529981:531441, ack 1, win 65535, length 1460
3.648734 IP 192.168.1.10.80 > 203.82.48.2.49161: Flags [.], ack 531441, win 65535, length 0
3.648980 IP 203.82.48.2.49161 > 192.168.1.10.80: Flags [.], seq 531441:532901, ack 1, win 65535, length 1460
3.648980 IP 192.168.1.10.80 > 203.82.48.2.49161: Flags [.], ack 532901, win 65535, length 0
3.649245 IP 203.82.48.2.49161 > 192.168.1.10.80: Flags [.], seq 532901:534361, ack 1, win 65535, length 1460
3.649245 IP 192.168.1.10.80 > 203.82.48.2.49161: Flags [.], ack 534361, win 65535, length 0
3.649559 IP 203.82.48.2.49161 > 192.168.1.10.80: Flags [.], seq 534361:535821, ack 1, win 65535, length 1460
3.649559 IP 192.168.1.10.80 > 203.82.48.2.49161: Flags [.], ack 535821, win 65535, length 0
3.650070 IP 203.82.48.2.49161 > 192.168.1.10.80: Flags [.], seq 535821:537281, ack 1, win 65535, length 1460
3.650070 IP 192.168.1.10.80 > 203.82.48.2.49161: Flags [.], ack 537281, win 65535, length 0
3.650562 IP 203.82.48.2.49161 > 192.168.1.10.80: Flags [.], seq 537281:538741, ack 1, win 65535, length 1460
3.650562 IP 192.168.1.10.80 > 203.82.48.2.49161: Flags [.], ack 538741, win 65535, length 0
3.689809 IP 203.82.48.2.49161 > 192.168.1.10.80: Flags [.], seq 538741:540201, ack 1, win 65535, length 1460
3.689809 IP 192.168.1.10.80 > 203.82.48.2.49161: Flags [.], ack 540201, win 65535, length 0
3.690060 IP 203.82.48.2.49161 > 192.168.1.10.80: Flags [.], seq 540201:541661, ack 1, win 65535, length 1460
3.690060 IP 192.168.1.10.80 > 203.82.48.2.49161: Flags [.], ack 541661, win 65535, length 0
3.690312 IP 203.82.48.2.49161 > 192.168.1.10.80: Flags [.], seq 541661:543121, ack 1, win 65535, length 1460
3.690312 IP 192.168.1.10.80 > 203.82.48.2.49161: Flags [.], ack 543121, win 65535, length 0
3.690606 IP 203.82.48.2.49161 > 192.168.1.10.80: Flags [.], seq 543121:544581, ack 1, win 65535, length 1460
3.690606 IP 192.168.1.10.80 > 203.82.48.2.49161: Flags [.], ack 544581, win 65535, length 0
3.690943 IP 203.82.48.2.49161 > 192.168.1.10.80: Flags [.], seq 544581:546041, ack 1, win 65535, length 1460
3.690943 IP 192.168.1.10.80 > 203.82.48.2.49161: Flags [.], ack 546041, win 65535, length 0
3.691591 IP 203.82.48.2.49161 > 192.168.1.10.80: Flags [.], seq 547501:548961, ack 1, win 65535, length 1460
3.691591 IP 192.168.1.10.80 > 203.82.48.2.49161: Flags [.], ack 546041, win 65535, length 0
3.720586 IP 203.82.48.2.49161 > 192.168.1.10.80: Flags [.], seq 548961:550421, ack 1, win 65535, length 1460
3.720586 IP 192.168.1.10.80 > 203.82.48.2.49161: Flags [.], ack 546041, win 65535, length 0
3.721051 IP 203.82.48.2.49161 > 192.168.1.10.80: Flags [.], seq 550421:551881, ack 1, win 65535, length 1460
3.721051 IP 192.168.1.10.80 > 203.82.48.2.49161: Flags [.], ack 546041, win 65535, length 0
3.721361 IP 203.82.48.2.49161 > 192.168.1.10.80: Flags [.], seq 551881:553341, ack 1, win 65535, length 1460
3.721361 IP 192.168.1.10.80 > 203.82.48.2.49161: Flags [.], ack 546041, win 65535, length 0
3.721611 IP 203.82.48.2.49161 > 192.168.1.10.80: Flags [.], seq 553341:554801, ack 1, win 65535, length 1460
3.721611 IP 192.168.1.10.80 > 203.82.48.2.49161: Flags [.], ack 546041, win 65535, length 0
3.721869 IP 203.82.48.2.49161 > 192.168.1.10.80: Flags [.], seq 554801:556261, ack 1, win 65535, length 1460
3.721869 IP 192.168.1.10.80 > 203.82.48.2.49161: Flags [.], ack 546041, win 65535, length 0
3.722253 IP 203.82.48.2.49161 > 192.168.1.10.80: Flags [.], seq 556261:557721, ack 1, win 65535, length 1460
3.722253 IP 192.168.1.10.80 > 203.82.48.2.49161: Flags [.], ack 546041, win 65535, length 0
3.763582 IP 203.82.48.2.49161 > 192.168.1.10.80: Flags [.], seq 546041:547501, ack 1, win 65535, length 1460
3.763582 IP 192.168.1.10.80 > 203.82.48.2.49161: Flags [.], ack 557721, win 65535, length 0
3.764365 IP 203.82.48.2.49161 > 192.168.1.10.80: Flags [.], seq 557721:559181, ack 1, win 65535, length 1460
3.764365 IP 192.168.1.10.80 > 203.82.48.2.49161: Flags [.], ack 559181, win 65535, length 0
3.764696 IP 203.82.48.2.49161 > 192.168.1.10.80: Flags [.], seq 559181:560641, ack 1, win 65535, length 1460
3.764696 IP 192.168.1.10.80 > 203.82.48.2.49161: Flags [.], ack 560641, win 65535, length 0
3.764943 IP 203.82.48.2.49161 > 192.168.1.10.80: Flags [.], seq 560641:562101, ack 1, win 65535, length 1460
3.764943 IP 192.168.1.10.80 > 203.82.48.2.49161: Flags [.], ack 562101, win 65535, length 0
3.803108 IP 203.82.48.2.49161 > 192.168.1.10.80: Flags [.], seq 562101:563561, ack 1, win 65535, length 1460
3.803108 IP 192.168.1.10.80 > 203.82.48.2.49161: Flags [.], ack 563561, win 65535, length 0
3.804012 IP 203.82.48.2.49161 > 192.168.1.10.80: Flags [.], seq 563561:565021, ack 1, win 65535, length 1460
3.804012 IP 192.168.1.10.80 > 203.82.48.2.49161: Flags [.], ack 565021, win 65535, length 0
3.804260 IP 203.82.48.2.49161 > 192.168.1.10.80: Flags [.], seq 565021:566481, ack 1, win 65535, length 1460
3.804260 IP 192.168.1.10.80 > 203.82.48.2.49161: Flags [.], ack 566481, win 65535, length 0
3.805503 IP 203.82.48.2.49161 > 192.168.1.10.80: Flags [.], seq 566481:567941, ack 1, win 65535, length 1460
3.805503 IP 192.168.1.10.80 > 203.82.48.2.49161: Flags [.], ack 567941, win 65535, length 0
3.837217 IP 203.82.48.2.49161 > 192.168.1.10.80: Flags [.], seq 567941:569401, ack 1, win 65535, length 1460
3.837217 IP 192.168.1.10.80 > 203.82.48.2.49161: Flags [.], ack 569401, win 65535, length 0
3.837630 IP 203.82.48.2.49161 > 192.168.1.10.80: Flags [.], seq 569401:570861, ack 1, win 65535, length 1460
3.837630 IP 192.168.1.10.80 > 203.82.48.2.49161: Flags [.], ack 570861, win 65535, length 0
3.837911 IP 203.82.48.2.49161 > 192.168.1.10.80: Flags [.], seq 570861:572321, ack 1, win 65535, length 1460
3.837911 IP 192.168.1.10.80 > 203.82.48.2.49161: Flags [.], ack 572321, win 65535, length 0
3.838178 IP 203.82.48.2.49161 > 192.168.1.10.80: Flags [.], seq 572321:573781, ack 1, win 65535, length 1460
3.838178 IP 192.168.1.10.80 > 203.82.48.2.49161: Flags [.], ack 573781, win 65535, length 0
3.838538 IP 203.82.48.2.49161 > 192.168.1.10.80: Flags [.], seq 573781:575241, ack 1, win 65535, length 1460
3.838538 IP 192.168.1.10.80 > 203.82.48.2.49161: Flags [.], ack 575241, win 65535, length 0
3.880867 IP 203.82.48.2.49161 > 192.168.1.10.80: Flags [.], seq 575241:576701, ack 1, win 65535, length 1460
3.880867 IP 192.168.1.10.80 > 203.82.48.2.49161: Flags [.], ack 576701, win 65535, length 0
3.881153 IP 203.82.48.2.49161 > 192.168.1.10.80: Flags [.], seq 576701:578161, ack 1, win 65535, length 1460
3.881153 IP 192.168.1.10.80 > 203.82.48.2.49161: Flags [.], ack 578161, win 65535, length 0
3.881570 IP 203.82.48.2.49161 > 192.168.1.10.80: Flags [.], seq 578161:579621, ack 1, win 65535, length 1460
3.881570 IP 192.168.1.10.80 > 203.82.48.2.49161: Flags [.], ack 579621, win 65535, length 0
3.881906 IP 203.82.48.2.49161 > 192.168.1.10.80: Flags [.], seq 579621:581081, ack 1, win 65535, length 1460
3.881906 IP 192.168.1.10.80 > 203.82.48.2.49161: Flags [.], ack 581081, win 65535, length 0
3.882173 IP 203.82.48.2.49161 > 192.168.1.10.80: Flags [.], seq 581081:582541, ack 1, win 65535, length 1460
3.882173 IP 192.168.1.10.80 > 203.82.48.2.49161: Flags [.], ack 582541, win 65535, length 0
3.882496 IP 203.82.48.2.49161 > 192.168.1.10.80: Flags [.], seq 582541:584001, ack 1, win 65535, length 1460
3.882496 IP 192.168.1.10.80 > 203.82.48.2.49161: Flags [.], ack 584001, win 65535, length 0
3.920207 IP 203.82.48.2.49161 > 192.168.1.10.80: Flags [.], seq 584001:585461, ack 1, win 65535, length 1460
3.920207 IP 192.168.1.10.80 > 203.82.48.2.49161: Flags [.], ack 585461, win 65535, length 0
3.920573 IP 203.82.48.2.49161 > 192.168.1.10.80: Flags [.], seq 585461:586921, ack 1, win 65535, length 1460
3.920573 IP 192.168.1.10.80 > 203.82.48.2.49161: Flags [.], ack 586921, win 65535, length 0
3.921024 IP 203.82.48.2.49161 > 192.168.1.10.80: Flags [.], seq 586921:588381, ack 1, win 65535, length 1460
3.921024 IP 192.168.1.10.80 > 203.82.48.2.49161: Flags [.], ack 588381, win 65535, length 0
3.921273 IP 203.82.48.2.49161 > 192.168.1.10.80: Flags [.], seq 588381:589841, ack 1, win 65535, length 1460
3.921273 IP 192.168.1.10.80 > 203.82.48.2.49161: Flags [.], ack 589841, win 65535, length 0
3.921522 IP 203.82.48.2.49161 > 192.168.1.10.80: Flags [.], seq 589841:591301, ack 1, win 65535, length 1460
3.921522 IP 192.168.1.10.80 > 203.82.48.2.49161: Flags [.], ack 591301, win 65535, length 0
3.921881 IP 203.82.48.2.49161 > 192.168.1.10.80: Flags [.], seq 591301:592761, ack 1, win 65535, length 1460
3.921881 IP 192.168.1.10.80 > 203.82.48.2.49161: Flags [.], ack 592761, win 65535, length 0
3.922231 IP 203.82.48.2.49161 > 192.168.1.10.80: Flags [.], seq 592761:594221, ack 1, win 65535, length 1460
3.922231 IP 192.168.1.10.80 > 203.82.48.2.49161: Flags [.], ack 594221, win 65535, length 0
3.958556 IP 203.82.48.2.49161 > 192.168.1.10.80: Flags [.], seq 594221:595681, ack 1, win 65535, length 1460
3.958556 IP 192.168.1.10.80 > 203.82.48.2.49161: Flags [.], ack 595681, win 65535, length 0
3.959021 IP 203.82.48.2.49161 > 192.168.1.10.80: Flags [.], seq 595681:597141, ack 1, win 65535, length 1460
3.959021 IP 192.168.1.10.80 > 203.82.48.2.49161: Flags [.], ack 597141, win 65535, length 0
3.959344 IP 203.82.48.2.49161 > 192.168.1.10.80: Flags [.], seq 597141:598601, ack 1, win 65535, length 1460
3.959344 IP 192.168.1.10.80 > 203.82.48.2.49161: Flags [.], ack 598601, win 65535, length 0
3.959740 IP 203.82.48.2.49161 > 192.168.1.10.80: Flags [.], seq 598601:600061, ack 1, win 65535, length 1460
3.959740 IP 192.168.1.10.80 > 203.82.48.2.49161: Flags [.], ack 600061, win 65535, length 0
3.960057 IP 203.82.48.2.49161 > 192.168.1.10.80: Flags [.], seq 600061:601521, ack 1, win 65535, length 1460
3.960057 IP 192.168.1.10.80 > 203.82.48.2.49161: Flags [.], ack 601521, win 65535, length 0
3.960322 IP 203.82.48.2.49161 > 192.168.1.10.80: Flags [.], seq 601521:602981, ack 1, win 65535, length 1460
3.960322 IP 192.168.1.10.80 > 203.82.48.2.49161: Flags [.], ack 602981, win 65535, length 0
3.960586 IP 203.82.48.2.49161 > 192.168.1.10.80: Flags [.], seq 602981:604441, ack 1, win 65535, length 1460
3.960586 IP 192.168.1.10.80 > 203.82.48.2.49161: Flags [.], ack 604441, win 65535, length 0
3.961046 IP 203.82.48.2.49161 > 192.168.1.10.80: Flags [.], seq 604441:605901, ack 1, win 65535, length 1460
3.961046 IP 192.168.1.10.80 > 203.82.48.2.49161: Flags [.], ack 605901, win 65535, length 0
4.009761 IP 203.82.48.2.49161 > 192.168.1.10.80: Flags [.], seq 605901:607361, ack 1, win 65535, length 1460
4.009761 IP 192.168.1.10.80 > 203.82.48.2.49161: Flags [.], ack 607361, win 65535, length 0
4.010082 IP 203.82.48.2.49161 > 192.168.1.10.80: Flags [.], seq 607361:608821, ack 1, win 65535, length 1460
4.010082 IP 192.168.1.10.80 > 203.82.48.2.49161: Flags [.], ack 608821, win 65535, length 0
4.010362 IP 203.82.48.2.49161 > 192.168.1.10.80: Flags [.], seq 608821:610281, ack 1, win 65535, length 1460
4.010362 IP 192.168.1.10.80 > 203.82.48.2.49161: Flags [.], ack 610281, win 65535, length 0
4.011012 IP 203.82.48.2.49161 > 192.168.1.10.80: Flags [.], seq 610281:611741, ack 1, win 65535, length 1460
4.011012 IP 192.168.1.10.80 > 203.82.48.2.49161: Flags [.], ack 611741, win 65535, length 0
4.011285 IP 203.82.48.2.49161 > 192.168.1.10.80: Flags [.], seq 611741:613201, ack 1, win 65535, length 1460
4.011285 IP 192.168.1.10.80 > 203.82.48.2.49161: Flags [.], ack 613201, win 65535, length 0
4.011615 IP 203.82.48.2.49161 > 192.168.1.10.80: Flags [.], seq 613201:614661, ack 1, win 65535, length 1460
4.011615 IP 192.168.1.10.80 > 203.82.48.2.49161: Flags [.], ack 614661, win 65535, length 0
4.011893 IP 203.82.48.2.49161 > 192.168.1.10.80: Flags [.], seq 614661:616121, ack 1, win 65535, length 1460
4.011893 IP 192.168.1.10.80 > 203.82.48.2.49161: Flags [.], ack 616121, win 65535, length 0
4.012163 IP 203.82.48.2.49161 > 192.168.1.10.80: Flags [.], seq 616121:617581, ack 1, win 65535, length 1460
4.012163 IP 192.168.1.10.80 > 203.82.48.2.49161: Flags [.], ack 617581, win 65535, length 0
4.012654 IP 203.82.48.2.49161 > 192.168.1.10.80: Flags [.], seq 617581:619041, ack 1, win 65535, length 1460
4.012654 IP 192.168.1.10.80 > 203.82.48.2.49161: Flags [.], ack 619041, win 65535, length 0
4.041415 IP 203.82.48.2.49161 > 192.168.1.10.80: Flags [.], seq 619041:620501, ack 1, win 65535, length 1460
4.041415 IP 192.168.1.10.80 > 203.82.48.2.49161: Flags [.], ack 620501, win 65535, length 0
4.041675 IP 203.82.48.2.49161 > 192.168.1.10.80: Flags [.], seq 620501:621961, ack 1, win 65535, length 1460
4.041675 IP 192.168.1.10.80 > 203.82.48.2.49161: Flags [.], ack 621961, win 65535, length 0
4.041964 IP 203.82.48.2.49161 > 192.168.1.10.80: Flags [.], seq 621961:623421, ack 1, win 65535, length 1460
4.041964 IP 192.168.1.10.80 > 203.82.48.2.49161: Flags [.], ack 623421, win 65535, length 0
4.042253 IP 203.82.48.2.49161 > 192.168.1.10.80: Flags [.], seq 623421:624881, ack 1, win 65535, length 1460
4.042253 IP 192.168.1.10.80 > 203.82.48.2.49161: Flags [.], ack 624881, win 65535, length 0
4.042536 IP 203.82.48.2.49161 > 192.168.1.10.80: Flags [.], seq 624881:626341, ack 1, win 65535, length 1460
4.042536 IP 192.168.1.10.80 > 203.82.48.2.49161: Flags [.], ack 626341, win 65535, length 0
4.042862 IP 203.82.48.2.49161 > 192.168.1.10.80: Flags [.], seq 626341:627801, ack 1, win 65535, length 1460
4.042862 IP 192.168.1.10.80 > 203.82.48.2.49161: Flags [.], ack 627801, win 65535, length 0
4.043268 IP 203.82.48.2.49161 > 192.168.1.10.80: Flags [.], seq 627801:629261, ack 1, win 65535, length 1460
4.043268 IP 192.168.1.10.80 > 203.82.48.2.49161: Flags [.], ack 629261, win 65535, length 0
4.043597 IP 203.82.48.2.49161 > 192.168.1.10.80: Flags [.], seq 629261:630721, ack 1, win 65535, length 1460
4.043597 IP 192.168.1.10.80 > 203.82.48.2.49161: Flags [.], ack 630721, win 65535, length 0
4.043889 IP 203.82.48.2.49161 > 192.168.1.10.80: Flags [.], seq 630721:632181, ack 1, win 65535, length 1460
4.043889 IP 192.168.1.10.80 > 203.82.48.2.49161: Flags [.], ack 632181, win 65535, length 0
4.044141 IP 203.82.48.2.49161 > 192.168.1.10.80: Flags [.], seq 632181:633641, ack 1, win 65535, length 1460
4.044141 IP 192.168.1.10.80 > 203.82.48.2.49161: Flags [.], ack 633641, win 65535, length 0
4.078569 IP 203.82.48.2.49161 > 192.168.1.10.80: Flags [.], seq 633641:635101, ack 1, win 65535, length 1460
4.078569 IP 192.168.1.10.80 > 203.82.48.2.49161: Flags [.], ack 635101, win 65535, length 0
4.081716 IP 203.82.48.2.49161 > 192.168.1.10.80: Flags [.], seq 635101:636561, ack 1, win 65535, length 1460
4.081716 IP 192.168.1.10.80 > 203.82.48.2.49161: Flags [.], ack 636561, win 65535, length 0
4.082956 IP 203.82.48.2.49161 > 192.168.1.10.80: Flags [.], seq 636561:638021, ack 1, win 65535, length 1460
4.082956 IP 192.168.1.10.80 > 203.82.48.2.49161: Flags [.], ack 638021, win 65535, length 0
4.083723 IP 203.82.48.2.49161 > 192.168.1.10.80: Flags [.], seq 638021:639481, ack 1, win 65535, length 1460
4.083723 IP 192.168.1.10.80 > 203.82.48.2.49161: Flags [.], ack 639481, win 65535, length 0
4.084075 IP 203.82.48.2.49161 > 192.168.1.10.80: Flags [.], seq 639481:640941, ack 1, win 65535, length 1460
4.084075 IP 192.168.1.10.80 > 203.82.48.2.49161: Flags [.], ack 640941, win 65535, length 0
4.084476 IP 203.82.48.2.49161 > 192.168.1.10.80: Flags [.], seq 640941:642401, ack 1, win 65535, length 1460
4.084476 IP 192.168.1.10.80 > 203.82.48.2.49161: Flags [.], ack 642401, win 65535, length 0
4.084765 IP 203.82.48.2.49161 > 192.168.1.10.80: Flags [.], seq 642401:643861, ack 1, win 65535, length 1460
4.084765 IP 192.168.1.10.80 > 203.82.48.2.49161: Flags [.], ack 643861, win 65535, length 0
4.085095 IP 203.82.48.2.49161 > 192.168.1.10.80: Flags [.], seq 643861:645321, ack 1, win 65535, length 1460
4.085095 IP 192.168.1.10.80 > 203.82.48.2.49161: Flags [.], ack 645321, win 65535, length 0
4.085685 IP 203.82.48.2.49161 > 192.168.1.10.80: Flags [.], seq 645321:646781, ack 1, win 65535, length 1460
4.085685 IP 192.168.1.10.80 > 203.82.48.2.49161: Flags [.], ack 646781, win 65535, length 0
4.087910 IP 203.82.48.2.49161 > 192.168.1.10.80: Flags [.], seq 646781:648241, ack 1, win 65535, length 1460
4.087910 IP 192.168.1.10.80 > 203.82.48.2.49161: Flags [.], ack 648241, win 65535, length 0
4.112465 IP 203.82.48.2.49161 > 192.168.1.10.80: Flags [.], seq 648241:649701, ack 1, win 65535, length 1460
4.112465 IP 192.168.1.10.80 > 203.82.48.2.49161: Flags [.], ack 649701, win 65535, length 0
4.112725 IP 203.82.48.2.49161 > 192.168.1.10.80: Flags [.], seq 649701:651161, ack 1, win 65535, length 1460
4.112725 IP 192.168.1.10.80 > 203.82.48.2.49161: Flags [.], ack 651161, win 65535, length 0
4.113084 IP 203.82.48.2.49161 > 192.168.1.10.80: Flags [.], seq 651161:652621, ack 1, win 65535, length 1460
4.113084 IP 192.168.1.10.80 > 203.82.48.2.49161: Flags [.], ack 652621, win 65535, length 0
4.113808 IP 203.82.48.2.49161 > 192.168.1.10.80: Flags [.], seq 652621:654081, ack 1, win 65535, length 1460
4.113808 IP 192.168.1.10.80 > 203.82.48.2.49161: Flags [.], ack 654081, win 65535, length 0
4.114367 IP 203.82.48.2.49161 > 192.168.1.10.80: Flags [F.], seq 654081:655351, ack 1, win 65535, length 1270
4.114367 IP 192.168.1.10.80 > 203.82.48.2.49161: Flags [.], ack 655352, win 65535, length 0
4.114373 IP 192.168.1.10.49153 > 192.168.1.1.9: UDP, length 5
4.114490 IP 192.168.1.10.80 > 203.82.48.2.49161: Flags [F.], seq 1, ack 655352, win 65535, length 0
4.151087 IP 203.82.48.2.49161 > 192.168.1.10.80: Flags [.], ack 2, win 65535, length 0
