7.200000 IP 203.82.48.2.49153 > 203.82.48.1.80: Flags [S], seq 0, win 65535, length 0
7.200003 IP 203.82.48.2.49154 > 203.82.48.1.80: Flags [S], seq 0, win 65535, length 0
7.200006 IP 203.82.48.2.49155 > 203.82.48.1.80: Flags [S], seq 0, win 65535, length 0
7.200010 IP 203.82.48.2.49156 > 203.82.48.1.80: Flags [S], seq 0, win 65535, length 0
7.204128 IP 203.82.48.1.80 > 203.82.48.2.49153: Flags [S.], seq 0, ack 1, win 65535, length 0
7.204128 IP 203.82.48.2.49153 > 203.82.48.1.80: Flags [.], ack 1, win 65535, length 0
7.204151 IP 203.82.48.1.80 > 203.82.48.2.49154: Flags [S.], seq 0, ack 1, win 65535, length 0
7.204151 IP 203.82.48.2.49154 > 203.82.48.1.80: Flags [.], ack 1, win 65535, length 0
7.204166 IP 203.82.48.1.80 > 203.82.48.2.49155: Flags [S.], seq 0, ack 1, win 65535, length 0
7.204166 IP 203.82.48.2.49155 > 203.82.48.1.80: Flags [.], ack 1, win 65535, length 0
7.208191 IP 203.82.48.2.49153 > 203.82.48.1.80: Flags [.], seq 1:513, ack 1, win 65535, length 512
7.208236 IP 203.82.48.2.49154 > 203.82.48.1.80: Flags [.], seq 1:513, ack 1, win 65535, length 512
7.208280 IP 203.82.48.2.49155 > 203.82.48.1.80: Flags [.], seq 1:513, ack 1, win 65535, length 512
7.212303 IP 203.82.48.1.80 > 203.82.48.2.49153: Flags [.], ack 513, win 65535, length 0
7.212368 IP 203.82.48.1.80 > 203.82.48.2.49154: Flags [.], ack 513, win 65535, length 0
7.212457 IP 203.82.48.1.80 > 203.82.48.2.49155: Flags [.], ack 513, win 65535, length 0
7.216383 IP 203.82.48.2.49153 > 203.82.48.1.80: Flags [.], seq 513:1025, ack 1, win 65535, length 512
7.216428 IP 203.82.48.2.49154 > 203.82.48.1.80: Flags [.], seq 513:1025, ack 1, win 65535, length 512
7.216472 IP 203.82.48.2.49155 > 203.82.48.1.80: Flags [.], seq 513:1025, ack 1, win 65535, length 512
7.224575 IP 203.82.48.2.49153 > 203.82.48.1.80: Flags [.], seq 1025:1537, ack 1, win 65535, length 512
7.224620 IP 203.82.48.2.49154 > 203.82.48.1.80: Flags [.], seq 1025:1537, ack 1, win 65535, length 512
7.224664 IP 203.82.48.2.49155 > 203.82.48.1.80: Flags [.], seq 1025:1537, ack 1, win 65535, length 512
7.228687 IP 203.82.48.1.80 > 203.82.48.2.49153: Flags [.], ack 1537, win 65535, length 0
7.228752 IP 203.82.48.1.80 > 203.82.48.2.49154: Flags [.], ack 1537, win 65535, length 0
7.228819 IP 203.82.48.1.80 > 203.82.48.2.49155: Flags [.], ack 1537, win 65535, length 0
7.232767 IP 203.82.48.2.49153 > 203.82.48.1.80: Flags [.], seq 1537:2049, ack 1, win 65535, length 512
7.232812 IP 203.82.48.2.49154 > 203.82.48.1.80: Flags [.], seq 1537:2049, ack 1, win 65535, length 512
7.232856 IP 203.82.48.2.49155 > 203.82.48.1.80: Flags [.], seq 1537:2049, ack 1, win 65535, length 512
7.240959 IP 203.82.48.2.49153 > 203.82.48.1.80: Flags [.], seq 2049:2561, ack 1, win 65535, length 512
7.241004 IP 203.82.48.2.49154 > 203.82.48.1.80: Flags [.], seq 2049:2561, ack 1, win 65535, length 512
7.241048 IP 203.82.48.2.49155 > 203.82.48.1.80: Flags [.], seq 2049:2561, ack 1, win 65535, length 512
7.245071 IP 203.82.48.1.80 > 203.82.48.2.49153: Flags [.], ack 2561, win 65535, length 0
7.245157 IP 203.82.48.1.80 > 203.82.48.2.49154: Flags [.], ack 2561, win 65535, length 0
7.245249 IP 203.82.48.1.80 > 203.82.48.2.49155: Flags [.], ack 2561, win 65535, length 0
7.249151 IP 203.82.48.2.49153 > 203.82.48.1.80: Flags [.], seq 2561:3073, ack 1, win 65535, length 512
7.249196 IP 203.82.48.2.49154 > 203.82.48.1.80: Flags [.], seq 2561:3073, ack 1, win 65535, length 512
7.249240 IP 203.82.48.2.49155 > 203.82.48.1.80: Flags [.], seq 2561:3073, ack 1, win 65535, length 512
7.257343 IP 203.82.48.2.49153 > 203.82.48.1.80: Flags [.], seq 3073:3585, ack 1, win 65535, length 512
7.257388 IP 203.82.48.2.49154 > 203.82.48.1.80: Flags [.], seq 3073:3585, ack 1, win 65535, length 512
7.257432 IP 203.82.48.2.49155 > 203.82.48.1.80: Flags [.], seq 3073:3585, ack 1, win 65535, length 512
7.261455 IP 203.82.48.1.80 > 203.82.48.2.49153: Flags [.], ack 3585, win 65535, length 0
7.261521 IP 203.82.48.1.80 > 203.82.48.2.49154: Flags [.], ack 3585, win 65535, length 0
7.261596 IP 203.82.48.1.80 > 203.82.48.2.49155: Flags [.], ack 3585, win 65535, length 0
7.265535 IP 203.82.48.2.49153 > 203.82.48.1.80: Flags [.], seq 3585:4097, ack 1, win 65535, length 512
7.265580 IP 203.82.48.2.49154 > 203.82.48.1.80: Flags [.], seq 3585:4097, ack 1, win 65535, length 512
7.265624 IP 203.82.48.2.49155 > 203.82.48.1.80: Flags [.], seq 3585:4097, ack 1, win 65535, length 512
7.273727 IP 203.82.48.2.49153 > 203.82.48.1.80: Flags [.], seq 4097:4609, ack 1, win 65535, length 512
7.273772 IP 203.82.48.2.49154 > 203.82.48.1.80: Flags [.], seq 4097:4609, ack 1, win 65535, length 512
7.273816 IP 203.82.48.2.49155 > 203.82.48.1.80: Flags [.], seq 4097:4609, ack 1, win 65535, length 512
7.277839 IP 203.82.48.1.80 > 203.82.48.2.49153: Flags [.], ack 4609, win 65535, length 0
7.277911 IP 203.82.48.1.80 > 203.82.48.2.49154: Flags [.], ack 4609, win 65535, length 0
7.277980 IP 203.82.48.1.80 > 203.82.48.2.49155: Flags [.], ack 4609, win 65535, length 0
7.281919 IP 203.82.48.2.49153 > 203.82.48.1.80: Flags [.], seq 4609:5121, ack 1, win 65535, length 512
7.281964 IP 203.82.48.2.49154 > 203.82.48.1.80: Flags [.], seq 4609:5121, ack 1, win 65535, length 512
7.282008 IP 203.82.48.2.49155 > 203.82.48.1.80: Flags [.], seq 4609:5121, ack 1, win 65535, length 512
7.290111 IP 203.82.48.2.49153 > 203.82.48.1.80: Flags [.], seq 5121:5633, ack 1, win 65535, length 512
7.290156 IP 203.82.48.2.49154 > 203.82.48.1.80: Flags [.], seq 5121:5633, ack 1, win 65535, length 512
7.290200 IP 203.82.48.2.49155 > 203.82.48.1.80: Flags [.], seq 5121:5633, ack 1, win 65535, length 512
7.294223 IP 203.82.48.1.80 > 203.82.48.2.49153: Flags [.], ack 5633, win 65535, length 0
7.294297 IP 203.82.48.1.80 > 203.82.48.2.49154: Flags [.], ack 5633, win 65535, length 0
7.294367 IP 203.82.48.1.80 > 203.82.48.2.49155: Flags [.], ack 5633, win 65535, length 0
7.298303 IP 203.82.48.2.49153 > 203.82.48.1.80: Flags [.], seq 5633:6145, ack 1, win 65535, length 512
7.298348 IP 203.82.48.2.49154 > 203.82.48.1.80: Flags [.], seq 5633:6145, ack 1, win 65535, length 512
7.298392 IP 203.82.48.2.49155 > 203.82.48.1.80: Flags [.], seq 5633:6145, ack 1, win 65535, length 512
7.306495 IP 203.82.48.2.49153 > 203.82.48.1.80: Flags [.], seq 6145:6657, ack 1, win 65535, length 512
7.306540 IP 203.82.48.2.49154 > 203.82.48.1.80: Flags [.], seq 6145:6657, ack 1, win 65535, length 512
7.306584 IP 203.82.48.2.49155 > 203.82.48.1.80: Flags [.], seq 6145:6657, ack 1, win 65535, length 512
7.310607 IP 203.82.48.1.80 > 203.82.48.2.49153: Flags [.], ack 6657, win 65535, length 0
7.310699 IP 203.82.48.1.80 > 203.82.48.2.49154: Flags [.], ack 6657, win 65535, length 0
7.310774 IP 203.82.48.1.80 > 203.82.48.2.49155: Flags [.], ack 6657, win 65535, length 0
7.314687 IP 203.82.48.2.49153 > 203.82.48.1.80: Flags [.], seq 6657:7169, ack 1, win 65535, length 512
7.314732 IP 203.82.48.2.49154 > 203.82.48.1.80: Flags [.], seq 6657:7169, ack 1, win 65535, length 512
7.314776 IP 203.82.48.2.49155 > 203.82.48.1.80: Flags [.], seq 6657:7169, ack 1, win 65535, length 512
7.322879 IP 203.82.48.2.49153 > 203.82.48.1.80: Flags [.], seq 7169:7681, ack 1, win 65535, length 512
7.322924 IP 203.82.48.2.49154 > 203.82.48.1.80: Flags [.], seq 7169:7681, ack 1, win 65535, length 512
7.322968 IP 203.82.48.2.49155 > 203.82.48.1.80: Flags [.], seq 7169:7681, ack 1, win 65535, length 512
7.326991 IP 203.82.48.1.80 > 203.82.48.2.49153: Flags [.], ack 7681, win 65535, length 0
7.327077 IP 203.82.48.1.80 > 203.82.48.2.49154: Flags [.], ack 7681, win 65535, length 0
7.327151 IP 203.82.48.1.80 > 203.82.48.2.49155: Flags [.], ack 7681, win 65535, length 0
7.331071 IP 203.82.48.2.49153 > 203.82.48.1.80: Flags [.], seq 7681:8193, ack 1, win 65535, length 512
7.331116 IP 203.82.48.2.49154 > 203.82.48.1.80: Flags [.], seq 7681:8193, ack 1, win 65535, length 512
7.331160 IP 203.82.48.2.49155 > 203.82.48.1.80: Flags [.], seq 7681:8193, ack 1, win 65535, length 512
7.339263 IP 203.82.48.2.49153 > 203.82.48.1.80: Flags [.], seq 8193:8705, ack 1, win 65535, length 512
7.339308 IP 203.82.48.2.49154 > 203.82.48.1.80: Flags [.], seq 8193:8705, ack 1, win 65535, length 512
7.339352 IP 203.82.48.2.49155 > 203.82.48.1.80: Flags [.], seq 8193:8705, ack 1, win 65535, length 512
7.343375 IP 203.82.48.1.80 > 203.82.48.2.49153: Flags [.], ack 8705, win 65535, length 0
7.343452 IP 203.82.48.1.80 > 203.82.48.2.49154: Flags [.], ack 8705, win 65535, length 0
7.343534 IP 203.82.48.1.80 > 203.82.48.2.49155: Flags [.], ack 8705, win 65535, length 0
7.347455 IP 203.82.48.2.49153 > 203.82.48.1.80: Flags [.], seq 8705:9217, ack 1, win 65535, length 512
7.347500 IP 203.82.48.2.49154 > 203.82.48.1.80: Flags [.], seq 8705:9217, ack 1, win 65535, length 512
7.347544 IP 203.82.48.2.49155 > 203.82.48.1.80: Flags [.], seq 8705:9217, ack 1, win 65535, length 512
7.355647 IP 203.82.48.2.49153 > 203.82.48.1.80: Flags [.], seq 9217:9729, ack 1, win 65535, length 512
7.355692 IP 203.82.48.2.49154 > 203.82.48.1.80: Flags [.], seq 9217:9729, ack 1, win 65535, length 512
7.355736 IP 203.82.48.2.49155 > 203.82.48.1.80: Flags [.], seq 9217:9729, ack 1, win 65535, length 512
7.359759 IP 203.82.48.1.80 > 203.82.48.2.49153: Flags [.], ack 9729, win 65535, length 0
7.359824 IP 203.82.48.1.80 > 203.82.48.2.49154: Flags [.], ack 9729, win 65535, length 0
7.359888 IP 203.82.48.1.80 > 203.82.48.2.49155: Flags [.], ack 9729, win 65535, length 0
7.363839 IP 203.82.48.2.49153 > 203.82.48.1.80: Flags [.], seq 9729:10241, ack 1, win 65535, length 512
7.363884 IP 203.82.48.2.49154 > 203.82.48.1.80: Flags [.], seq 9729:10241, ack 1, win 65535, length 512
7.363928 IP 203.82.48.2.49155 > 203.82.48.1.80: Flags [.], seq 9729:10241, ack 1, win 65535, length 512
7.372031 IP 203.82.48.2.49153 > 203.82.48.1.80: Flags [.], seq 10241:10753, ack 1, win 65535, length 512
7.372076 IP 203.82.48.2.49154 > 203.82.48.1.80: Flags [.], seq 10241:10753, ack 1, win 65535, length 512
7.372120 IP 203.82.48.2.49155 > 203.82.48.1.80: Flags [.], seq 10241:10753, ack 1, win 65535, length 512
7.376143 IP 203.82.48.1.80 > 203.82.48.2.49153: Flags [.], ack 10753, win 65535, length 0
7.376222 IP 203.82.48.1.80 > 203.82.48.2.49154: Flags [.], ack 10753, win 65535, length 0
7.376314 IP 203.82.48.1.80 > 203.82.48.2.49155: Flags [.], ack 10753, win 65535, length 0
7.380223 IP 203.82.48.2.49153 > 203.82.48.1.80: Flags [.], seq 10753:11265, ack 1, win 65535, length 512
7.380268 IP 203.82.48.2.49154 > 203.82.48.1.80: Flags [.], seq 10753:11265, ack 1, win 65535, length 512
7.380312 IP 203.82.48.2.49155 > 203.82.48.1.80: Flags [.], seq 10753:11265, ack 1, win 65535, length 512
7.388415 IP 203.82.48.2.49153 > 203.82.48.1.80: Flags [.], seq 11265:11777, ack 1, win 65535, length 512
7.388460 IP 203.82.48.2.49154 > 203.82.48.1.80: Flags [.], seq 11265:11777, ack 1, win 65535, length 512
7.388504 IP 203.82.48.2.49155 > 203.82.48.1.80: Flags [.], seq 11265:11777, ack 1, win 65535, length 512
7.392527 IP 203.82.48.1.80 > 203.82.48.2.49153: Flags [.], ack 11777, win 65535, length 0
7.392604 IP 203.82.48.1.80 > 203.82.48.2.49154: Flags [.], ack 11777, win 65535, length 0
7.392674 IP 203.82.48.1.80 > 203.82.48.2.49155: Flags [.], ack 11777, win 65535, length 0
7.396607 IP 203.82.48.2.49153 > 203.82.48.1.80: Flags [.], seq 11777:12289, ack 1, win 65535, length 512
7.396652 IP 203.82.48.2.49154 > 203.82.48.1.80: Flags [.], seq 11777:12289, ack 1, win 65535, length 512
7.396696 IP 203.82.48.2.49155 > 203.82.48.1.80: Flags [.], seq 11777:12289, ack 1, win 65535, length 512
7.404799 IP 203.82.48.2.49153 > 203.82.48.1.80: Flags [.], seq 12289:12801, ack 1, win 65535, length 512
7.404844 IP 203.82.48.2.49154 > 203.82.48.1.80: Flags [.], seq 12289:12801, ack 1, win 65535, length 512
7.404888 IP 203.82.48.2.49155 > 203.82.48.1.80: Flags [.], seq 12289:12801, ack 1, win 65535, length 512
7.408911 IP 203.82.48.1.80 > 203.82.48.2.49153: Flags [.], ack 12801, win 65535, length 0
7.408979 IP 203.82.48.1.80 > 203.82.48.2.49154: Flags [.], ack 12801, win 65535, length 0
7.409043 IP 203.82.48.1.80 > 203.82.48.2.49155: Flags [.], ack 12801, win 65535, length 0
7.412991 IP 203.82.48.2.49153 > 203.82.48.1.80: Flags [.], seq 12801:13313, ack 1, win 65535, length 512
7.413036 IP 203.82.48.2.49154 > 203.82.48.1.80: Flags [.], seq 12801:13313, ack 1, win 65535, length 512
7.413080 IP 203.82.48.2.49155 > 203.82.48.1.80: Flags [.], seq 12801:13313, ack 1, win 65535, length 512
7.421183 IP 203.82.48.2.49153 > 203.82.48.1.80: Flags [.], seq 13313:13825, ack 1, win 65535, length 512
7.421228 IP 203.82.48.2.49154 > 203.82.48.1.80: Flags [.], seq 13313:13825, ack 1, win 65535, length 512
7.421272 IP 203.82.48.2.49155 > 203.82.48.1.80: Flags [.], seq 13313:13825, ack 1, win 65535, length 512
7.425295 IP 203.82.48.1.80 > 203.82.48.2.49153: Flags [.], ack 13825, win 65535, length 0
7.425363 IP 203.82.48.1.80 > 203.82.48.2.49154: Flags [.], ack 13825, win 65535, length 0
7.425430 IP 203.82.48.1.80 > 203.82.48.2.49155: Flags [.], ack 13825, win 65535, length 0
7.429375 IP 203.82.48.2.49153 > 203.82.48.1.80: Flags [.], seq 13825:14337, ack 1, win 65535, length 512
7.429420 IP 203.82.48.2.49154 > 203.82.48.1.80: Flags [.], seq 13825:14337, ack 1, win 65535, length 512
7.429464 IP 203.82.48.2.49155 > 203.82.48.1.80: Flags [.], seq 13825:14337, ack 1, win 65535, length 512
7.437567 IP 203.82.48.2.49153 > 203.82.48.1.80: Flags [.], seq 14337:14849, ack 1, win 65535, length 512
7.437612 IP 203.82.48.2.49154 > 203.82.48.1.80: Flags [.], seq 14337:14849, ack 1, win 65535, length 512
7.437656 IP 203.82.48.2.49155 > 203.82.48.1.80: Flags [.], seq 14337:14849, ack 1, win 65535, length 512
7.441679 IP 203.82.48.1.80 > 203.82.48.2.49153: Flags [.], ack 14849, win 65535, length 0
7.441747 IP 203.82.48.1.80 > 203.82.48.2.49154: Flags [.], ack 14849, win 65535, length 0
7.441821 IP 203.82.48.1.80 > 203.82.48.2.49155: Flags [.], ack 14849, win 65535, length 0
7.445759 IP 203.82.48.2.49153 > 203.82.48.1.80: Flags [.], seq 14849:15361, ack 1, win 65535, length 512
7.445804 IP 203.82.48.2.49154 > 203.82.48.1.80: Flags [.], seq 14849:15361, ack 1, win 65535, length 512
7.445848 IP 203.82.48.2.49155 > 203.82.48.1.80: Flags [.], seq 14849:15361, ack 1, win 65535, length 512
7.453951 IP 203.82.48.2.49153 > 203.82.48.1.80: Flags [.], seq 15361:15873, ack 1, win 65535, length 512
7.453996 IP 203.82.48.2.49154 > 203.82.48.1.80: Flags [.], seq 15361:15873, ack 1, win 65535, length 512
7.454040 IP 203.82.48.2.49155 > 203.82.48.1.80: Flags [.], seq 15361:15873, ack 1, win 65535, length 512
7.458063 IP 203.82.48.1.80 > 203.82.48.2.49153: Flags [.], ack 15873, win 65535, length 0
7.458140 IP 203.82.48.1.80 > 203.82.48.2.49154: Flags [.], ack 15873, win 65535, length 0
7.458228 IP 203.82.48.1.80 > 203.82.48.2.49155: Flags [.], ack 15873, win 65535, length 0
7.462143 IP 203.82.48.2.49153 > 203.82.48.1.80: Flags [.], seq 15873:16385, ack 1, win 65535, length 512
7.462188 IP 203.82.48.2.49154 > 203.82.48.1.80: Flags [.], seq 15873:16385, ack 1, win 65535, length 512
7.462232 IP 203.82.48.2.49155 > 203.82.48.1.80: Flags [.], seq 15873:16385, ack 1, win 65535, length 512
7.470335 IP 203.82.48.2.49153 > 203.82.48.1.80: Flags [.], seq 16385:16897, ack 1, win 65535, length 512
7.470380 IP 203.82.48.2.49154 > 203.82.48.1.80: Flags [.], seq 16385:16897, ack 1, win 65535, length 512
7.470424 IP 203.82.48.2.49155 > 203.82.48.1.80: Flags [.], seq 16385:16897, ack 1, win 65535, length 512
7.474447 IP 203.82.48.1.80 > 203.82.48.2.49153: Flags [.], ack 16897, win 65535, length 0
7.474534 IP 203.82.48.1.80 > 203.82.48.2.49154: Flags [.], ack 16897, win 65535, length 0
7.474614 IP 203.82.48.1.80 > 203.82.48.2.49155: Flags [.], ack 16897, win 65535, length 0
7.478527 IP 203.82.48.2.49153 > 203.82.48.1.80: Flags [.], seq 16897:17409, ack 1, win 65535, length 512
7.478572 IP 203.82.48.2.49154 > 203.82.48.1.80: Flags [.], seq 16897:17409, ack 1, win 65535, length 512
7.478616 IP 203.82.48.2.49155 > 203.82.48.1.80: Flags [.], seq 16897:17409, ack 1, win 65535, length 512
7.486719 IP 203.82.48.2.49153 > 203.82.48.1.80: Flags [.], seq 17409:17921, ack 1, win 65535, length 512
7.486764 IP 203.82.48.2.49154 > 203.82.48.1.80: Flags [.], seq 17409:17921, ack 1, win 65535, length 512
7.486808 IP 203.82.48.2.49155 > 203.82.48.1.80: Flags [.], seq 17409:17921, ack 1, win 65535, length 512
7.490831 IP 203.82.48.1.80 > 203.82.48.2.49153: Flags [.], ack 17921, win 65535, length 0
7.490905 IP 203.82.48.1.80 > 203.82.48.2.49154: Flags [.], ack 17921, win 65535, length 0
7.490976 IP 203.82.48.1.80 > 203.82.48.2.49155: Flags [.], ack 17921, win 65535, length 0
7.494911 IP 203.82.48.2.49153 > 203.82.48.1.80: Flags [.], seq 17921:18433, ack 1, win 65535, length 512
7.494956 IP 203.82.48.2.49154 > 203.82.48.1.80: Flags [.], seq 17921:18433, ack 1, win 65535, length 512
7.495000 IP 203.82.48.2.49155 > 203.82.48.1.80: Flags [.], seq 17921:18433, ack 1, win 65535, length 512
7.503103 IP 203.82.48.2.49153 > 203.82.48.1.80: Flags [.], seq 18433:18945, ack 1, win 65535, length 512
7.503148 IP 203.82.48.2.49154 > 203.82.48.1.80: Flags [.], seq 18433:18945, ack 1, win 65535, length 512
7.503192 IP 203.82.48.2.49155 > 203.82.48.1.80: Flags [.], seq 18433:18945, ack 1, win 65535, length 512
7.507215 IP 203.82.48.1.80 > 203.82.48.2.49153: Flags [.], ack 18945, win 65535, length 0
7.507292 IP 203.82.48.1.80 > 203.82.48.2.49154: Flags [.], ack 18945, win 65535, length 0
7.507373 IP 203.82.48.1.80 > 203.82.48.2.49155: Flags [.], ack 18945, win 65535, length 0
7.511295 IP 203.82.48.2.49153 > 203.82.48.1.80: Flags [.], seq 18945:19457, ack 1, win 65535, length 512
7.511340 IP 203.82.48.2.49154 > 203.82.48.1.80: Flags [.], seq 18945:19457, ack 1, win 65535, length 512
7.511384 IP 203.82.48.2.49155 > 203.82.48.1.80: Flags [.], seq 18945:19457, ack 1, win 65535, length 512
7.519487 IP 203.82.48.2.49153 > 203.82.48.1.80: Flags [.], seq 19457:19969, ack 1, win 65535, length 512
7.519532 IP 203.82.48.2.49154 > 203.82.48.1.80: Flags [.], seq 19457:19969, ack 1, win 65535, length 512
7.519576 IP 203.82.48.2.49155 > 203.82.48.1.80: Flags [.], seq 19457:19969, ack 1, win 65535, length 512
7.523599 IP 203.82.48.1.80 > 203.82.48.2.49153: Flags [.], ack 19969, win 65535, length 0
7.523685 IP 203.82.48.1.80 > 203.82.48.2.49154: Flags [.], ack 19969, win 65535, length 0
7.523770 IP 203.82.48.1.80 > 203.82.48.2.49155: Flags [.], ack 19969, win 65535, length 0
7.527679 IP 203.82.48.2.49153 > 203.82.48.1.80: Flags [.], seq 19969:20481, ack 1, win 65535, length 512
7.527724 IP 203.82.48.2.49154 > 203.82.48.1.80: Flags [.], seq 19969:20481, ack 1, win 65535, length 512
7.527768 IP 203.82.48.2.49155 > 203.82.48.1.80: Flags [.], seq 19969:20481, ack 1, win 65535, length 512
7.535871 IP 203.82.48.2.49153 > 203.82.48.1.80: Flags [.], seq 20481:20993, ack 1, win 65535, length 512
7.535916 IP 203.82.48.2.49154 > 203.82.48.1.80: Flags [.], seq 20481:20993, ack 1, win 65535, length 512
7.535960 IP 203.82.48.2.49155 > 203.82.48.1.80: Flags [.], seq 20481:20993, ack 1, win 65535, length 512
7.539983 IP 203.82.48.1.80 > 203.82.48.2.49153: Flags [.], ack 20993, win 65535, length 0
7.540051 IP 203.82.48.1.80 > 203.82.48.2.49154: Flags [.], ack 20993, win 65535, length 0
7.540132 IP 203.82.48.1.80 > 203.82.48.2.49155: Flags [.], ack 20993, win 65535, length 0
7.544063 IP 203.82.48.2.49153 > 203.82.48.1.80: Flags [.], seq 20993:21505, ack 1, win 65535, length 512
7.544108 IP 203.82.48.2.49154 > 203.82.48.1.80: Flags [.], seq 20993:21505, ack 1, win 65535, length 512
7.544152 IP 203.82.48.2.49155 > 203.82.48.1.80: Flags [.], seq 20993:21505, ack 1, win 65535, length 512
7.552255 IP 203.82.48.2.49153 > 203.82.48.1.80: Flags [.], seq 21505:22017, ack 1, win 65535, length 512
7.552300 IP 203.82.48.2.49154 > 203.82.48.1.80: Flags [.], seq 21505:22017, ack 1, win 65535, length 512
7.552344 IP 203.82.48.2.49155 > 203.82.48.1.80: Flags [.], seq 21505:22017, ack 1, win 65535, length 512
7.556367 IP 203.82.48.1.80 > 203.82.48.2.49153: Flags [.], ack 22017, win 65535, length 0
7.556444 IP 203.82.48.1.80 > 203.82.48.2.49154: Flags [.], ack 22017, win 65535, length 0
7.556524 IP 203.82.48.1.80 > 203.82.48.2.49155: Flags [.], ack 22017, win 65535, length 0
7.560447 IP 203.82.48.2.49153 > 203.82.48.1.80: Flags [.], seq 22017:22529, ack 1, win 65535, length 512
7.560492 IP 203.82.48.2.49154 > 203.82.48.1.80: Flags [.], seq 22017:22529, ack 1, win 65535, length 512
7.560536 IP 203.82.48.2.49155 > 203.82.48.1.80: Flags [.], seq 22017:22529, ack 1, win 65535, length 512
7.568639 IP 203.82.48.2.49153 > 203.82.48.1.80: Flags [.], seq 22529:23041, ack 1, win 65535, length 512
7.568684 IP 203.82.48.2.49154 > 203.82.48.1.80: Flags [.], seq 22529:23041, ack 1, win 65535, length 512
7.568728 IP 203.82.48.2.49155 > 203.82.48.1.80: Flags [.], seq 22529:23041, ack 1, win 65535, length 512
7.572751 IP 203.82.48.1.80 > 203.82.48.2.49153: Flags [.], ack 23041, win 65535, length 0
7.572835 IP 203.82.48.1.80 > 203.82.48.2.49154: Flags [.], ack 23041, win 65535, length 0
7.572916 IP 203.82.48.1.80 > 203.82.48.2.49155: Flags [.], ack 23041, win 65535, length 0
7.576831 IP 203.82.48.2.49153 > 203.82.48.1.80: Flags [.], seq 23041:23553, ack 1, win 65535, length 512
7.576876 IP 203.82.48.2.49154 > 203.82.48.1.80: Flags [.], seq 23041:23553, ack 1, win 65535, length 512
7.576920 IP 203.82.48.2.49155 > 203.82.48.1.80: Flags [.], seq 23041:23553, ack 1, win 65535, length 512
7.585023 IP 203.82.48.2.49153 > 203.82.48.1.80: Flags [.], seq 23553:24065, ack 1, win 65535, length 512
7.585068 IP 203.82.48.2.49154 > 203.82.48.1.80: Flags [.], seq 23553:24065, ack 1, win 65535, length 512
7.585112 IP 203.82.48.2.49155 > 203.82.48.1.80: Flags [.], seq 23553:24065, ack 1, win 65535, length 512
7.589135 IP 203.82.48.1.80 > 203.82.48.2.49153: Flags [.], ack 24065, win 65535, length 0
7.589201 IP 203.82.48.1.80 > 203.82.48.2.49154: Flags [.], ack 24065, win 65535, length 0
7.589276 IP 203.82.48.1.80 > 203.82.48.2.49155: Flags [.], ack 24065, win 65535, length 0
7.593215 IP 203.82.48.2.49153 > 203.82.48.1.80: Flags [.], seq 24065:24577, ack 1, win 65535, length 512
7.593260 IP 203.82.48.2.49154 > 203.82.48.1.80: Flags [.], seq 24065:24577, ack 1, win 65535, length 512
7.593304 IP 203.82.48.2.49155 > 203.82.48.1.80: Flags [.], seq 24065:24577, ack 1, win 65535, length 512
7.601407 IP 203.82.48.2.49153 > 203.82.48.1.80: Flags [.], seq 24577:25089, ack 1, win 65535, length 512
7.601452 IP 203.82.48.2.49154 > 203.82.48.1.80: Flags [.], seq 24577:25089, ack 1, win 65535, length 512
7.601496 IP 203.82.48.2.49155 > 203.82.48.1.80: Flags [.], seq 24577:25089, ack 1, win 65535, length 512
7.605519 IP 203.82.48.1.80 > 203.82.48.2.49153: Flags [.], ack 25089, win 65535, length 0
7.605639 IP 203.82.48.1.80 > 203.82.48.2.49154: Flags [.], ack 25089, win 65535, length 0
7.605713 IP 203.82.48.1.80 > 203.82.48.2.49155: Flags [.], ack 25089, win 65535, length 0
7.609599 IP 203.82.48.2.49153 > 203.82.48.1.80: Flags [.], seq 25089:25601, ack 1, win 65535, length 512
7.609644 IP 203.82.48.2.49154 > 203.82.48.1.80: Flags [.], seq 25089:25601, ack 1, win 65535, length 512
7.609688 IP 203.82.48.2.49155 > 203.82.48.1.80: Flags [.], seq 25089:25601, ack 1, win 65535, length 512
7.617791 IP 203.82.48.2.49153 > 203.82.48.1.80: Flags [.], seq 25601:26113, ack 1, win 65535, length 512
7.617836 IP 203.82.48.2.49154 > 203.82.48.1.80: Flags [.], seq 25601:26113, ack 1, win 65535, length 512
7.617880 IP 203.82.48.2.49155 > 203.82.48.1.80: Flags [.], seq 25601:26113, ack 1, win 65535, length 512
7.621903 IP 203.82.48.1.80 > 203.82.48.2.49153: Flags [.], ack 26113, win 65535, length 0
7.621975 IP 203.82.48.1.80 > 203.82.48.2.49154: Flags [.], ack 26113, win 65535, length 0
7.622039 IP 203.82.48.1.80 > 203.82.48.2.49155: Flags [.], ack 26113, win 65535, length 0
7.625983 IP 203.82.48.2.49153 > 203.82.48.1.80: Flags [.], seq 26113:26625, ack 1, win 65535, length 512
7.626028 IP 203.82.48.2.49154 > 203.82.48.1.80: Flags [.], seq 26113:26625, ack 1, win 65535, length 512
7.626072 IP 203.82.48.2.49155 > 203.82.48.1.80: Flags [.], seq 26113:26625, ack 1, win 65535, length 512
7.634175 IP 203.82.48.2.49153 > 203.82.48.1.80: Flags [.], seq 26625:27137, ack 1, win 65535, length 512
7.634220 IP 203.82.48.2.49154 > 203.82.48.1.80: Flags [.], seq 26625:27137, ack 1, win 65535, length 512
7.634264 IP 203.82.48.2.49155 > 203.82.48.1.80: Flags [.], seq 26625:27137, ack 1, win 65535, length 512
7.638287 IP 203.82.48.1.80 > 203.82.48.2.49153: Flags [.], ack 27137, win 65535, length 0
7.638357 IP 203.82.48.1.80 > 203.82.48.2.49154: Flags [.], ack 27137, win 65535, length 0
7.638432 IP 203.82.48.1.80 > 203.82.48.2.49155: Flags [.], ack 27137, win 65535, length 0
7.642367 IP 203.82.48.2.49153 > 203.82.48.1.80: Flags [.], seq 27137:27649, ack 1, win 65535, length 512
7.642412 IP 203.82.48.2.49154 > 203.82.48.1.80: Flags [.], seq 27137:27649, ack 1, win 65535, length 512
7.642456 IP 203.82.48.2.49155 > 203.82.48.1.80: Flags [.], seq 27137:27649, ack 1, win 65535, length 512
7.650559 IP 203.82.48.2.49153 > 203.82.48.1.80: Flags [.], seq 27649:28161, ack 1, win 65535, length 512
7.650604 IP 203.82.48.2.49154 > 203.82.48.1.80: Flags [.], seq 27649:28161, ack 1, win 65535, length 512
7.650648 IP 203.82.48.2.49155 > 203.82.48.1.80: Flags [.], seq 27649:28161, ack 1, win 65535, length 512
7.654671 IP 203.82.48.1.80 > 203.82.48.2.49153: Flags [.], ack 28161, win 65535, length 0
7.654787 IP 203.82.48.1.80 > 203.82.48.2.49154: Flags [.], ack 28161, win 65535, length 0
7.654960 IP 203.82.48.1.80 > 203.82.48.2.49155: Flags [.], ack 28161, win 65535, length 0
7.658751 IP 203.82.48.2.49153 > 203.82.48.1.80: Flags [.], seq 28161:28673, ack 1, win 65535, length 512
7.658796 IP 203.82.48.2.49154 > 203.82.48.1.80: Flags [.], seq 28161:28673, ack 1, win 65535, length 512
7.658840 IP 203.82.48.2.49155 > 203.82.48.1.80: Flags [.], seq 28161:28673, ack 1, win 65535, length 512
7.666943 IP 203.82.48.2.49153 > 203.82.48.1.80: Flags [.], seq 28673:29185, ack 1, win 65535, length 512
7.666988 IP 203.82.48.2.49154 > 203.82.48.1.80: Flags [.], seq 28673:29185, ack 1, win 65535, length 512
7.667032 IP 203.82.48.2.49155 > 203.82.48.1.80: Flags [.], seq 28673:29185, ack 1, win 65535, length 512
7.671055 IP 203.82.48.1.80 > 203.82.48.2.49153: Flags [.], ack 29185, win 65535, length 0
7.671164 IP 203.82.48.1.80 > 203.82.48.2.49154: Flags [.], ack 29185, win 65535, length 0
7.671253 IP 203.82.48.1.80 > 203.82.48.2.49155: Flags [.], ack 29185, win 65535, length 0
7.675135 IP 203.82.48.2.49153 > 203.82.48.1.80: Flags [.], seq 29185:29697, ack 1, win 65535, length 512
7.675180 IP 203.82.48.2.49154 > 203.82.48.1.80: Flags [.], seq 29185:29697, ack 1, win 65535, length 512
7.675224 IP 203.82.48.2.49155 > 203.82.48.1.80: Flags [.], seq 29185:29697, ack 1, win 65535, length 512
7.683327 IP 203.82.48.2.49153 > 203.82.48.1.80: Flags [.], seq 29697:30209, ack 1, win 65535, length 512
7.683372 IP 203.82.48.2.49154 > 203.82.48.1.80: Flags [.], seq 29697:30209, ack 1, win 65535, length 512
7.683416 IP 203.82.48.2.49155 > 203.82.48.1.80: Flags [.], seq 29697:30209, ack 1, win 65535, length 512
7.687439 IP 203.82.48.1.80 > 203.82.48.2.49153: Flags [.], ack 30209, win 65535, length 0
7.687539 IP 203.82.48.1.80 > 203.82.48.2.49154: Flags [.], ack 30209, win 65535, length 0
7.687609 IP 203.82.48.1.80 > 203.82.48.2.49155: Flags [.], ack 30209, win 65535, length 0
7.691519 IP 203.82.48.2.49153 > 203.82.48.1.80: Flags [.], seq 30209:30721, ack 1, win 65535, length 512
7.691564 IP 203.82.48.2.49154 > 203.82.48.1.80: Flags [.], seq 30209:30721, ack 1, win 65535, length 512
7.691608 IP 203.82.48.2.49155 > 203.82.48.1.80: Flags [.], seq 30209:30721, ack 1, win 65535, length 512
7.699711 IP 203.82.48.2.49153 > 203.82.48.1.80: Flags [.], seq 30721:31233, ack 1, win 65535, length 512
7.699756 IP 203.82.48.2.49154 > 203.82.48.1.80: Flags [.], seq 30721:31233, ack 1, win 65535, length 512
7.699800 IP 203.82.48.2.49155 > 203.82.48.1.80: Flags [.], seq 30721:31233, ack 1, win 65535, length 512
7.703823 IP 203.82.48.1.80 > 203.82.48.2.49153: Flags [.], ack 31233, win 65535, length 0
7.703909 IP 203.82.48.1.80 > 203.82.48.2.49154: Flags [.], ack 31233, win 65535, length 0
7.703974 IP 203.82.48.1.80 > 203.82.48.2.49155: Flags [.], ack 31233, win 65535, length 0
7.707903 IP 203.82.48.2.49153 > 203.82.48.1.80: Flags [.], seq 31233:31745, ack 1, win 65535, length 512
7.707948 IP 203.82.48.2.49154 > 203.82.48.1.80: Flags [.], seq 31233:31745, ack 1, win 65535, length 512
7.707992 IP 203.82.48.2.49155 > 203.82.48.1.80: Flags [.], seq 31233:31745, ack 1, win 65535, length 512
7.716095 IP 203.82.48.2.49153 > 203.82.48.1.80: Flags [.], seq 31745:32257, ack 1, win 65535, length 512
7.716140 IP 203.82.48.2.49154 > 203.82.48.1.80: Flags [.], seq 31745:32257, ack 1, win 65535, length 512
7.716184 IP 203.82.48.2.49155 > 203.82.48.1.80: Flags [.], seq 31745:32257, ack 1, win 65535, length 512
7.720207 IP 203.82.48.1.80 > 203.82.48.2.49153: Flags [.], ack 32257, win 65535, length 0
7.720290 IP 203.82.48.1.80 > 203.82.48.2.49154: Flags [.], ack 32257, win 65535, length 0
7.720354 IP 203.82.48.1.80 > 203.82.48.2.49155: Flags [.], ack 32257, win 65535, length 0
7.724287 IP 203.82.48.2.49153 > 203.82.48.1.80: Flags [.], seq 32257:32769, ack 1, win 65535, length 512
7.724332 IP 203.82.48.2.49154 > 203.82.48.1.80: Flags [.], seq 32257:32769, ack 1, win 65535, length 512
7.724376 IP 203.82.48.2.49155 > 203.82.48.1.80: Flags [.], seq 32257:32769, ack 1, win 65535, length 512
7.732479 IP 203.82.48.2.49153 > 203.82.48.1.80: Flags [.], seq 32769:33281, ack 1, win 65535, length 512
7.732524 IP 203.82.48.2.49154 > 203.82.48.1.80: Flags [.], seq 32769:33281, ack 1, win 65535, length 512
7.732568 IP 203.82.48.2.49155 > 203.82.48.1.80: Flags [.], seq 32769:33281, ack 1, win 65535, length 512
7.736591 IP 203.82.48.1.80 > 203.82.48.2.49153: Flags [.], ack 33281, win 65535, length 0
7.736685 IP 203.82.48.1.80 > 203.82.48.2.49154: Flags [.], ack 33281, win 65535, length 0
7.736758 IP 203.82.48.1.80 > 203.82.48.2.49155: Flags [.], ack 33281, win 65535, length 0
7.740671 IP 203.82.48.2.49153 > 203.82.48.1.80: Flags [.], seq 33281:33793, ack 1, win 65535, length 512
7.740716 IP 203.82.48.2.49154 > 203.82.48.1.80: Flags [.], seq 33281:33793, ack 1, win 65535, length 512
7.740760 IP 203.82.48.2.49155 > 203.82.48.1.80: Flags [.], seq 33281:33793, ack 1, win 65535, length 512
7.748863 IP 203.82.48.2.49153 > 203.82.48.1.80: Flags [.], seq 33793:34305, ack 1, win 65535, length 512
7.748908 IP 203.82.48.2.49154 > 203.82.48.1.80: Flags [.], seq 33793:34305, ack 1, win 65535, length 512
7.748952 IP 203.82.48.2.49155 > 203.82.48.1.80: Flags [.], seq 33793:34305, ack 1, win 65535, length 512
7.752975 IP 203.82.48.1.80 > 203.82.48.2.49153: Flags [.], ack 34305, win 65535, length 0
7.753056 IP 203.82.48.1.80 > 203.82.48.2.49154: Flags [.], ack 34305, win 65535, length 0
7.753121 IP 203.82.48.1.80 > 203.82.48.2.49155: Flags [.], ack 34305, win 65535, length 0
7.757055 IP 203.82.48.2.49153 > 203.82.48.1.80: Flags [.], seq 34305:34817, ack 1, win 65535, length 512
7.757100 IP 203.82.48.2.49154 > 203.82.48.1.80: Flags [.], seq 34305:34817, ack 1, win 65535, length 512
7.757144 IP 203.82.48.2.49155 > 203.82.48.1.80: Flags [.], seq 34305:34817, ack 1, win 65535, length 512
7.765247 IP 203.82.48.2.49153 > 203.82.48.1.80: Flags [.], seq 34817:35329, ack 1, win 65535, length 512
7.765292 IP 203.82.48.2.49154 > 203.82.48.1.80: Flags [.], seq 34817:35329, ack 1, win 65535, length 512
7.765336 IP 203.82.48.2.49155 > 203.82.48.1.80: Flags [.], seq 34817:35329, ack 1, win 65535, length 512
7.769359 IP 203.82.48.1.80 > 203.82.48.2.49153: Flags [.], ack 35329, win 65535, length 0
7.769441 IP 203.82.48.1.80 > 203.82.48.2.49154: Flags [.], ack 35329, win 65535, length 0
7.769508 IP 203.82.48.1.80 > 203.82.48.2.49155: Flags [.], ack 35329, win 65535, length 0
7.773439 IP 203.82.48.2.49153 > 203.82.48.1.80: Flags [.], seq 35329:35841, ack 1, win 65535, length 512
7.773484 IP 203.82.48.2.49154 > 203.82.48.1.80: Flags [.], seq 35329:35841, ack 1, win 65535, length 512
7.773528 IP 203.82.48.2.49155 > 203.82.48.1.80: Flags [.], seq 35329:35841, ack 1, win 65535, length 512
7.781631 IP 203.82.48.2.49153 > 203.82.48.1.80: Flags [.], seq 35841:36353, ack 1, win 65535, length 512
7.781676 IP 203.82.48.2.49154 > 203.82.48.1.80: Flags [.], seq 35841:36353, ack 1, win 65535, length 512
7.781720 IP 203.82.48.2.49155 > 203.82.48.1.80: Flags [.], seq 35841:36353, ack 1, win 65535, length 512
7.785743 IP 203.82.48.1.80 > 203.82.48.2.49153: Flags [.], ack 36353, win 65535, length 0
7.785816 IP 203.82.48.1.80 > 203.82.48.2.49154: Flags [.], ack 36353, win 65535, length 0
7.785906 IP 203.82.48.1.80 > 203.82.48.2.49155: Flags [.], ack 36353, win 65535, length 0
7.789823 IP 203.82.48.2.49153 > 203.82.48.1.80: Flags [.], seq 36353:36865, ack 1, win 65535, length 512
7.789868 IP 203.82.48.2.49154 > 203.82.48.1.80: Flags [.], seq 36353:36865, ack 1, win 65535, length 512
7.789912 IP 203.82.48.2.49155 > 203.82.48.1.80: Flags [.], seq 36353:36865, ack 1, win 65535, length 512
7.798015 IP 203.82.48.2.49153 > 203.82.48.1.80: Flags [.], seq 36865:37377, ack 1, win 65535, length 512
7.798060 IP 203.82.48.2.49154 > 203.82.48.1.80: Flags [.], seq 36865:37377, ack 1, win 65535, length 512
7.798104 IP 203.82.48.2.49155 > 203.82.48.1.80: Flags [.], seq 36865:37377, ack 1, win 65535, length 512
7.802127 IP 203.82.48.1.80 > 203.82.48.2.49153: Flags [.], ack 37377, win 65535, length 0
7.802194 IP 203.82.48.1.80 > 203.82.48.2.49154: Flags [.], ack 37377, win 65535, length 0
7.802267 IP 203.82.48.1.80 > 203.82.48.2.49155: Flags [.], ack 37377, win 65535, length 0
7.806207 IP 203.82.48.2.49153 > 203.82.48.1.80: Flags [.], seq 37377:37889, ack 1, win 65535, length 512
7.806252 IP 203.82.48.2.49154 > 203.82.48.1.80: Flags [.], seq 37377:37889, ack 1, win 65535, length 512
7.806296 IP 203.82.48.2.49155 > 203.82.48.1.80: Flags [.], seq 37377:37889, ack 1, win 65535, length 512
7.814399 IP 203.82.48.2.49153 > 203.82.48.1.80: Flags [.], seq 37889:38401, ack 1, win 65535, length 512
7.814444 IP 203.82.48.2.49154 > 203.82.48.1.80: Flags [.], seq 37889:38401, ack 1, win 65535, length 512
7.814488 IP 203.82.48.2.49155 > 203.82.48.1.80: Flags [.], seq 37889:38401, ack 1, win 65535, length 512
7.818511 IP 203.82.48.1.80 > 203.82.48.2.49153: Flags [.], ack 38401, win 65535, length 0
7.818603 IP 203.82.48.1.80 > 203.82.48.2.49154: Flags [.], ack 38401, win 65535, length 0
7.818693 IP 203.82.48.1.80 > 203.82.48.2.49155: Flags [.], ack 38401, win 65535, length 0
7.822591 IP 203.82.48.2.49153 > 203.82.48.1.80: Flags [.], seq 38401:38913, ack 1, win 65535, length 512
7.822636 IP 203.82.48.2.49154 > 203.82.48.1.80: Flags [.], seq 38401:38913, ack 1, win 65535, length 512
7.822680 IP 203.82.48.2.49155 > 203.82.48.1.80: Flags [.], seq 38401:38913, ack 1, win 65535, length 512
7.830783 IP 203.82.48.2.49153 > 203.82.48.1.80: Flags [.], seq 38913:39425, ack 1, win 65535, length 512
7.830828 IP 203.82.48.2.49154 > 203.82.48.1.80: Flags [.], seq 38913:39425, ack 1, win 65535, length 512
7.830872 IP 203.82.48.2.49155 > 203.82.48.1.80: Flags [.], seq 38913:39425, ack 1, win 65535, length 512
7.834895 IP 203.82.48.1.80 > 203.82.48.2.49153: Flags [.], ack 39425, win 65535, length 0
7.835001 IP 203.82.48.1.80 > 203.82.48.2.49154: Flags [.], ack 39425, win 65535, length 0
7.835075 IP 203.82.48.1.80 > 203.82.48.2.49155: Flags [.], ack 39425, win 65535, length 0
7.838975 IP 203.82.48.2.49153 > 203.82.48.1.80: Flags [.], seq 39425:39937, ack 1, win 65535, length 512
7.839020 IP 203.82.48.2.49154 > 203.82.48.1.80: Flags [.], seq 39425:39937, ack 1, win 65535, length 512
7.839064 IP 203.82.48.2.49155 > 203.82.48.1.80: Flags [.], seq 39425:39937, ack 1, win 65535, length 512
7.847167 IP 203.82.48.2.49153 > 203.82.48.1.80: Flags [.], seq 39937:40449, ack 1, win 65535, length 512
7.847212 IP 203.82.48.2.49154 > 203.82.48.1.80: Flags [.], seq 39937:40449, ack 1, win 65535, length 512
7.847256 IP 203.82.48.2.49155 > 203.82.48.1.80: Flags [.], seq 39937:40449, ack 1, win 65535, length 512
7.851279 IP 203.82.48.1.80 > 203.82.48.2.49153: Flags [.], ack 40449, win 65535, length 0
7.851343 IP 203.82.48.1.80 > 203.82.48.2.49154: Flags [.], ack 40449, win 65535, length 0
7.851411 IP 203.82.48.1.80 > 203.82.48.2.49155: Flags [.], ack 40449, win 65535, length 0
7.855359 IP 203.82.48.2.49153 > 203.82.48.1.80: Flags [.], seq 40449:40961, ack 1, win 65535, length 512
7.855404 IP 203.82.48.2.49154 > 203.82.48.1.80: Flags [.], seq 40449:40961, ack 1, win 65535, length 512
7.855448 IP 203.82.48.2.49155 > 203.82.48.1.80: Flags [.], seq 40449:40961, ack 1, win 65535, length 512
7.863551 IP 203.82.48.2.49153 > 203.82.48.1.80: Flags [.], seq 40961:41473, ack 1, win 65535, length 512
7.863596 IP 203.82.48.2.49154 > 203.82.48.1.80: Flags [.], seq 40961:41473, ack 1, win 65535, length 512
7.863640 IP 203.82.48.2.49155 > 203.82.48.1.80: Flags [.], seq 40961:41473, ack 1, win 65535, length 512
7.867663 IP 203.82.48.1.80 > 203.82.48.2.49153: Flags [.], ack 41473, win 65535, length 0
7.867746 IP 203.82.48.1.80 > 203.82.48.2.49154: Flags [.], ack 41473, win 65535, length 0
7.867860 IP 203.82.48.1.80 > 203.82.48.2.49155: Flags [.], ack 41473, win 65535, length 0
7.871743 IP 203.82.48.2.49153 > 203.82.48.1.80: Flags [.], seq 41473:41985, ack 1, win 65535, length 512
7.871788 IP 203.82.48.2.49154 > 203.82.48.1.80: Flags [.], seq 41473:41985, ack 1, win 65535, length 512
7.871832 IP 203.82.48.2.49155 > 203.82.48.1.80: Flags [.], seq 41473:41985, ack 1, win 65535, length 512
7.879935 IP 203.82.48.2.49153 > 203.82.48.1.80: Flags [.], seq 41985:42497, ack 1, win 65535, length 512
7.879980 IP 203.82.48.2.49154 > 203.82.48.1.80: Flags [.], seq 41985:42497, ack 1, win 65535, length 512
7.880024 IP 203.82.48.2.49155 > 203.82.48.1.80: Flags [.], seq 41985:42497, ack 1, win 65535, length 512
7.884047 IP 203.82.48.1.80 > 203.82.48.2.49153: Flags [.], ack 42497, win 65535, length 0
7.884111 IP 203.82.48.1.80 > 203.82.48.2.49154: Flags [.], ack 42497, win 65535, length 0
7.884180 IP 203.82.48.1.80 > 203.82.48.2.49155: Flags [.], ack 42497, win 65535, length 0
7.888127 IP 203.82.48.2.49153 > 203.82.48.1.80: Flags [.], seq 42497:43009, ack 1, win 65535, length 512
7.888172 IP 203.82.48.2.49154 > 203.82.48.1.80: Flags [.], seq 42497:43009, ack 1, win 65535, length 512
7.888216 IP 203.82.48.2.49155 > 203.82.48.1.80: Flags [.], seq 42497:43009, ack 1, win 65535, length 512
7.896319 IP 203.82.48.2.49153 > 203.82.48.1.80: Flags [.], seq 43009:43521, ack 1, win 65535, length 512
7.896364 IP 203.82.48.2.49154 > 203.82.48.1.80: Flags [.], seq 43009:43521, ack 1, win 65535, length 512
7.896408 IP 203.82.48.2.49155 > 203.82.48.1.80: Flags [.], seq 43009:43521, ack 1, win 65535, length 512
7.900431 IP 203.82.48.1.80 > 203.82.48.2.49153: Flags [.], ack 43521, win 65535, length 0
7.900495 IP 203.82.48.1.80 > 203.82.48.2.49154: Flags [.], ack 43521, win 65535, length 0
7.900567 IP 203.82.48.1.80 > 203.82.48.2.49155: Flags [.], ack 43521, win 65535, length 0
7.904511 IP 203.82.48.2.49153 > 203.82.48.1.80: Flags [.], seq 43521:44033, ack 1, win 65535, length 512
7.904556 IP 203.82.48.2.49154 > 203.82.48.1.80: Flags [.], seq 43521:44033, ack 1, win 65535, length 512
7.904600 IP 203.82.48.2.49155 > 203.82.48.1.80: Flags [.], seq 43521:44033, ack 1, win 65535, length 512
7.912703 IP 203.82.48.2.49153 > 203.82.48.1.80: Flags [.], seq 44033:44545, ack 1, win 65535, length 512
7.912748 IP 203.82.48.2.49154 > 203.82.48.1.80: Flags [.], seq 44033:44545, ack 1, win 65535, length 512
7.912792 IP 203.82.48.2.49155 > 203.82.48.1.80: Flags [.], seq 44033:44545, ack 1, win 65535, length 512
7.916815 IP 203.82.48.1.80 > 203.82.48.2.49153: Flags [.], ack 44545, win 65535, length 0
7.916879 IP 203.82.48.1.80 > 203.82.48.2.49154: Flags [.], ack 44545, win 65535, length 0
7.916965 IP 203.82.48.1.80 > 203.82.48.2.49155: Flags [.], ack 44545, win 65535, length 0
7.920895 IP 203.82.48.2.49153 > 203.82.48.1.80: Flags [.], seq 44545:45057, ack 1, win 65535, length 512
7.920940 IP 203.82.48.2.49154 > 203.82.48.1.80: Flags [.], seq 44545:45057, ack 1, win 65535, length 512
7.920984 IP 203.82.48.2.49155 > 203.82.48.1.80: Flags [.], seq 44545:45057, ack 1, win 65535, length 512
7.929087 IP 203.82.48.2.49153 > 203.82.48.1.80: Flags [.], seq 45057:45569, ack 1, win 65535, length 512
7.929132 IP 203.82.48.2.49154 > 203.82.48.1.80: Flags [.], seq 45057:45569, ack 1, win 65535, length 512
7.929176 IP 203.82.48.2.49155 > 203.82.48.1.80: Flags [.], seq 45057:45569, ack 1, win 65535, length 512
7.933199 IP 203.82.48.1.80 > 203.82.48.2.49153: Flags [.], ack 45569, win 65535, length 0
7.933280 IP 203.82.48.1.80 > 203.82.48.2.49154: Flags [.], ack 45569, win 65535, length 0
7.933359 IP 203.82.48.1.80 > 203.82.48.2.49155: Flags [.], ack 45569, win 65535, length 0
7.937279 IP 203.82.48.2.49153 > 203.82.48.1.80: Flags [.], seq 45569:46081, ack 1, win 65535, length 512
7.937324 IP 203.82.48.2.49154 > 203.82.48.1.80: Flags [.], seq 45569:46081, ack 1, win 65535, length 512
7.937368 IP 203.82.48.2.49155 > 203.82.48.1.80: Flags [.], seq 45569:46081, ack 1, win 65535, length 512
7.945471 IP 203.82.48.2.49153 > 203.82.48.1.80: Flags [.], seq 46081:46593, ack 1, win 65535, length 512
7.945516 IP 203.82.48.2.49154 > 203.82.48.1.80: Flags [.], seq 46081:46593, ack 1, win 65535, length 512
7.945560 IP 203.82.48.2.49155 > 203.82.48.1.80: Flags [.], seq 46081:46593, ack 1, win 65535, length 512
7.949583 IP 203.82.48.1.80 > 203.82.48.2.49153: Flags [.], ack 46593, win 65535, length 0
7.949655 IP 203.82.48.1.80 > 203.82.48.2.49154: Flags [.], ack 46593, win 65535, length 0
7.949739 IP 203.82.48.1.80 > 203.82.48.2.49155: Flags [.], ack 46593, win 65535, length 0
7.953663 IP 203.82.48.2.49153 > 203.82.48.1.80: Flags [.], seq 46593:47105, ack 1, win 65535, length 512
7.953708 IP 203.82.48.2.49154 > 203.82.48.1.80: Flags [.], seq 46593:47105, ack 1, win 65535, length 512
7.953752 IP 203.82.48.2.49155 > 203.82.48.1.80: Flags [.], seq 46593:47105, ack 1, win 65535, length 512
7.961855 IP 203.82.48.2.49153 > 203.82.48.1.80: Flags [.], seq 47105:47617, ack 1, win 65535, length 512
7.961900 IP 203.82.48.2.49154 > 203.82.48.1.80: Flags [.], seq 47105:47617, ack 1, win 65535, length 512
7.961944 IP 203.82.48.2.49155 > 203.82.48.1.80: Flags [.], seq 47105:47617, ack 1, win 65535, length 512
7.965967 IP 203.82.48.1.80 > 203.82.48.2.49153: Flags [.], ack 47617, win 65535, length 0
7.966033 IP 203.82.48.1.80 > 203.82.48.2.49154: Flags [.], ack 47617, win 65535, length 0
7.966106 IP 203.82.48.1.80 > 203.82.48.2.49155: Flags [.], ack 47617, win 65535, length 0
7.970047 IP 203.82.48.2.49153 > 203.82.48.1.80: Flags [.], seq 47617:48129, ack 1, win 65535, length 512
7.970092 IP 203.82.48.2.49154 > 203.82.48.1.80: Flags [.], seq 47617:48129, ack 1, win 65535, length 512
7.970136 IP 203.82.48.2.49155 > 203.82.48.1.80: Flags [.], seq 47617:48129, ack 1, win 65535, length 512
7.978239 IP 203.82.48.2.49153 > 203.82.48.1.80: Flags [.], seq 48129:48641, ack 1, win 65535, length 512
7.978284 IP 203.82.48.2.49154 > 203.82.48.1.80: Flags [.], seq 48129:48641, ack 1, win 65535, length 512
7.978328 IP 203.82.48.2.49155 > 203.82.48.1.80: Flags [.], seq 48129:48641, ack 1, win 65535, length 512
7.982351 IP 203.82.48.1.80 > 203.82.48.2.49153: Flags [.], ack 48641, win 65535, length 0
7.982430 IP 203.82.48.1.80 > 203.82.48.2.49154: Flags [.], ack 48641, win 65535, length 0
7.982508 IP 203.82.48.1.80 > 203.82.48.2.49155: Flags [.], ack 48641, win 65535, length 0
7.986431 IP 203.82.48.2.49153 > 203.82.48.1.80: Flags [.], seq 48641:49153, ack 1, win 65535, length 512
7.986476 IP 203.82.48.2.49154 > 203.82.48.1.80: Flags [.], seq 48641:49153, ack 1, win 65535, length 512
7.986520 IP 203.82.48.2.49155 > 203.82.48.1.80: Flags [.], seq 48641:49153, ack 1, win 65535, length 512
7.994623 IP 203.82.48.2.49153 > 203.82.48.1.80: Flags [.], seq 49153:49665, ack 1, win 65535, length 512
7.994668 IP 203.82.48.2.49154 > 203.82.48.1.80: Flags [.], seq 49153:49665, ack 1, win 65535, length 512
7.994712 IP 203.82.48.2.49155 > 203.82.48.1.80: Flags [.], seq 49153:49665, ack 1, win 65535, length 512
7.998735 IP 203.82.48.1.80 > 203.82.48.2.49153: Flags [.], ack 49665, win 65535, length 0
7.998827 IP 203.82.48.1.80 > 203.82.48.2.49154: Flags [.], ack 49665, win 65535, length 0
7.998894 IP 203.82.48.1.80 > 203.82.48.2.49155: Flags [.], ack 49665, win 65535, length 0
8.000000 IP 203.82.48.2.49153 > 203.82.48.1.80: Flags [F.], seq 49665, ack 1, win 65535, length 0
8.000003 IP 203.82.48.2.49154 > 203.82.48.1.80: Flags [F.], seq 49665, ack 1, win 65535, length 0
8.000006 IP 203.82.48.2.49155 > 203.82.48.1.80: Flags [F.], seq 49665, ack 1, win 65535, length 0
8.004043 IP 203.82.48.1.80 > 203.82.48.2.49153: Flags [F.], seq 1, ack 49666, win 65535, length 0
8.004043 IP 203.82.48.2.49153 > 203.82.48.1.80: Flags [.], ack 2, win 65535, length 0
8.004103 IP 203.82.48.1.80 > 203.82.48.2.49154: Flags [F.], seq 1, ack 49666, win 65535, length 0
8.004103 IP 203.82.48.2.49154 > 203.82.48.1.80: Flags [.], ack 2, win 65535, length 0
8.004171 IP 203.82.48.1.80 > 203.82.48.2.49155: Flags [F.], seq 1, ack 49666, win 65535, length 0
8.004171 IP 203.82.48.2.49155 > 203.82.48.1.80: Flags [.], ack 2, win 65535, length 0
10.200000 IP 203.82.48.2.49156 > 203.82.48.1.80: Flags [S], seq 0, win 65535, length 0
10.204030 IP 203.82.48.1.80 > 203.82.48.2.49156: Flags [S.], seq 0, ack 1, win 65535, length 0
10.204030 IP 203.82.48.2.49156 > 203.82.48.1.80: Flags [.], ack 1, win 65535, length 0
10.204033 IP 203.82.48.2.49156 > 203.82.48.1.80: Flags [.], seq 1:537, ack 1, win 65535, length 536
10.208148 IP 203.82.48.1.80 > 203.82.48.2.49156: Flags [.], ack 537, win 65535, length 0
10.208148 IP 203.82.48.2.49156 > 203.82.48.1.80: Flags [.], seq 537:1073, ack 1, win 65535, length 536
10.208195 IP 203.82.48.2.49156 > 203.82.48.1.80: Flags [.], seq 1073:1609, ack 1, win 65535, length 536
10.212320 IP 203.82.48.1.80 > 203.82.48.2.49156: Flags [.], ack 1609, win 65535, length 0
10.212320 IP 203.82.48.2.49156 > 203.82.48.1.80: Flags [.], seq 1609:2145, ack 1, win 65535, length 536
10.212366 IP 203.82.48.2.49156 > 203.82.48.1.80: Flags [.], seq 2145:2681, ack 1, win 65535, length 536
10.212413 IP 203.82.48.2.49156 > 203.82.48.1.80: Flags [.], seq 2681:3217, ack 1, win 65535, length 536
10.216491 IP 203.82.48.1.80 > 203.82.48.2.49156: Flags [.], ack 2681, win 65535, length 0
10.216491 IP 203.82.48.2.49156 > 203.82.48.1.80: Flags [.], seq 3217:3753, ack 1, win 65535, length 536
10.216537 IP 203.82.48.2.49156 > 203.82.48.1.80: Flags [.], seq 3753:4289, ack 1, win 65535, length 536
10.216583 IP 203.82.48.2.49156 > 203.82.48.1.80: Flags [.], seq 4289:4825, ack 1, win 65535, length 536
10.220606 IP 203.82.48.1.80 > 203.82.48.2.49156: Flags [.], ack 3753, win 65535, length 0
10.220606 IP 203.82.48.2.49156 > 203.82.48.1.80: Flags [.], seq 4825:5361, ack 1, win 65535, length 536
10.220653 IP 203.82.48.2.49156 > 203.82.48.1.80: Flags [.], seq 5361:5897, ack 1, win 65535, length 536
10.220699 IP 203.82.48.2.49156 > 203.82.48.1.80: Flags [.], seq 5897:6433, ack 1, win 65535, length 536
10.220743 IP 203.82.48.1.80 > 203.82.48.2.49156: Flags [.], ack 4825, win 65535, length 0
10.220745 IP 203.82.48.2.49156 > 203.82.48.1.80: Flags [.], seq 6433:6969, ack 1, win 65535, length 536
10.220791 IP 203.82.48.2.49156 > 203.82.48.1.80: Flags [.], seq 6969:7505, ack 1, win 65535, length 536
10.220838 IP 203.82.48.2.49156 > 203.82.48.1.80: Flags [.], seq 7505:8041, ack 1, win 65535, length 536
10.224779 IP 203.82.48.1.80 > 203.82.48.2.49156: Flags [.], ack 5897, win 65535, length 0
10.224779 IP 203.82.48.2.49156 > 203.82.48.1.80: Flags [.], seq 8041:8577, ack 1, win 65535, length 536
10.224825 IP 203.82.48.2.49156 > 203.82.48.1.80: Flags [.], seq 8577:9113, ack 1, win 65535, length 536
10.224872 IP 203.82.48.2.49156 > 203.82.48.1.80: Flags [.], seq 9113:9649, ack 1, win 65535, length 536
10.224922 IP 203.82.48.1.80 > 203.82.48.2.49156: Flags [.], ack 6969, win 65535, length 0
10.224922 IP 203.82.48.2.49156 > 203.82.48.1.80: Flags [.], seq 9649:10185, ack 1, win 65535, length 536
10.224968 IP 203.82.48.2.49156 > 203.82.48.1.80: Flags [.], seq 10185:10721, ack 1, win 65535, length 536
10.225015 IP 203.82.48.2.49156 > 203.82.48.1.80: Flags [.], seq 10721:11257, ack 1, win 65535, length 536
10.225051 IP 203.82.48.1.80 > 203.82.48.2.49156: Flags [.], ack 8041, win 65535, length 0
10.225061 IP 203.82.48.2.49156 > 203.82.48.1.80: Flags [.], seq 11257:11793, ack 1, win 65535, length 536
10.225107 IP 203.82.48.2.49156 > 203.82.48.1.80: Flags [.], seq 11793:12329, ack 1, win 65535, length 536
10.225153 IP 203.82.48.2.49156 > 203.82.48.1.80: Flags [.], seq 12329:12865, ack 1, win 65535, length 536
10.228951 IP 203.82.48.1.80 > 203.82.48.2.49156: Flags [.], ack 9113, win 65535, length 0
10.228951 IP 203.82.48.2.49156 > 203.82.48.1.80: Flags [.], seq 12865:13401, ack 1, win 65535, length 536
10.228997 IP 203.82.48.2.49156 > 203.82.48.1.80: Flags [.], seq 13401:13937, ack 1, win 65535, length 536
10.229043 IP 203.82.48.2.49156 > 203.82.48.1.80: Flags [.], seq 13937:14473, ack 1, win 65535, length 536
10.229156 IP 203.82.48.1.80 > 203.82.48.2.49156: Flags [.], ack 10185, win 65535, length 0
10.229156 IP 203.82.48.2.49156 > 203.82.48.1.80: Flags [.], seq 14473:15009, ack 1, win 65535, length 536
10.229202 IP 203.82.48.2.49156 > 203.82.48.1.80: Flags [.], seq 15009:15545, ack 1, win 65535, length 536
10.229248 IP 203.82.48.2.49156 > 203.82.48.1.80: Flags [.], seq 15545:16081, ack 1, win 65535, length 536
10.229288 IP 203.82.48.1.80 > 203.82.48.2.49156: Flags [.], ack 11257, win 65535, length 0
10.229295 IP 203.82.48.2.49156 > 203.82.48.1.80: Flags [.], seq 16081:16617, ack 1, win 65535, length 536
10.229341 IP 203.82.48.2.49156 > 203.82.48.1.80: Flags [.], seq 16617:17153, ack 1, win 65535, length 536
10.229387 IP 203.82.48.2.49156 > 203.82.48.1.80: Flags [.], seq 17153:17689, ack 1, win 65535, length 536
10.229492 IP 203.82.48.1.80 > 203.82.48.2.49156: Flags [.], ack 12329, win 65535, length 0
10.229492 IP 203.82.48.2.49156 > 203.82.48.1.80: Flags [.], seq 17689:18225, ack 1, win 65535, length 536
10.229538 IP 203.82.48.2.49156 > 203.82.48.1.80: Flags [.], seq 18225:18761, ack 1, win 65535, length 536
10.229584 IP 203.82.48.2.49156 > 203.82.48.1.80: Flags [.], seq 18761:19297, ack 1, win 65535, length 536
10.233066 IP 203.82.48.1.80 > 203.82.48.2.49156: Flags [.], ack 13401, win 65535, length 0
10.233066 IP 203.82.48.2.49156 > 203.82.48.1.80: Flags [.], seq 19297:19833, ack 1, win 65535, length 536
10.233113 IP 203.82.48.2.49156 > 203.82.48.1.80: Flags [.], seq 19833:20369, ack 1, win 65535, length 536
10.233159 IP 203.82.48.2.49156 > 203.82.48.1.80: Flags [.], seq 20369:20905, ack 1, win 65535, length 536
10.233224 IP 203.82.48.1.80 > 203.82.48.2.49156: Flags [.], ack 14473, win 65535, length 0
10.233224 IP 203.82.48.2.49156 > 203.82.48.1.80: Flags [.], seq 20905:21441, ack 1, win 65535, length 536
10.233271 IP 203.82.48.2.49156 > 203.82.48.1.80: Flags [.], seq 21441:21977, ack 1, win 65535, length 536
10.233317 IP 203.82.48.2.49156 > 203.82.48.1.80: Flags [.], seq 21977:22513, ack 1, win 65535, length 536
10.233359 IP 203.82.48.1.80 > 203.82.48.2.49156: Flags [.], ack 15545, win 65535, length 0
10.233363 IP 203.82.48.2.49156 > 203.82.48.1.80: Flags [.], seq 22513:23049, ack 1, win 65535, length 536
10.233409 IP 203.82.48.2.49156 > 203.82.48.1.80: Flags [.], seq 23049:23585, ack 1, win 65535, length 536
10.233455 IP 203.82.48.2.49156 > 203.82.48.1.80: Flags [.], seq 23585:24121, ack 1, win 65535, length 536
10.233534 IP 203.82.48.1.80 > 203.82.48.2.49156: Flags [.], ack 16617, win 65535, length 0
10.233534 IP 203.82.48.2.49156 > 203.82.48.1.80: Flags [.], seq 24121:24657, ack 1, win 65535, length 536
10.233580 IP 203.82.48.2.49156 > 203.82.48.1.80: Flags [.], seq 24657:25193, ack 1, win 65535, length 536
10.233627 IP 203.82.48.2.49156 > 203.82.48.1.80: Flags [.], seq 25193:25729, ack 1, win 65535, length 536
10.233672 IP 203.82.48.1.80 > 203.82.48.2.49156: Flags [.], ack 17689, win 65535, length 0
10.233673 IP 203.82.48.2.49156 > 203.82.48.1.80: Flags [.], seq 25729:26265, ack 1, win 65535, length 536
10.233719 IP 203.82.48.2.49156 > 203.82.48.1.80: Flags [.], seq 26265:26801, ack 1, win 65535, length 536
10.233765 IP 203.82.48.2.49156 > 203.82.48.1.80: Flags [.], seq 26801:27337, ack 1, win 65535, length 536
10.233805 IP 203.82.48.1.80 > 203.82.48.2.49156: Flags [.], ack 18761, win 65535, length 0
10.233812 IP 203.82.48.2.49156 > 203.82.48.1.80: Flags [.], seq 27337:27873, ack 1, win 65535, length 536
10.233858 IP 203.82.48.2.49156 > 203.82.48.1.80: Flags [.], seq 27873:28409, ack 1, win 65535, length 536
10.233904 IP 203.82.48.2.49156 > 203.82.48.1.80: Flags [.], seq 28409:28945, ack 1, win 65535, length 536
10.237182 IP 203.82.48.1.80 > 203.82.48.2.49156: Flags [.], ack 19833, win 65535, length 0
10.237182 IP 203.82.48.2.49156 > 203.82.48.1.80: Flags [.], seq 28945:29481, ack 1, win 65535, length 536
10.237228 IP 203.82.48.2.49156 > 203.82.48.1.80: Flags [.], seq 29481:30017, ack 1, win 65535, length 536
10.237274 IP 203.82.48.2.49156 > 203.82.48.1.80: Flags [.], seq 30017:30553, ack 1, win 65535, length 536
10.237304 IP 203.82.48.1.80 > 203.82.48.2.49156: Flags [.], ack 20905, win 65535, length 0
10.237320 IP 203.82.48.2.49156 > 203.82.48.1.80: Flags [.], seq 30553:31089, ack 1, win 65535, length 536
10.237367 IP 203.82.48.2.49156 > 203.82.48.1.80: Flags [.], seq 31089:31625, ack 1, win 65535, length 536
10.237413 IP 203.82.48.2.49156 > 203.82.48.1.80: Flags [.], seq 31625:32161, ack 1, win 65535, length 536
10.237425 IP 203.82.48.1.80 > 203.82.48.2.49156: Flags [.], ack 21977, win 65535, length 0
10.237459 IP 203.82.48.2.49156 > 203.82.48.1.80: Flags [.], seq 32161:32697, ack 1, win 65535, length 536
10.237505 IP 203.82.48.2.49156 > 203.82.48.1.80: Flags [.], seq 32697:33233, ack 1, win 65535, length 536
10.237552 IP 203.82.48.2.49156 > 203.82.48.1.80: Flags [.], seq 33233:33769, ack 1, win 65535, length 536
10.237554 IP 203.82.48.1.80 > 203.82.48.2.49156: Flags [.], ack 23049, win 65535, length 0
10.237598 IP 203.82.48.2.49156 > 203.82.48.1.80: Flags [.], seq 33769:34305, ack 1, win 65535, length 536
10.237644 IP 203.82.48.2.49156 > 203.82.48.1.80: Flags [.], seq 34305:34841, ack 1, win 65535, length 536
10.237690 IP 203.82.48.2.49156 > 203.82.48.1.80: Flags [.], seq 34841:35377, ack 1, win 65535, length 536
10.237726 IP 203.82.48.1.80 > 203.82.48.2.49156: Flags [.], ack 24121, win 65535, length 0
10.237737 IP 203.82.48.2.49156 > 203.82.48.1.80: Flags [.], seq 35377:35913, ack 1, win 65535, length 536
10.237783 IP 203.82.48.2.49156 > 203.82.48.1.80: Flags [.], seq 35913:36449, ack 1, win 65535, length 536
10.237829 IP 203.82.48.2.49156 > 203.82.48.1.80: Flags [.], seq 36449:36985, ack 1, win 65535, length 536
10.237857 IP 203.82.48.1.80 > 203.82.48.2.49156: Flags [.], ack 25193, win 65535, length 0
10.237875 IP 203.82.48.2.49156 > 203.82.48.1.80: Flags [.], seq 36985:37521, ack 1, win 65535, length 536
10.237922 IP 203.82.48.2.49156 > 203.82.48.1.80: Flags [.], seq 37521:38057, ack 1, win 65535, length 536
10.237968 IP 203.82.48.2.49156 > 203.82.48.1.80: Flags [.], seq 38057:38593, ack 1, win 65535, length 536
10.238013 IP 203.82.48.1.80 > 203.82.48.2.49156: Flags [.], ack 26265, win 65535, length 0
10.238014 IP 203.82.48.2.49156 > 203.82.48.1.80: Flags [.], seq 38593:39129, ack 1, win 65535, length 536
10.238060 IP 203.82.48.2.49156 > 203.82.48.1.80: Flags [.], seq 39129:39665, ack 1, win 65535, length 536
10.238106 IP 203.82.48.2.49156 > 203.82.48.1.80: Flags [.], seq 39665:40201, ack 1, win 65535, length 536
10.238138 IP 203.82.48.1.80 > 203.82.48.2.49156: Flags [.], ack 27337, win 65535, length 0
10.238153 IP 203.82.48.2.49156 > 203.82.48.1.80: Flags [.], seq 40201:40737, ack 1, win 65535, length 536
10.238199 IP 203.82.48.2.49156 > 203.82.48.1.80: Flags [.], seq 40737:41273, ack 1, win 65535, length 536
10.238245 IP 203.82.48.2.49156 > 203.82.48.1.80: Flags [.], seq 41273:41809, ack 1, win 65535, length 536
10.238268 IP 203.82.48.1.80 > 203.82.48.2.49156: Flags [.], ack 28409, win 65535, length 0
10.238291 IP 203.82.48.2.49156 > 203.82.48.1.80: Flags [.], seq 41809:42345, ack 1, win 65535, length 536
10.238338 IP 203.82.48.2.49156 > 203.82.48.1.80: Flags [.], seq 42345:42881, ack 1, win 65535, length 536
10.238384 IP 203.82.48.2.49156 > 203.82.48.1.80: Flags [.], seq 42881:43417, ack 1, win 65535, length 536
10.241297 IP 203.82.48.1.80 > 203.82.48.2.49156: Flags [.], ack 29481, win 65535, length 0
10.241297 IP 203.82.48.2.49156 > 203.82.48.1.80: Flags [.], seq 43417:43953, ack 1, win 65535, length 536
10.241343 IP 203.82.48.2.49156 > 203.82.48.1.80: Flags [.], seq 43953:44489, ack 1, win 65535, length 536
10.241390 IP 203.82.48.2.49156 > 203.82.48.1.80: Flags [.], seq 44489:45025, ack 1, win 65535, length 536
10.241433 IP 203.82.48.1.80 > 203.82.48.2.49156: Flags [.], ack 30553, win 65535, length 0
10.241436 IP 203.82.48.2.49156 > 203.82.48.1.80: Flags [.], seq 45025:45561, ack 1, win 65535, length 536
10.241482 IP 203.82.48.2.49156 > 203.82.48.1.80: Flags [.], seq 45561:46097, ack 1, win 65535, length 536
10.241528 IP 203.82.48.2.49156 > 203.82.48.1.80: Flags [.], seq 46097:46633, ack 1, win 65535, length 536
10.241562 IP 203.82.48.1.80 > 203.82.48.2.49156: Flags [.], ack 31625, win 65535, length 0
10.241574 IP 203.82.48.2.49156 > 203.82.48.1.80: Flags [.], seq 46633:47169, ack 1, win 65535, length 536
10.241621 IP 203.82.48.2.49156 > 203.82.48.1.80: Flags [.], seq 47169:47705, ack 1, win 65535, length 536
10.241667 IP 203.82.48.2.49156 > 203.82.48.1.80: Flags [.], seq 47705:48241, ack 1, win 65535, length 536
10.241688 IP 203.82.48.1.80 > 203.82.48.2.49156: Flags [.], ack 32697, win 65535, length 0
10.241713 IP 203.82.48.2.49156 > 203.82.48.1.80: Flags [.], seq 48241:48777, ack 1, win 65535, length 536
10.241759 IP 203.82.48.2.49156 > 203.82.48.1.80: Flags [.], seq 48777:49313, ack 1, win 65535, length 536
10.241806 IP 203.82.48.2.49156 > 203.82.48.1.80: Flags [F.], seq 49313:49665, ack 1, win 65535, length 352
10.241834 IP 203.82.48.1.80 > 203.82.48.2.49156: Flags [.], ack 33769, win 65535, length 0
10.241955 IP 203.82.48.1.80 > 203.82.48.2.49156: Flags [.], ack 34841, win 65535, length 0
10.242078 IP 203.82.48.1.80 > 203.82.48.2.49156: Flags [.], ack 35913, win 65535, length 0
10.242209 IP 203.82.48.1.80 > 203.82.48.2.49156: Flags [.], ack 36985, win 65535, length 0
10.242342 IP 203.82.48.1.80 > 203.82.48.2.49156: Flags [.], ack 38057, win 65535, length 0
10.242467 IP 203.82.48.1.80 > 203.82.48.2.49156: Flags [.], ack 39129, win 65535, length 0
10.242615 IP 203.82.48.1.80 > 203.82.48.2.49156: Flags [.], ack 40201, win 65535, length 0
10.242763 IP 203.82.48.1.80 > 203.82.48.2.49156: Flags [.], ack 41273, win 65535, length 0
10.242891 IP 203.82.48.1.80 > 203.82.48.2.49156: Flags [.], ack 42345, win 65535, length 0
10.243023 IP 203.82.48.1.80 > 203.82.48.2.49156: Flags [.], ack 43417, win 65535, length 0
10.245468 IP 203.82.48.1.80 > 203.82.48.2.49156: Flags [.], ack 44489, win 65535, length 0
10.245599 IP 203.82.48.1.80 > 203.82.48.2.49156: Flags [.], ack 45561, win 65535, length 0
10.245756 IP 203.82.48.1.80 > 203.82.48.2.49156: Flags [.], ack 46633, win 65535, length 0
10.245878 IP 203.82.48.1.80 > 203.82.48.2.49156: Flags [.], ack 47705, win 65535, length 0
10.246003 IP 203.82.48.1.80 > 203.82.48.2.49156: Flags [.], ack 48777, win 65535, length 0
10.246126 IP 203.82.48.1.80 > 203.82.48.2.49156: Flags [.], ack 49666, win 65535, length 0
10.246159 IP 203.82.48.1.80 > 203.82.48.2.49156: Flags [F.], seq 1, ack 49666, win 65535, length 0
10.246159 IP 203.82.48.2.49156 > 203.82.48.1.80: Flags [.], ack 2, win 65535, length 0
