0.000000 IP 10.1.1.1.49153 > 10.1.1.2.9: Flags [S], seq 0, win 65535, length 0
0.020067 IP 10.1.1.2.9 > 10.1.1.1.49153: Flags [S.], seq 0, ack 1, win 65535, length 0
0.020067 IP 10.1.1.1.49153 > 10.1.1.2.9: Flags [.], ack 1, win 65535, length 0
0.020100 IP 10.1.1.1.49153 > 10.1.1.2.9: Flags [.], seq 1:1461, ack 1, win 65535, length 1460
0.041335 IP 10.1.1.2.9 > 10.1.1.1.49153: Flags [.], ack 1461, win 65535, length 0
0.041335 IP 10.1.1.1.49153 > 10.1.1.2.9: Flags [.], seq 1461:2921, ack 1, win 65535, length 1460
0.042537 IP 10.1.1.1.49153 > 10.1.1.2.9: Flags [.], seq 2921:4381, ack 1, win 65535, length 1460
0.062571 IP 10.1.1.2.9 > 10.1.1.1.49153: Flags [.], ack 2921, win 65535, length 0
0.062571 IP 10.1.1.1.49153 > 10.1.1.2.9: Flags [.], seq 4381:5841, ack 1, win 65535, length 1460
0.063772 IP 10.1.1.2.9 > 10.1.1.1.49153: Flags [.], ack 4381, win 65535, length 0
0.063772 IP 10.1.1.1.49153 > 10.1.1.2.9: Flags [.], seq 5841:7301, ack 1, win 65535, length 1460
0.064974 IP 10.1.1.1.49153 > 10.1.1.2.9: Flags [.], seq 7301:8761, ack 1, win 65535, length 1460
0.066175 IP 10.1.1.1.49153 > 10.1.1.2.9: Flags [.], seq 8761:10221, ack 1, win 65535, length 1460
0.083806 IP 10.1.1.2.9 > 10.1.1.1.49153: Flags [.], ack 5841, win 65535, length 0
0.083806 IP 10.1.1.1.49153 > 10.1.1.2.9: Flags [.], seq 10221:11681, ack 1, win 65535, length 1460
0.085007 IP 10.1.1.2.9 > 10.1.1.1.49153: Flags [.], ack 7301, win 65535, length 0
0.085007 IP 10.1.1.1.49153 > 10.1.1.2.9: Flags [.], seq 11681:13141, ack 1, win 65535, length 1460
0.086209 IP 10.1.1.2.9 > 10.1.1.1.49153: Flags [.], ack 8761, win 65535, length 0
0.086209 IP 10.1.1.1.49153 > 10.1.1.2.9: Flags [.], seq 13141:14601, ack 1, win 65535, length 1460
0.087411 IP 10.1.1.2.9 > 10.1.1.1.49153: Flags [.], ack 10221, win 65535, length 0
0.087411 IP 10.1.1.1.49153 > 10.1.1.2.9: Flags [.], seq 14601:16061, ack 1, win 65535, length 1460
0.088612 IP 10.1.1.1.49153 > 10.1.1.2.9: Flags [.], seq 16061:17521, ack 1, win 65535, length 1460
0.089814 IP 10.1.1.1.49153 > 10.1.1.2.9: Flags [.], seq 17521:18981, ack 1, win 65535, length 1460
0.091015 IP 10.1.1.1.49153 > 10.1.1.2.9: Flags [.], seq 18981:20441, ack 1, win 65535, length 1460
0.092217 IP 10.1.1.1.49153 > 10.1.1.2.9: Flags [.], seq 20441:21901, ack 1, win 65535, length 1460
0.105041 IP 10.1.1.2.9 > 10.1.1.1.49153: Flags [.], ack 11681, win 65535, length 0
0.105041 IP 10.1.1.1.49153 > 10.1.1.2.9: Flags [.], seq 21901:23361, ack 1, win 65535, length 1460
0.106243 IP 10.1.1.2.9 > 10.1.1.1.49153: Flags [.], ack 13141, win 65535, length 0
0.106243 IP 10.1.1.1.49153 > 10.1.1.2.9: Flags [.], seq 23361:24821, ack 1, win 65535, length 1460
0.107444 IP 10.1.1.2.9 > 10.1.1.1.49153: Flags [.], ack 14601, win 65535, length 0
0.107444 IP 10.1.1.1.49153 > 10.1.1.2.9: Flags [.], seq 24821:26281, ack 1, win 65535, length 1460
0.108646 IP 10.1.1.2.9 > 10.1.1.1.49153: Flags [.], ack 16061, win 65535, length 0
0.108646 IP 10.1.1.1.49153 > 10.1.1.2.9: Flags [.], seq 26281:27741, ack 1, win 65535, length 1460
0.109847 IP 10.1.1.2.9 > 10.1.1.1.49153: Flags [.], ack 17521, win 65535, length 0
0.109847 IP 10.1.1.1.49153 > 10.1.1.2.9: Flags [.], seq 27741:29201, ack 1, win 65535, length 1460
0.111049 IP 10.1.1.2.9 > 10.1.1.1.49153: Flags [.], ack 18981, win 65535, length 0
0.111049 IP 10.1.1.1.49153 > 10.1.1.2.9: Flags [.], seq 29201:30661, ack 1, win 65535, length 1460
0.112251 IP 10.1.1.2.9 > 10.1.1.1.49153: Flags [.], ack 20441, win 65535, length 0
0.112251 IP 10.1.1.1.49153 > 10.1.1.2.9: Flags [.], seq 30661:32121, ack 1, win 65535, length 1460
0.113452 IP 10.1.1.2.9 > 10.1.1.1.49153: Flags [.], ack 21901, win 65535, length 0
0.113452 IP 10.1.1.1.49153 > 10.1.1.2.9: Flags [.], seq 32121:33581, ack 1, win 65535, length 1460
0.114654 IP 10.1.1.1.49153 > 10.1.1.2.9: Flags [.], seq 33581:35041, ack 1, win 65535, length 1460
0.115855 IP 10.1.1.1.49153 > 10.1.1.2.9: Flags [.], seq 35041:36501, ack 1, win 65535, length 1460
0.117057 IP 10.1.1.1.49153 > 10.1.1.2.9: Flags [.], seq 36501:37961, ack 1, win 65535, length 1460
0.118259 IP 10.1.1.1.49153 > 10.1.1.2.9: Flags [.], seq 37961:39421, ack 1, win 65535, length 1460
0.119460 IP 10.1.1.1.49153 > 10.1.1.2.9: Flags [.], seq 39421:40881, ack 1, win 65535, length 1460
0.120662 IP 10.1.1.1.49153 > 10.1.1.2.9: Flags [.], seq 40881:42341, ack 1, win 65535, length 1460
0.121863 IP 10.1.1.1.49153 > 10.1.1.2.9: Flags [.], seq 42341:43801, ack 1, win 65535, length 1460
0.123065 IP 10.1.1.1.49153 > 10.1.1.2.9: Flags [.], seq 43801:45261, ack 1, win 65535, length 1460
0.126276 IP 10.1.1.2.9 > 10.1.1.1.49153: Flags [.], ack 23361, win 65535, length 0
0.126276 IP 10.1.1.1.49153 > 10.1.1.2.9: Flags [.], seq 45261:46721, ack 1, win 65535, length 1460
0.127478 IP 10.1.1.2.9 > 10.1.1.1.49153: Flags [.], ack 24821, win 65535, length 0
0.127478 IP 10.1.1.1.49153 > 10.1.1.2.9: Flags [.], seq 46721:48181, ack 1, win 65535, length 1460
0.128679 IP 10.1.1.2.9 > 10.1.1.1.49153: Flags [.], ack 26281, win 65535, length 0
0.128679 IP 10.1.1.1.49153 > 10.1.1.2.9: Flags [.], seq 48181:49641, ack 1, win 65535, length 1460
0.129881 IP 10.1.1.2.9 > 10.1.1.1.49153: Flags [.], ack 27741, win 65535, length 0
0.129881 IP 10.1.1.1.49153 > 10.1.1.2.9: Flags [.], seq 49641:51101, ack 1, win 65535, length 1460
0.131083 IP 10.1.1.2.9 > 10.1.1.1.49153: Flags [.], ack 29201, win 65535, length 0
0.131083 IP 10.1.1.1.49153 > 10.1.1.2.9: Flags [.], seq 51101:52561, ack 1, win 65535, length 1460
0.132284 IP 10.1.1.2.9 > 10.1.1.1.49153: Flags [.], ack 30661, win 65535, length 0
0.132284 IP 10.1.1.1.49153 > 10.1.1.2.9: Flags [.], seq 52561:54021, ack 1, win 65535, length 1460
0.133486 IP 10.1.1.2.9 > 10.1.1.1.49153: Flags [.], ack 32121, win 65535, length 0
0.133486 IP 10.1.1.1.49153 > 10.1.1.2.9: Flags [.], seq 54021:55481, ack 1, win 65535, length 1460
0.134687 IP 10.1.1.2.9 > 10.1.1.1.49153: Flags [.], ack 33581, win 65535, length 0
0.134687 IP 10.1.1.1.49153 > 10.1.1.2.9: Flags [.], seq 55481:56941, ack 1, win 65535, length 1460
0.135889 IP 10.1.1.2.9 > 10.1.1.1.49153: Flags [.], ack 35041, win 65535, length 0
0.135889 IP 10.1.1.1.49153 > 10.1.1.2.9: Flags [.], seq 56941:58401, ack 1, win 65535, length 1460
0.137091 IP 10.1.1.2.9 > 10.1.1.1.49153: Flags [.], ack 36501, win 65535, length 0
0.137091 IP 10.1.1.1.49153 > 10.1.1.2.9: Flags [.], seq 58401:59861, ack 1, win 65535, length 1460
0.138292 IP 10.1.1.2.9 > 10.1.1.1.49153: Flags [.], ack 37961, win 65535, length 0
0.138292 IP 10.1.1.1.49153 > 10.1.1.2.9: Flags [.], seq 59861:61321, ack 1, win 65535, length 1460
0.139494 IP 10.1.1.2.9 > 10.1.1.1.49153: Flags [.], ack 39421, win 65535, length 0
0.139494 IP 10.1.1.1.49153 > 10.1.1.2.9: Flags [.], seq 61321:62781, ack 1, win 65535, length 1460
0.140695 IP 10.1.1.2.9 > 10.1.1.1.49153: Flags [.], ack 40881, win 65535, length 0
0.140695 IP 10.1.1.1.49153 > 10.1.1.2.9: Flags [.], seq 62781:64241, ack 1, win 65535, length 1460
0.141897 IP 10.1.1.2.9 > 10.1.1.1.49153: Flags [.], ack 42341, win 65535, length 0
0.141897 IP 10.1.1.1.49153 > 10.1.1.2.9: Flags [.], seq 64241:65701, ack 1, win 65535, length 1460
0.143099 IP 10.1.1.2.9 > 10.1.1.1.49153: Flags [.], ack 43801, win 65535, length 0
0.143099 IP 10.1.1.1.49153 > 10.1.1.2.9: Flags [.], seq 65701:67161, ack 1, win 65535, length 1460
0.144300 IP 10.1.1.2.9 > 10.1.1.1.49153: Flags [.], ack 45261, win 65535, length 0
0.144300 IP 10.1.1.1.49153 > 10.1.1.2.9: Flags [.], seq 67161:68621, ack 1, win 65535, length 1460
0.145502 IP 10.1.1.1.49153 > 10.1.1.2.9: Flags [.], seq 68621:70081, ack 1, win 65535, length 1460
0.146703 IP 10.1.1.1.49153 > 10.1.1.2.9: Flags [.], seq 70081:71541, ack 1, win 65535, length 1460
0.147511 IP 10.1.1.2.9 > 10.1.1.1.49153: Flags [.], ack 46721, win 65535, length 0
0.147905 IP 10.1.1.1.49153 > 10.1.1.2.9: Flags [.], seq 71541:73001, ack 1, win 65535, length 1460
0.148713 IP 10.1.1.2.9 > 10.1.1.1.49153: Flags [.], ack 48181, win 65535, length 0
0.149107 IP 10.1.1.1.49153 > 10.1.1.2.9: Flags [.], seq 73001:74461, ack 1, win 65535, length 1460
0.149915 IP 10.1.1.2.9 > 10.1.1.1.49153: Flags [.], ack 49641, win 65535, length 0
0.150308 IP 10.1.1.1.49153 > 10.1.1.2.9: Flags [.], seq 74461:75921, ack 1, win 65535, length 1460
0.151116 IP 10.1.1.2.9 > 10.1.1.1.49153: Flags [.], ack 51101, win 65535, length 0
0.151510 IP 10.1.1.1.49153 > 10.1.1.2.9: Flags [.], seq 75921:77381, ack 1, win 65535, length 1460
0.152318 IP 10.1.1.2.9 > 10.1.1.1.49153: Flags [.], ack 52561, win 65535, length 0
0.152711 IP 10.1.1.1.49153 > 10.1.1.2.9: Flags [.], seq 77381:78841, ack 1, win 65535, length 1460
0.153519 IP 10.1.1.2.9 > 10.1.1.1.49153: Flags [.], ack 54021, win 65535, length 0
0.153913 IP 10.1.1.1.49153 > 10.1.1.2.9: Flags [.], seq 78841:80301, ack 1, win 65535, length 1460
0.154721 IP 10.1.1.2.9 > 10.1.1.1.49153: Flags [.], ack 55481, win 65535, length 0
0.155115 IP 10.1.1.1.49153 > 10.1.1.2.9: Flags [.], seq 80301:81761, ack 1, win 65535, length 1460
0.155923 IP 10.1.1.2.9 > 10.1.1.1.49153: Flags [.], ack 56941, win 65535, length 0
0.156316 IP 10.1.1.1.49153 > 10.1.1.2.9: Flags [.], seq 81761:83221, ack 1, win 65535, length 1460
0.157124 IP 10.1.1.2.9 > 10.1.1.1.49153: Flags [.], ack 58401, win 65535, length 0
0.157518 IP 10.1.1.1.49153 > 10.1.1.2.9: Flags [.], seq 83221:84681, ack 1, win 65535, length 1460
0.158326 IP 10.1.1.2.9 > 10.1.1.1.49153: Flags [.], ack 59861, win 65535, length 0
0.158719 IP 10.1.1.1.49153 > 10.1.1.2.9: Flags [.], seq 84681:86141, ack 1, win 65535, length 1460
0.159527 IP 10.1.1.2.9 > 10.1.1.1.49153: Flags [.], ack 61321, win 65535, length 0
0.159921 IP 10.1.1.1.49153 > 10.1.1.2.9: Flags [.], seq 86141:87601, ack 1, win 65535, length 1460
0.160729 IP 10.1.1.2.9 > 10.1.1.1.49153: Flags [.], ack 62781, win 65535, length 0
0.161123 IP 10.1.1.1.49153 > 10.1.1.2.9: Flags [.], seq 87601:89061, ack 1, win 65535, length 1460
0.161931 IP 10.1.1.2.9 > 10.1.1.1.49153: Flags [.], ack 64241, win 65535, length 0
0.162324 IP 10.1.1.1.49153 > 10.1.1.2.9: Flags [.], seq 89061:90521, ack 1, win 65535, length 1460
0.163132 IP 10.1.1.2.9 > 10.1.1.1.49153: Flags [.], ack 65701, win 65535, length 0
0.163526 IP 10.1.1.1.49153 > 10.1.1.2.9: Flags [.], seq 90521:91981, ack 1, win 65535, length 1460
0.164334 IP 10.1.1.2.9 > 10.1.1.1.49153: Flags [.], ack 67161, win 65535, length 0
0.164727 IP 10.1.1.1.49153 > 10.1.1.2.9: Flags [.], seq 91981:93441, ack 1, win 65535, length 1460
0.165535 IP 10.1.1.2.9 > 10.1.1.1.49153: Flags [.], ack 68621, win 65535, length 0
0.165929 IP 10.1.1.1.49153 > 10.1.1.2.9: Flags [.], seq 93441:94901, ack 1, win 65535, length 1460
0.166737 IP 10.1.1.2.9 > 10.1.1.1.49153: Flags [.], ack 70081, win 65535, length 0
0.167131 IP 10.1.1.1.49153 > 10.1.1.2.9: Flags [.], seq 94901:96361, ack 1, win 65535, length 1460
0.167939 IP 10.1.1.2.9 > 10.1.1.1.49153: Flags [.], ack 71541, win 65535, length 0
0.168332 IP 10.1.1.1.49153 > 10.1.1.2.9: Flags [.], seq 96361:97821, ack 1, win 65535, length 1460
0.169140 IP 10.1.1.2.9 > 10.1.1.1.49153: Flags [.], ack 73001, win 65535, length 0
0.169534 IP 10.1.1.1.49153 > 10.1.1.2.9: Flags [.], seq 97821:99281, ack 1, win 65535, length 1460
0.170342 IP 10.1.1.2.9 > 10.1.1.1.49153: Flags [.], ack 74461, win 65535, length 0
0.170735 IP 10.1.1.1.49153 > 10.1.1.2.9: Flags [.], seq 99281:100741, ack 1, win 65535, length 1460
0.171543 IP 10.1.1.2.9 > 10.1.1.1.49153: Flags [.], ack 75921, win 65535, length 0
0.171937 IP 10.1.1.1.49153 > 10.1.1.2.9: Flags [.], seq 100741:102201, ack 1, win 65535, length 1460
0.172745 IP 10.1.1.2.9 > 10.1.1.1.49153: Flags [.], ack 77381, win 65535, length 0
0.173139 IP 10.1.1.1.49153 > 10.1.1.2.9: Flags [.], seq 102201:103661, ack 1, win 65535, length 1460
0.173947 IP 10.1.1.2.9 > 10.1.1.1.49153: Flags [.], ack 78841, win 65535, length 0
0.174340 IP 10.1.1.1.49153 > 10.1.1.2.9: Flags [.], seq 103661:105121, ack 1, win 65535, length 1460
0.175148 IP 10.1.1.2.9 > 10.1.1.1.49153: Flags [.], ack 80301, win 65535, length 0
0.175542 IP 10.1.1.1.49153 > 10.1.1.2.9: Flags [.], seq 105121:106581, ack 1, win 65535, length 1460
0.176350 IP 10.1.1.2.9 > 10.1.1.1.49153: Flags [.], ack 81761, win 65535, length 0
0.176743 IP 10.1.1.1.49153 > 10.1.1.2.9: Flags [.], seq 106581:108041, ack 1, win 65535, length 1460
0.177551 IP 10.1.1.2.9 > 10.1.1.1.49153: Flags [.], ack 83221, win 65535, length 0
0.177945 IP 10.1.1.1.49153 > 10.1.1.2.9: Flags [.], seq 109501:110961, ack 1, win 65535, length 1460
0.178753 IP 10.1.1.2.9 > 10.1.1.1.49153: Flags [.], ack 84681, win 65535, length 0
0.179147 IP 10.1.1.1.49153 > 10.1.1.2.9: Flags [.], seq 112421:113881, ack 1, win 65535, length 1460
0.179955 IP 10.1.1.2.9 > 10.1.1.1.49153: Flags [.], ack 86141, win 65535, length 0
0.180348 IP 10.1.1.1.49153 > 10.1.1.2.9: Flags [.], seq 115341:116801, ack 1, win 65535, length 1460
0.181156 IP 10.1.1.2.9 > 10.1.1.1.49153: Flags [.], ack 87601, win 65535, length 0
0.181550 IP 10.1.1.1.49153 > 10.1.1.2.9: Flags [.], seq 118261:119721, ack 1, win 65535, length 1460
0.182358 IP 10.1.1.2.9 > 10.1.1.1.49153: Flags [.], ack 89061, win 65535, length 0
0.182751 IP 10.1.1.1.49153 > 10.1.1.2.9: Flags [.], seq 121181:122641, ack 1, win 65535, length 1460
0.183559 IP 10.1.1.2.9 > 10.1.1.1.49153: Flags [.], ack 90521, win 65535, length 0
0.183953 IP 10.1.1.1.49153 > 10.1.1.2.9: Flags [.], seq 124101:125561, ack 1, win 65535, length 1460
0.184761 IP 10.1.1.2.9 > 10.1.1.1.49153: Flags [.], ack 91981, win 65535, length 0
0.185155 IP 10.1.1.1.49153 > 10.1.1.2.9: Flags [.], seq 127021:128481, ack 1, win 65535, length 1460
0.185963 IP 10.1.1.2.9 > 10.1.1.1.49153: Flags [.], ack 93441, win 65535, length 0
0.186356 IP 10.1.1.1.49153 > 10.1.1.2.9: Flags [.], seq 128481:129941, ack 1, win 65535, length 1460
0.187164 IP 10.1.1.2.9 > 10.1.1.1.49153: Flags [.], ack 94901, win 65535, length 0
0.187558 IP 10.1.1.1.49153 > 10.1.1.2.9: Flags [.], seq 129941:131401, ack 1, win 65535, length 1460
0.188366 IP 10.1.1.2.9 > 10.1.1.1.49153: Flags [.], ack 96361, win 65535, length 0
0.188759 IP 10.1.1.1.49153 > 10.1.1.2.9: Flags [.], seq 131401:132861, ack 1, win 65535, length 1460
0.189567 IP 10.1.1.2.9 > 10.1.1.1.49153: Flags [.], ack 97821, win 65535, length 0
0.189961 IP 10.1.1.1.49153 > 10.1.1.2.9: Flags [.], seq 132861:134321, ack 1, win 65535, length 1460
0.190769 IP 10.1.1.2.9 > 10.1.1.1.49153: Flags [.], ack 99281, win 65535, length 0
0.191163 IP 10.1.1.1.49153 > 10.1.1.2.9: Flags [.], seq 134321:135781, ack 1, win 65535, length 1460
0.191971 IP 10.1.1.2.9 > 10.1.1.1.49153: Flags [.], ack 100741, win 65535, length 0
0.192364 IP 10.1.1.1.49153 > 10.1.1.2.9: Flags [.], seq 135781:137241, ack 1, win 65535, length 1460
0.193172 IP 10.1.1.2.9 > 10.1.1.1.49153: Flags [.], ack 102201, win 65535, length 0
0.193566 IP 10.1.1.1.49153 > 10.1.1.2.9: Flags [.], seq 137241:138701, ack 1, win 65535, length 1460
0.194374 IP 10.1.1.2.9 > 10.1.1.1.49153: Flags [.], ack 103661, win 65535, length 0
0.194767 IP 10.1.1.1.49153 > 10.1.1.2.9: Flags [.], seq 138701:140161, ack 1, win 65535, length 1460
0.195575 IP 10.1.1.2.9 > 10.1.1.1.49153: Flags [.], ack 105121, win 65535, length 0
0.195969 IP 10.1.1.1.49153 > 10.1.1.2.9: Flags [.], seq 140161:141621, ack 1, win 65535, length 1460
0.196777 IP 10.1.1.2.9 > 10.1.1.1.49153: Flags [.], ack 106581, win 65535, length 0
0.197171 IP 10.1.1.1.49153 > 10.1.1.2.9: Flags [.], seq 141621:143081, ack 1, win 65535, length 1460
0.197979 IP 10.1.1.2.9 > 10.1.1.1.49153: Flags [.], ack 108041, win 65535, length 0
0.198372 IP 10.1.1.1.49153 > 10.1.1.2.9: Flags [.], seq 143081:144541, ack 1, win 65535, length 1460
0.199180 IP 10.1.1.2.9 > 10.1.1.1.49153: Flags [.], ack 108041, win 65535, length 0
0.199574 IP 10.1.1.1.49153 > 10.1.1.2.9: Flags [.], seq 144541:146001, ack 1, win 65535, length 1460
0.200382 IP 10.1.1.2.9 > 10.1.1.1.49153: Flags [.], ack 108041, win 65535, length 0
0.200775 IP 10.1.1.1.49153 > 10.1.1.2.9: Flags [.], seq 146001:147461, ack 1, win 65535, length 1460
0.201583 IP 10.1.1.2.9 > 10.1.1.1.49153: Flags [.], ack 108041, win 65535, length 0
0.201977 IP 10.1.1.1.49153 > 10.1.1.2.9: Flags [.], seq 147461:148921, ack 1, win 65535, length 1460
0.202785 IP 10.1.1.2.9 > 10.1.1.1.49153: Flags [.], ack 108041, win 65535, length 0
0.203179 IP 10.1.1.1.49153 > 10.1.1.2.9: Flags [.], seq 148921:150381, ack 1, win 65535, length 1460
0.203987 IP 10.1.1.2.9 > 10.1.1.1.49153: Flags [.], ack 108041, win 65535, length 0
0.204380 IP 10.1.1.1.49153 > 10.1.1.2.9: Flags [.], seq 150381:151841, ack 1, win 65535, length 1460
0.205188 IP 10.1.1.2.9 > 10.1.1.1.49153: Flags [.], ack 108041, win 65535, length 0
0.205582 IP 10.1.1.1.49153 > 10.1.1.2.9: Flags [.], seq 151841:153301, ack 1, win 65535, length 1460
0.206390 IP 10.1.1.2.9 > 10.1.1.1.49153: Flags [.], ack 108041, win 65535, length 0
0.206783 IP 10.1.1.1.49153 > 10.1.1.2.9: Flags [.], seq 153301:154761, ack 1, win 65535, length 1460
0.207591 IP 10.1.1.2.9 > 10.1.1.1.49153: Flags [.], ack 108041, win 65535, length 0
0.207985 IP 10.1.1.1.49153 > 10.1.1.2.9: Flags [.], seq 154761:156221, ack 1, win 65535, length 1460
0.208793 IP 10.1.1.2.9 > 10.1.1.1.49153: Flags [.], ack 108041, win 65535, length 0
0.209187 IP 10.1.1.1.49153 > 10.1.1.2.9: Flags [.], seq 156221:157681, ack 1, win 65535, length 1460
0.209995 IP 10.1.1.2.9 > 10.1.1.1.49153: Flags [.], ack 108041, win 65535, length 0
0.210388 IP 10.1.1.1.49153 > 10.1.1.2.9: Flags [.], seq 157681:159141, ack 1, win 65535, length 1460
0.211196 IP 10.1.1.2.9 > 10.1.1.1.49153: Flags [.], ack 108041, win 65535, length 0
0.211590 IP 10.1.1.1.49153 > 10.1.1.2.9: Flags [.], seq 159141:160601, ack 1, win 65535, length 1460
0.212398 IP 10.1.1.2.9 > 10.1.1.1.49153: Flags [.], ack 108041, win 65535, length 0
0.212791 IP 10.1.1.1.49153 > 10.1.1.2.9: Flags [.], seq 160601:162061, ack 1, win 65535, length 1460
0.213599 IP 10.1.1.2.9 > 10.1.1.1.49153: Flags [.], ack 108041, win 65535, length 0
0.213993 IP 10.1.1.1.49153 > 10.1.1.2.9: Flags [.], seq 162061:163521, ack 1, win 65535, length 1460
0.214801 IP 10.1.1.2.9 > 10.1.1.1.49153: Flags [.], ack 108041, win 65535, length 0
0.215195 IP 10.1.1.1.49153 > 10.1.1.2.9: Flags [.], seq 163521:164981, ack 1, win 65535, length 1460
0.216003 IP 10.1.1.2.9 > 10.1.1.1.49153: Flags [.], ack 108041, win 65535, length 0
0.216396 IP 10.1.1.1.49153 > 10.1.1.2.9: Flags [.], seq 164981:166441, ack 1, win 65535, length 1460
0.217204 IP 10.1.1.2.9 > 10.1.1.1.49153: Flags [.], ack 108041, win 65535, length 0
0.217598 IP 10.1.1.1.49153 > 10.1.1.2.9: Flags [.], seq 166441:167901, ack 1, win 65535, length 1460
0.218406 IP 10.1.1.2.9 > 10.1.1.1.49153: Flags [.], ack 108041, win 65535, length 0
0.218799 IP 10.1.1.1.49153 > 10.1.1.2.9: Flags [.], seq 167901:169361, ack 1, win 65535, length 1460
0.219607 IP 10.1.1.2.9 > 10.1.1.1.49153: Flags [.], ack 108041, win 65535, length 0
0.220001 IP 10.1.1.1.49153 > 10.1.1.2.9: Flags [.], seq 169361:170821, ack 1, win 65535, length 1460
0.220809 IP 10.1.1.2.9 > 10.1.1.1.49153: Flags [.], ack 108041, win 65535, length 0
0.221203 IP 10.1.1.1.49153 > 10.1.1.2.9: Flags [.], seq 170821:172281, ack 1, win 65535, length 1460
0.222011 IP 10.1.1.2.9 > 10.1.1.1.49153: Flags [.], ack 108041, win 65535, length 0
0.222404 IP 10.1.1.1.49153 > 10.1.1.2.9: Flags [.], seq 108041:109501, ack 1, win 65535, length 1460
0.223212 IP 10.1.1.2.9 > 10.1.1.1.49153: Flags [.], ack 108041, win 65535, length 0
0.224414 IP 10.1.1.2.9 > 10.1.1.1.49153: Flags [.], ack 108041, win 65535, length 0
0.225615 IP 10.1.1.2.9 > 10.1.1.1.49153: Flags [.], ack 108041, win 65535, length 0
0.226817 IP 10.1.1.2.9 > 10.1.1.1.49153: Flags [.], ack 108041, win 65535, length 0
0.228019 IP 10.1.1.2.9 > 10.1.1.1.49153: Flags [.], ack 108041, win 65535, length 0
0.229220 IP 10.1.1.2.9 > 10.1.1.1.49153: Flags [.], ack 108041, win 65535, length 0
0.230422 IP 10.1.1.2.9 > 10.1.1.1.49153: Flags [.], ack 108041, win 65535, length 0
0.231623 IP 10.1.1.2.9 > 10.1.1.1.49153: Flags [.], ack 108041, win 65535, length 0
0.232825 IP 10.1.1.2.9 > 10.1.1.1.49153: Flags [.], ack 108041, win 65535, length 0
0.234027 IP 10.1.1.2.9 > 10.1.1.1.49153: Flags [.], ack 108041, win 65535, length 0
0.235228 IP 10.1.1.2.9 > 10.1.1.1.49153: Flags [.], ack 108041, win 65535, length 0
0.236430 IP 10.1.1.2.9 > 10.1.1.1.49153: Flags [.], ack 108041, win 65535, length 0
0.237631 IP 10.1.1.2.9 > 10.1.1.1.49153: Flags [.], ack 108041, win 65535, length 0
0.238833 IP 10.1.1.2.9 > 10.1.1.1.49153: Flags [.], ack 108041, win 65535, length 0
0.240035 IP 10.1.1.2.9 > 10.1.1.1.49153: Flags [.], ack 108041, win 65535, length 0
0.241236 IP 10.1.1.2.9 > 10.1.1.1.49153: Flags [.], ack 108041, win 65535, length 0
0.242438 IP 10.1.1.2.9 > 10.1.1.1.49153: Flags [.], ack 108041, win 65535, length 0
0.243639 IP 10.1.1.2.9 > 10.1.1.1.49153: Flags [.], ack 110961, win 65535, length 0
0.243639 IP 10.1.1.1.49153 > 10.1.1.2.9: Flags [.], seq 172281:173741, ack 1, win 65535, length 1460
0.244841 IP 10.1.1.1.49153 > 10.1.1.2.9: Flags [.], seq 173741:175201, ack 1, win 65535, length 1460
0.246043 IP 10.1.1.1.49153 > 10.1.1.2.9: Flags [.], seq 110961:112421, ack 1, win 65535, length 1460
0.264875 IP 10.1.1.2.9 > 10.1.1.1.49153: Flags [.], ack 110961, win 65535, length 0
0.266076 IP 10.1.1.2.9 > 10.1.1.1.49153: Flags [.], ack 110961, win 65535, length 0
0.267278 IP 10.1.1.2.9 > 10.1.1.1.49153: Flags [.], ack 113881, win 65535, length 0
0.267278 IP 10.1.1.1.49153 > 10.1.1.2.9: Flags [.], seq 175201:176661, ack 1, win 65535, length 1460
0.268479 IP 10.1.1.1.49153 > 10.1.1.2.9: Flags [.], seq 176661:178121, ack 1, win 65535, length 1460
0.269681 IP 10.1.1.1.49153 > 10.1.1.2.9: Flags [.], seq 113881:115341, ack 1, win 65535, length 1460
0.288513 IP 10.1.1.2.9 > 10.1.1.1.49153: Flags [.], ack 113881, win 65535, length 0
0.289715 IP 10.1.1.2.9 > 10.1.1.1.49153: Flags [.], ack 113881, win 65535, length 0
0.290916 IP 10.1.1.2.9 > 10.1.1.1.49153: Flags [.], ack 116801, win 65535, length 0
0.290916 IP 10.1.1.1.49153 > 10.1.1.2.9: Flags [.], seq 178121:179581, ack 1, win 65535, length 1460
0.292118 IP 10.1.1.1.49153 > 10.1.1.2.9: Flags [.], seq 179581:181041, ack 1, win 65535, length 1460
0.293319 IP 10.1.1.1.49153 > 10.1.1.2.9: Flags [.], seq 116801:118261, ack 1, win 65535, length 1460
0.312151 IP 10.1.1.2.9 > 10.1.1.1.49153: Flags [.], ack 116801, win 65535, length 0
0.313353 IP 10.1.1.2.9 > 10.1.1.1.49153: Flags [.], ack 116801, win 65535, length 0
0.314555 IP 10.1.1.2.9 > 10.1.1.1.49153: Flags [.], ack 119721, win 65535, length 0
0.314555 IP 10.1.1.1.49153 > 10.1.1.2.9: Flags [.], seq 181041:182501, ack 1, win 65535, length 1460
0.315756 IP 10.1.1.1.49153 > 10.1.1.2.9: Flags [.], seq 182501:183961, ack 1, win 65535, length 1460
0.316958 IP 10.1.1.1.49153 > 10.1.1.2.9: Flags [.], seq 119721:121181, ack 1, win 65535, length 1460
0.335790 IP 10.1.1.2.9 > 10.1.1.1.49153: Flags [.], ack 119721, win 65535, length 0
0.336991 IP 10.1.1.2.9 > 10.1.1.1.49153: Flags [.], ack 119721, win 65535, length 0
0.338193 IP 10.1.1.2.9 > 10.1.1.1.49153: Flags [.], ack 122641, win 65535, length 0
0.338193 IP 10.1.1.1.49153 > 10.1.1.2.9: Flags [.], seq 183961:185421, ack 1, win 65535, length 1460
0.339395 IP 10.1.1.1.49153 > 10.1.1.2.9: Flags [.], seq 185421:186881, ack 1, win 65535, length 1460
0.340596 IP 10.1.1.1.49153 > 10.1.1.2.9: Flags [.], seq 122641:124101, ack 1, win 65535, length 1460
0.359428 IP 10.1.1.2.9 > 10.1.1.1.49153: Flags [.], ack 122641, win 65535, length 0
0.360630 IP 10.1.1.2.9 > 10.1.1.1.49153: Flags [.], ack 122641, win 65535, length 0
0.361831 IP 10.1.1.2.9 > 10.1.1.1.49153: Flags [.], ack 125561, win 65535, length 0
0.361831 IP 10.1.1.1.49153 > 10.1.1.2.9: Flags [.], seq 186881:188341, ack 1, win 65535, length 1460
0.363033 IP 10.1.1.1.49153 > 10.1.1.2.9: Flags [.], seq 188341:189801, ack 1, win 65535, length 1460
0.364235 IP 10.1.1.1.49153 > 10.1.1.2.9: Flags [.], seq 125561:127021, ack 1, win 65535, length 1460
0.383067 IP 10.1.1.2.9 > 10.1.1.1.49153: Flags [.], ack 125561, win 65535, length 0
0.384268 IP 10.1.1.2.9 > 10.1.1.1.49153: Flags [.], ack 125561, win 65535, length 0
0.385470 IP 10.1.1.2.9 > 10.1.1.1.49153: Flags [.], ack 189801, win 65535, length 0
0.385470 IP 10.1.1.1.49153 > 10.1.1.2.9: Flags [.], seq 189801:191261, ack 1, win 65535, length 1460
0.386671 IP 10.1.1.1.49153 > 10.1.1.2.9: Flags [.], seq 191261:192721, ack 1, win 65535, length 1460
0.387873 IP 10.1.1.1.49153 > 10.1.1.2.9: Flags [.], seq 192721:194181, ack 1, win 65535, length 1460
0.389075 IP 10.1.1.1.49153 > 10.1.1.2.9: Flags [.], seq 194181:195641, ack 1, win 65535, length 1460
0.390276 IP 10.1.1.1.49153 > 10.1.1.2.9: Flags [.], seq 195641:197101, ack 1, win 65535, length 1460
0.391478 IP 10.1.1.1.49153 > 10.1.1.2.9: Flags [.], seq 197101:198561, ack 1, win 65535, length 1460
0.392679 IP 10.1.1.1.49153 > 10.1.1.2.9: Flags [.], seq 198561:200021, ack 1, win 65535, length 1460
0.393881 IP 10.1.1.1.49153 > 10.1.1.2.9: Flags [.], seq 200021:201481, ack 1, win 65535, length 1460
0.395083 IP 10.1.1.1.49153 > 10.1.1.2.9: Flags [.], seq 201481:202941, ack 1, win 65535, length 1460
0.396284 IP 10.1.1.1.49153 > 10.1.1.2.9: Flags [.], seq 202941:204401, ack 1, win 65535, length 1460
0.397486 IP 10.1.1.1.49153 > 10.1.1.2.9: Flags [.], seq 204401:205861, ack 1, win 65535, length 1460
0.398687 IP 10.1.1.1.49153 > 10.1.1.2.9: Flags [.], seq 205861:207321, ack 1, win 65535, length 1460
0.399889 IP 10.1.1.1.49153 > 10.1.1.2.9: Flags [.], seq 207321:208781, ack 1, win 65535, length 1460
0.401091 IP 10.1.1.1.49153 > 10.1.1.2.9: Flags [.], seq 208781:210241, ack 1, win 65535, length 1460
0.402292 IP 10.1.1.1.49153 > 10.1.1.2.9: Flags [.], seq 210241:211701, ack 1, win 65535, length 1460
0.403494 IP 10.1.1.1.49153 > 10.1.1.2.9: Flags [.], seq 211701:213161, ack 1, win 65535, length 1460
0.404695 IP 10.1.1.1.49153 > 10.1.1.2.9: Flags [.], seq 213161:214621, ack 1, win 65535, length 1460
0.405897 IP 10.1.1.1.49153 > 10.1.1.2.9: Flags [.], seq 214621:216081, ack 1, win 65535, length 1460
0.406705 IP 10.1.1.2.9 > 10.1.1.1.49153: Flags [.], ack 191261, win 65535, length 0
0.407099 IP 10.1.1.1.49153 > 10.1.1.2.9: Flags [.], seq 216081:217541, ack 1, win 65535, length 1460
0.407907 IP 10.1.1.2.9 > 10.1.1.1.49153: Flags [.], ack 192721, win 65535, length 0
0.408300 IP 10.1.1.1.49153 > 10.1.1.2.9: Flags [.], seq 217541:219001, ack 1, win 65535, length 1460
0.409108 IP 10.1.1.2.9 > 10.1.1.1.49153: Flags [.], ack 194181, win 65535, length 0
0.409502 IP 10.1.1.1.49153 > 10.1.1.2.9: Flags [.], seq 219001:220461, ack 1, win 65535, length 1460
0.410310 IP 10.1.1.2.9 > 10.1.1.1.49153: Flags [.], ack 195641, win 65535, length 0
0.410703 IP 10.1.1.1.49153 > 10.1.1.2.9: Flags [.], seq 221921:223381, ack 1, win 65535, length 1460
0.411511 IP 10.1.1.2.9 > 10.1.1.1.49153: Flags [.], ack 197101, win 65535, length 0
0.411905 IP 10.1.1.1.49153 > 10.1.1.2.9: Flags [.], seq 223381:224841, ack 1, win 65535, length 1460
0.412713 IP 10.1.1.2.9 > 10.1.1.1.49153: Flags [.], ack 198561, win 65535, length 0
0.413107 IP 10.1.1.1.49153 > 10.1.1.2.9: Flags [.], seq 224841:226301, ack 1, win 65535, length 1460
0.413915 IP 10.1.1.2.9 > 10.1.1.1.49153: Flags [.], ack 200021, win 65535, length 0
0.414308 IP 10.1.1.1.49153 > 10.1.1.2.9: Flags [.], seq 226301:227761, ack 1, win 65535, length 1460
0.415116 IP 10.1.1.2.9 > 10.1.1.1.49153: Flags [.], ack 201481, win 65535, length 0
0.415510 IP 10.1.1.1.49153 > 10.1.1.2.9: Flags [.], seq 227761:229221, ack 1, win 65535, length 1460
0.416318 IP 10.1.1.2.9 > 10.1.1.1.49153: Flags [.], ack 202941, win 65535, length 0
0.416711 IP 10.1.1.1.49153 > 10.1.1.2.9: Flags [.], seq 229221:230681, ack 1, win 65535, length 1460
0.417519 IP 10.1.1.2.9 > 10.1.1.1.49153: Flags [.], ack 204401, win 65535, length 0
0.417913 IP 10.1.1.1.49153 > 10.1.1.2.9: Flags [.], seq 230681:232141, ack 1, win 65535, length 1460
0.418721 IP 10.1.1.2.9 > 10.1.1.1.49153: Flags [.], ack 205861, win 65535, length 0
0.419115 IP 10.1.1.1.49153 > 10.1.1.2.9: Flags [.], seq 232141:233601, ack 1, win 65535, length 1460
0.419923 IP 10.1.1.2.9 > 10.1.1.1.49153: Flags [.], ack 207321, win 65535, length 0
0.420316 IP 10.1.1.1.49153 > 10.1.1.2.9: Flags [.], seq 233601:235061, ack 1, win 65535, length 1460
0.421124 IP 10.1.1.2.9 > 10.1.1.1.49153: Flags [.], ack 208781, win 65535, length 0
0.421518 IP 10.1.1.1.49153 > 10.1.1.2.9: Flags [.], seq 235061:236521, ack 1, win 65535, length 1460
0.422326 IP 10.1.1.2.9 > 10.1.1.1.49153: Flags [.], ack 210241, win 65535, length 0
0.422719 IP 10.1.1.1.49153 > 10.1.1.2.9: Flags [.], seq 236521:237981, ack 1, win 65535, length 1460
0.423527 IP 10.1.1.2.9 > 10.1.1.1.49153: Flags [.], ack 211701, win 65535, length 0
0.423921 IP 10.1.1.1.49153 > 10.1.1.2.9: Flags [.], seq 237981:239441, ack 1, win 65535, length 1460
0.424729 IP 10.1.1.2.9 > 10.1.1.1.49153: Flags [.], ack 213161, win 65535, length 0
0.425123 IP 10.1.1.1.49153 > 10.1.1.2.9: Flags [.], seq 239441:240901, ack 1, win 65535, length 1460
0.425931 IP 10.1.1.2.9 > 10.1.1.1.49153: Flags [.], ack 214621, win 65535, length 0
0.426324 IP 10.1.1.1.49153 > 10.1.1.2.9: Flags [.], seq 240901:242361, ack 1, win 65535, length 1460
0.427132 IP 10.1.1.2.9 > 10.1.1.1.49153: Flags [.], ack 216081, win 65535, length 0
0.427526 IP 10.1.1.1.49153 > 10.1.1.2.9: Flags [.], seq 242361:243821, ack 1, win 65535, length 1460
0.428334 IP 10.1.1.2.9 > 10.1.1.1.49153: Flags [.], ack 217541, win 65535, length 0
0.428727 IP 10.1.1.1.49153 > 10.1.1.2.9: Flags [.], seq 243821:245281, ack 1, win 65535, length 1460
0.429535 IP 10.1.1.2.9 > 10.1.1.1.49153: Flags [.], ack 219001, win 65535, length 0
0.429929 IP 10.1.1.1.49153 > 10.1.1.2.9: Flags [.], seq 245281:246741, ack 1, win 65535, length 1460
0.430737 IP 10.1.1.2.9 > 10.1.1.1.49153: Flags [.], ack 220461, win 65535, length 0
0.431131 IP 10.1.1.1.49153 > 10.1.1.2.9: Flags [.], seq 246741:248201, ack 1, win 65535, length 1460
0.431939 IP 10.1.1.2.9 > 10.1.1.1.49153: Flags [.], ack 220461, win 65535, length 0
0.432332 IP 10.1.1.1.49153 > 10.1.1.2.9: Flags [.], seq 248201:249661, ack 1, win 65535, length 1460
0.433140 IP 10.1.1.2.9 > 10.1.1.1.49153: Flags [.], ack 220461, win 65535, length 0
0.433534 IP 10.1.1.1.49153 > 10.1.1.2.9: Flags [.], seq 249661:251121, ack 1, win 65535, length 1460
0.434342 IP 10.1.1.2.9 > 10.1.1.1.49153: Flags [.], ack 220461, win 65535, length 0
0.434735 IP 10.1.1.1.49153 > 10.1.1.2.9: Flags [.], seq 251121:252581, ack 1, win 65535, length 1460
0.435543 IP 10.1.1.2.9 > 10.1.1.1.49153: Flags [.], ack 220461, win 65535, length 0
0.435937 IP 10.1.1.1.49153 > 10.1.1.2.9: Flags [.], seq 220461:221921, ack 1, win 65535, length 1460
0.436745 IP 10.1.1.2.9 > 10.1.1.1.49153: Flags [.], ack 220461, win 65535, length 0
0.437947 IP 10.1.1.2.9 > 10.1.1.1.49153: Flags [.], ack 220461, win 65535, length 0
0.439148 IP 10.1.1.2.9 > 10.1.1.1.49153: Flags [.], ack 220461, win 65535, length 0
0.440350 IP 10.1.1.2.9 > 10.1.1.1.49153: Flags [.], ack 220461, win 65535, length 0
0.441551 IP 10.1.1.2.9 > 10.1.1.1.49153: Flags [.], ack 220461, win 65535, length 0
0.442753 IP 10.1.1.2.9 > 10.1.1.1.49153: Flags [.], ack 220461, win 65535, length 0
0.443955 IP 10.1.1.2.9 > 10.1.1.1.49153: Flags [.], ack 220461, win 65535, length 0
0.445156 IP 10.1.1.2.9 > 10.1.1.1.49153: Flags [.], ack 220461, win 65535, length 0
0.445156 IP 10.1.1.1.49153 > 10.1.1.2.9: Flags [.], seq 252581:254041, ack 1, win 65535, length 1460
0.446358 IP 10.1.1.2.9 > 10.1.1.1.49153: Flags [.], ack 220461, win 65535, length 0
0.446358 IP 10.1.1.1.49153 > 10.1.1.2.9: Flags [.], seq 254041:255501, ack 1, win 65535, length 1460
0.447559 IP 10.1.1.2.9 > 10.1.1.1.49153: Flags [.], ack 220461, win 65535, length 0
0.447559 IP 10.1.1.1.49153 > 10.1.1.2.9: Flags [.], seq 255501:256961, ack 1, win 65535, length 1460
0.448761 IP 10.1.1.2.9 > 10.1.1.1.49153: Flags [.], ack 220461, win 65535, length 0
0.448761 IP 10.1.1.1.49153 > 10.1.1.2.9: Flags [.], seq 256961:258421, ack 1, win 65535, length 1460
0.449963 IP 10.1.1.2.9 > 10.1.1.1.49153: Flags [.], ack 220461, win 65535, length 0
0.449963 IP 10.1.1.1.49153 > 10.1.1.2.9: Flags [.], seq 258421:259881, ack 1, win 65535, length 1460
0.451164 IP 10.1.1.2.9 > 10.1.1.1.49153: Flags [.], ack 220461, win 65535, length 0
0.451164 IP 10.1.1.1.49153 > 10.1.1.2.9: Flags [.], seq 259881:261341, ack 1, win 65535, length 1460
0.452366 IP 10.1.1.2.9 > 10.1.1.1.49153: Flags [.], ack 220461, win 65535, length 0
0.452366 IP 10.1.1.1.49153 > 10.1.1.2.9: Flags [.], seq 261341:262801, ack 1, win 65535, length 1460
0.453567 IP 10.1.1.2.9 > 10.1.1.1.49153: Flags [.], ack 220461, win 65535, length 0
0.453567 IP 10.1.1.1.49153 > 10.1.1.2.9: Flags [.], seq 262801:264261, ack 1, win 65535, length 1460
0.454769 IP 10.1.1.2.9 > 10.1.1.1.49153: Flags [.], ack 220461, win 65535, length 0
0.454769 IP 10.1.1.1.49153 > 10.1.1.2.9: Flags [.], seq 264261:265721, ack 1, win 65535, length 1460
0.455971 IP 10.1.1.2.9 > 10.1.1.1.49153: Flags [.], ack 220461, win 65535, length 0
0.455971 IP 10.1.1.1.49153 > 10.1.1.2.9: Flags [.], seq 265721:267181, ack 1, win 65535, length 1460
0.457172 IP 10.1.1.2.9 > 10.1.1.1.49153: Flags [.], ack 252581, win 65535, length 0
0.457172 IP 10.1.1.1.49153 > 10.1.1.2.9: Flags [.], seq 267181:268641, ack 1, win 65535, length 1460
0.466391 IP 10.1.1.2.9 > 10.1.1.1.49153: Flags [.], ack 254041, win 65535, length 0
0.466391 IP 10.1.1.1.49153 > 10.1.1.2.9: Flags [.], seq 268641:270101, ack 1, win 65535, length 1460
0.467593 IP 10.1.1.2.9 > 10.1.1.1.49153: Flags [.], ack 255501, win 65535, length 0
0.467593 IP 10.1.1.1.49153 > 10.1.1.2.9: Flags [.], seq 270101:271561, ack 1, win 65535, length 1460
0.468795 IP 10.1.1.2.9 > 10.1.1.1.49153: Flags [.], ack 256961, win 65535, length 0
0.468795 IP 10.1.1.1.49153 > 10.1.1.2.9: Flags [.], seq 271561:273021, ack 1, win 65535, length 1460
0.469996 IP 10.1.1.2.9 > 10.1.1.1.49153: Flags [.], ack 258421, win 65535, length 0
0.469996 IP 10.1.1.1.49153 > 10.1.1.2.9: Flags [.], seq 273021:274481, ack 1, win 65535, length 1460
0.471198 IP 10.1.1.2.9 > 10.1.1.1.49153: Flags [.], ack 259881, win 65535, length 0
0.471198 IP 10.1.1.1.49153 > 10.1.1.2.9: Flags [.], seq 274481:275941, ack 1, win 65535, length 1460
0.472399 IP 10.1.1.2.9 > 10.1.1.1.49153: Flags [.], ack 261341, win 65535, length 0
0.472399 IP 10.1.1.1.49153 > 10.1.1.2.9: Flags [.], seq 275941:277401, ack 1, win 65535, length 1460
0.473601 IP 10.1.1.2.9 > 10.1.1.1.49153: Flags [.], ack 262801, win 65535, length 0
0.473601 IP 10.1.1.1.49153 > 10.1.1.2.9: Flags [.], seq 277401:278861, ack 1, win 65535, length 1460
0.474803 IP 10.1.1.2.9 > 10.1.1.1.49153: Flags [.], ack 264261, win 65535, length 0
0.474803 IP 10.1.1.1.49153 > 10.1.1.2.9: Flags [.], seq 278861:280321, ack 1, win 65535, length 1460
0.476004 IP 10.1.1.2.9 > 10.1.1.1.49153: Flags [.], ack 265721, win 65535, length 0
0.476004 IP 10.1.1.1.49153 > 10.1.1.2.9: Flags [.], seq 280321:281781, ack 1, win 65535, length 1460
0.477206 IP 10.1.1.2.9 > 10.1.1.1.49153: Flags [.], ack 267181, win 65535, length 0
0.477206 IP 10.1.1.1.49153 > 10.1.1.2.9: Flags [.], seq 281781:283241, ack 1, win 65535, length 1460
0.478407 IP 10.1.1.2.9 > 10.1.1.1.49153: Flags [.], ack 268641, win 65535, length 0
0.478407 IP 10.1.1.1.49153 > 10.1.1.2.9: Flags [.], seq 283241:284701, ack 1, win 65535, length 1460
0.479609 IP 10.1.1.1.49153 > 10.1.1.2.9: Flags [.], seq 284701:286161, ack 1, win 65535, length 1460
0.487627 IP 10.1.1.2.9 > 10.1.1.1.49153: Flags [.], ack 270101, win 65535, length 0
0.487627 IP 10.1.1.1.49153 > 10.1.1.2.9: Flags [.], seq 286161:287621, ack 1, win 65535, length 1460
0.488828 IP 10.1.1.2.9 > 10.1.1.1.49153: Flags [.], ack 271561, win 65535, length 0
0.488828 IP 10.1.1.1.49153 > 10.1.1.2.9: Flags [.], seq 287621:289081, ack 1, win 65535, length 1460
0.490030 IP 10.1.1.2.9 > 10.1.1.1.49153: Flags [.], ack 273021, win 65535, length 0
0.490030 IP 10.1.1.1.49153 > 10.1.1.2.9: Flags [.], seq 289081:290541, ack 1, win 65535, length 1460
0.491231 IP 10.1.1.2.9 > 10.1.1.1.49153: Flags [.], ack 274481, win 65535, length 0
0.491231 IP 10.1.1.1.49153 > 10.1.1.2.9: Flags [.], seq 290541:292001, ack 1, win 65535, length 1460
0.492433 IP 10.1.1.2.9 > 10.1.1.1.49153: Flags [.], ack 275941, win 65535, length 0
0.492433 IP 10.1.1.1.49153 > 10.1.1.2.9: Flags [.], seq 292001:293461, ack 1, win 65535, length 1460
0.493635 IP 10.1.1.2.9 > 10.1.1.1.49153: Flags [.], ack 277401, win 65535, length 0
0.493635 IP 10.1.1.1.49153 > 10.1.1.2.9: Flags [.], seq 293461:294921, ack 1, win 65535, length 1460
0.494836 IP 10.1.1.2.9 > 10.1.1.1.49153: Flags [.], ack 278861, win 65535, length 0
0.494836 IP 10.1.1.1.49153 > 10.1.1.2.9: Flags [.], seq 294921:296381, ack 1, win 65535, length 1460
0.496038 IP 10.1.1.2.9 > 10.1.1.1.49153: Flags [.], ack 280321, win 65535, length 0
0.496038 IP 10.1.1.1.49153 > 10.1.1.2.9: Flags [.], seq 296381:297841, ack 1, win 65535, length 1460
0.497239 IP 10.1.1.2.9 > 10.1.1.1.49153: Flags [.], ack 281781, win 65535, length 0
0.497239 IP 10.1.1.1.49153 > 10.1.1.2.9: Flags [.], seq 297841:299301, ack 1, win 65535, length 1460
0.498441 IP 10.1.1.2.9 > 10.1.1.1.49153: Flags [.], ack 283241, win 65535, length 0
0.498441 IP 10.1.1.1.49153 > 10.1.1.2.9: Flags [.], seq 299301:300761, ack 1, win 65535, length 1460
0.499643 IP 10.1.1.2.9 > 10.1.1.1.49153: Flags [.], ack 284701, win 65535, length 0
0.499643 IP 10.1.1.1.49153 > 10.1.1.2.9: Flags [.], seq 300761:302221, ack 1, win 65535, length 1460
0.500844 IP 10.1.1.2.9 > 10.1.1.1.49153: Flags [.], ack 286161, win 65535, length 0
0.500844 IP 10.1.1.1.49153 > 10.1.1.2.9: Flags [.], seq 302221:303681, ack 1, win 65535, length 1460
0.508862 IP 10.1.1.2.9 > 10.1.1.1.49153: Flags [.], ack 287621, win 65535, length 0
0.508862 IP 10.1.1.1.49153 > 10.1.1.2.9: Flags [.], seq 303681:305141, ack 1, win 65535, length 1460
0.510063 IP 10.1.1.2.9 > 10.1.1.1.49153: Flags [.], ack 289081, win 65535, length 0
0.510063 IP 10.1.1.1.49153 > 10.1.1.2.9: Flags [.], seq 305141:306601, ack 1, win 65535, length 1460
0.511265 IP 10.1.1.2.9 > 10.1.1.1.49153: Flags [.], ack 290541, win 65535, length 0
0.511265 IP 10.1.1.1.49153 > 10.1.1.2.9: Flags [.], seq 306601:308061, ack 1, win 65535, length 1460
0.512467 IP 10.1.1.2.9 > 10.1.1.1.49153: Flags [.], ack 292001, win 65535, length 0
0.512467 IP 10.1.1.1.49153 > 10.1.1.2.9: Flags [.], seq 308061:309521, ack 1, win 65535, length 1460
0.513668 IP 10.1.1.2.9 > 10.1.1.1.49153: Flags [.], ack 293461, win 65535, length 0
0.513668 IP 10.1.1.1.49153 > 10.1.1.2.9: Flags [.], seq 309521:310981, ack 1, win 65535, length 1460
0.514870 IP 10.1.1.2.9 > 10.1.1.1.49153: Flags [.], ack 294921, win 65535, length 0
0.514870 IP 10.1.1.1.49153 > 10.1.1.2.9: Flags [.], seq 310981:312441, ack 1, win 65535, length 1460
0.516071 IP 10.1.1.2.9 > 10.1.1.1.49153: Flags [.], ack 296381, win 65535, length 0
0.516071 IP 10.1.1.1.49153 > 10.1.1.2.9: Flags [.], seq 312441:313901, ack 1, win 65535, length 1460
0.517273 IP 10.1.1.2.9 > 10.1.1.1.49153: Flags [.], ack 297841, win 65535, length 0
0.517273 IP 10.1.1.1.49153 > 10.1.1.2.9: Flags [.], seq 313901:315361, ack 1, win 65535, length 1460
0.518475 IP 10.1.1.2.9 > 10.1.1.1.49153: Flags [.], ack 299301, win 65535, length 0
0.518475 IP 10.1.1.1.49153 > 10.1.1.2.9: Flags [.], seq 315361:316821, ack 1, win 65535, length 1460
0.519676 IP 10.1.1.2.9 > 10.1.1.1.49153: Flags [.], ack 300761, win 65535, length 0
0.519676 IP 10.1.1.1.49153 > 10.1.1.2.9: Flags [.], seq 316821:318281, ack 1, win 65535, length 1460
0.520878 IP 10.1.1.2.9 > 10.1.1.1.49153: Flags [.], ack 302221, win 65535, length 0
0.520878 IP 10.1.1.1.49153 > 10.1.1.2.9: Flags [.], seq 318281:319741, ack 1, win 65535, length 1460
0.522079 IP 10.1.1.2.9 > 10.1.1.1.49153: Flags [.], ack 303681, win 65535, length 0
0.522079 IP 10.1.1.1.49153 > 10.1.1.2.9: Flags [.], seq 319741:321201, ack 1, win 65535, length 1460
0.523281 IP 10.1.1.1.49153 > 10.1.1.2.9: Flags [.], seq 321201:322661, ack 1, win 65535, length 1460
0.530097 IP 10.1.1.2.9 > 10.1.1.1.49153: Flags [.], ack 305141, win 65535, length 0
0.530097 IP 10.1.1.1.49153 > 10.1.1.2.9: Flags [.], seq 322661:324121, ack 1, win 65535, length 1460
