1.002067 ARP, Request who-has 192.168.1.1 (ff:ff:ff:ff:ff:ff) tell 192.168.1.5, length 50
1.006272 ARP, Reply 192.168.1.1 is-at 00:00:00:00:00:01, length 50
1.006272 IP 203.82.48.2.49153 > 192.168.1.1.80: Flags [S], seq 0, win 65535, length 0
1.010478 ARP, Request who-has 192.168.1.5 (ff:ff:ff:ff:ff:ff) tell 192.168.1.1, length 50
1.010478 ARP, Reply 192.168.1.5 is-at 00:00:00:00:00:05, length 50
1.014685 IP 192.168.1.1.80 > 203.82.48.2.49153: Flags [S.], seq 0, ack 1, win 65535, length 0
1.018819 IP 203.82.48.2.49153 > 192.168.1.1.80: Flags [.], ack 1, win 65535, length 0
1.019744 IP 203.82.48.2.49153 > 192.168.1.1.80: Flags [.], seq 1:537, ack 1, win 65535, length 536
1.023024 IP 192.168.1.1.49153 > 203.82.48.1.9: UDP, length 3
1.028573 IP 192.168.1.1.80 > 203.82.48.2.49153: Flags [.], ack 537, win 65535, length 0
1.033565 ARP, Request who-has 192.168.1.2 (ff:ff:ff:ff:ff:ff) tell 192.168.1.5, length 50
1.037771 ARP, Reply 192.168.1.2 is-at 00:00:00:00:00:02, length 50
1.037771 IP 203.82.48.2.49153 > 192.168.1.2.80: Flags [.], seq 537:1073, ack 1, win 65535, length 536
1.038741 IP 203.82.48.2.49153 > 192.168.1.2.80: Flags [.], seq 536:1000, ack 1, win 65535, length 464
1.233565 IP 203.82.48.2.49153 > 192.168.1.2.80: Flags [.], seq 0:536, ack 1, win 65535, length 536
1.633565 IP 203.82.48.2.49153 > 192.168.1.2.80: Flags [.], seq 0:536, ack 1, win 65535, length 536
2.433565 IP 203.82.48.2.49153 > 192.168.1.2.80: Flags [.], seq 0:536, ack 1, win 65535, length 536
4.033565 IP 203.82.48.2.49153 > 192.168.1.2.80: Flags [.], seq 0:536, ack 1, win 65535, length 536
7.233565 IP 203.82.48.2.49153 > 192.168.1.2.80: Flags [.], seq 0:536, ack 1, win 65535, length 536
10.002102 IP 192.168.1.1.80 > 203.82.48.2.49153: Flags [F.], seq 1, ack 537, win 65535, length 0
10.004336 ARP, Request who-has 192.168.1.5 (ff:ff:ff:ff:ff:ff) tell 192.168.1.2, length 50
10.004336 ARP, Reply 192.168.1.5 is-at 00:00:00:00:00:05, length 50
10.006236 IP 203.82.48.2.49153 > 192.168.1.2.80: Flags [.], ack 2, win 65535, length 0
10.008543 IP 192.168.1.2.49153 > 203.82.48.1.9: UDP, length 5
10.010936 IP 192.168.1.1.49153 > 203.82.48.1.9: UDP, length 5
10.013174 ARP, Request who-has 192.168.1.5 (ff:ff:ff:ff:ff:ff) tell 192.168.1.3, length 50
10.013387 ARP, Reply 192.168.1.5 is-at 00:00:00:00:00:05, length 50
10.017471 IP 192.168.1.2.80 > 203.82.48.2.49153: Flags [R], seq 0, win 65535, length 0
10.021840 IP 192.168.1.3.49153 > 203.82.48.1.9: UDP, length 5
10.024228 ARP, Request who-has 192.168.1.5 (ff:ff:ff:ff:ff:ff) tell 192.168.1.4, length 50
10.024228 ARP, Reply 192.168.1.5 is-at 00:00:00:00:00:05, length 50
10.028435 IP 192.168.1.4.49153 > 203.82.48.1.9: UDP, length 5
10.202102 IP 192.168.1.1.80 > 203.82.48.2.49153: Flags [F.], seq 1, ack 537, win 65535, length 0
10.206236 IP 203.82.48.2.49153 > 192.168.1.2.80: Flags [R], seq 0, win 65535, length 0
10.402102 IP 192.168.1.1.80 > 203.82.48.2.49153: Flags [F.], seq 1, ack 537, win 65535, length 0
10.406236 IP 203.82.48.2.49153 > 192.168.1.2.80: Flags [R], seq 0, win 65535, length 0
10.602102 IP 192.168.1.1.80 > 203.82.48.2.49153: Flags [F.], seq 1, ack 537, win 65535, length 0
10.606236 IP 203.82.48.2.49153 > 192.168.1.2.80: Flags [R], seq 0, win 65535, length 0
10.802102 IP 192.168.1.1.80 > 203.82.48.2.49153: Flags [F.], seq 1, ack 537, win 65535, length 0
10.806236 IP 203.82.48.2.49153 > 192.168.1.2.80: Flags [R], seq 0, win 65535, length 0
11.002102 IP 192.168.1.1.80 > 203.82.48.2.49153: Flags [F.], seq 1, ack 537, win 65535, length 0
11.006236 IP 203.82.48.2.49153 > 192.168.1.2.80: Flags [R], seq 0, win 65535, length 0
11.202102 IP 192.168.1.1.80 > 203.82.48.2.49153: Flags [F.], seq 1, ack 537, win 65535, length 0
11.206236 IP 203.82.48.2.49153 > 192.168.1.2.80: Flags [R], seq 0, win 65535, length 0
11.402102 IP 192.168.1.1.80 > 203.82.48.2.49153: Flags [F.], seq 1, ack 537, win 65535, length 0
11.406236 IP 203.82.48.2.49153 > 192.168.1.2.80: Flags [R], seq 0, win 65535, length 0
11.602102 IP 192.168.1.1.80 > 203.82.48.2.49153: Flags [F.], seq 1, ack 537, win 65535, length 0
11.606236 IP 203.82.48.2.49153 > 192.168.1.2.80: Flags [R], seq 0, win 65535, length 0
11.802102 IP 192.168.1.1.80 > 203.82.48.2.49153: Flags [F.], seq 1, ack 537, win 65535, length 0
11.806236 IP 203.82.48.2.49153 > 192.168.1.2.80: Flags [R], seq 0, win 65535, length 0
12.002102 IP 192.168.1.1.80 > 203.82.48.2.49153: Flags [F.], seq 1, ack 537, win 65535, length 0
12.006236 IP 203.82.48.2.49153 > 192.168.1.2.80: Flags [R], seq 0, win 65535, length 0
12.202102 IP 192.168.1.1.80 > 203.82.48.2.49153: Flags [F.], seq 1, ack 537, win 65535, length 0
12.206236 IP 203.82.48.2.49153 > 192.168.1.2.80: Flags [R], seq 0, win 65535, length 0
12.402102 IP 192.168.1.1.80 > 203.82.48.2.49153: Flags [F.], seq 1, ack 537, win 65535, length 0
12.406236 IP 203.82.48.2.49153 > 192.168.1.2.80: Flags [R], seq 0, win 65535, length 0
12.602102 IP 192.168.1.1.80 > 203.82.48.2.49153: Flags [F.], seq 1, ack 537, win 65535, length 0
12.606236 IP 203.82.48.2.49153 > 192.168.1.2.80: Flags [R], seq 0, win 65535, length 0
12.802102 IP 192.168.1.1.80 > 203.82.48.2.49153: Flags [F.], seq 1, ack 537, win 65535, length 0
12.806236 IP 203.82.48.2.49153 > 192.168.1.2.80: Flags [R], seq 0, win 65535, length 0
13.002102 IP 192.168.1.1.80 > 203.82.48.2.49153: Flags [F.], seq 1, ack 537, win 65535, length 0
13.006236 IP 203.82.48.2.49153 > 192.168.1.2.80: Flags [R], seq 0, win 65535, length 0
13.202102 IP 192.168.1.1.80 > 203.82.48.2.49153: Flags [F.], seq 1, ack 537, win 65535, length 0
13.206236 IP 203.82.48.2.49153 > 192.168.1.2.80: Flags [R], seq 0, win 65535, length 0
13.402102 IP 192.168.1.1.80 > 203.82.48.2.49153: Flags [F.], seq 1, ack 537, win 65535, length 0
13.406236 IP 203.82.48.2.49153 > 192.168.1.2.80: Flags [R], seq 0, win 65535, length 0
13.602102 IP 192.168.1.1.80 > 203.82.48.2.49153: Flags [F.], seq 1, ack 537, win 65535, length 0
13.606236 IP 203.82.48.2.49153 > 192.168.1.2.80: Flags [R], seq 0, win 65535, length 0
13.802102 IP 192.168.1.1.80 > 203.82.48.2.49153: Flags [F.], seq 1, ack 537, win 65535, length 0
13.806236 IP 203.82.48.2.49153 > 192.168.1.2.80: Flags [R], seq 0, win 65535, length 0
14.002102 IP 192.168.1.1.80 > 203.82.48.2.49153: Flags [F.], seq 1, ack 537, win 65535, length 0
14.006236 IP 203.82.48.2.49153 > 192.168.1.2.80: Flags [R], seq 0, win 65535, length 0
14.202102 IP 192.168.1.1.80 > 203.82.48.2.49153: Flags [F.], seq 1, ack 537, win 65535, length 0
14.206236 IP 203.82.48.2.49153 > 192.168.1.2.80: Flags [R], seq 0, win 65535, length 0
14.402102 IP 192.168.1.1.80 > 203.82.48.2.49153: Flags [F.], seq 1, ack 537, win 65535, length 0
14.406236 IP 203.82.48.2.49153 > 192.168.1.2.80: Flags [R], seq 0, win 65535, length 0
14.602102 IP 192.168.1.1.80 > 203.82.48.2.49153: Flags [F.], seq 1, ack 537, win 65535, length 0
14.606236 IP 203.82.48.2.49153 > 192.168.1.2.80: Flags [R], seq 0, win 65535, length 0
14.802102 IP 192.168.1.1.80 > 203.82.48.2.49153: Flags [F.], seq 1, ack 537, win 65535, length 0
14.806236 IP 203.82.48.2.49153 > 192.168.1.2.80: Flags [R], seq 0, win 65535, length 0
15.002102 IP 192.168.1.1.80 > 203.82.48.2.49153: Flags [F.], seq 1, ack 537, win 65535, length 0
15.006236 IP 203.82.48.2.49153 > 192.168.1.2.80: Flags [R], seq 0, win 65535, length 0
15.202102 IP 192.168.1.1.80 > 203.82.48.2.49153: Flags [F.], seq 1, ack 537, win 65535, length 0
15.206236 IP 203.82.48.2.49153 > 192.168.1.2.80: Flags [R], seq 0, win 65535, length 0
15.402102 IP 192.168.1.1.80 > 203.82.48.2.49153: Flags [F.], seq 1, ack 537, win 65535, length 0
15.406236 IP 203.82.48.2.49153 > 192.168.1.2.80: Flags [R], seq 0, win 65535, length 0
15.602102 IP 192.168.1.1.80 > 203.82.48.2.49153: Flags [F.], seq 1, ack 537, win 65535, length 0
15.606236 IP 203.82.48.2.49153 > 192.168.1.2.80: Flags [R], seq 0, win 65535, length 0
15.802102 IP 192.168.1.1.80 > 203.82.48.2.49153: Flags [F.], seq 1, ack 537, win 65535, length 0
15.806236 IP 203.82.48.2.49153 > 192.168.1.2.80: Flags [R], seq 0, win 65535, length 0
16.002102 IP 192.168.1.1.80 > 203.82.48.2.49153: Flags [F.], seq 1, ack 537, win 65535, length 0
16.006236 IP 203.82.48.2.49153 > 192.168.1.2.80: Flags [R], seq 0, win 65535, length 0
16.202102 IP 192.168.1.1.80 > 203.82.48.2.49153: Flags [F.], seq 1, ack 537, win 65535, length 0
16.206236 IP 203.82.48.2.49153 > 192.168.1.2.80: Flags [R], seq 0, win 65535, length 0
16.402102 IP 192.168.1.1.80 > 203.82.48.2.49153: Flags [F.], seq 1, ack 537, win 65535, length 0
16.406236 IP 203.82.48.2.49153 > 192.168.1.2.80: Flags [R], seq 0, win 65535, length 0
16.602102 IP 192.168.1.1.80 > 203.82.48.2.49153: Flags [F.], seq 1, ack 537, win 65535, length 0
16.606236 IP 203.82.48.2.49153 > 192.168.1.2.80: Flags [R], seq 0, win 65535, length 0
16.802102 IP 192.168.1.1.80 > 203.82.48.2.49153: Flags [F.], seq 1, ack 537, win 65535, length 0
16.806236 IP 203.82.48.2.49153 > 192.168.1.2.80: Flags [R], seq 0, win 65535, length 0
17.002102 IP 192.168.1.1.80 > 203.82.48.2.49153: Flags [F.], seq 1, ack 537, win 65535, length 0
17.006236 IP 203.82.48.2.49153 > 192.168.1.2.80: Flags [R], seq 0, win 65535, length 0
17.202102 IP 192.168.1.1.80 > 203.82.48.2.49153: Flags [F.], seq 1, ack 537, win 65535, length 0
17.206236 IP 203.82.48.2.49153 > 192.168.1.2.80: Flags [R], seq 0, win 65535, length 0
17.402102 IP 192.168.1.1.80 > 203.82.48.2.49153: Flags [F.], seq 1, ack 537, win 65535, length 0
17.406236 IP 203.82.48.2.49153 > 192.168.1.2.80: Flags [R], seq 0, win 65535, length 0
17.602102 IP 192.168.1.1.80 > 203.82.48.2.49153: Flags [F.], seq 1, ack 537, win 65535, length 0
17.606236 IP 203.82.48.2.49153 > 192.168.1.2.80: Flags [R], seq 0, win 65535, length 0
17.802102 IP 192.168.1.1.80 > 203.82.48.2.49153: Flags [F.], seq 1, ack 537, win 65535, length 0
17.806236 IP 203.82.48.2.49153 > 192.168.1.2.80: Flags [R], seq 0, win 65535, length 0
18.002102 IP 192.168.1.1.80 > 203.82.48.2.49153: Flags [F.], seq 1, ack 537, win 65535, length 0
18.006236 IP 203.82.48.2.49153 > 192.168.1.2.80: Flags [R], seq 0, win 65535, length 0
18.202102 IP 192.168.1.1.80 > 203.82.48.2.49153: Flags [F.], seq 1, ack 537, win 65535, length 0
18.206236 IP 203.82.48.2.49153 > 192.168.1.2.80: Flags [R], seq 0, win 65535, length 0
18.402102 IP 192.168.1.1.80 > 203.82.48.2.49153: Flags [F.], seq 1, ack 537, win 65535, length 0
18.406236 IP 203.82.48.2.49153 > 192.168.1.2.80: Flags [R], seq 0, win 65535, length 0
18.602102 IP 192.168.1.1.80 > 203.82.48.2.49153: Flags [F.], seq 1, ack 537, win 65535, length 0
18.606236 IP 203.82.48.2.49153 > 192.168.1.2.80: Flags [R], seq 0, win 65535, length 0
18.802102 IP 192.168.1.1.80 > 203.82.48.2.49153: Flags [F.], seq 1, ack 537, win 65535, length 0
18.806236 IP 203.82.48.2.49153 > 192.168.1.2.80: Flags [R], seq 0, win 65535, length 0
19.002102 IP 192.168.1.1.80 > 203.82.48.2.49153: Flags [F.], seq 1, ack 537, win 65535, length 0
19.006236 IP 203.82.48.2.49153 > 192.168.1.2.80: Flags [R], seq 0, win 65535, length 0
19.202102 IP 192.168.1.1.80 > 203.82.48.2.49153: Flags [F.], seq 1, ack 537, win 65535, length 0
19.206236 IP 203.82.48.2.49153 > 192.168.1.2.80: Flags [R], seq 0, win 65535, length 0
19.402102 IP 192.168.1.1.80 > 203.82.48.2.49153: Flags [F.], seq 1, ack 537, win 65535, length 0
19.406236 IP 203.82.48.2.49153 > 192.168.1.2.80: Flags [R], seq 0, win 65535, length 0
19.602102 IP 192.168.1.1.80 > 203.82.48.2.49153: Flags [F.], seq 1, ack 537, win 65535, length 0
19.606236 IP 203.82.48.2.49153 > 192.168.1.2.80: Flags [R], seq 0, win 65535, length 0
19.802102 IP 192.168.1.1.80 > 203.82.48.2.49153: Flags [F.], seq 1, ack 537, win 65535, length 0
19.806236 IP 203.82.48.2.49153 > 192.168.1.2.80: Flags [R], seq 0, win 65535, length 0
20.002102 IP 192.168.1.1.80 > 203.82.48.2.49153: Flags [F.], seq 1, ack 537, win 65535, length 0
20.006236 IP 203.82.48.2.49153 > 192.168.1.2.80: Flags [R], seq 0, win 65535, length 0
20.202102 IP 192.168.1.1.80 > 203.82.48.2.49153: Flags [F.], seq 1, ack 537, win 65535, length 0
20.206236 IP 203.82.48.2.49153 > 192.168.1.2.80: Flags [R], seq 0, win 65535, length 0
20.402102 IP 192.168.1.1.80 > 203.82.48.2.49153: Flags [F.], seq 1, ack 537, win 65535, length 0
20.406236 IP 203.82.48.2.49153 > 192.168.1.2.80: Flags [R], seq 0, win 65535, length 0
20.602102 IP 192.168.1.1.80 > 203.82.48.2.49153: Flags [F.], seq 1, ack 537, win 65535, length 0
20.606236 IP 203.82.48.2.49153 > 192.168.1.2.80: Flags [R], seq 0, win 65535, length 0
20.802102 IP 192.168.1.1.80 > 203.82.48.2.49153: Flags [F.], seq 1, ack 537, win 65535, length 0
20.806236 IP 203.82.48.2.49153 > 192.168.1.2.80: Flags [R], seq 0, win 65535, length 0
21.002102 IP 192.168.1.1.80 > 203.82.48.2.49153: Flags [F.], seq 1, ack 537, win 65535, length 0
21.006236 IP 203.82.48.2.49153 > 192.168.1.2.80: Flags [R], seq 0, win 65535, length 0
21.202102 IP 192.168.1.1.80 > 203.82.48.2.49153: Flags [F.], seq 1, ack 537, win 65535, length 0
21.206236 IP 203.82.48.2.49153 > 192.168.1.2.80: Flags [R], seq 0, win 65535, length 0
21.402102 IP 192.168.1.1.80 > 203.82.48.2.49153: Flags [F.], seq 1, ack 537, win 65535, length 0
21.406236 IP 203.82.48.2.49153 > 192.168.1.2.80: Flags [R], seq 0, win 65535, length 0
21.602102 IP 192.168.1.1.80 > 203.82.48.2.49153: Flags [F.], seq 1, ack 537, win 65535, length 0
21.606236 IP 203.82.48.2.49153 > 192.168.1.2.80: Flags [R], seq 0, win 65535, length 0
21.802102 IP 192.168.1.1.80 > 203.82.48.2.49153: Flags [F.], seq 1, ack 537, win 65535, length 0
21.806236 IP 203.82.48.2.49153 > 192.168.1.2.80: Flags [R], seq 0, win 65535, length 0
22.002102 IP 192.168.1.1.80 > 203.82.48.2.49153: Flags [F.], seq 1, ack 537, win 65535, length 0
22.006236 IP 203.82.48.2.49153 > 192.168.1.2.80: Flags [R], seq 0, win 65535, length 0
22.202102 IP 192.168.1.1.80 > 203.82.48.2.49153: Flags [F.], seq 1, ack 537, win 65535, length 0
22.206236 IP 203.82.48.2.49153 > 192.168.1.2.80: Flags [R], seq 0, win 65535, length 0
22.402102 IP 192.168.1.1.80 > 203.82.48.2.49153: Flags [F.], seq 1, ack 537, win 65535, length 0
22.406236 IP 203.82.48.2.49153 > 192.168.1.2.80: Flags [R], seq 0, win 65535, length 0
22.602102 IP 192.168.1.1.80 > 203.82.48.2.49153: Flags [F.], seq 1, ack 537, win 65535, length 0
22.606236 IP 203.82.48.2.49153 > 192.168.1.2.80: Flags [R], seq 0, win 65535, length 0
22.802102 IP 192.168.1.1.80 > 203.82.48.2.49153: Flags [F.], seq 1, ack 537, win 65535, length 0
22.806236 IP 203.82.48.2.49153 > 192.168.1.2.80: Flags [R], seq 0, win 65535, length 0
23.002102 IP 192.168.1.1.80 > 203.82.48.2.49153: Flags [F.], seq 1, ack 537, win 65535, length 0
23.006236 IP 203.82.48.2.49153 > 192.168.1.2.80: Flags [R], seq 0, win 65535, length 0
23.202102 IP 192.168.1.1.80 > 203.82.48.2.49153: Flags [F.], seq 1, ack 537, win 65535, length 0
23.206236 IP 203.82.48.2.49153 > 192.168.1.2.80: Flags [R], seq 0, win 65535, length 0
23.402102 IP 192.168.1.1.80 > 203.82.48.2.49153: Flags [F.], seq 1, ack 537, win 65535, length 0
23.406236 IP 203.82.48.2.49153 > 192.168.1.2.80: Flags [R], seq 0, win 65535, length 0
23.602102 IP 192.168.1.1.80 > 203.82.48.2.49153: Flags [F.], seq 1, ack 537, win 65535, length 0
23.606236 IP 203.82.48.2.49153 > 192.168.1.2.80: Flags [R], seq 0, win 65535, length 0
23.802102 IP 192.168.1.1.80 > 203.82.48.2.49153: Flags [F.], seq 1, ack 537, win 65535, length 0
23.806236 IP 203.82.48.2.49153 > 192.168.1.2.80: Flags [R], seq 0, win 65535, length 0
24.002102 IP 192.168.1.1.80 > 203.82.48.2.49153: Flags [F.], seq 1, ack 537, win 65535, length 0
24.006236 IP 203.82.48.2.49153 > 192.168.1.2.80: Flags [R], seq 0, win 65535, length 0
24.202102 IP 192.168.1.1.80 > 203.82.48.2.49153: Flags [F.], seq 1, ack 537, win 65535, length 0
24.206236 IP 203.82.48.2.49153 > 192.168.1.2.80: Flags [R], seq 0, win 65535, length 0
24.402102 IP 192.168.1.1.80 > 203.82.48.2.49153: Flags [F.], seq 1, ack 537, win 65535, length 0
24.406236 IP 203.82.48.2.49153 > 192.168.1.2.80: Flags [R], seq 0, win 65535, length 0
24.602102 IP 192.168.1.1.80 > 203.82.48.2.49153: Flags [F.], seq 1, ack 537, win 65535, length 0
24.606236 IP 203.82.48.2.49153 > 192.168.1.2.80: Flags [R], seq 0, win 65535, length 0
24.802102 IP 192.168.1.1.80 > 203.82.48.2.49153: Flags [F.], seq 1, ack 537, win 65535, length 0
24.806236 IP 203.82.48.2.49153 > 192.168.1.2.80: Flags [R], seq 0, win 65535, length 0
25.002102 IP 192.168.1.1.80 > 203.82.48.2.49153: Flags [F.], seq 1, ack 537, win 65535, length 0
25.006236 IP 203.82.48.2.49153 > 192.168.1.2.80: Flags [R], seq 0, win 65535, length 0
25.202102 IP 192.168.1.1.80 > 203.82.48.2.49153: Flags [F.], seq 1, ack 537, win 65535, length 0
25.206236 IP 203.82.48.2.49153 > 192.168.1.2.80: Flags [R], seq 0, win 65535, length 0
25.402102 IP 192.168.1.1.80 > 203.82.48.2.49153: Flags [F.], seq 1, ack 537, win 65535, length 0
25.406236 IP 203.82.48.2.49153 > 192.168.1.2.80: Flags [R], seq 0, win 65535, length 0
25.602102 IP 192.168.1.1.80 > 203.82.48.2.49153: Flags [F.], seq 1, ack 537, win 65535, length 0
25.606236 IP 203.82.48.2.49153 > 192.168.1.2.80: Flags [R], seq 0, win 65535, length 0
25.802102 IP 192.168.1.1.80 > 203.82.48.2.49153: Flags [F.], seq 1, ack 537, win 65535, length 0
25.806236 IP 203.82.48.2.49153 > 192.168.1.2.80: Flags [R], seq 0, win 65535, length 0
26.002102 IP 192.168.1.1.80 > 203.82.48.2.49153: Flags [F.], seq 1, ack 537, win 65535, length 0
26.006236 IP 203.82.48.2.49153 > 192.168.1.2.80: Flags [R], seq 0, win 65535, length 0
26.202102 IP 192.168.1.1.80 > 203.82.48.2.49153: Flags [F.], seq 1, ack 537, win 65535, length 0
26.206236 IP 203.82.48.2.49153 > 192.168.1.2.80: Flags [R], seq 0, win 65535, length 0
26.402102 IP 192.168.1.1.80 > 203.82.48.2.49153: Flags [F.], seq 1, ack 537, win 65535, length 0
26.406236 IP 203.82.48.2.49153 > 192.168.1.2.80: Flags [R], seq 0, win 65535, length 0
26.602102 IP 192.168.1.1.80 > 203.82.48.2.49153: Flags [F.], seq 1, ack 537, win 65535, length 0
26.606236 IP 203.82.48.2.49153 > 192.168.1.2.80: Flags [R], seq 0, win 65535, length 0
26.802102 IP 192.168.1.1.80 > 203.82.48.2.49153: Flags [F.], seq 1, ack 537, win 65535, length 0
26.806236 IP 203.82.48.2.49153 > 192.168.1.2.80: Flags [R], seq 0, win 65535, length 0
27.002102 IP 192.168.1.1.80 > 203.82.48.2.49153: Flags [F.], seq 1, ack 537, win 65535, length 0
27.006236 IP 203.82.48.2.49153 > 192.168.1.2.80: Flags [R], seq 0, win 65535, length 0
27.202102 IP 192.168.1.1.80 > 203.82.48.2.49153: Flags [F.], seq 1, ack 537, win 65535, length 0
27.206236 IP 203.82.48.2.49153 > 192.168.1.2.80: Flags [R], seq 0, win 65535, length 0
27.402102 IP 192.168.1.1.80 > 203.82.48.2.49153: Flags [F.], seq 1, ack 537, win 65535, length 0
27.406236 IP 203.82.48.2.49153 > 192.168.1.2.80: Flags [R], seq 0, win 65535, length 0
27.602102 IP 192.168.1.1.80 > 203.82.48.2.49153: Flags [F.], seq 1, ack 537, win 65535, length 0
27.606236 IP 203.82.48.2.49153 > 192.168.1.2.80: Flags [R], seq 0, win 65535, length 0
27.802102 IP 192.168.1.1.80 > 203.82.48.2.49153: Flags [F.], seq 1, ack 537, win 65535, length 0
27.806236 IP 203.82.48.2.49153 > 192.168.1.2.80: Flags [R], seq 0, win 65535, length 0
28.002102 IP 192.168.1.1.80 > 203.82.48.2.49153: Flags [F.], seq 1, ack 537, win 65535, length 0
28.006236 IP 203.82.48.2.49153 > 192.168.1.2.80: Flags [R], seq 0, win 65535, length 0
28.202102 IP 192.168.1.1.80 > 203.82.48.2.49153: Flags [F.], seq 1, ack 537, win 65535, length 0
28.206236 IP 203.82.48.2.49153 > 192.168.1.2.80: Flags [R], seq 0, win 65535, length 0
28.402102 IP 192.168.1.1.80 > 203.82.48.2.49153: Flags [F.], seq 1, ack 537, win 65535, length 0
28.406236 IP 203.82.48.2.49153 > 192.168.1.2.80: Flags [R], seq 0, win 65535, length 0
28.602102 IP 192.168.1.1.80 > 203.82.48.2.49153: Flags [F.], seq 1, ack 537, win 65535, length 0
28.606236 IP 203.82.48.2.49153 > 192.168.1.2.80: Flags [R], seq 0, win 65535, length 0
28.802102 IP 192.168.1.1.80 > 203.82.48.2.49153: Flags [F.], seq 1, ack 537, win 65535, length 0
28.806236 IP 203.82.48.2.49153 > 192.168.1.2.80: Flags [R], seq 0, win 65535, length 0
29.002102 IP 192.168.1.1.80 > 203.82.48.2.49153: Flags [F.], seq 1, ack 537, win 65535, length 0
29.006236 IP 203.82.48.2.49153 > 192.168.1.2.80: Flags [R], seq 0, win 65535, length 0
29.202102 IP 192.168.1.1.80 > 203.82.48.2.49153: Flags [F.], seq 1, ack 537, win 65535, length 0
29.206236 IP 203.82.48.2.49153 > 192.168.1.2.80: Flags [R], seq 0, win 65535, length 0
29.402102 IP 192.168.1.1.80 > 203.82.48.2.49153: Flags [F.], seq 1, ack 537, win 65535, length 0
29.406236 IP 203.82.48.2.49153 > 192.168.1.2.80: Flags [R], seq 0, win 65535, length 0
29.602102 IP 192.168.1.1.80 > 203.82.48.2.49153: Flags [F.], seq 1, ack 537, win 65535, length 0
29.606236 IP 203.82.48.2.49153 > 192.168.1.2.80: Flags [R], seq 0, win 65535, length 0
29.802102 IP 192.168.1.1.80 > 203.82.48.2.49153: Flags [F.], seq 1, ack 537, win 65535, length 0
29.806236 IP 203.82.48.2.49153 > 192.168.1.2.80: Flags [R], seq 0, win 65535, length 0
30.002102 IP 192.168.1.1.80 > 203.82.48.2.49153: Flags [F.], seq 1, ack 537, win 65535, length 0
30.006236 IP 203.82.48.2.49153 > 192.168.1.2.80: Flags [R], seq 0, win 65535, length 0
30.202102 IP 192.168.1.1.80 > 203.82.48.2.49153: Flags [F.], seq 1, ack 537, win 65535, length 0
30.206236 IP 203.82.48.2.49153 > 192.168.1.2.80: Flags [R], seq 0, win 65535, length 0
30.402102 IP 192.168.1.1.80 > 203.82.48.2.49153: Flags [F.], seq 1, ack 537, win 65535, length 0
30.406236 IP 203.82.48.2.49153 > 192.168.1.2.80: Flags [R], seq 0, win 65535, length 0
30.602102 IP 192.168.1.1.80 > 203.82.48.2.49153: Flags [F.], seq 1, ack 537, win 65535, length 0
30.606236 IP 203.82.48.2.49153 > 192.168.1.2.80: Flags [R], seq 0, win 65535, length 0
30.802102 IP 192.168.1.1.80 > 203.82.48.2.49153: Flags [F.], seq 1, ack 537, win 65535, length 0
30.806236 IP 203.82.48.2.49153 > 192.168.1.2.80: Flags [R], seq 0, win 65535, length 0
31.002102 IP 192.168.1.1.80 > 203.82.48.2.49153: Flags [F.], seq 1, ack 537, win 65535, length 0
31.006236 IP 203.82.48.2.49153 > 192.168.1.2.80: Flags [R], seq 0, win 65535, length 0
31.202102 IP 192.168.1.1.80 > 203.82.48.2.49153: Flags [F.], seq 1, ack 537, win 65535, length 0
31.206236 IP 203.82.48.2.49153 > 192.168.1.2.80: Flags [R], seq 0, win 65535, length 0
31.402102 IP 192.168.1.1.80 > 203.82.48.2.49153: Flags [F.], seq 1, ack 537, win 65535, length 0
31.406236 IP 203.82.48.2.49153 > 192.168.1.2.80: Flags [R], seq 0, win 65535, length 0
31.602102 IP 192.168.1.1.80 > 203.82.48.2.49153: Flags [F.], seq 1, ack 537, win 65535, length 0
31.606236 IP 203.82.48.2.49153 > 192.168.1.2.80: Flags [R], seq 0, win 65535, length 0
31.802102 IP 192.168.1.1.80 > 203.82.48.2.49153: Flags [F.], seq 1, ack 537, win 65535, length 0
31.806236 IP 203.82.48.2.49153 > 192.168.1.2.80: Flags [R], seq 0, win 65535, length 0
32.002102 IP 192.168.1.1.80 > 203.82.48.2.49153: Flags [F.], seq 1, ack 537, win 65535, length 0
32.006236 IP 203.82.48.2.49153 > 192.168.1.2.80: Flags [R], seq 0, win 65535, length 0
32.202102 IP 192.168.1.1.80 > 203.82.48.2.49153: Flags [F.], seq 1, ack 537, win 65535, length 0
32.206236 IP 203.82.48.2.49153 > 192.168.1.2.80: Flags [R], seq 0, win 65535, length 0
32.402102 IP 192.168.1.1.80 > 203.82.48.2.49153: Flags [F.], seq 1, ack 537, win 65535, length 0
32.406236 IP 203.82.48.2.49153 > 192.168.1.2.80: Flags [R], seq 0, win 65535, length 0
32.602102 IP 192.168.1.1.80 > 203.82.48.2.49153: Flags [F.], seq 1, ack 537, win 65535, length 0
32.606236 IP 203.82.48.2.49153 > 192.168.1.2.80: Flags [R], seq 0, win 65535, length 0
32.802102 IP 192.168.1.1.80 > 203.82.48.2.49153: Flags [F.], seq 1, ack 537, win 65535, length 0
32.806236 IP 203.82.48.2.49153 > 192.168.1.2.80: Flags [R], seq 0, win 65535, length 0
33.002102 IP 192.168.1.1.80 > 203.82.48.2.49153: Flags [F.], seq 1, ack 537, win 65535, length 0
33.006236 IP 203.82.48.2.49153 > 192.168.1.2.80: Flags [R], seq 0, win 65535, length 0
33.202102 IP 192.168.1.1.80 > 203.82.48.2.49153: Flags [F.], seq 1, ack 537, win 65535, length 0
33.206236 IP 203.82.48.2.49153 > 192.168.1.2.80: Flags [R], seq 0, win 65535, length 0
33.402102 IP 192.168.1.1.80 > 203.82.48.2.49153: Flags [F.], seq 1, ack 537, win 65535, length 0
33.406236 IP 203.82.48.2.49153 > 192.168.1.2.80: Flags [R], seq 0, win 65535, length 0
33.602102 IP 192.168.1.1.80 > 203.82.48.2.49153: Flags [F.], seq 1, ack 537, win 65535, length 0
33.606236 IP 203.82.48.2.49153 > 192.168.1.2.80: Flags [R], seq 0, win 65535, length 0
33.802102 IP 192.168.1.1.80 > 203.82.48.2.49153: Flags [F.], seq 1, ack 537, win 65535, length 0
33.806236 IP 203.82.48.2.49153 > 192.168.1.2.80: Flags [R], seq 0, win 65535, length 0
34.002102 IP 192.168.1.1.80 > 203.82.48.2.49153: Flags [F.], seq 1, ack 537, win 65535, length 0
34.006236 IP 203.82.48.2.49153 > 192.168.1.2.80: Flags [R], seq 0, win 65535, length 0
34.202102 IP 192.168.1.1.80 > 203.82.48.2.49153: Flags [F.], seq 1, ack 537, win 65535, length 0
34.206236 IP 203.82.48.2.49153 > 192.168.1.2.80: Flags [R], seq 0, win 65535, length 0
34.402102 IP 192.168.1.1.80 > 203.82.48.2.49153: Flags [F.], seq 1, ack 537, win 65535, length 0
34.406236 IP 203.82.48.2.49153 > 192.168.1.2.80: Flags [R], seq 0, win 65535, length 0
34.602102 IP 192.168.1.1.80 > 203.82.48.2.49153: Flags [F.], seq 1, ack 537, win 65535, length 0
34.606236 IP 203.82.48.2.49153 > 192.168.1.2.80: Flags [R], seq 0, win 65535, length 0
34.802102 IP 192.168.1.1.80 > 203.82.48.2.49153: Flags [F.], seq 1, ack 537, win 65535, length 0
34.806236 IP 203.82.48.2.49153 > 192.168.1.2.80: Flags [R], seq 0, win 65535, length 0
35.002102 IP 192.168.1.1.80 > 203.82.48.2.49153: Flags [F.], seq 1, ack 537, win 65535, length 0
35.006236 IP 203.82.48.2.49153 > 192.168.1.2.80: Flags [R], seq 0, win 65535, length 0
35.202102 IP 192.168.1.1.80 > 203.82.48.2.49153: Flags [F.], seq 1, ack 537, win 65535, length 0
35.206236 IP 203.82.48.2.49153 > 192.168.1.2.80: Flags [R], seq 0, win 65535, length 0
35.402102 IP 192.168.1.1.80 > 203.82.48.2.49153: Flags [F.], seq 1, ack 537, win 65535, length 0
35.406236 IP 203.82.48.2.49153 > 192.168.1.2.80: Flags [R], seq 0, win 65535, length 0
35.602102 IP 192.168.1.1.80 > 203.82.48.2.49153: Flags [F.], seq 1, ack 537, win 65535, length 0
35.606236 IP 203.82.48.2.49153 > 192.168.1.2.80: Flags [R], seq 0, win 65535, length 0
35.802102 IP 192.168.1.1.80 > 203.82.48.2.49153: Flags [F.], seq 1, ack 537, win 65535, length 0
35.806236 IP 203.82.48.2.49153 > 192.168.1.2.80: Flags [R], seq 0, win 65535, length 0
36.002102 IP 192.168.1.1.80 > 203.82.48.2.49153: Flags [F.], seq 1, ack 537, win 65535, length 0
36.006236 IP 203.82.48.2.49153 > 192.168.1.2.80: Flags [R], seq 0, win 65535, length 0
36.202102 IP 192.168.1.1.80 > 203.82.48.2.49153: Flags [F.], seq 1, ack 537, win 65535, length 0
36.206236 IP 203.82.48.2.49153 > 192.168.1.2.80: Flags [R], seq 0, win 65535, length 0
36.402102 IP 192.168.1.1.80 > 203.82.48.2.49153: Flags [F.], seq 1, ack 537, win 65535, length 0
36.406236 IP 203.82.48.2.49153 > 192.168.1.2.80: Flags [R], seq 0, win 65535, length 0
36.602102 IP 192.168.1.1.80 > 203.82.48.2.49153: Flags [F.], seq 1, ack 537, win 65535, length 0
36.606236 IP 203.82.48.2.49153 > 192.168.1.2.80: Flags [R], seq 0, win 65535, length 0
36.802102 IP 192.168.1.1.80 > 203.82.48.2.49153: Flags [F.], seq 1, ack 537, win 65535, length 0
36.806236 IP 203.82.48.2.49153 > 192.168.1.2.80: Flags [R], seq 0, win 65535, length 0
37.002102 IP 192.168.1.1.80 > 203.82.48.2.49153: Flags [F.], seq 1, ack 537, win 65535, length 0
37.006236 IP 203.82.48.2.49153 > 192.168.1.2.80: Flags [R], seq 0, win 65535, length 0
37.202102 IP 192.168.1.1.80 > 203.82.48.2.49153: Flags [F.], seq 1, ack 537, win 65535, length 0
37.206236 IP 203.82.48.2.49153 > 192.168.1.2.80: Flags [R], seq 0, win 65535, length 0
37.402102 IP 192.168.1.1.80 > 203.82.48.2.49153: Flags [F.], seq 1, ack 537, win 65535, length 0
37.406236 IP 203.82.48.2.49153 > 192.168.1.2.80: Flags [R], seq 0, win 65535, length 0
37.602102 IP 192.168.1.1.80 > 203.82.48.2.49153: Flags [F.], seq 1, ack 537, win 65535, length 0
37.606236 IP 203.82.48.2.49153 > 192.168.1.2.80: Flags [R], seq 0, win 65535, length 0
37.802102 IP 192.168.1.1.80 > 203.82.48.2.49153: Flags [F.], seq 1, ack 537, win 65535, length 0
37.806236 IP 203.82.48.2.49153 > 192.168.1.2.80: Flags [R], seq 0, win 65535, length 0
38.002102 IP 192.168.1.1.80 > 203.82.48.2.49153: Flags [F.], seq 1, ack 537, win 65535, length 0
38.006236 IP 203.82.48.2.49153 > 192.168.1.2.80: Flags [R], seq 0, win 65535, length 0
38.202102 IP 192.168.1.1.80 > 203.82.48.2.49153: Flags [F.], seq 1, ack 537, win 65535, length 0
38.206236 IP 203.82.48.2.49153 > 192.168.1.2.80: Flags [R], seq 0, win 65535, length 0
38.402102 IP 192.168.1.1.80 > 203.82.48.2.49153: Flags [F.], seq 1, ack 537, win 65535, length 0
38.406236 IP 203.82.48.2.49153 > 192.168.1.2.80: Flags [R], seq 0, win 65535, length 0
38.602102 IP 192.168.1.1.80 > 203.82.48.2.49153: Flags [F.], seq 1, ack 537, win 65535, length 0
38.606236 IP 203.82.48.2.49153 > 192.168.1.2.80: Flags [R], seq 0, win 65535, length 0
38.802102 IP 192.168.1.1.80 > 203.82.48.2.49153: Flags [F.], seq 1, ack 537, win 65535, length 0
38.806236 IP 203.82.48.2.49153 > 192.168.1.2.80: Flags [R], seq 0, win 65535, length 0
39.002102 IP 192.168.1.1.80 > 203.82.48.2.49153: Flags [F.], seq 1, ack 537, win 65535, length 0
39.006236 IP 203.82.48.2.49153 > 192.168.1.2.80: Flags [R], seq 0, win 65535, length 0
39.202102 IP 192.168.1.1.80 > 203.82.48.2.49153: Flags [F.], seq 1, ack 537, win 65535, length 0
39.206236 IP 203.82.48.2.49153 > 192.168.1.2.80: Flags [R], seq 0, win 65535, length 0
39.402102 IP 192.168.1.1.80 > 203.82.48.2.49153: Flags [F.], seq 1, ack 537, win 65535, length 0
39.406236 IP 203.82.48.2.49153 > 192.168.1.2.80: Flags [R], seq 0, win 65535, length 0
39.602102 IP 192.168.1.1.80 > 203.82.48.2.49153: Flags [F.], seq 1, ack 537, win 65535, length 0
39.606236 IP 203.82.48.2.49153 > 192.168.1.2.80: Flags [R], seq 0, win 65535, length 0
39.802102 IP 192.168.1.1.80 > 203.82.48.2.49153: Flags [F.], seq 1, ack 537, win 65535, length 0
39.806236 IP 203.82.48.2.49153 > 192.168.1.2.80: Flags [R], seq 0, win 65535, length 0
40.002102 IP 192.168.1.1.80 > 203.82.48.2.49153: Flags [F.], seq 1, ack 537, win 65535, length 0
40.006236 IP 203.82.48.2.49153 > 192.168.1.2.80: Flags [R], seq 0, win 65535, length 0
40.202102 IP 192.168.1.1.80 > 203.82.48.2.49153: Flags [F.], seq 1, ack 537, win 65535, length 0
40.206236 IP 203.82.48.2.49153 > 192.168.1.2.80: Flags [R], seq 0, win 65535, length 0
40.402102 IP 192.168.1.1.80 > 203.82.48.2.49153: Flags [F.], seq 1, ack 537, win 65535, length 0
40.406236 IP 203.82.48.2.49153 > 192.168.1.2.80: Flags [R], seq 0, win 65535, length 0
40.602102 IP 192.168.1.1.80 > 203.82.48.2.49153: Flags [F.], seq 1, ack 537, win 65535, length 0
40.606236 IP 203.82.48.2.49153 > 192.168.1.2.80: Flags [R], seq 0, win 65535, length 0
40.802102 IP 192.168.1.1.80 > 203.82.48.2.49153: Flags [F.], seq 1, ack 537, win 65535, length 0
40.806236 IP 203.82.48.2.49153 > 192.168.1.2.80: Flags [R], seq 0, win 65535, length 0
41.002102 IP 192.168.1.1.80 > 203.82.48.2.49153: Flags [F.], seq 1, ack 537, win 65535, length 0
41.006236 IP 203.82.48.2.49153 > 192.168.1.2.80: Flags [R], seq 0, win 65535, length 0
41.202102 IP 192.168.1.1.80 > 203.82.48.2.49153: Flags [F.], seq 1, ack 537, win 65535, length 0
41.206236 IP 203.82.48.2.49153 > 192.168.1.2.80: Flags [R], seq 0, win 65535, length 0
41.402102 IP 192.168.1.1.80 > 203.82.48.2.49153: Flags [F.], seq 1, ack 537, win 65535, length 0
41.406236 IP 203.82.48.2.49153 > 192.168.1.2.80: Flags [R], seq 0, win 65535, length 0
41.602102 IP 192.168.1.1.80 > 203.82.48.2.49153: Flags [F.], seq 1, ack 537, win 65535, length 0
41.606236 IP 203.82.48.2.49153 > 192.168.1.2.80: Flags [R], seq 0, win 65535, length 0
41.802102 IP 192.168.1.1.80 > 203.82.48.2.49153: Flags [F.], seq 1, ack 537, win 65535, length 0
41.806236 IP 203.82.48.2.49153 > 192.168.1.2.80: Flags [R], seq 0, win 65535, length 0
42.002102 IP 192.168.1.1.80 > 203.82.48.2.49153: Flags [F.], seq 1, ack 537, win 65535, length 0
42.006236 IP 203.82.48.2.49153 > 192.168.1.2.80: Flags [R], seq 0, win 65535, length 0
42.202102 IP 192.168.1.1.80 > 203.82.48.2.49153: Flags [F.], seq 1, ack 537, win 65535, length 0
42.206236 IP 203.82.48.2.49153 > 192.168.1.2.80: Flags [R], seq 0, win 65535, length 0
42.402102 IP 192.168.1.1.80 > 203.82.48.2.49153: Flags [F.], seq 1, ack 537, win 65535, length 0
42.406236 IP 203.82.48.2.49153 > 192.168.1.2.80: Flags [R], seq 0, win 65535, length 0
42.602102 IP 192.168.1.1.80 > 203.82.48.2.49153: Flags [F.], seq 1, ack 537, win 65535, length 0
42.606236 IP 203.82.48.2.49153 > 192.168.1.2.80: Flags [R], seq 0, win 65535, length 0
42.802102 IP 192.168.1.1.80 > 203.82.48.2.49153: Flags [F.], seq 1, ack 537, win 65535, length 0
42.806236 IP 203.82.48.2.49153 > 192.168.1.2.80: Flags [R], seq 0, win 65535, length 0
43.002102 IP 192.168.1.1.80 > 203.82.48.2.49153: Flags [F.], seq 1, ack 537, win 65535, length 0
43.006236 IP 203.82.48.2.49153 > 192.168.1.2.80: Flags [R], seq 0, win 65535, length 0
43.202102 IP 192.168.1.1.80 > 203.82.48.2.49153: Flags [F.], seq 1, ack 537, win 65535, length 0
43.206236 IP 203.82.48.2.49153 > 192.168.1.2.80: Flags [R], seq 0, win 65535, length 0
43.402102 IP 192.168.1.1.80 > 203.82.48.2.49153: Flags [F.], seq 1, ack 537, win 65535, length 0
43.406236 IP 203.82.48.2.49153 > 192.168.1.2.80: Flags [R], seq 0, win 65535, length 0
43.602102 IP 192.168.1.1.80 > 203.82.48.2.49153: Flags [F.], seq 1, ack 537, win 65535, length 0
43.606236 IP 203.82.48.2.49153 > 192.168.1.2.80: Flags [R], seq 0, win 65535, length 0
43.802102 IP 192.168.1.1.80 > 203.82.48.2.49153: Flags [F.], seq 1, ack 537, win 65535, length 0
43.806236 IP 203.82.48.2.49153 > 192.168.1.2.80: Flags [R], seq 0, win 65535, length 0
44.002102 IP 192.168.1.1.80 > 203.82.48.2.49153: Flags [F.], seq 1, ack 537, win 65535, length 0
44.006236 IP 203.82.48.2.49153 > 192.168.1.2.80: Flags [R], seq 0, win 65535, length 0
44.202102 IP 192.168.1.1.80 > 203.82.48.2.49153: Flags [F.], seq 1, ack 537, win 65535, length 0
44.206236 IP 203.82.48.2.49153 > 192.168.1.2.80: Flags [R], seq 0, win 65535, length 0
44.402102 IP 192.168.1.1.80 > 203.82.48.2.49153: Flags [F.], seq 1, ack 537, win 65535, length 0
44.406236 IP 203.82.48.2.49153 > 192.168.1.2.80: Flags [R], seq 0, win 65535, length 0
44.602102 IP 192.168.1.1.80 > 203.82.48.2.49153: Flags [F.], seq 1, ack 537, win 65535, length 0
44.606236 IP 203.82.48.2.49153 > 192.168.1.2.80: Flags [R], seq 0, win 65535, length 0
44.802102 IP 192.168.1.1.80 > 203.82.48.2.49153: Flags [F.], seq 1, ack 537, win 65535, length 0
44.806236 IP 203.82.48.2.49153 > 192.168.1.2.80: Flags [R], seq 0, win 65535, length 0
45.002102 IP 192.168.1.1.80 > 203.82.48.2.49153: Flags [F.], seq 1, ack 537, win 65535, length 0
45.006236 IP 203.82.48.2.49153 > 192.168.1.2.80: Flags [R], seq 0, win 65535, length 0
45.202102 IP 192.168.1.1.80 > 203.82.48.2.49153: Flags [F.], seq 1, ack 537, win 65535, length 0
45.206236 IP 203.82.48.2.49153 > 192.168.1.2.80: Flags [R], seq 0, win 65535, length 0
45.402102 IP 192.168.1.1.80 > 203.82.48.2.49153: Flags [F.], seq 1, ack 537, win 65535, length 0
45.406236 IP 203.82.48.2.49153 > 192.168.1.2.80: Flags [R], seq 0, win 65535, length 0
45.602102 IP 192.168.1.1.80 > 203.82.48.2.49153: Flags [F.], seq 1, ack 537, win 65535, length 0
45.606236 IP 203.82.48.2.49153 > 192.168.1.2.80: Flags [R], seq 0, win 65535, length 0
45.802102 IP 192.168.1.1.80 > 203.82.48.2.49153: Flags [F.], seq 1, ack 537, win 65535, length 0
45.806236 IP 203.82.48.2.49153 > 192.168.1.2.80: Flags [R], seq 0, win 65535, length 0
46.002102 IP 192.168.1.1.80 > 203.82.48.2.49153: Flags [F.], seq 1, ack 537, win 65535, length 0
46.006236 IP 203.82.48.2.49153 > 192.168.1.2.80: Flags [R], seq 0, win 65535, length 0
46.202102 IP 192.168.1.1.80 > 203.82.48.2.49153: Flags [F.], seq 1, ack 537, win 65535, length 0
46.206236 IP 203.82.48.2.49153 > 192.168.1.2.80: Flags [R], seq 0, win 65535, length 0
46.402102 IP 192.168.1.1.80 > 203.82.48.2.49153: Flags [F.], seq 1, ack 537, win 65535, length 0
46.406236 IP 203.82.48.2.49153 > 192.168.1.2.80: Flags [R], seq 0, win 65535, length 0
46.602102 IP 192.168.1.1.80 > 203.82.48.2.49153: Flags [F.], seq 1, ack 537, win 65535, length 0
46.606236 IP 203.82.48.2.49153 > 192.168.1.2.80: Flags [R], seq 0, win 65535, length 0
46.802102 IP 192.168.1.1.80 > 203.82.48.2.49153: Flags [F.], seq 1, ack 537, win 65535, length 0
46.806236 IP 203.82.48.2.49153 > 192.168.1.2.80: Flags [R], seq 0, win 65535, length 0
47.002102 IP 192.168.1.1.80 > 203.82.48.2.49153: Flags [F.], seq 1, ack 537, win 65535, length 0
47.006236 IP 203.82.48.2.49153 > 192.168.1.2.80: Flags [R], seq 0, win 65535, length 0
47.202102 IP 192.168.1.1.80 > 203.82.48.2.49153: Flags [F.], seq 1, ack 537, win 65535, length 0
47.206236 IP 203.82.48.2.49153 > 192.168.1.2.80: Flags [R], seq 0, win 65535, length 0
47.402102 IP 192.168.1.1.80 > 203.82.48.2.49153: Flags [F.], seq 1, ack 537, win 65535, length 0
47.406236 IP 203.82.48.2.49153 > 192.168.1.2.80: Flags [R], seq 0, win 65535, length 0
47.602102 IP 192.168.1.1.80 > 203.82.48.2.49153: Flags [F.], seq 1, ack 537, win 65535, length 0
47.606236 IP 203.82.48.2.49153 > 192.168.1.2.80: Flags [R], seq 0, win 65535, length 0
47.802102 IP 192.168.1.1.80 > 203.82.48.2.49153: Flags [F.], seq 1, ack 537, win 65535, length 0
47.806236 IP 203.82.48.2.49153 > 192.168.1.2.80: Flags [R], seq 0, win 65535, length 0
48.002102 IP 192.168.1.1.80 > 203.82.48.2.49153: Flags [F.], seq 1, ack 537, win 65535, length 0
48.006236 IP 203.82.48.2.49153 > 192.168.1.2.80: Flags [R], seq 0, win 65535, length 0
48.202102 IP 192.168.1.1.80 > 203.82.48.2.49153: Flags [F.], seq 1, ack 537, win 65535, length 0
48.206236 IP 203.82.48.2.49153 > 192.168.1.2.80: Flags [R], seq 0, win 65535, length 0
48.402102 IP 192.168.1.1.80 > 203.82.48.2.49153: Flags [F.], seq 1, ack 537, win 65535, length 0
48.406236 IP 203.82.48.2.49153 > 192.168.1.2.80: Flags [R], seq 0, win 65535, length 0
48.602102 IP 192.168.1.1.80 > 203.82.48.2.49153: Flags [F.], seq 1, ack 537, win 65535, length 0
48.606236 IP 203.82.48.2.49153 > 192.168.1.2.80: Flags [R], seq 0, win 65535, length 0
48.802102 IP 192.168.1.1.80 > 203.82.48.2.49153: Flags [F.], seq 1, ack 537, win 65535, length 0
48.806236 IP 203.82.48.2.49153 > 192.168.1.2.80: Flags [R], seq 0, win 65535, length 0
49.002102 IP 192.168.1.1.80 > 203.82.48.2.49153: Flags [F.], seq 1, ack 537, win 65535, length 0
49.006236 IP 203.82.48.2.49153 > 192.168.1.2.80: Flags [R], seq 0, win 65535, length 0
49.202102 IP 192.168.1.1.80 > 203.82.48.2.49153: Flags [F.], seq 1, ack 537, win 65535, length 0
49.206236 IP 203.82.48.2.49153 > 192.168.1.2.80: Flags [R], seq 0, win 65535, length 0
49.402102 IP 192.168.1.1.80 > 203.82.48.2.49153: Flags [F.], seq 1, ack 537, win 65535, length 0
49.406236 IP 203.82.48.2.49153 > 192.168.1.2.80: Flags [R], seq 0, win 65535, length 0
49.602102 IP 192.168.1.1.80 > 203.82.48.2.49153: Flags [F.], seq 1, ack 537, win 65535, length 0
49.606236 IP 203.82.48.2.49153 > 192.168.1.2.80: Flags [R], seq 0, win 65535, length 0
49.802102 IP 192.168.1.1.80 > 203.82.48.2.49153: Flags [F.], seq 1, ack 537, win 65535, length 0
49.806236 IP 203.82.48.2.49153 > 192.168.1.2.80: Flags [R], seq 0, win 65535, length 0
50.002102 IP 192.168.1.1.80 > 203.82.48.2.49153: Flags [F.], seq 1, ack 537, win 65535, length 0
50.006236 IP 203.82.48.2.49153 > 192.168.1.2.80: Flags [R], seq 0, win 65535, length 0
50.202102 IP 192.168.1.1.80 > 203.82.48.2.49153: Flags [F.], seq 1, ack 537, win 65535, length 0
50.206236 IP 203.82.48.2.49153 > 192.168.1.2.80: Flags [R], seq 0, win 65535, length 0
50.402102 IP 192.168.1.1.80 > 203.82.48.2.49153: Flags [F.], seq 1, ack 537, win 65535, length 0
50.406236 IP 203.82.48.2.49153 > 192.168.1.2.80: Flags [R], seq 0, win 65535, length 0
50.602102 IP 192.168.1.1.80 > 203.82.48.2.49153: Flags [F.], seq 1, ack 537, win 65535, length 0
