1.002067 ARP, Request who-has 192.168.1.2 (ff:ff:ff:ff:ff:ff) tell 192.168.1.1, length 50
1.002114 ARP, Reply 192.168.1.2 is-at 00:00:00:00:00:05, length 50
1.002114 IP 203.82.48.2.49153 > 192.168.1.2.80: Flags [S], seq 0, win 65535, length 0
1.002134 IP 203.82.48.2.49154 > 192.168.1.2.80: Flags [S], seq 0, win 65535, length 0
1.002162 ARP, Request who-has 192.168.1.1 (ff:ff:ff:ff:ff:ff) tell 192.168.1.2, length 50
1.002162 ARP, Reply 192.168.1.1 is-at 00:00:00:00:00:03, length 50
1.002201 IP 203.82.48.2.49155 > 192.168.1.2.80: Flags [S], seq 0, win 65535, length 0
1.002211 IP 192.168.1.2.80 > 203.82.48.2.49153: Flags [S.], seq 0, ack 1, win 65535, length 0
1.002265 IP 192.168.1.2.80 > 203.82.48.2.49154: Flags [S.], seq 0, ack 1, win 65535, length 0
1.002268 IP 203.82.48.2.49156 > 192.168.1.2.80: Flags [S], seq 0, win 65535, length 0
1.002295 IP 192.168.1.2.80 > 203.82.48.2.49155: Flags [S.], seq 0, ack 1, win 65535, length 0
1.002315 IP 192.168.1.2.80 > 203.82.48.2.49156: Flags [S.], seq 0, ack 1, win 65535, length 0
1.002335 IP 203.82.48.2.49157 > 192.168.1.2.80: Flags [S], seq 0, win 65535, length 0
1.002382 IP 192.168.1.2.80 > 203.82.48.2.49157: Flags [S.], seq 0, ack 1, win 65535, length 0
1.002403 IP 203.82.48.2.49158 > 192.168.1.2.80: Flags [S], seq 0, win 65535, length 0
1.002449 IP 192.168.1.2.80 > 203.82.48.2.49158: Flags [S.], seq 0, ack 1, win 65535, length 0
1.002470 IP 203.82.48.2.49159 > 192.168.1.2.80: Flags [S], seq 0, win 65535, length 0
1.002517 IP 192.168.1.2.80 > 203.82.48.2.49159: Flags [S.], seq 0, ack 1, win 65535, length 0
1.002537 IP 203.82.48.2.49160 > 192.168.1.2.80: Flags [S], seq 0, win 65535, length 0
1.002584 IP 192.168.1.2.80 > 203.82.48.2.49160: Flags [S.], seq 0, ack 1, win 65535, length 0
1.002604 IP 203.82.48.2.49161 > 192.168.1.2.80: Flags [S], seq 0, win 65535, length 0
1.002651 IP 192.168.1.2.80 > 203.82.48.2.49161: Flags [S.], seq 0, ack 1, win 65535, length 0
1.002671 IP 203.82.48.2.49162 > 192.168.1.2.80: Flags [S], seq 0, win 65535, length 0
1.002718 IP 192.168.1.2.80 > 203.82.48.2.49162: Flags [S.], seq 0, ack 1, win 65535, length 0
1.002739 IP 203.82.48.2.49163 > 192.168.1.2.80: Flags [S], seq 0, win 65535, length 0
1.002785 IP 192.168.1.2.80 > 203.82.48.2.49163: Flags [S.], seq 0, ack 1, win 65535, length 0
1.002806 IP 203.82.48.2.49164 > 192.168.1.2.80: Flags [S], seq 0, win 65535, length 0
1.002853 IP 192.168.1.2.80 > 203.82.48.2.49164: Flags [S.], seq 0, ack 1, win 65535, length 0
1.002873 IP 203.82.48.2.49165 > 192.168.1.2.80: Flags [S], seq 0, win 65535, length 0
1.002920 IP 192.168.1.2.80 > 203.82.48.2.49165: Flags [S.], seq 0, ack 1, win 65535, length 0
1.002940 IP 203.82.48.2.49166 > 192.168.1.2.80: Flags [S], seq 0, win 65535, length 0
1.002987 IP 192.168.1.2.80 > 203.82.48.2.49166: Flags [S.], seq 0, ack 1, win 65535, length 0
1.003007 IP 203.82.48.2.49167 > 192.168.1.2.80: Flags [S], seq 0, win 65535, length 0
1.003054 IP 192.168.1.2.80 > 203.82.48.2.49167: Flags [S.], seq 0, ack 1, win 65535, length 0
1.003075 IP 203.82.48.2.49168 > 192.168.1.2.80: Flags [S], seq 0, win 65535, length 0
1.003121 IP 192.168.1.2.80 > 203.82.48.2.49168: Flags [S.], seq 0, ack 1, win 65535, length 0
1.003142 IP 203.82.48.2.49169 > 192.168.1.2.80: Flags [S], seq 0, win 65535, length 0
1.003189 IP 192.168.1.2.80 > 203.82.48.2.49169: Flags [S.], seq 0, ack 1, win 65535, length 0
1.003209 IP 203.82.48.2.49170 > 192.168.1.2.80: Flags [S], seq 0, win 65535, length 0
1.003256 IP 192.168.1.2.80 > 203.82.48.2.49170: Flags [S.], seq 0, ack 1, win 65535, length 0
1.003276 IP 203.82.48.2.49171 > 192.168.1.2.80: Flags [S], seq 0, win 65535, length 0
1.003323 IP 192.168.1.2.80 > 203.82.48.2.49171: Flags [S.], seq 0, ack 1, win 65535, length 0
1.003343 IP 203.82.48.2.49172 > 192.168.1.2.80: Flags [S], seq 0, win 65535, length 0
1.003390 IP 192.168.1.2.80 > 203.82.48.2.49172: Flags [S.], seq 0, ack 1, win 65535, length 0
1.006345 IP 203.82.48.2.49153 > 192.168.1.2.80: Flags [.], ack 1, win 65535, length 0
1.006392 IP 192.168.1.2.49153 > 192.168.1.1.9: UDP, length 3
1.006412 IP 203.82.48.2.49154 > 192.168.1.2.80: Flags [.], ack 1, win 65535, length 0
1.006459 IP 192.168.1.2.49153 > 192.168.1.1.9: UDP, length 3
1.006480 IP 203.82.48.2.49155 > 192.168.1.2.80: Flags [.], ack 1, win 65535, length 0
1.006526 IP 192.168.1.2.49153 > 192.168.1.1.9: UDP, length 3
1.006547 IP 203.82.48.2.49156 > 192.168.1.2.80: Flags [.], ack 1, win 65535, length 0
1.006594 IP 192.168.1.2.49153 > 192.168.1.1.9: UDP, length 3
1.006614 IP 203.82.48.2.49157 > 192.168.1.2.80: Flags [.], ack 1, win 65535, length 0
1.006661 IP 192.168.1.2.49153 > 192.168.1.1.9: UDP, length 3
1.006681 IP 203.82.48.2.49158 > 192.168.1.2.80: Flags [.], ack 1, win 65535, length 0
1.006728 IP 192.168.1.2.49153 > 192.168.1.1.9: UDP, length 3
1.006748 IP 203.82.48.2.49159 > 192.168.1.2.80: Flags [.], ack 1, win 65535, length 0
1.006795 IP 192.168.1.2.49153 > 192.168.1.1.9: UDP, length 3
1.006816 IP 203.82.48.2.49160 > 192.168.1.2.80: Flags [.], ack 1, win 65535, length 0
1.006862 IP 192.168.1.2.49153 > 192.168.1.1.9: UDP, length 3
1.006883 IP 203.82.48.2.49161 > 192.168.1.2.80: Flags [.], ack 1, win 65535, length 0
1.006930 IP 192.168.1.2.49153 > 192.168.1.1.9: UDP, length 3
1.006950 IP 203.82.48.2.49162 > 192.168.1.2.80: Flags [.], ack 1, win 65535, length 0
1.006997 IP 192.168.1.2.49153 > 192.168.1.1.9: UDP, length 3
1.007017 IP 203.82.48.2.49163 > 192.168.1.2.80: Flags [.], ack 1, win 65535, length 0
1.007064 IP 192.168.1.2.49153 > 192.168.1.1.9: UDP, length 3
1.007084 IP 203.82.48.2.49164 > 192.168.1.2.80: Flags [.], ack 1, win 65535, length 0
1.007131 IP 192.168.1.2.49153 > 192.168.1.1.9: UDP, length 3
1.007152 IP 203.82.48.2.49165 > 192.168.1.2.80: Flags [.], ack 1, win 65535, length 0
1.007198 IP 192.168.1.2.49153 > 192.168.1.1.9: UDP, length 3
1.007219 IP 203.82.48.2.49166 > 192.168.1.2.80: Flags [.], ack 1, win 65535, length 0
1.007266 IP 192.168.1.2.49153 > 192.168.1.1.9: UDP, length 3
1.007286 IP 203.82.48.2.49167 > 192.168.1.2.80: Flags [.], ack 1, win 65535, length 0
1.007333 IP 192.168.1.2.49153 > 192.168.1.1.9: UDP, length 3
1.007353 IP 203.82.48.2.49168 > 192.168.1.2.80: Flags [.], ack 1, win 65535, length 0
1.007400 IP 192.168.1.2.49153 > 192.168.1.1.9: UDP, length 3
1.007420 IP 203.82.48.2.49169 > 192.168.1.2.80: Flags [.], ack 1, win 65535, length 0
1.007467 IP 192.168.1.2.49153 > 192.168.1.1.9: UDP, length 3
1.007488 IP 203.82.48.2.49170 > 192.168.1.2.80: Flags [.], ack 1, win 65535, length 0
1.007534 IP 192.168.1.2.49153 > 192.168.1.1.9: UDP, length 3
1.007555 IP 203.82.48.2.49171 > 192.168.1.2.80: Flags [.], ack 1, win 65535, length 0
1.007602 IP 192.168.1.2.49153 > 192.168.1.1.9: UDP, length 3
1.007622 IP 203.82.48.2.49172 > 192.168.1.2.80: Flags [.], ack 1, win 65535, length 0
1.007669 IP 192.168.1.2.49153 > 192.168.1.1.9: UDP, length 3
1.011078 IP 203.82.48.2.49153 > 192.168.1.2.80: Flags [.], seq 1:513, ack 1, win 65535, length 512
1.011206 IP 192.168.1.2.80 > 203.82.48.2.49153: Flags [.], ack 513, win 65535, length 0
1.011964 IP 203.82.48.2.49154 > 192.168.1.2.80: Flags [.], seq 1:513, ack 1, win 65535, length 512
1.012092 IP 192.168.1.2.80 > 203.82.48.2.49154: Flags [.], ack 513, win 65535, length 0
1.012851 IP 203.82.48.2.49155 > 192.168.1.2.80: Flags [.], seq 1:513, ack 1, win 65535, length 512
1.012978 IP 192.168.1.2.80 > 203.82.48.2.49155: Flags [.], ack 513, win 65535, length 0
1.013737 IP 203.82.48.2.49156 > 192.168.1.2.80: Flags [.], seq 1:513, ack 1, win 65535, length 512
1.013865 IP 192.168.1.2.80 > 203.82.48.2.49156: Flags [.], ack 513, win 65535, length 0
1.014623 IP 203.82.48.2.49157 > 192.168.1.2.80: Flags [.], seq 1:513, ack 1, win 65535, length 512
1.014751 IP 192.168.1.2.80 > 203.82.48.2.49157: Flags [.], ack 513, win 65535, length 0
1.015510 IP 203.82.48.2.49158 > 192.168.1.2.80: Flags [.], seq 1:513, ack 1, win 65535, length 512
1.015638 IP 192.168.1.2.80 > 203.82.48.2.49158: Flags [.], ack 513, win 65535, length 0
1.016396 IP 203.82.48.2.49159 > 192.168.1.2.80: Flags [.], seq 1:513, ack 1, win 65535, length 512
1.016524 IP 192.168.1.2.80 > 203.82.48.2.49159: Flags [.], ack 513, win 65535, length 0
1.017283 IP 203.82.48.2.49160 > 192.168.1.2.80: Flags [.], seq 1:513, ack 1, win 65535, length 512
1.017410 IP 192.168.1.2.80 > 203.82.48.2.49160: Flags [.], ack 513, win 65535, length 0
1.018169 IP 203.82.48.2.49161 > 192.168.1.2.80: Flags [.], seq 1:513, ack 1, win 65535, length 512
1.018297 IP 192.168.1.2.80 > 203.82.48.2.49161: Flags [.], ack 513, win 65535, length 0
1.019055 IP 203.82.48.2.49162 > 192.168.1.2.80: Flags [.], seq 1:513, ack 1, win 65535, length 512
1.019183 IP 192.168.1.2.80 > 203.82.48.2.49162: Flags [.], ack 513, win 65535, length 0
1.019942 IP 203.82.48.2.49163 > 192.168.1.2.80: Flags [.], seq 1:513, ack 1, win 65535, length 512
1.020070 IP 192.168.1.2.80 > 203.82.48.2.49163: Flags [.], ack 513, win 65535, length 0
1.020828 IP 203.82.48.2.49164 > 192.168.1.2.80: Flags [.], seq 1:513, ack 1, win 65535, length 512
1.020956 IP 192.168.1.2.80 > 203.82.48.2.49164: Flags [.], ack 513, win 65535, length 0
1.021715 IP 203.82.48.2.49165 > 192.168.1.2.80: Flags [.], seq 1:513, ack 1, win 65535, length 512
1.021842 IP 192.168.1.2.80 > 203.82.48.2.49165: Flags [.], ack 513, win 65535, length 0
1.022601 IP 203.82.48.2.49166 > 192.168.1.2.80: Flags [.], seq 1:513, ack 1, win 65535, length 512
1.022729 IP 192.168.1.2.80 > 203.82.48.2.49166: Flags [.], ack 513, win 65535, length 0
1.023487 IP 203.82.48.2.49167 > 192.168.1.2.80: Flags [.], seq 1:513, ack 1, win 65535, length 512
1.023615 IP 192.168.1.2.80 > 203.82.48.2.49167: Flags [.], ack 513, win 65535, length 0
1.024374 IP 203.82.48.2.49168 > 192.168.1.2.80: Flags [.], seq 1:513, ack 1, win 65535, length 512
1.024502 IP 192.168.1.2.80 > 203.82.48.2.49168: Flags [.], ack 513, win 65535, length 0
1.025260 IP 203.82.48.2.49169 > 192.168.1.2.80: Flags [.], seq 1:513, ack 1, win 65535, length 512
1.025388 IP 192.168.1.2.80 > 203.82.48.2.49169: Flags [.], ack 513, win 65535, length 0
1.026147 IP 203.82.48.2.49170 > 192.168.1.2.80: Flags [.], seq 1:513, ack 1, win 65535, length 512
1.026274 IP 192.168.1.2.80 > 203.82.48.2.49170: Flags [.], ack 513, win 65535, length 0
1.027033 IP 203.82.48.2.49171 > 192.168.1.2.80: Flags [.], seq 1:513, ack 1, win 65535, length 512
1.027161 IP 192.168.1.2.80 > 203.82.48.2.49171: Flags [.], ack 513, win 65535, length 0
1.027919 IP 203.82.48.2.49172 > 192.168.1.2.80: Flags [.], seq 1:513, ack 1, win 65535, length 512
1.028047 IP 192.168.1.2.80 > 203.82.48.2.49172: Flags [.], ack 513, win 65535, length 0
1.028806 IP 203.82.48.2.49153 > 192.168.1.2.80: Flags [.], seq 513:1025, ack 1, win 65535, length 512
1.029692 IP 203.82.48.2.49154 > 192.168.1.2.80: Flags [.], seq 513:1025, ack 1, win 65535, length 512
1.030579 IP 203.82.48.2.49155 > 192.168.1.2.80: Flags [.], seq 513:1025, ack 1, win 65535, length 512
1.031465 IP 203.82.48.2.49156 > 192.168.1.2.80: Flags [.], seq 513:1025, ack 1, win 65535, length 512
1.032351 IP 203.82.48.2.49157 > 192.168.1.2.80: Flags [.], seq 513:1025, ack 1, win 65535, length 512
1.033238 IP 203.82.48.2.49158 > 192.168.1.2.80: Flags [.], seq 513:1025, ack 1, win 65535, length 512
1.034124 IP 203.82.48.2.49159 > 192.168.1.2.80: Flags [.], seq 513:1025, ack 1, win 65535, length 512
1.035011 IP 203.82.48.2.49160 > 192.168.1.2.80: Flags [.], seq 513:1025, ack 1, win 65535, length 512
1.035897 IP 203.82.48.2.49161 > 192.168.1.2.80: Flags [.], seq 513:1025, ack 1, win 65535, length 512
1.036783 IP 203.82.48.2.49162 > 192.168.1.2.80: Flags [.], seq 513:1025, ack 1, win 65535, length 512
1.037670 IP 203.82.48.2.49163 > 192.168.1.2.80: Flags [.], seq 513:1025, ack 1, win 65535, length 512
1.038556 IP 203.82.48.2.49164 > 192.168.1.2.80: Flags [.], seq 513:1025, ack 1, win 65535, length 512
1.039443 IP 203.82.48.2.49165 > 192.168.1.2.80: Flags [.], seq 513:1025, ack 1, win 65535, length 512
1.040329 IP 203.82.48.2.49153 > 192.168.1.2.80: Flags [.], seq 1025:1537, ack 1, win 65535, length 512
1.040457 IP 192.168.1.2.80 > 203.82.48.2.49153: Flags [.], ack 1537, win 65535, length 0
1.041215 IP 203.82.48.2.49154 > 192.168.1.2.80: Flags [.], seq 1025:1537, ack 1, win 65535, length 512
1.041343 IP 192.168.1.2.80 > 203.82.48.2.49154: Flags [.], ack 1537, win 65535, length 0
1.042102 IP 203.82.48.2.49155 > 192.168.1.2.80: Flags [.], seq 1025:1537, ack 1, win 65535, length 512
1.042230 IP 192.168.1.2.80 > 203.82.48.2.49155: Flags [.], ack 1537, win 65535, length 0
1.042988 IP 203.82.48.2.49156 > 192.168.1.2.80: Flags [.], seq 1025:1537, ack 1, win 65535, length 512
1.043116 IP 192.168.1.2.80 > 203.82.48.2.49156: Flags [.], ack 1537, win 65535, length 0
1.043875 IP 203.82.48.2.49157 > 192.168.1.2.80: Flags [.], seq 1025:1537, ack 1, win 65535, length 512
1.044002 IP 192.168.1.2.80 > 203.82.48.2.49157: Flags [.], ack 1537, win 65535, length 0
1.044761 IP 203.82.48.2.49158 > 192.168.1.2.80: Flags [.], seq 1025:1537, ack 1, win 65535, length 512
1.044889 IP 192.168.1.2.80 > 203.82.48.2.49158: Flags [.], ack 1537, win 65535, length 0
1.045647 IP 203.82.48.2.49159 > 192.168.1.2.80: Flags [.], seq 1025:1537, ack 1, win 65535, length 512
1.045775 IP 192.168.1.2.80 > 203.82.48.2.49159: Flags [.], ack 1537, win 65535, length 0
1.046534 IP 203.82.48.2.49160 > 192.168.1.2.80: Flags [.], seq 1025:1537, ack 1, win 65535, length 512
1.046662 IP 192.168.1.2.80 > 203.82.48.2.49160: Flags [.], ack 1537, win 65535, length 0
1.047420 IP 203.82.48.2.49161 > 192.168.1.2.80: Flags [.], seq 1025:1537, ack 1, win 65535, length 512
1.047548 IP 192.168.1.2.80 > 203.82.48.2.49161: Flags [.], ack 1537, win 65535, length 0
1.048307 IP 203.82.48.2.49162 > 192.168.1.2.80: Flags [.], seq 1025:1537, ack 1, win 65535, length 512
1.048434 IP 192.168.1.2.80 > 203.82.48.2.49162: Flags [.], ack 1537, win 65535, length 0
1.049193 IP 203.82.48.2.49163 > 192.168.1.2.80: Flags [.], seq 1025:1537, ack 1, win 65535, length 512
1.049321 IP 192.168.1.2.80 > 203.82.48.2.49163: Flags [.], ack 1537, win 65535, length 0
1.050079 IP 203.82.48.2.49164 > 192.168.1.2.80: Flags [.], seq 1025:1537, ack 1, win 65535, length 512
1.050207 IP 192.168.1.2.80 > 203.82.48.2.49164: Flags [.], ack 1537, win 65535, length 0
1.050966 IP 203.82.48.2.49165 > 192.168.1.2.80: Flags [.], seq 1025:1537, ack 1, win 65535, length 512
1.051094 IP 192.168.1.2.80 > 203.82.48.2.49165: Flags [.], ack 1537, win 65535, length 0
1.051891 IP 203.82.48.2.49166 > 192.168.1.2.80: Flags [.], seq 513:1049, ack 1, win 65535, length 536
1.052739 IP 203.82.48.2.49166 > 192.168.1.2.80: Flags [.], seq 1049:1537, ack 1, win 65535, length 488
1.052862 IP 192.168.1.2.80 > 203.82.48.2.49166: Flags [.], ack 1537, win 65535, length 0
1.053663 IP 203.82.48.2.49167 > 192.168.1.2.80: Flags [.], seq 513:1049, ack 1, win 65535, length 536
1.054511 IP 203.82.48.2.49167 > 192.168.1.2.80: Flags [.], seq 1049:1537, ack 1, win 65535, length 488
1.054635 IP 192.168.1.2.80 > 203.82.48.2.49167: Flags [.], ack 1537, win 65535, length 0
1.055436 IP 203.82.48.2.49168 > 192.168.1.2.80: Flags [.], seq 513:1049, ack 1, win 65535, length 536
1.056284 IP 203.82.48.2.49168 > 192.168.1.2.80: Flags [.], seq 1049:1537, ack 1, win 65535, length 488
1.056408 IP 192.168.1.2.80 > 203.82.48.2.49168: Flags [.], ack 1537, win 65535, length 0
1.057209 IP 203.82.48.2.49169 > 192.168.1.2.80: Flags [.], seq 513:1049, ack 1, win 65535, length 536
1.058057 IP 203.82.48.2.49169 > 192.168.1.2.80: Flags [.], seq 1049:1537, ack 1, win 65535, length 488
1.058181 IP 192.168.1.2.80 > 203.82.48.2.49169: Flags [.], ack 1537, win 65535, length 0
1.058982 IP 203.82.48.2.49170 > 192.168.1.2.80: Flags [.], seq 513:1049, ack 1, win 65535, length 536
1.059830 IP 203.82.48.2.49170 > 192.168.1.2.80: Flags [.], seq 1049:1537, ack 1, win 65535, length 488
1.059954 IP 192.168.1.2.80 > 203.82.48.2.49170: Flags [.], ack 1537, win 65535, length 0
1.060755 IP 203.82.48.2.49171 > 192.168.1.2.80: Flags [.], seq 513:1049, ack 1, win 65535, length 536
1.061603 IP 203.82.48.2.49171 > 192.168.1.2.80: Flags [.], seq 1049:1537, ack 1, win 65535, length 488
1.061726 IP 192.168.1.2.80 > 203.82.48.2.49171: Flags [.], ack 1537, win 65535, length 0
1.062527 IP 203.82.48.2.49172 > 192.168.1.2.80: Flags [.], seq 513:1049, ack 1, win 65535, length 536
1.063375 IP 203.82.48.2.49172 > 192.168.1.2.80: Flags [.], seq 1049:1537, ack 1, win 65535, length 488
1.063499 IP 192.168.1.2.80 > 203.82.48.2.49172: Flags [.], ack 1537, win 65535, length 0
1.064300 IP 203.82.48.2.49153 > 192.168.1.2.80: Flags [.], seq 1537:2073, ack 1, win 65535, length 536
1.065148 IP 203.82.48.2.49153 > 192.168.1.2.80: Flags [.], seq 2073:2561, ack 1, win 65535, length 488
1.065272 IP 192.168.1.2.80 > 203.82.48.2.49153: Flags [.], ack 2561, win 65535, length 0
1.066073 IP 203.82.48.2.49154 > 192.168.1.2.80: Flags [.], seq 1537:2073, ack 1, win 65535, length 536
1.066921 IP 203.82.48.2.49154 > 192.168.1.2.80: Flags [.], seq 2073:2561, ack 1, win 65535, length 488
1.067045 IP 192.168.1.2.80 > 203.82.48.2.49154: Flags [.], ack 2561, win 65535, length 0
1.067846 IP 203.82.48.2.49155 > 192.168.1.2.80: Flags [.], seq 1537:2073, ack 1, win 65535, length 536
1.068694 IP 203.82.48.2.49155 > 192.168.1.2.80: Flags [.], seq 2073:2561, ack 1, win 65535, length 488
1.068818 IP 192.168.1.2.80 > 203.82.48.2.49155: Flags [.], ack 2561, win 65535, length 0
1.069619 IP 203.82.48.2.49156 > 192.168.1.2.80: Flags [.], seq 1537:2073, ack 1, win 65535, length 536
1.070467 IP 203.82.48.2.49156 > 192.168.1.2.80: Flags [.], seq 2073:2561, ack 1, win 65535, length 488
1.070590 IP 192.168.1.2.80 > 203.82.48.2.49156: Flags [.], ack 2561, win 65535, length 0
1.071391 IP 203.82.48.2.49157 > 192.168.1.2.80: Flags [.], seq 1537:2073, ack 1, win 65535, length 536
1.072239 IP 203.82.48.2.49157 > 192.168.1.2.80: Flags [.], seq 2073:2561, ack 1, win 65535, length 488
1.072363 IP 192.168.1.2.80 > 203.82.48.2.49157: Flags [.], ack 2561, win 65535, length 0
1.073164 IP 203.82.48.2.49158 > 192.168.1.2.80: Flags [.], seq 1537:2073, ack 1, win 65535, length 536
1.074012 IP 203.82.48.2.49158 > 192.168.1.2.80: Flags [.], seq 2073:2561, ack 1, win 65535, length 488
1.074136 IP 192.168.1.2.80 > 203.82.48.2.49158: Flags [.], ack 2561, win 65535, length 0
1.074937 IP 203.82.48.2.49159 > 192.168.1.2.80: Flags [.], seq 1537:2073, ack 1, win 65535, length 536
1.075785 IP 203.82.48.2.49159 > 192.168.1.2.80: Flags [.], seq 2073:2561, ack 1, win 65535, length 488
1.075909 IP 192.168.1.2.80 > 203.82.48.2.49159: Flags [.], ack 2561, win 65535, length 0
1.076710 IP 203.82.48.2.49160 > 192.168.1.2.80: Flags [.], seq 1537:2073, ack 1, win 65535, length 536
1.077558 IP 203.82.48.2.49160 > 192.168.1.2.80: Flags [.], seq 2073:2561, ack 1, win 65535, length 488
1.077682 IP 192.168.1.2.80 > 203.82.48.2.49160: Flags [.], ack 2561, win 65535, length 0
1.078444 IP 203.82.48.2.49153 > 192.168.1.2.80: Flags [.], seq 2561:3073, ack 1, win 65535, length 512
1.079331 IP 203.82.48.2.49154 > 192.168.1.2.80: Flags [.], seq 2561:3073, ack 1, win 65535, length 512
1.080217 IP 203.82.48.2.49155 > 192.168.1.2.80: Flags [.], seq 2561:3073, ack 1, win 65535, length 512
1.081103 IP 203.82.48.2.49156 > 192.168.1.2.80: Flags [.], seq 2561:3073, ack 1, win 65535, length 512
1.081990 IP 203.82.48.2.49157 > 192.168.1.2.80: Flags [.], seq 2561:3073, ack 1, win 65535, length 512
1.082876 IP 203.82.48.2.49158 > 192.168.1.2.80: Flags [.], seq 2561:3073, ack 1, win 65535, length 512
1.083763 IP 203.82.48.2.49159 > 192.168.1.2.80: Flags [.], seq 2561:3073, ack 1, win 65535, length 512
1.084649 IP 203.82.48.2.49160 > 192.168.1.2.80: Flags [.], seq 2561:3073, ack 1, win 65535, length 512
1.085574 IP 203.82.48.2.49161 > 192.168.1.2.80: Flags [.], seq 1537:2073, ack 1, win 65535, length 536
1.086499 IP 203.82.48.2.49161 > 192.168.1.2.80: Flags [.], seq 2073:2609, ack 1, win 65535, length 536
1.086630 IP 192.168.1.2.80 > 203.82.48.2.49161: Flags [.], ack 2609, win 65535, length 0
1.087308 IP 203.82.48.2.49161 > 192.168.1.2.80: Flags [.], seq 2609:3073, ack 1, win 65535, length 464
1.088233 IP 203.82.48.2.49162 > 192.168.1.2.80: Flags [.], seq 1537:2073, ack 1, win 65535, length 536
1.089158 IP 203.82.48.2.49162 > 192.168.1.2.80: Flags [.], seq 2073:2609, ack 1, win 65535, length 536
1.089289 IP 192.168.1.2.80 > 203.82.48.2.49162: Flags [.], ack 2609, win 65535, length 0
1.089967 IP 203.82.48.2.49162 > 192.168.1.2.80: Flags [.], seq 2609:3073, ack 1, win 65535, length 464
1.090892 IP 203.82.48.2.49163 > 192.168.1.2.80: Flags [.], seq 1537:2073, ack 1, win 65535, length 536
1.091817 IP 203.82.48.2.49163 > 192.168.1.2.80: Flags [.], seq 2073:2609, ack 1, win 65535, length 536
1.091949 IP 192.168.1.2.80 > 203.82.48.2.49163: Flags [.], ack 2609, win 65535, length 0
1.092627 IP 203.82.48.2.49163 > 192.168.1.2.80: Flags [.], seq 2609:3073, ack 1, win 65535, length 464
1.093551 IP 203.82.48.2.49164 > 192.168.1.2.80: Flags [.], seq 1537:2073, ack 1, win 65535, length 536
1.094476 IP 203.82.48.2.49164 > 192.168.1.2.80: Flags [.], seq 2073:2609, ack 1, win 65535, length 536
1.094608 IP 192.168.1.2.80 > 203.82.48.2.49164: Flags [.], ack 2609, win 65535, length 0
1.095286 IP 203.82.48.2.49164 > 192.168.1.2.80: Flags [.], seq 2609:3073, ack 1, win 65535, length 464
1.096211 IP 203.82.48.2.49165 > 192.168.1.2.80: Flags [.], seq 1537:2073, ack 1, win 65535, length 536
1.097135 IP 203.82.48.2.49165 > 192.168.1.2.80: Flags [.], seq 2073:2609, ack 1, win 65535, length 536
1.097267 IP 192.168.1.2.80 > 203.82.48.2.49165: Flags [.], ack 2609, win 65535, length 0
1.097945 IP 203.82.48.2.49165 > 192.168.1.2.80: Flags [.], seq 2609:3073, ack 1, win 65535, length 464
1.098870 IP 203.82.48.2.49166 > 192.168.1.2.80: Flags [.], seq 1537:2073, ack 1, win 65535, length 536
1.099795 IP 203.82.48.2.49166 > 192.168.1.2.80: Flags [.], seq 2073:2609, ack 1, win 65535, length 536
1.099926 IP 192.168.1.2.80 > 203.82.48.2.49166: Flags [.], ack 2609, win 65535, length 0
1.100604 IP 203.82.48.2.49166 > 192.168.1.2.80: Flags [.], seq 2609:3073, ack 1, win 65535, length 464
1.101529 IP 203.82.48.2.49167 > 192.168.1.2.80: Flags [.], seq 1537:2073, ack 1, win 65535, length 536
1.102454 IP 203.82.48.2.49167 > 192.168.1.2.80: Flags [.], seq 2073:2609, ack 1, win 65535, length 536
1.102585 IP 192.168.1.2.80 > 203.82.48.2.49167: Flags [.], ack 2609, win 65535, length 0
1.103263 IP 203.82.48.2.49167 > 192.168.1.2.80: Flags [.], seq 2609:3073, ack 1, win 65535, length 464
1.104188 IP 203.82.48.2.49168 > 192.168.1.2.80: Flags [.], seq 1537:2073, ack 1, win 65535, length 536
1.105113 IP 203.82.48.2.49168 > 192.168.1.2.80: Flags [.], seq 2073:2609, ack 1, win 65535, length 536
1.105245 IP 192.168.1.2.80 > 203.82.48.2.49168: Flags [.], ack 2609, win 65535, length 0
1.106038 IP 203.82.48.2.49168 > 192.168.1.2.80: Flags [.], seq 2609:3145, ack 1, win 65535, length 536
1.106963 IP 203.82.48.2.49169 > 192.168.1.2.80: Flags [.], seq 1537:2073, ack 1, win 65535, length 536
1.107887 IP 203.82.48.2.49169 > 192.168.1.2.80: Flags [.], seq 2073:2609, ack 1, win 65535, length 536
1.108019 IP 192.168.1.2.80 > 203.82.48.2.49169: Flags [.], ack 2609, win 65535, length 0
1.108812 IP 203.82.48.2.49169 > 192.168.1.2.80: Flags [.], seq 2609:3145, ack 1, win 65535, length 536
1.109737 IP 203.82.48.2.49170 > 192.168.1.2.80: Flags [.], seq 1537:2073, ack 1, win 65535, length 536
1.110662 IP 203.82.48.2.49170 > 192.168.1.2.80: Flags [.], seq 2073:2609, ack 1, win 65535, length 536
1.110793 IP 192.168.1.2.80 > 203.82.48.2.49170: Flags [.], ack 2609, win 65535, length 0
1.111587 IP 203.82.48.2.49170 > 192.168.1.2.80: Flags [.], seq 2609:3145, ack 1, win 65535, length 536
1.112511 IP 203.82.48.2.49171 > 192.168.1.2.80: Flags [.], seq 1537:2073, ack 1, win 65535, length 536
1.113436 IP 203.82.48.2.49171 > 192.168.1.2.80: Flags [.], seq 2073:2609, ack 1, win 65535, length 536
1.113568 IP 192.168.1.2.80 > 203.82.48.2.49171: Flags [.], ack 2609, win 65535, length 0
1.114361 IP 203.82.48.2.49171 > 192.168.1.2.80: Flags [.], seq 2609:3145, ack 1, win 65535, length 536
1.115286 IP 203.82.48.2.49172 > 192.168.1.2.80: Flags [.], seq 1537:2073, ack 1, win 65535, length 536
1.116211 IP 203.82.48.2.49172 > 192.168.1.2.80: Flags [.], seq 2073:2609, ack 1, win 65535, length 536
1.116342 IP 192.168.1.2.80 > 203.82.48.2.49172: Flags [.], ack 2609, win 65535, length 0
1.117135 IP 203.82.48.2.49172 > 192.168.1.2.80: Flags [.], seq 2609:3145, ack 1, win 65535, length 536
1.118060 IP 203.82.48.2.49153 > 192.168.1.2.80: Flags [.], seq 3073:3609, ack 1, win 65535, length 536
1.118192 IP 192.168.1.2.80 > 203.82.48.2.49153: Flags [.], ack 3609, win 65535, length 0
1.118908 IP 203.82.48.2.49153 > 192.168.1.2.80: Flags [.], seq 3609:4097, ack 1, win 65535, length 488
1.119833 IP 203.82.48.2.49154 > 192.168.1.2.80: Flags [.], seq 3073:3609, ack 1, win 65535, length 536
1.119965 IP 192.168.1.2.80 > 203.82.48.2.49154: Flags [.], ack 3609, win 65535, length 0
1.120681 IP 203.82.48.2.49154 > 192.168.1.2.80: Flags [.], seq 3609:4097, ack 1, win 65535, length 488
1.121606 IP 203.82.48.2.49155 > 192.168.1.2.80: Flags [.], seq 3073:3609, ack 1, win 65535, length 536
1.121737 IP 192.168.1.2.80 > 203.82.48.2.49155: Flags [.], ack 3609, win 65535, length 0
1.122454 IP 203.82.48.2.49155 > 192.168.1.2.80: Flags [.], seq 3609:4097, ack 1, win 65535, length 488
1.123379 IP 203.82.48.2.49156 > 192.168.1.2.80: Flags [.], seq 3073:3609, ack 1, win 65535, length 536
1.123510 IP 192.168.1.2.80 > 203.82.48.2.49156: Flags [.], ack 3609, win 65535, length 0
1.124227 IP 203.82.48.2.49156 > 192.168.1.2.80: Flags [.], seq 3609:4097, ack 1, win 65535, length 488
1.125113 IP 203.82.48.2.49153 > 192.168.1.2.80: Flags [.], seq 4097:4609, ack 1, win 65535, length 512
1.125241 IP 192.168.1.2.80 > 203.82.48.2.49153: Flags [.], ack 4609, win 65535, length 0
1.125999 IP 203.82.48.2.49154 > 192.168.1.2.80: Flags [.], seq 4097:4609, ack 1, win 65535, length 512
1.126127 IP 192.168.1.2.80 > 203.82.48.2.49154: Flags [.], ack 4609, win 65535, length 0
1.126886 IP 203.82.48.2.49155 > 192.168.1.2.80: Flags [.], seq 4097:4609, ack 1, win 65535, length 512
1.127014 IP 192.168.1.2.80 > 203.82.48.2.49155: Flags [.], ack 4609, win 65535, length 0
1.127772 IP 203.82.48.2.49156 > 192.168.1.2.80: Flags [.], seq 4097:4609, ack 1, win 65535, length 512
1.127900 IP 192.168.1.2.80 > 203.82.48.2.49156: Flags [.], ack 4609, win 65535, length 0
1.128697 IP 203.82.48.2.49157 > 192.168.1.2.80: Flags [.], seq 3073:3609, ack 1, win 65535, length 536
1.128829 IP 192.168.1.2.80 > 203.82.48.2.49157: Flags [.], ack 3609, win 65535, length 0
1.129622 IP 203.82.48.2.49157 > 192.168.1.2.80: Flags [.], seq 3609:4145, ack 1, win 65535, length 536
1.130431 IP 203.82.48.2.49157 > 192.168.1.2.80: Flags [.], seq 4145:4609, ack 1, win 65535, length 464
1.130551 IP 192.168.1.2.80 > 203.82.48.2.49157: Flags [.], ack 4609, win 65535, length 0
1.131356 IP 203.82.48.2.49158 > 192.168.1.2.80: Flags [.], seq 3073:3609, ack 1, win 65535, length 536
1.131488 IP 192.168.1.2.80 > 203.82.48.2.49158: Flags [.], ack 3609, win 65535, length 0
1.132281 IP 203.82.48.2.49158 > 192.168.1.2.80: Flags [.], seq 3609:4145, ack 1, win 65535, length 536
1.133091 IP 203.82.48.2.49158 > 192.168.1.2.80: Flags [.], seq 4145:4609, ack 1, win 65535, length 464
1.133211 IP 192.168.1.2.80 > 203.82.48.2.49158: Flags [.], ack 4609, win 65535, length 0
1.134015 IP 203.82.48.2.49159 > 192.168.1.2.80: Flags [.], seq 3073:3609, ack 1, win 65535, length 536
1.134147 IP 192.168.1.2.80 > 203.82.48.2.49159: Flags [.], ack 3609, win 65535, length 0
1.134940 IP 203.82.48.2.49159 > 192.168.1.2.80: Flags [.], seq 3609:4145, ack 1, win 65535, length 536
1.135750 IP 203.82.48.2.49159 > 192.168.1.2.80: Flags [.], seq 4145:4609, ack 1, win 65535, length 464
1.135870 IP 192.168.1.2.80 > 203.82.48.2.49159: Flags [.], ack 4609, win 65535, length 0
1.136675 IP 203.82.48.2.49160 > 192.168.1.2.80: Flags [.], seq 3073:3609, ack 1, win 65535, length 536
1.136806 IP 192.168.1.2.80 > 203.82.48.2.49160: Flags [.], ack 3609, win 65535, length 0
1.137599 IP 203.82.48.2.49160 > 192.168.1.2.80: Flags [.], seq 3609:4145, ack 1, win 65535, length 536
1.138409 IP 203.82.48.2.49160 > 192.168.1.2.80: Flags [.], seq 4145:4609, ack 1, win 65535, length 464
1.138529 IP 192.168.1.2.80 > 203.82.48.2.49160: Flags [.], ack 4609, win 65535, length 0
1.139334 IP 203.82.48.2.49161 > 192.168.1.2.80: Flags [.], seq 3073:3609, ack 1, win 65535, length 536
1.139465 IP 192.168.1.2.80 > 203.82.48.2.49161: Flags [.], ack 3609, win 65535, length 0
1.140259 IP 203.82.48.2.49161 > 192.168.1.2.80: Flags [.], seq 3609:4145, ack 1, win 65535, length 536
1.141183 IP 203.82.48.2.49161 > 192.168.1.2.80: Flags [.], seq 4145:4681, ack 1, win 65535, length 536
1.141315 IP 192.168.1.2.80 > 203.82.48.2.49161: Flags [.], ack 4681, win 65535, length 0
1.142108 IP 203.82.48.2.49162 > 192.168.1.2.80: Flags [.], seq 3073:3609, ack 1, win 65535, length 536
1.142240 IP 192.168.1.2.80 > 203.82.48.2.49162: Flags [.], ack 3609, win 65535, length 0
1.143033 IP 203.82.48.2.49162 > 192.168.1.2.80: Flags [.], seq 3609:4145, ack 1, win 65535, length 536
1.143958 IP 203.82.48.2.49162 > 192.168.1.2.80: Flags [.], seq 4145:4681, ack 1, win 65535, length 536
1.144089 IP 192.168.1.2.80 > 203.82.48.2.49162: Flags [.], ack 4681, win 65535, length 0
1.144883 IP 203.82.48.2.49163 > 192.168.1.2.80: Flags [.], seq 3073:3609, ack 1, win 65535, length 536
1.145014 IP 192.168.1.2.80 > 203.82.48.2.49163: Flags [.], ack 3609, win 65535, length 0
1.145807 IP 203.82.48.2.49163 > 192.168.1.2.80: Flags [.], seq 3609:4145, ack 1, win 65535, length 536
1.146732 IP 203.82.48.2.49163 > 192.168.1.2.80: Flags [.], seq 4145:4681, ack 1, win 65535, length 536
1.146864 IP 192.168.1.2.80 > 203.82.48.2.49163: Flags [.], ack 4681, win 65535, length 0
1.147657 IP 203.82.48.2.49164 > 192.168.1.2.80: Flags [.], seq 3073:3609, ack 1, win 65535, length 536
1.147789 IP 192.168.1.2.80 > 203.82.48.2.49164: Flags [.], ack 3609, win 65535, length 0
1.148582 IP 203.82.48.2.49164 > 192.168.1.2.80: Flags [.], seq 3609:4145, ack 1, win 65535, length 536
1.149507 IP 203.82.48.2.49164 > 192.168.1.2.80: Flags [.], seq 4145:4681, ack 1, win 65535, length 536
1.149638 IP 192.168.1.2.80 > 203.82.48.2.49164: Flags [.], ack 4681, win 65535, length 0
1.150431 IP 203.82.48.2.49165 > 192.168.1.2.80: Flags [.], seq 3073:3609, ack 1, win 65535, length 536
1.150563 IP 192.168.1.2.80 > 203.82.48.2.49165: Flags [.], ack 3609, win 65535, length 0
1.151356 IP 203.82.48.2.49165 > 192.168.1.2.80: Flags [.], seq 3609:4145, ack 1, win 65535, length 536
1.152281 IP 203.82.48.2.49165 > 192.168.1.2.80: Flags [.], seq 4145:4681, ack 1, win 65535, length 536
1.152413 IP 192.168.1.2.80 > 203.82.48.2.49165: Flags [.], ack 4681, win 65535, length 0
1.153206 IP 203.82.48.2.49166 > 192.168.1.2.80: Flags [.], seq 3073:3609, ack 1, win 65535, length 536
1.153337 IP 192.168.1.2.80 > 203.82.48.2.49166: Flags [.], ack 3609, win 65535, length 0
1.154131 IP 203.82.48.2.49166 > 192.168.1.2.80: Flags [.], seq 3609:4145, ack 1, win 65535, length 536
1.155055 IP 203.82.48.2.49166 > 192.168.1.2.80: Flags [.], seq 4145:4681, ack 1, win 65535, length 536
1.155187 IP 192.168.1.2.80 > 203.82.48.2.49166: Flags [.], ack 4681, win 65535, length 0
1.155980 IP 203.82.48.2.49167 > 192.168.1.2.80: Flags [.], seq 3073:3609, ack 1, win 65535, length 536
1.156112 IP 192.168.1.2.80 > 203.82.48.2.49167: Flags [.], ack 3609, win 65535, length 0
1.156905 IP 203.82.48.2.49167 > 192.168.1.2.80: Flags [.], seq 3609:4145, ack 1, win 65535, length 536
1.157830 IP 203.82.48.2.49167 > 192.168.1.2.80: Flags [.], seq 4145:4681, ack 1, win 65535, length 536
1.157961 IP 192.168.1.2.80 > 203.82.48.2.49167: Flags [.], ack 4681, win 65535, length 0
1.158755 IP 203.82.48.2.49168 > 192.168.1.2.80: Flags [.], seq 3145:3681, ack 1, win 65535, length 536
1.158886 IP 192.168.1.2.80 > 203.82.48.2.49168: Flags [.], ack 3681, win 65535, length 0
1.159679 IP 203.82.48.2.49168 > 192.168.1.2.80: Flags [.], seq 3681:4217, ack 1, win 65535, length 536
1.160604 IP 203.82.48.2.49168 > 192.168.1.2.80: Flags [.], seq 4217:4753, ack 1, win 65535, length 536
1.160736 IP 192.168.1.2.80 > 203.82.48.2.49168: Flags [.], ack 4753, win 65535, length 0
1.161529 IP 203.82.48.2.49169 > 192.168.1.2.80: Flags [.], seq 3145:3681, ack 1, win 65535, length 536
1.161661 IP 192.168.1.2.80 > 203.82.48.2.49169: Flags [.], ack 3681, win 65535, length 0
1.162454 IP 203.82.48.2.49169 > 192.168.1.2.80: Flags [.], seq 3681:4217, ack 1, win 65535, length 536
1.163379 IP 203.82.48.2.49169 > 192.168.1.2.80: Flags [.], seq 4217:4753, ack 1, win 65535, length 536
1.163510 IP 192.168.1.2.80 > 203.82.48.2.49169: Flags [.], ack 4753, win 65535, length 0
1.164303 IP 203.82.48.2.49170 > 192.168.1.2.80: Flags [.], seq 3145:3681, ack 1, win 65535, length 536
1.164435 IP 192.168.1.2.80 > 203.82.48.2.49170: Flags [.], ack 3681, win 65535, length 0
1.165228 IP 203.82.48.2.49170 > 192.168.1.2.80: Flags [.], seq 3681:4217, ack 1, win 65535, length 536
1.166153 IP 203.82.48.2.49170 > 192.168.1.2.80: Flags [.], seq 4217:4753, ack 1, win 65535, length 536
1.166285 IP 192.168.1.2.80 > 203.82.48.2.49170: Flags [.], ack 4753, win 65535, length 0
1.167078 IP 203.82.48.2.49171 > 192.168.1.2.80: Flags [.], seq 3145:3681, ack 1, win 65535, length 536
1.167209 IP 192.168.1.2.80 > 203.82.48.2.49171: Flags [.], ack 3681, win 65535, length 0
1.168003 IP 203.82.48.2.49171 > 192.168.1.2.80: Flags [.], seq 3681:4217, ack 1, win 65535, length 536
1.168927 IP 203.82.48.2.49171 > 192.168.1.2.80: Flags [.], seq 4217:4753, ack 1, win 65535, length 536
1.169059 IP 192.168.1.2.80 > 203.82.48.2.49171: Flags [.], ack 4753, win 65535, length 0
1.169852 IP 203.82.48.2.49172 > 192.168.1.2.80: Flags [.], seq 3145:3681, ack 1, win 65535, length 536
1.169984 IP 192.168.1.2.80 > 203.82.48.2.49172: Flags [.], ack 3681, win 65535, length 0
1.170777 IP 203.82.48.2.49172 > 192.168.1.2.80: Flags [.], seq 3681:4217, ack 1, win 65535, length 536
1.171702 IP 203.82.48.2.49172 > 192.168.1.2.80: Flags [.], seq 4217:4753, ack 1, win 65535, length 536
1.171833 IP 192.168.1.2.80 > 203.82.48.2.49172: Flags [.], ack 4753, win 65535, length 0
1.172627 IP 203.82.48.2.49153 > 192.168.1.2.80: Flags [.], seq 4609:5145, ack 1, win 65535, length 536
1.173551 IP 203.82.48.2.49153 > 192.168.1.2.80: Flags [.], seq 5145:5681, ack 1, win 65535, length 536
1.173683 IP 192.168.1.2.80 > 203.82.48.2.49153: Flags [.], ack 5681, win 65535, length 0
1.174476 IP 203.82.48.2.49153 > 192.168.1.2.80: Flags [.], seq 5681:6217, ack 1, win 65535, length 536
1.175401 IP 203.82.48.2.49154 > 192.168.1.2.80: Flags [.], seq 4609:5145, ack 1, win 65535, length 536
1.176326 IP 203.82.48.2.49154 > 192.168.1.2.80: Flags [.], seq 5145:5681, ack 1, win 65535, length 536
1.176457 IP 192.168.1.2.80 > 203.82.48.2.49154: Flags [.], ack 5681, win 65535, length 0
1.177251 IP 203.82.48.2.49154 > 192.168.1.2.80: Flags [.], seq 5681:6217, ack 1, win 65535, length 536
1.178175 IP 203.82.48.2.49155 > 192.168.1.2.80: Flags [.], seq 4609:5145, ack 1, win 65535, length 536
1.179100 IP 203.82.48.2.49155 > 192.168.1.2.80: Flags [.], seq 5145:5681, ack 1, win 65535, length 536
1.179232 IP 192.168.1.2.80 > 203.82.48.2.49155: Flags [.], ack 5681, win 65535, length 0
1.180025 IP 203.82.48.2.49155 > 192.168.1.2.80: Flags [.], seq 5681:6217, ack 1, win 65535, length 536
1.180950 IP 203.82.48.2.49156 > 192.168.1.2.80: Flags [.], seq 4609:5145, ack 1, win 65535, length 536
1.181875 IP 203.82.48.2.49156 > 192.168.1.2.80: Flags [.], seq 5145:5681, ack 1, win 65535, length 536
1.182006 IP 192.168.1.2.80 > 203.82.48.2.49156: Flags [.], ack 5681, win 65535, length 0
1.182799 IP 203.82.48.2.49156 > 192.168.1.2.80: Flags [.], seq 5681:6217, ack 1, win 65535, length 536
1.183724 IP 203.82.48.2.49153 > 192.168.1.2.80: Flags [.], seq 6217:6753, ack 1, win 65535, length 536
1.183856 IP 192.168.1.2.80 > 203.82.48.2.49153: Flags [.], ack 6753, win 65535, length 0
1.184649 IP 203.82.48.2.49153 > 192.168.1.2.80: Flags [.], seq 6753:7289, ack 1, win 65535, length 536
1.185343 IP 203.82.48.2.49153 > 192.168.1.2.80: Flags [.], seq 7289:7681, ack 1, win 65535, length 392
1.185452 IP 192.168.1.2.80 > 203.82.48.2.49153: Flags [.], ack 7681, win 65535, length 0
1.186268 IP 203.82.48.2.49154 > 192.168.1.2.80: Flags [.], seq 6217:6753, ack 1, win 65535, length 536
1.186400 IP 192.168.1.2.80 > 203.82.48.2.49154: Flags [.], ack 6753, win 65535, length 0
1.187193 IP 203.82.48.2.49154 > 192.168.1.2.80: Flags [.], seq 6753:7289, ack 1, win 65535, length 536
1.187887 IP 203.82.48.2.49154 > 192.168.1.2.80: Flags [.], seq 7289:7681, ack 1, win 65535, length 392
1.187996 IP 192.168.1.2.80 > 203.82.48.2.49154: Flags [.], ack 7681, win 65535, length 0
1.188812 IP 203.82.48.2.49155 > 192.168.1.2.80: Flags [.], seq 6217:6753, ack 1, win 65535, length 536
1.188944 IP 192.168.1.2.80 > 203.82.48.2.49155: Flags [.], ack 6753, win 65535, length 0
1.189737 IP 203.82.48.2.49155 > 192.168.1.2.80: Flags [.], seq 6753:7289, ack 1, win 65535, length 536
1.190431 IP 203.82.48.2.49155 > 192.168.1.2.80: Flags [.], seq 7289:7681, ack 1, win 65535, length 392
1.190540 IP 192.168.1.2.80 > 203.82.48.2.49155: Flags [.], ack 7681, win 65535, length 0
1.191356 IP 203.82.48.2.49156 > 192.168.1.2.80: Flags [.], seq 6217:6753, ack 1, win 65535, length 536
1.191488 IP 192.168.1.2.80 > 203.82.48.2.49156: Flags [.], ack 6753, win 65535, length 0
1.192281 IP 203.82.48.2.49156 > 192.168.1.2.80: Flags [.], seq 6753:7289, ack 1, win 65535, length 536
1.192975 IP 203.82.48.2.49156 > 192.168.1.2.80: Flags [.], seq 7289:7681, ack 1, win 65535, length 392
1.193084 IP 192.168.1.2.80 > 203.82.48.2.49156: Flags [.], ack 7681, win 65535, length 0
1.193900 IP 203.82.48.2.49157 > 192.168.1.2.80: Flags [.], seq 4609:5145, ack 1, win 65535, length 536
1.194825 IP 203.82.48.2.49157 > 192.168.1.2.80: Flags [.], seq 5145:5681, ack 1, win 65535, length 536
1.194957 IP 192.168.1.2.80 > 203.82.48.2.49157: Flags [.], ack 5681, win 65535, length 0
1.195750 IP 203.82.48.2.49157 > 192.168.1.2.80: Flags [.], seq 5681:6217, ack 1, win 65535, length 536
1.196675 IP 203.82.48.2.49157 > 192.168.1.2.80: Flags [.], seq 6217:6753, ack 1, win 65535, length 536
1.196806 IP 192.168.1.2.80 > 203.82.48.2.49157: Flags [.], ack 6753, win 65535, length 0
1.197599 IP 203.82.48.2.49157 > 192.168.1.2.80: Flags [.], seq 6753:7289, ack 1, win 65535, length 536
1.198524 IP 203.82.48.2.49157 > 192.168.1.2.80: Flags [.], seq 7289:7825, ack 1, win 65535, length 536
1.198656 IP 192.168.1.2.80 > 203.82.48.2.49157: Flags [.], ack 7825, win 65535, length 0
1.199449 IP 203.82.48.2.49158 > 192.168.1.2.80: Flags [.], seq 4609:5145, ack 1, win 65535, length 536
1.200374 IP 203.82.48.2.49158 > 192.168.1.2.80: Flags [.], seq 5145:5681, ack 1, win 65535, length 536
1.200505 IP 192.168.1.2.80 > 203.82.48.2.49158: Flags [.], ack 5681, win 65535, length 0
1.201299 IP 203.82.48.2.49158 > 192.168.1.2.80: Flags [.], seq 5681:6217, ack 1, win 65535, length 536
1.202223 IP 203.82.48.2.49158 > 192.168.1.2.80: Flags [.], seq 6217:6753, ack 1, win 65535, length 536
1.202355 IP 192.168.1.2.80 > 203.82.48.2.49158: Flags [.], ack 6753, win 65535, length 0
1.203148 IP 203.82.48.2.49158 > 192.168.1.2.80: Flags [.], seq 6753:7289, ack 1, win 65535, length 536
1.204073 IP 203.82.48.2.49158 > 192.168.1.2.80: Flags [.], seq 7289:7825, ack 1, win 65535, length 536
1.204205 IP 192.168.1.2.80 > 203.82.48.2.49158: Flags [.], ack 7825, win 65535, length 0
1.204998 IP 203.82.48.2.49159 > 192.168.1.2.80: Flags [.], seq 4609:5145, ack 1, win 65535, length 536
1.205923 IP 203.82.48.2.49159 > 192.168.1.2.80: Flags [.], seq 5145:5681, ack 1, win 65535, length 536
1.206054 IP 192.168.1.2.80 > 203.82.48.2.49159: Flags [.], ack 5681, win 65535, length 0
1.206847 IP 203.82.48.2.49159 > 192.168.1.2.80: Flags [.], seq 5681:6217, ack 1, win 65535, length 536
1.207772 IP 203.82.48.2.49159 > 192.168.1.2.80: Flags [.], seq 6217:6753, ack 1, win 65535, length 536
