1.002067 ARP, Request who-has 192.168.1.2 (ff:ff:ff:ff:ff:ff) tell 192.168.1.1, length 50
1.002114 ARP, Reply 192.168.1.2 is-at 00:00:00:00:00:05, length 50
1.002114 IP 203.82.48.2.49153 > 192.168.1.2.80: Flags [S], seq 0, win 65535, length 0
1.002134 ARP, Request who-has 192.168.1.3 (ff:ff:ff:ff:ff:ff) tell 192.168.1.1, length 50
1.002162 ARP, Request who-has 192.168.1.1 (ff:ff:ff:ff:ff:ff) tell 192.168.1.2, length 50
1.002162 ARP, Reply 192.168.1.1 is-at 00:00:00:00:00:03, length 50
1.002188 ARP, Reply 192.168.1.3 is-at 00:00:00:00:00:07, length 50
1.002188 IP 203.82.48.2.49154 > 192.168.1.3.80: Flags [S], seq 0, win 65535, length 0
1.002201 ARP, Request who-has 192.168.1.4 (ff:ff:ff:ff:ff:ff) tell 192.168.1.1, length 50
1.002227 IP 192.168.1.2.80 > 203.82.48.2.49153: Flags [S.], seq 0, ack 1, win 65535, length 0
1.002242 ARP, Request who-has 192.168.1.1 (ff:ff:ff:ff:ff:ff) tell 192.168.1.3, length 50
1.002242 ARP, Reply 192.168.1.1 is-at 00:00:00:00:00:03, length 50
1.002268 ARP, Reply 192.168.1.4 is-at 00:00:00:00:00:09, length 50
1.002268 IP 203.82.48.2.49155 > 192.168.1.4.80: Flags [S], seq 0, win 65535, length 0
1.002275 ARP, Request who-has 192.168.1.5 (ff:ff:ff:ff:ff:ff) tell 192.168.1.1, length 50
1.002310 IP 192.168.1.3.80 > 203.82.48.2.49154: Flags [S.], seq 0, ack 1, win 65535, length 0
1.002329 ARP, Request who-has 192.168.1.1 (ff:ff:ff:ff:ff:ff) tell 192.168.1.4, length 50
1.002329 ARP, Reply 192.168.1.1 is-at 00:00:00:00:00:03, length 50
1.002336 ARP, Request who-has 192.168.1.6 (ff:ff:ff:ff:ff:ff) tell 192.168.1.1, length 50
1.002370 ARP, Reply 192.168.1.5 is-at 00:00:00:00:00:0b, length 50
1.002370 IP 203.82.48.2.49156 > 192.168.1.5.80: Flags [S], seq 0, win 65535, length 0
1.002382 IP 192.168.1.4.80 > 203.82.48.2.49155: Flags [S.], seq 0, ack 1, win 65535, length 0
1.002394 ARP, Reply 192.168.1.6 is-at 00:00:00:00:00:0d, length 50
1.002412 IP 203.82.48.2.49157 > 192.168.1.6.80: Flags [S], seq 0, win 65535, length 0
1.002425 ARP, Request who-has 192.168.1.7 (ff:ff:ff:ff:ff:ff) tell 192.168.1.1, length 50
1.002452 ARP, Request who-has 192.168.1.1 (ff:ff:ff:ff:ff:ff) tell 192.168.1.5, length 50
1.002465 ARP, Request who-has 192.168.1.1 (ff:ff:ff:ff:ff:ff) tell 192.168.1.6, length 50
1.002488 ARP, Reply 192.168.1.1 is-at 00:00:00:00:00:03, length 50
1.002510 ARP, Reply 192.168.1.1 is-at 00:00:00:00:00:03, length 50
1.002523 ARP, Request who-has 192.168.1.8 (ff:ff:ff:ff:ff:ff) tell 192.168.1.1, length 50
1.002537 ARP, Request who-has 192.168.1.9 (ff:ff:ff:ff:ff:ff) tell 192.168.1.1, length 50
1.002579 ARP, Reply 192.168.1.7 is-at 00:00:00:00:00:0f, length 50
1.002579 IP 203.82.48.2.49158 > 192.168.1.7.80: Flags [S], seq 0, win 65535, length 0
1.002604 ARP, Request who-has 192.168.1.10 (ff:ff:ff:ff:ff:ff) tell 192.168.1.1, length 50
1.002606 IP 192.168.1.5.80 > 203.82.48.2.49156: Flags [S.], seq 0, ack 1, win 65535, length 0
1.002618 IP 192.168.1.6.80 > 203.82.48.2.49157: Flags [S.], seq 0, ack 1, win 65535, length 0
1.002632 ARP, Reply 192.168.1.9 is-at 00:00:00:00:00:13, length 50
1.002644 ARP, Reply 192.168.1.8 is-at 00:00:00:00:00:11, length 50
1.002656 ARP, Request who-has 192.168.1.1 (ff:ff:ff:ff:ff:ff) tell 192.168.1.7, length 50
1.002687 IP 203.82.48.2.49160 > 192.168.1.9.80: Flags [S], seq 0, win 65535, length 0
1.002710 IP 203.82.48.2.49159 > 192.168.1.8.80: Flags [S], seq 0, win 65535, length 0
1.002729 ARP, Reply 192.168.1.10 is-at 00:00:00:00:00:15, length 50
1.002744 ARP, Reply 192.168.1.1 is-at 00:00:00:00:00:03, length 50
1.002765 ARP, Request who-has 192.168.1.11 (ff:ff:ff:ff:ff:ff) tell 192.168.1.1, length 50
1.002778 IP 203.82.48.2.49161 > 192.168.1.10.80: Flags [S], seq 0, win 65535, length 0
1.002791 ARP, Request who-has 192.168.1.12 (ff:ff:ff:ff:ff:ff) tell 192.168.1.1, length 50
1.002806 ARP, Request who-has 192.168.1.13 (ff:ff:ff:ff:ff:ff) tell 192.168.1.1, length 50
1.002873 ARP, Request who-has 192.168.1.14 (ff:ff:ff:ff:ff:ff) tell 192.168.1.1, length 50
1.002940 ARP, Request who-has 192.168.1.15 (ff:ff:ff:ff:ff:ff) tell 192.168.1.1, length 50
1.002950 ARP, Request who-has 192.168.1.1 (ff:ff:ff:ff:ff:ff) tell 192.168.1.9, length 50
1.002960 ARP, Reply 192.168.1.1 is-at 00:00:00:00:00:03, length 50
1.003007 ARP, Request who-has 192.168.1.16 (ff:ff:ff:ff:ff:ff) tell 192.168.1.1, length 50
1.003008 ARP, Request who-has 192.168.1.1 (ff:ff:ff:ff:ff:ff) tell 192.168.1.8, length 50
1.003015 ARP, Reply 192.168.1.1 is-at 00:00:00:00:00:03, length 50
1.003055 ARP, Reply 192.168.1.11 is-at 00:00:00:00:00:17, length 50
1.003055 IP 203.82.48.2.49162 > 192.168.1.11.80: Flags [S], seq 0, win 65535, length 0
1.003075 ARP, Request who-has 192.168.1.17 (ff:ff:ff:ff:ff:ff) tell 192.168.1.1, length 50
1.003105 ARP, Request who-has 192.168.1.1 (ff:ff:ff:ff:ff:ff) tell 192.168.1.10, length 50
1.003105 ARP, Reply 192.168.1.1 is-at 00:00:00:00:00:03, length 50
1.003141 ARP, Reply 192.168.1.12 is-at 00:00:00:00:00:19, length 50
1.003141 IP 203.82.48.2.49163 > 192.168.1.12.80: Flags [S], seq 0, win 65535, length 0
1.003148 ARP, Request who-has 192.168.1.18 (ff:ff:ff:ff:ff:ff) tell 192.168.1.1, length 50
1.003167 ARP, Reply 192.168.1.13 is-at 00:00:00:00:00:1b, length 50
1.003181 IP 192.168.1.7.80 > 203.82.48.2.49158: Flags [S.], seq 0, ack 1, win 65535, length 0
1.003199 IP 203.82.48.2.49164 > 192.168.1.13.80: Flags [S], seq 0, win 65535, length 0
1.003221 ARP, Reply 192.168.1.14 is-at 00:00:00:00:00:1d, length 50
1.003236 ARP, Reply 192.168.1.15 is-at 00:00:00:00:00:1f, length 50
1.003253 IP 192.168.1.9.80 > 203.82.48.2.49160: Flags [S.], seq 0, ack 1, win 65535, length 0
1.003263 ARP, Request who-has 192.168.1.19 (ff:ff:ff:ff:ff:ff) tell 192.168.1.1, length 50
1.003275 IP 203.82.48.2.49165 > 192.168.1.14.80: Flags [S], seq 0, win 65535, length 0
1.003291 IP 203.82.48.2.49166 > 192.168.1.15.80: Flags [S], seq 0, win 65535, length 0
1.003308 ARP, Request who-has 192.168.1.20 (ff:ff:ff:ff:ff:ff) tell 192.168.1.1, length 50
1.003343 ARP, Request who-has 192.168.1.21 (ff:ff:ff:ff:ff:ff) tell 192.168.1.1, length 50
1.003347 ARP, Reply 192.168.1.16 is-at 00:00:00:00:00:21, length 50
1.003362 IP 192.168.1.8.80 > 203.82.48.2.49159: Flags [S.], seq 0, ack 1, win 65535, length 0
1.003375 ARP, Request who-has 192.168.1.1 (ff:ff:ff:ff:ff:ff) tell 192.168.1.11, length 50
1.003387 ARP, Reply 192.168.1.17 is-at 00:00:00:00:00:23, length 50
1.003404 IP 192.168.1.10.80 > 203.82.48.2.49161: Flags [S.], seq 0, ack 1, win 65535, length 0
1.003412 IP 203.82.48.2.49167 > 192.168.1.16.80: Flags [S], seq 0, win 65535, length 0
1.003432 ARP, Request who-has 192.168.1.1 (ff:ff:ff:ff:ff:ff) tell 192.168.1.12, length 50
1.003453 ARP, Reply 192.168.1.18 is-at 00:00:00:00:00:25, length 50
1.003478 ARP, Request who-has 192.168.1.1 (ff:ff:ff:ff:ff:ff) tell 192.168.1.13, length 50
1.003490 ARP, Reply 192.168.1.19 is-at 00:00:00:00:00:27, length 50
1.003508 ARP, Request who-has 192.168.1.1 (ff:ff:ff:ff:ff:ff) tell 192.168.1.15, length 50
1.003533 ARP, Request who-has 192.168.1.1 (ff:ff:ff:ff:ff:ff) tell 192.168.1.14, length 50
1.003540 ARP, Reply 192.168.1.1 is-at 00:00:00:00:00:03, length 50
1.003552 IP 203.82.48.2.49168 > 192.168.1.17.80: Flags [S], seq 0, win 65535, length 0
1.003566 ARP, Request who-has 192.168.1.22 (ff:ff:ff:ff:ff:ff) tell 192.168.1.1, length 50
1.003579 ARP, Reply 192.168.1.1 is-at 00:00:00:00:00:03, length 50
1.003593 IP 203.82.48.2.49169 > 192.168.1.18.80: Flags [S], seq 0, win 65535, length 0
1.003605 ARP, Request who-has 192.168.1.23 (ff:ff:ff:ff:ff:ff) tell 192.168.1.1, length 50
1.003619 ARP, Reply 192.168.1.1 is-at 00:00:00:00:00:03, length 50
1.003632 IP 203.82.48.2.49170 > 192.168.1.19.80: Flags [S], seq 0, win 65535, length 0
1.003644 ARP, Reply 192.168.1.1 is-at 00:00:00:00:00:03, length 50
1.003659 ARP, Reply 192.168.1.1 is-at 00:00:00:00:00:03, length 50
1.003672 ARP, Request who-has 192.168.1.24 (ff:ff:ff:ff:ff:ff) tell 192.168.1.1, length 50
1.003686 ARP, Request who-has 192.168.1.25 (ff:ff:ff:ff:ff:ff) tell 192.168.1.1, length 50
1.003707 ARP, Request who-has 192.168.1.26 (ff:ff:ff:ff:ff:ff) tell 192.168.1.1, length 50
1.003747 ARP, Request who-has 192.168.1.27 (ff:ff:ff:ff:ff:ff) tell 192.168.1.1, length 50
1.003814 ARP, Request who-has 192.168.1.28 (ff:ff:ff:ff:ff:ff) tell 192.168.1.1, length 50
1.003881 ARP, Request who-has 192.168.1.29 (ff:ff:ff:ff:ff:ff) tell 192.168.1.1, length 50
1.003948 ARP, Request who-has 192.168.1.30 (ff:ff:ff:ff:ff:ff) tell 192.168.1.1, length 50
1.004015 ARP, Request who-has 192.168.1.31 (ff:ff:ff:ff:ff:ff) tell 192.168.1.1, length 50
1.004083 ARP, Request who-has 192.168.1.32 (ff:ff:ff:ff:ff:ff) tell 192.168.1.1, length 50
1.004150 ARP, Request who-has 192.168.1.33 (ff:ff:ff:ff:ff:ff) tell 192.168.1.1, length 50
1.004217 ARP, Request who-has 192.168.1.34 (ff:ff:ff:ff:ff:ff) tell 192.168.1.1, length 50
1.004229 ARP, Reply 192.168.1.20 is-at 00:00:00:00:00:29, length 50
1.004241 ARP, Reply 192.168.1.21 is-at 00:00:00:00:00:2b, length 50
1.004262 ARP, Request who-has 192.168.1.1 (ff:ff:ff:ff:ff:ff) tell 192.168.1.16, length 50
1.004277 IP 192.168.1.11.80 > 203.82.48.2.49162: Flags [S.], seq 0, ack 1, win 65535, length 0
1.004292 ARP, Request who-has 192.168.1.1 (ff:ff:ff:ff:ff:ff) tell 192.168.1.17, length 50
1.004305 ARP, Reply 192.168.1.22 is-at 00:00:00:00:00:2d, length 50
1.004317 IP 203.82.48.2.49171 > 192.168.1.20.80: Flags [S], seq 0, win 65535, length 0
1.004332 IP 203.82.48.2.49172 > 192.168.1.21.80: Flags [S], seq 0, win 65535, length 0
1.004347 ARP, Reply 192.168.1.1 is-at 00:00:00:00:00:03, length 50
1.004361 ARP, Request who-has 192.168.1.35 (ff:ff:ff:ff:ff:ff) tell 192.168.1.1, length 50
1.004374 ARP, Reply 192.168.1.1 is-at 00:00:00:00:00:03, length 50
1.004397 IP 203.82.48.2.49173 > 192.168.1.22.80: Flags [S], seq 0, win 65535, length 0
1.004409 ARP, Request who-has 192.168.1.36 (ff:ff:ff:ff:ff:ff) tell 192.168.1.1, length 50
1.004422 ARP, Request who-has 192.168.1.37 (ff:ff:ff:ff:ff:ff) tell 192.168.1.1, length 50
1.004486 ARP, Request who-has 192.168.1.38 (ff:ff:ff:ff:ff:ff) tell 192.168.1.1, length 50
1.004542 IP 192.168.1.12.80 > 203.82.48.2.49163: Flags [S.], seq 0, ack 1, win 65535, length 0
1.004553 ARP, Request who-has 192.168.1.39 (ff:ff:ff:ff:ff:ff) tell 192.168.1.1, length 50
1.004557 ARP, Reply 192.168.1.23 is-at 00:00:00:00:00:2f, length 50
1.004570 ARP, Request who-has 192.168.1.1 (ff:ff:ff:ff:ff:ff) tell 192.168.1.18, length 50
1.004583 IP 192.168.1.13.80 > 203.82.48.2.49164: Flags [S.], seq 0, ack 1, win 65535, length 0
1.004596 ARP, Request who-has 192.168.1.1 (ff:ff:ff:ff:ff:ff) tell 192.168.1.19, length 50
1.004617 IP 192.168.1.15.80 > 203.82.48.2.49166: Flags [S.], seq 0, ack 1, win 65535, length 0
1.004629 ARP, Reply 192.168.1.24 is-at 00:00:00:00:00:31, length 50
1.004636 IP 203.82.48.2.49174 > 192.168.1.23.80: Flags [S], seq 0, win 65535, length 0
1.004655 IP 192.168.1.14.80 > 203.82.48.2.49165: Flags [S.], seq 0, ack 1, win 65535, length 0
1.004670 ARP, Reply 192.168.1.25 is-at 00:00:00:00:00:33, length 50
1.004683 ARP, Reply 192.168.1.26 is-at 00:00:00:00:00:35, length 50
1.004697 ARP, Reply 192.168.1.27 is-at 00:00:00:00:00:37, length 50
1.004704 ARP, Reply 192.168.1.1 is-at 00:00:00:00:00:03, length 50
1.004722 ARP, Reply 192.168.1.28 is-at 00:00:00:00:00:39, length 50
1.004737 ARP, Reply 192.168.1.29 is-at 00:00:00:00:00:3b, length 50
1.004751 ARP, Reply 192.168.1.30 is-at 00:00:00:00:00:3d, length 50
1.004770 ARP, Reply 192.168.1.31 is-at 00:00:00:00:00:3f, length 50
1.004785 ARP, Reply 192.168.1.32 is-at 00:00:00:00:00:41, length 50
1.004797 ARP, Reply 192.168.1.33 is-at 00:00:00:00:00:43, length 50
1.004814 ARP, Reply 192.168.1.34 is-at 00:00:00:00:00:45, length 50
1.004830 ARP, Request who-has 192.168.1.1 (ff:ff:ff:ff:ff:ff) tell 192.168.1.20, length 50
1.004843 ARP, Request who-has 192.168.1.1 (ff:ff:ff:ff:ff:ff) tell 192.168.1.21, length 50
1.004865 IP 192.168.1.16.80 > 203.82.48.2.49167: Flags [S.], seq 0, ack 1, win 65535, length 0
1.004883 ARP, Reply 192.168.1.35 is-at 00:00:00:00:00:47, length 50
1.004896 IP 192.168.1.17.80 > 203.82.48.2.49168: Flags [S.], seq 0, ack 1, win 65535, length 0
1.004908 ARP, Request who-has 192.168.1.1 (ff:ff:ff:ff:ff:ff) tell 192.168.1.22, length 50
1.004921 ARP, Reply 192.168.1.37 is-at 00:00:00:00:00:4b, length 50
1.004936 ARP, Reply 192.168.1.36 is-at 00:00:00:00:00:49, length 50
1.004948 ARP, Reply 192.168.1.38 is-at 00:00:00:00:00:4d, length 50
1.004960 ARP, Reply 192.168.1.39 is-at 00:00:00:00:00:4f, length 50
1.004975 ARP, Request who-has 192.168.1.1 (ff:ff:ff:ff:ff:ff) tell 192.168.1.23, length 50
1.005046 ARP, Reply 192.168.1.1 is-at 00:00:00:00:00:03, length 50
1.005069 ARP, Request who-has 192.168.1.40 (ff:ff:ff:ff:ff:ff) tell 192.168.1.1, length 50
1.005088 IP 192.168.1.18.80 > 203.82.48.2.49169: Flags [S.], seq 0, ack 1, win 65535, length 0
1.005094 IP 203.82.48.2.49175 > 192.168.1.24.80: Flags [S], seq 0, win 65535, length 0
1.005112 IP 192.168.1.19.80 > 203.82.48.2.49170: Flags [S.], seq 0, ack 1, win 65535, length 0
1.005136 ARP, Reply 192.168.1.40 is-at 00:00:00:00:00:51, length 50
1.005193 IP 203.82.48.2.49176 > 192.168.1.25.80: Flags [S], seq 0, win 65535, length 0
1.005207 IP 203.82.48.2.49177 > 192.168.1.26.80: Flags [S], seq 0, win 65535, length 0
1.005219 ARP, Request who-has 192.168.1.41 (ff:ff:ff:ff:ff:ff) tell 192.168.1.1, length 50
1.005236 ARP, Request who-has 192.168.1.1 (ff:ff:ff:ff:ff:ff) tell 192.168.1.24, length 50
1.005248 ARP, Request who-has 192.168.1.1 (ff:ff:ff:ff:ff:ff) tell 192.168.1.25, length 50
1.005272 ARP, Request who-has 192.168.1.1 (ff:ff:ff:ff:ff:ff) tell 192.168.1.26, length 50
1.005301 IP 203.82.48.2.49178 > 192.168.1.27.80: Flags [S], seq 0, win 65535, length 0
1.005318 IP 203.82.48.2.49179 > 192.168.1.28.80: Flags [S], seq 0, win 65535, length 0
1.005330 IP 203.82.48.2.49180 > 192.168.1.29.80: Flags [S], seq 0, win 65535, length 0
1.005349 ARP, Reply 192.168.1.41 is-at 00:00:00:00:00:53, length 50
1.005365 ARP, Request who-has 192.168.1.1 (ff:ff:ff:ff:ff:ff) tell 192.168.1.27, length 50
1.005377 IP 203.82.48.2.49181 > 192.168.1.30.80: Flags [S], seq 0, win 65535, length 0
1.005389 ARP, Request who-has 192.168.1.42 (ff:ff:ff:ff:ff:ff) tell 192.168.1.1, length 50
1.005411 IP 203.82.48.2.49182 > 192.168.1.31.80: Flags [S], seq 0, win 65535, length 0
1.005452 IP 203.82.48.2.49183 > 192.168.1.32.80: Flags [S], seq 0, win 65535, length 0
1.005472 IP 203.82.48.2.49184 > 192.168.1.33.80: Flags [S], seq 0, win 65535, length 0
1.005485 IP 203.82.48.2.49185 > 192.168.1.34.80: Flags [S], seq 0, win 65535, length 0
1.005513 ARP, Request who-has 192.168.1.1 (ff:ff:ff:ff:ff:ff) tell 192.168.1.28, length 50
1.005528 ARP, Request who-has 192.168.1.1 (ff:ff:ff:ff:ff:ff) tell 192.168.1.29, length 50
1.005540 ARP, Request who-has 192.168.1.1 (ff:ff:ff:ff:ff:ff) tell 192.168.1.30, length 50
1.005552 ARP, Reply 192.168.1.42 is-at 00:00:00:00:00:55, length 50
1.005588 ARP, Request who-has 192.168.1.1 (ff:ff:ff:ff:ff:ff) tell 192.168.1.31, length 50
1.005600 ARP, Request who-has 192.168.1.1 (ff:ff:ff:ff:ff:ff) tell 192.168.1.32, length 50
1.005613 ARP, Request who-has 192.168.1.43 (ff:ff:ff:ff:ff:ff) tell 192.168.1.1, length 50
1.005627 ARP, Reply 192.168.1.1 is-at 00:00:00:00:00:03, length 50
1.005640 ARP, Reply 192.168.1.1 is-at 00:00:00:00:00:03, length 50
1.005653 IP 203.82.48.2.49186 > 192.168.1.35.80: Flags [S], seq 0, win 65535, length 0
1.005668 ARP, Request who-has 192.168.1.44 (ff:ff:ff:ff:ff:ff) tell 192.168.1.1, length 50
1.005681 ARP, Reply 192.168.1.1 is-at 00:00:00:00:00:03, length 50
1.005693 IP 203.82.48.2.49188 > 192.168.1.37.80: Flags [S], seq 0, win 65535, length 0
1.005707 IP 203.82.48.2.49187 > 192.168.1.36.80: Flags [S], seq 0, win 65535, length 0
1.005722 IP 203.82.48.2.49189 > 192.168.1.38.80: Flags [S], seq 0, win 65535, length 0
1.005746 ARP, Request who-has 192.168.1.45 (ff:ff:ff:ff:ff:ff) tell 192.168.1.1, length 50
1.005764 IP 203.82.48.2.49190 > 192.168.1.39.80: Flags [S], seq 0, win 65535, length 0
1.005777 ARP, Reply 192.168.1.1 is-at 00:00:00:00:00:03, length 50
1.005791 ARP, Request who-has 192.168.1.46 (ff:ff:ff:ff:ff:ff) tell 192.168.1.1, length 50
1.005803 ARP, Request who-has 192.168.1.47 (ff:ff:ff:ff:ff:ff) tell 192.168.1.1, length 50
1.005822 IP 203.82.48.2.49191 > 192.168.1.40.80: Flags [S], seq 0, win 65535, length 0
1.005834 ARP, Request who-has 192.168.1.48 (ff:ff:ff:ff:ff:ff) tell 192.168.1.1, length 50
1.005848 ARP, Request who-has 192.168.1.49 (ff:ff:ff:ff:ff:ff) tell 192.168.1.1, length 50
1.005861 ARP, Reply 192.168.1.1 is-at 00:00:00:00:00:03, length 50
1.005873 ARP, Reply 192.168.1.1 is-at 00:00:00:00:00:03, length 50
1.005886 ARP, Reply 192.168.1.1 is-at 00:00:00:00:00:03, length 50
1.005906 IP 203.82.48.2.49192 > 192.168.1.41.80: Flags [S], seq 0, win 65535, length 0
1.005920 ARP, Reply 192.168.1.1 is-at 00:00:00:00:00:03, length 50
1.005933 ARP, Reply 192.168.1.1 is-at 00:00:00:00:00:03, length 50
1.005947 ARP, Reply 192.168.1.1 is-at 00:00:00:00:00:03, length 50
1.005970 ARP, Reply 192.168.1.1 is-at 00:00:00:00:00:03, length 50
1.005985 IP 203.82.48.2.49193 > 192.168.1.42.80: Flags [S], seq 0, win 65535, length 0
1.006004 ARP, Reply 192.168.1.1 is-at 00:00:00:00:00:03, length 50
1.006020 ARP, Reply 192.168.1.1 is-at 00:00:00:00:00:03, length 50
1.006319 ARP, Request who-has 192.168.1.1 (ff:ff:ff:ff:ff:ff) tell 192.168.1.33, length 50
1.006319 ARP, Reply 192.168.1.1 is-at 00:00:00:00:00:03, length 50
1.006361 IP 203.82.48.2.49153 > 192.168.1.2.80: Flags [.], ack 1, win 65535, length 0
1.006399 ARP, Request who-has 192.168.1.1 (ff:ff:ff:ff:ff:ff) tell 192.168.1.34, length 50
1.006399 ARP, Reply 192.168.1.1 is-at 00:00:00:00:00:03, length 50
1.006437 ARP, Reply 192.168.1.43 is-at 00:00:00:00:00:57, length 50
1.006437 IP 203.82.48.2.49194 > 192.168.1.43.80: Flags [S], seq 0, win 65535, length 0
1.006449 IP 192.168.1.20.80 > 203.82.48.2.49171: Flags [S.], seq 0, ack 1, win 65535, length 0
1.006461 IP 192.168.1.21.80 > 203.82.48.2.49172: Flags [S.], seq 0, ack 1, win 65535, length 0
1.006475 ARP, Request who-has 192.168.1.1 (ff:ff:ff:ff:ff:ff) tell 192.168.1.35, length 50
1.006490 ARP, Reply 192.168.1.44 is-at 00:00:00:00:00:59, length 50
1.006506 ARP, Request who-has 192.168.1.1 (ff:ff:ff:ff:ff:ff) tell 192.168.1.37, length 50
1.006516 IP 203.82.48.2.49154 > 192.168.1.3.80: Flags [.], ack 1, win 65535, length 0
1.006528 ARP, Reply 192.168.1.1 is-at 00:00:00:00:00:03, length 50
1.006541 IP 203.82.48.2.49195 > 192.168.1.44.80: Flags [S], seq 0, win 65535, length 0
1.006555 ARP, Reply 192.168.1.1 is-at 00:00:00:00:00:03, length 50
1.006576 IP 203.82.48.2.49155 > 192.168.1.4.80: Flags [.], ack 1, win 65535, length 0
1.006740 IP 203.82.48.2.49156 > 192.168.1.5.80: Flags [.], ack 1, win 65535, length 0
1.006807 IP 203.82.48.2.49157 > 192.168.1.6.80: Flags [.], ack 1, win 65535, length 0
1.006815 IP 192.168.1.22.80 > 203.82.48.2.49173: Flags [S.], seq 0, ack 1, win 65535, length 0
1.006827 ARP, Request who-has 192.168.1.1 (ff:ff:ff:ff:ff:ff) tell 192.168.1.36, length 50
1.006845 ARP, Request who-has 192.168.1.1 (ff:ff:ff:ff:ff:ff) tell 192.168.1.38, length 50
1.006857 ARP, Reply 192.168.1.45 is-at 00:00:00:00:00:5b, length 50
1.006877 ARP, Request who-has 192.168.1.1 (ff:ff:ff:ff:ff:ff) tell 192.168.1.39, length 50
1.006892 IP 192.168.1.23.80 > 203.82.48.2.49174: Flags [S.], seq 0, ack 1, win 65535, length 0
1.006904 ARP, Reply 192.168.1.46 is-at 00:00:00:00:00:5d, length 50
1.006916 ARP, Reply 192.168.1.47 is-at 00:00:00:00:00:5f, length 50
1.006930 ARP, Request who-has 192.168.1.1 (ff:ff:ff:ff:ff:ff) tell 192.168.1.40, length 50
1.006945 ARP, Reply 192.168.1.48 is-at 00:00:00:00:00:61, length 50
1.006966 ARP, Reply 192.168.1.49 is-at 00:00:00:00:00:63, length 50
1.006983 IP 192.168.1.25.80 > 203.82.48.2.49176: Flags [S.], seq 0, ack 1, win 65535, length 0
1.007007 IP 192.168.1.24.80 > 203.82.48.2.49175: Flags [S.], seq 0, ack 1, win 65535, length 0
1.007018 ARP, Reply 192.168.1.1 is-at 00:00:00:00:00:03, length 50
1.007030 ARP, Reply 192.168.1.1 is-at 00:00:00:00:00:03, length 50
1.007051 IP 203.82.48.2.49196 > 192.168.1.45.80: Flags [S], seq 0, win 65535, length 0
1.007065 ARP, Reply 192.168.1.1 is-at 00:00:00:00:00:03, length 50
1.007078 IP 203.82.48.2.49197 > 192.168.1.46.80: Flags [S], seq 0, win 65535, length 0
1.007096 IP 203.82.48.2.49198 > 192.168.1.47.80: Flags [S], seq 0, win 65535, length 0
1.007120 ARP, Reply 192.168.1.1 is-at 00:00:00:00:00:03, length 50
1.007132 IP 203.82.48.2.49199 > 192.168.1.48.80: Flags [S], seq 0, win 65535, length 0
1.007146 IP 203.82.48.2.49200 > 192.168.1.49.80: Flags [S], seq 0, win 65535, length 0
1.007293 IP 192.168.1.26.80 > 203.82.48.2.49177: Flags [S.], seq 0, ack 1, win 65535, length 0
1.007305 ARP, Request who-has 192.168.1.1 (ff:ff:ff:ff:ff:ff) tell 192.168.1.41, length 50
1.007305 ARP, Reply 192.168.1.1 is-at 00:00:00:00:00:03, length 50
1.007317 IP 192.168.1.27.80 > 203.82.48.2.49178: Flags [S.], seq 0, ack 1, win 65535, length 0
1.007326 IP 203.82.48.2.49158 > 192.168.1.7.80: Flags [.], ack 1, win 65535, length 0
1.007372 IP 192.168.1.28.80 > 203.82.48.2.49179: Flags [S.], seq 0, ack 1, win 65535, length 0
1.007387 IP 203.82.48.2.49160 > 192.168.1.9.80: Flags [.], ack 1, win 65535, length 0
1.007388 IP 192.168.1.29.80 > 203.82.48.2.49180: Flags [S.], seq 0, ack 1, win 65535, length 0
1.007412 IP 192.168.1.30.80 > 203.82.48.2.49181: Flags [S.], seq 0, ack 1, win 65535, length 0
1.007427 ARP, Request who-has 192.168.1.1 (ff:ff:ff:ff:ff:ff) tell 192.168.1.42, length 50
1.007427 ARP, Reply 192.168.1.1 is-at 00:00:00:00:00:03, length 50
1.007463 IP 192.168.1.31.80 > 203.82.48.2.49182: Flags [S.], seq 0, ack 1, win 65535, length 0
1.007477 IP 192.168.1.32.80 > 203.82.48.2.49183: Flags [S.], seq 0, ack 1, win 65535, length 0
1.007492 IP 192.168.1.33.80 > 203.82.48.2.49184: Flags [S.], seq 0, ack 1, win 65535, length 0
1.007496 IP 203.82.48.2.49159 > 192.168.1.8.80: Flags [.], ack 1, win 65535, length 0
1.007507 IP 192.168.1.2.49153 > 192.168.1.1.9: UDP, length 3
1.007520 IP 192.168.1.34.80 > 203.82.48.2.49185: Flags [S.], seq 0, ack 1, win 65535, length 0
1.007543 ARP, Request who-has 192.168.1.1 (ff:ff:ff:ff:ff:ff) tell 192.168.1.43, length 50
1.007549 ARP, Reply 192.168.1.1 is-at 00:00:00:00:00:03, length 50
1.007574 IP 192.168.1.3.49153 > 192.168.1.1.9: UDP, length 3
1.007589 IP 203.82.48.2.49161 > 192.168.1.10.80: Flags [.], ack 1, win 65535, length 0
1.007667 IP 192.168.1.35.80 > 203.82.48.2.49186: Flags [S.], seq 0, ack 1, win 65535, length 0
1.007682 ARP, Request who-has 192.168.1.1 (ff:ff:ff:ff:ff:ff) tell 192.168.1.44, length 50
1.007682 ARP, Reply 192.168.1.1 is-at 00:00:00:00:00:03, length 50
1.007721 IP 192.168.1.37.80 > 203.82.48.2.49188: Flags [S.], seq 0, ack 1, win 65535, length 0
1.007733 IP 192.168.1.4.49153 > 192.168.1.1.9: UDP, length 3
1.007748 IP 192.168.1.5.49153 > 192.168.1.1.9: UDP, length 3
1.007772 IP 192.168.1.6.49153 > 192.168.1.1.9: UDP, length 3
1.007784 IP 192.168.1.36.80 > 203.82.48.2.49187: Flags [S.], seq 0, ack 1, win 65535, length 0
1.007801 IP 192.168.1.38.80 > 203.82.48.2.49189: Flags [S.], seq 0, ack 1, win 65535, length 0
1.007814 ARP, Request who-has 192.168.1.1 (ff:ff:ff:ff:ff:ff) tell 192.168.1.45, length 50
1.007814 ARP, Reply 192.168.1.1 is-at 00:00:00:00:00:03, length 50
1.007857 IP 192.168.1.39.80 > 203.82.48.2.49190: Flags [S.], seq 0, ack 1, win 65535, length 0
1.007872 ARP, Request who-has 192.168.1.1 (ff:ff:ff:ff:ff:ff) tell 192.168.1.46, length 50
1.007872 ARP, Reply 192.168.1.1 is-at 00:00:00:00:00:03, length 50
1.007884 ARP, Request who-has 192.168.1.1 (ff:ff:ff:ff:ff:ff) tell 192.168.1.47, length 50
1.007891 ARP, Reply 192.168.1.1 is-at 00:00:00:00:00:03, length 50
1.007929 IP 192.168.1.40.80 > 203.82.48.2.49191: Flags [S.], seq 0, ack 1, win 65535, length 0
1.007941 ARP, Request who-has 192.168.1.1 (ff:ff:ff:ff:ff:ff) tell 192.168.1.49, length 50
1.007941 ARP, Reply 192.168.1.1 is-at 00:00:00:00:00:03, length 50
1.007985 ARP, Request who-has 192.168.1.1 (ff:ff:ff:ff:ff:ff) tell 192.168.1.48, length 50
1.007985 ARP, Reply 192.168.1.1 is-at 00:00:00:00:00:03, length 50
1.008027 IP 192.168.1.41.80 > 203.82.48.2.49192: Flags [S.], seq 0, ack 1, win 65535, length 0
1.008046 IP 192.168.1.7.49153 > 192.168.1.1.9: UDP, length 3
1.008058 IP 192.168.1.9.49153 > 192.168.1.1.9: UDP, length 3
1.008082 IP 192.168.1.42.80 > 203.82.48.2.49193: Flags [S.], seq 0, ack 1, win 65535, length 0
1.008099 IP 192.168.1.8.49153 > 192.168.1.1.9: UDP, length 3
1.008111 IP 192.168.1.43.80 > 203.82.48.2.49194: Flags [S.], seq 0, ack 1, win 65535, length 0
1.008123 IP 192.168.1.10.49153 > 192.168.1.1.9: UDP, length 3
1.008145 IP 192.168.1.44.80 > 203.82.48.2.49195: Flags [S.], seq 0, ack 1, win 65535, length 0
1.008169 IP 192.168.1.45.80 > 203.82.48.2.49196: Flags [S.], seq 0, ack 1, win 65535, length 0
1.008194 IP 192.168.1.46.80 > 203.82.48.2.49197: Flags [S.], seq 0, ack 1, win 65535, length 0
1.008208 IP 192.168.1.47.80 > 203.82.48.2.49198: Flags [S.], seq 0, ack 1, win 65535, length 0
1.008221 IP 192.168.1.49.80 > 203.82.48.2.49200: Flags [S.], seq 0, ack 1, win 65535, length 0
1.008235 IP 192.168.1.48.80 > 203.82.48.2.49199: Flags [S.], seq 0, ack 1, win 65535, length 0
1.008411 IP 203.82.48.2.49162 > 192.168.1.11.80: Flags [.], ack 1, win 65535, length 0
1.008458 IP 192.168.1.11.49153 > 192.168.1.1.9: UDP, length 3
1.008677 IP 203.82.48.2.49163 > 192.168.1.12.80: Flags [.], ack 1, win 65535, length 0
1.008723 IP 192.168.1.12.49153 > 192.168.1.1.9: UDP, length 3
1.008744 IP 203.82.48.2.49164 > 192.168.1.13.80: Flags [.], ack 1, win 65535, length 0
1.008791 IP 192.168.1.13.49153 > 192.168.1.1.9: UDP, length 3
1.008811 IP 203.82.48.2.49166 > 192.168.1.15.80: Flags [.], ack 1, win 65535, length 0
1.008858 IP 192.168.1.15.49153 > 192.168.1.1.9: UDP, length 3
1.008878 IP 203.82.48.2.49165 > 192.168.1.14.80: Flags [.], ack 1, win 65535, length 0
1.008925 IP 192.168.1.14.49153 > 192.168.1.1.9: UDP, length 3
1.008999 IP 203.82.48.2.49167 > 192.168.1.16.80: Flags [.], ack 1, win 65535, length 0
1.009046 IP 192.168.1.16.49153 > 192.168.1.1.9: UDP, length 3
1.009066 IP 203.82.48.2.49168 > 192.168.1.17.80: Flags [.], ack 1, win 65535, length 0
1.009113 IP 192.168.1.17.49153 > 192.168.1.1.9: UDP, length 3
1.009222 IP 203.82.48.2.49169 > 192.168.1.18.80: Flags [.], ack 1, win 65535, length 0
1.009269 IP 192.168.1.18.49153 > 192.168.1.1.9: UDP, length 3
1.009290 IP 203.82.48.2.49170 > 192.168.1.19.80: Flags [.], ack 1, win 65535, length 0
1.009336 IP 192.168.1.19.49153 > 192.168.1.1.9: UDP, length 3
1.011078 IP 203.82.48.2.49153 > 192.168.1.2.80: Flags [.], seq 1:513, ack 1, win 65535, length 512
1.011206 IP 192.168.1.2.80 > 203.82.48.2.49153: Flags [.], ack 513, win 65535, length 0
1.011964 IP 203.82.48.2.49154 > 192.168.1.3.80: Flags [.], seq 1:513, ack 1, win 65535, length 512
1.012092 IP 192.168.1.3.80 > 203.82.48.2.49154: Flags [.], ack 513, win 65535, length 0
1.012851 IP 203.82.48.2.49155 > 192.168.1.4.80: Flags [.], seq 1:513, ack 1, win 65535, length 512
1.012978 IP 192.168.1.4.80 > 203.82.48.2.49155: Flags [.], ack 513, win 65535, length 0
1.013737 IP 203.82.48.2.49156 > 192.168.1.5.80: Flags [.], seq 1:513, ack 1, win 65535, length 512
1.013865 IP 192.168.1.5.80 > 203.82.48.2.49156: Flags [.], ack 513, win 65535, length 0
1.014623 IP 203.82.48.2.49157 > 192.168.1.6.80: Flags [.], seq 1:513, ack 1, win 65535, length 512
1.014751 IP 192.168.1.6.80 > 203.82.48.2.49157: Flags [.], ack 513, win 65535, length 0
1.015510 IP 203.82.48.2.49158 > 192.168.1.7.80: Flags [.], seq 1:513, ack 1, win 65535, length 512
1.015638 IP 192.168.1.7.80 > 203.82.48.2.49158: Flags [.], ack 513, win 65535, length 0
1.016396 IP 203.82.48.2.49159 > 192.168.1.8.80: Flags [.], seq 1:513, ack 1, win 65535, length 512
1.016524 IP 192.168.1.8.80 > 203.82.48.2.49159: Flags [.], ack 513, win 65535, length 0
1.017283 IP 203.82.48.2.49160 > 192.168.1.9.80: Flags [.], seq 1:513, ack 1, win 65535, length 512
1.017410 IP 192.168.1.9.80 > 203.82.48.2.49160: Flags [.], ack 513, win 65535, length 0
1.018169 IP 203.82.48.2.49161 > 192.168.1.10.80: Flags [.], seq 1:513, ack 1, win 65535, length 512
1.018297 IP 192.168.1.10.80 > 203.82.48.2.49161: Flags [.], ack 513, win 65535, length 0
1.019055 IP 203.82.48.2.49162 > 192.168.1.11.80: Flags [.], seq 1:513, ack 1, win 65535, length 512
1.019183 IP 192.168.1.11.80 > 203.82.48.2.49162: Flags [.], ack 513, win 65535, length 0
1.019942 IP 203.82.48.2.49163 > 192.168.1.12.80: Flags [.], seq 1:513, ack 1, win 65535, length 512
1.020070 IP 192.168.1.12.80 > 203.82.48.2.49163: Flags [.], ack 513, win 65535, length 0
1.020828 IP 203.82.48.2.49164 > 192.168.1.13.80: Flags [.], seq 1:513, ack 1, win 65535, length 512
1.020956 IP 192.168.1.13.80 > 203.82.48.2.49164: Flags [.], ack 513, win 65535, length 0
1.021715 IP 203.82.48.2.49165 > 192.168.1.14.80: Flags [.], seq 1:513, ack 1, win 65535, length 512
1.021842 IP 192.168.1.14.80 > 203.82.48.2.49165: Flags [.], ack 513, win 65535, length 0
1.022601 IP 203.82.48.2.49166 > 192.168.1.15.80: Flags [.], seq 1:513, ack 1, win 65535, length 512
1.022729 IP 192.168.1.15.80 > 203.82.48.2.49166: Flags [.], ack 513, win 65535, length 0
1.023487 IP 203.82.48.2.49167 > 192.168.1.16.80: Flags [.], seq 1:513, ack 1, win 65535, length 512
1.023615 IP 192.168.1.16.80 > 203.82.48.2.49167: Flags [.], ack 513, win 65535, length 0
1.024374 IP 203.82.48.2.49168 > 192.168.1.17.80: Flags [.], seq 1:513, ack 1, win 65535, length 512
1.024502 IP 192.168.1.17.80 > 203.82.48.2.49168: Flags [.], ack 513, win 65535, length 0
1.025260 IP 203.82.48.2.49169 > 192.168.1.18.80: Flags [.], seq 1:513, ack 1, win 65535, length 512
1.025388 IP 192.168.1.18.80 > 203.82.48.2.49169: Flags [.], ack 513, win 65535, length 0
1.026147 IP 203.82.48.2.49170 > 192.168.1.19.80: Flags [.], seq 1:513, ack 1, win 65535, length 512
1.026214 IP 203.82.48.2.49171 > 192.168.1.20.80: Flags [.], ack 1, win 65535, length 0
1.026261 IP 192.168.1.20.49153 > 192.168.1.1.9: UDP, length 3
1.026274 IP 192.168.1.19.80 > 203.82.48.2.49170: Flags [.], ack 513, win 65535, length 0
1.027100 IP 203.82.48.2.49171 > 192.168.1.20.80: Flags [.], seq 1:513, ack 1, win 65535, length 512
1.027167 IP 203.82.48.2.49172 > 192.168.1.21.80: Flags [.], ack 1, win 65535, length 0
1.027214 IP 192.168.1.21.49153 > 192.168.1.1.9: UDP, length 3
1.027228 IP 192.168.1.20.80 > 203.82.48.2.49171: Flags [.], ack 513, win 65535, length 0
1.028054 IP 203.82.48.2.49172 > 192.168.1.21.80: Flags [.], seq 1:513, ack 1, win 65535, length 512
1.028121 IP 203.82.48.2.49173 > 192.168.1.22.80: Flags [.], ack 1, win 65535, length 0
1.028168 IP 192.168.1.22.49153 > 192.168.1.1.9: UDP, length 3
1.028182 IP 192.168.1.21.80 > 203.82.48.2.49172: Flags [.], ack 513, win 65535, length 0
1.029007 IP 203.82.48.2.49173 > 192.168.1.22.80: Flags [.], seq 1:513, ack 1, win 65535, length 512
1.029075 IP 203.82.48.2.49174 > 192.168.1.23.80: Flags [.], ack 1, win 65535, length 0
1.029121 IP 192.168.1.23.49153 > 192.168.1.1.9: UDP, length 3
1.029135 IP 192.168.1.22.80 > 203.82.48.2.49173: Flags [.], ack 513, win 65535, length 0
1.029961 IP 203.82.48.2.49174 > 192.168.1.23.80: Flags [.], seq 1:513, ack 1, win 65535, length 512
1.030028 IP 203.82.48.2.49176 > 192.168.1.25.80: Flags [.], ack 1, win 65535, length 0
1.030075 IP 192.168.1.25.49153 > 192.168.1.1.9: UDP, length 3
1.030089 IP 192.168.1.23.80 > 203.82.48.2.49174: Flags [.], ack 513, win 65535, length 0
1.030915 IP 203.82.48.2.49176 > 192.168.1.25.80: Flags [.], seq 1:513, ack 1, win 65535, length 512
1.030982 IP 203.82.48.2.49175 > 192.168.1.24.80: Flags [.], ack 1, win 65535, length 0
1.031029 IP 192.168.1.24.49153 > 192.168.1.1.9: UDP, length 3
1.031042 IP 192.168.1.25.80 > 203.82.48.2.49176: Flags [.], ack 513, win 65535, length 0
1.031868 IP 203.82.48.2.49175 > 192.168.1.24.80: Flags [.], seq 1:513, ack 1, win 65535, length 512
1.031935 IP 203.82.48.2.49177 > 192.168.1.26.80: Flags [.], ack 1, win 65535, length 0
1.031982 IP 192.168.1.26.49153 > 192.168.1.1.9: UDP, length 3
1.031996 IP 192.168.1.24.80 > 203.82.48.2.49175: Flags [.], ack 513, win 65535, length 0
1.032822 IP 203.82.48.2.49177 > 192.168.1.26.80: Flags [.], seq 1:513, ack 1, win 65535, length 512
1.032889 IP 203.82.48.2.49178 > 192.168.1.27.80: Flags [.], ack 1, win 65535, length 0
1.032936 IP 192.168.1.27.49153 > 192.168.1.1.9: UDP, length 3
1.032950 IP 192.168.1.26.80 > 203.82.48.2.49177: Flags [.], ack 513, win 65535, length 0
1.033775 IP 203.82.48.2.49178 > 192.168.1.27.80: Flags [.], seq 1:513, ack 1, win 65535, length 512
1.033843 IP 203.82.48.2.49179 > 192.168.1.28.80: Flags [.], ack 1, win 65535, length 0
1.033889 IP 192.168.1.28.49153 > 192.168.1.1.9: UDP, length 3
1.033903 IP 192.168.1.27.80 > 203.82.48.2.49178: Flags [.], ack 513, win 65535, length 0
1.034729 IP 203.82.48.2.49179 > 192.168.1.28.80: Flags [.], seq 1:513, ack 1, win 65535, length 512
1.034796 IP 203.82.48.2.49180 > 192.168.1.29.80: Flags [.], ack 1, win 65535, length 0
1.034843 IP 192.168.1.29.49153 > 192.168.1.1.9: UDP, length 3
1.034857 IP 192.168.1.28.80 > 203.82.48.2.49179: Flags [.], ack 513, win 65535, length 0
1.035683 IP 203.82.48.2.49180 > 192.168.1.29.80: Flags [.], seq 1:513, ack 1, win 65535, length 512
1.035750 IP 203.82.48.2.49181 > 192.168.1.30.80: Flags [.], ack 1, win 65535, length 0
1.035797 IP 192.168.1.30.49153 > 192.168.1.1.9: UDP, length 3
1.035810 IP 192.168.1.29.80 > 203.82.48.2.49180: Flags [.], ack 513, win 65535, length 0
1.036636 IP 203.82.48.2.49181 > 192.168.1.30.80: Flags [.], seq 1:513, ack 1, win 65535, length 512
1.036703 IP 203.82.48.2.49182 > 192.168.1.31.80: Flags [.], ack 1, win 65535, length 0
1.036750 IP 192.168.1.31.49153 > 192.168.1.1.9: UDP, length 3
1.036764 IP 192.168.1.30.80 > 203.82.48.2.49181: Flags [.], ack 513, win 65535, length 0
1.037590 IP 203.82.48.2.49182 > 192.168.1.31.80: Flags [.], seq 1:513, ack 1, win 65535, length 512
1.037657 IP 203.82.48.2.49183 > 192.168.1.32.80: Flags [.], ack 1, win 65535, length 0
1.037704 IP 192.168.1.32.49153 > 192.168.1.1.9: UDP, length 3
1.037718 IP 192.168.1.31.80 > 203.82.48.2.49182: Flags [.], ack 513, win 65535, length 0
1.038543 IP 203.82.48.2.49183 > 192.168.1.32.80: Flags [.], seq 1:513, ack 1, win 65535, length 512
1.038611 IP 203.82.48.2.49184 > 192.168.1.33.80: Flags [.], ack 1, win 65535, length 0
1.038657 IP 192.168.1.33.49153 > 192.168.1.1.9: UDP, length 3
1.038671 IP 192.168.1.32.80 > 203.82.48.2.49183: Flags [.], ack 513, win 65535, length 0
1.039497 IP 203.82.48.2.49184 > 192.168.1.33.80: Flags [.], seq 1:513, ack 1, win 65535, length 512
1.039564 IP 203.82.48.2.49185 > 192.168.1.34.80: Flags [.], ack 1, win 65535, length 0
1.039611 IP 192.168.1.34.49153 > 192.168.1.1.9: UDP, length 3
1.039625 IP 192.168.1.33.80 > 203.82.48.2.49184: Flags [.], ack 513, win 65535, length 0
1.040451 IP 203.82.48.2.49185 > 192.168.1.34.80: Flags [.], seq 1:513, ack 1, win 65535, length 512
1.040518 IP 203.82.48.2.49186 > 192.168.1.35.80: Flags [.], ack 1, win 65535, length 0
1.040565 IP 192.168.1.35.49153 > 192.168.1.1.9: UDP, length 3
1.040578 IP 192.168.1.34.80 > 203.82.48.2.49185: Flags [.], ack 513, win 65535, length 0
1.041404 IP 203.82.48.2.49186 > 192.168.1.35.80: Flags [.], seq 1:513, ack 1, win 65535, length 512
1.041471 IP 203.82.48.2.49188 > 192.168.1.37.80: Flags [.], ack 1, win 65535, length 0
1.041518 IP 192.168.1.37.49153 > 192.168.1.1.9: UDP, length 3
1.041532 IP 192.168.1.35.80 > 203.82.48.2.49186: Flags [.], ack 513, win 65535, length 0
1.042358 IP 203.82.48.2.49188 > 192.168.1.37.80: Flags [.], seq 1:513, ack 1, win 65535, length 512
1.042425 IP 203.82.48.2.49187 > 192.168.1.36.80: Flags [.], ack 1, win 65535, length 0
1.042472 IP 192.168.1.36.49153 > 192.168.1.1.9: UDP, length 3
1.042486 IP 192.168.1.37.80 > 203.82.48.2.49188: Flags [.], ack 513, win 65535, length 0
1.043311 IP 203.82.48.2.49187 > 192.168.1.36.80: Flags [.], seq 1:513, ack 1, win 65535, length 512
1.043379 IP 203.82.48.2.49189 > 192.168.1.38.80: Flags [.], ack 1, win 65535, length 0
1.043425 IP 192.168.1.38.49153 > 192.168.1.1.9: UDP, length 3
1.043439 IP 192.168.1.36.80 > 203.82.48.2.49187: Flags [.], ack 513, win 65535, length 0
1.044265 IP 203.82.48.2.49189 > 192.168.1.38.80: Flags [.], seq 1:513, ack 1, win 65535, length 512
1.044332 IP 203.82.48.2.49190 > 192.168.1.39.80: Flags [.], ack 1, win 65535, length 0
1.044379 IP 192.168.1.39.49153 > 192.168.1.1.9: UDP, length 3
1.044393 IP 192.168.1.38.80 > 203.82.48.2.49189: Flags [.], ack 513, win 65535, length 0
1.045219 IP 203.82.48.2.49190 > 192.168.1.39.80: Flags [.], seq 1:513, ack 1, win 65535, length 512
1.045286 IP 203.82.48.2.49191 > 192.168.1.40.80: Flags [.], ack 1, win 65535, length 0
1.045333 IP 192.168.1.40.49153 > 192.168.1.1.9: UDP, length 3
1.045346 IP 192.168.1.39.80 > 203.82.48.2.49190: Flags [.], ack 513, win 65535, length 0
1.046172 IP 203.82.48.2.49191 > 192.168.1.40.80: Flags [.], seq 1:513, ack 1, win 65535, length 512
1.046239 IP 203.82.48.2.49192 > 192.168.1.41.80: Flags [.], ack 1, win 65535, length 0
1.046286 IP 192.168.1.41.49153 > 192.168.1.1.9: UDP, length 3
1.046300 IP 192.168.1.40.80 > 203.82.48.2.49191: Flags [.], ack 513, win 65535, length 0
1.047126 IP 203.82.48.2.49192 > 192.168.1.41.80: Flags [.], seq 1:513, ack 1, win 65535, length 512
1.047193 IP 203.82.48.2.49193 > 192.168.1.42.80: Flags [.], ack 1, win 65535, length 0
1.047240 IP 192.168.1.42.49153 > 192.168.1.1.9: UDP, length 3
1.047254 IP 192.168.1.41.80 > 203.82.48.2.49192: Flags [.], ack 513, win 65535, length 0
1.048079 IP 203.82.48.2.49193 > 192.168.1.42.80: Flags [.], seq 1:513, ack 1, win 65535, length 512
1.048147 IP 203.82.48.2.49194 > 192.168.1.43.80: Flags [.], ack 1, win 65535, length 0
1.048193 IP 192.168.1.43.49153 > 192.168.1.1.9: UDP, length 3
1.048207 IP 192.168.1.42.80 > 203.82.48.2.49193: Flags [.], ack 513, win 65535, length 0
1.049033 IP 203.82.48.2.49194 > 192.168.1.43.80: Flags [.], seq 1:513, ack 1, win 65535, length 512
1.049100 IP 203.82.48.2.49195 > 192.168.1.44.80: Flags [.], ack 1, win 65535, length 0
1.049147 IP 192.168.1.44.49153 > 192.168.1.1.9: UDP, length 3
1.049161 IP 192.168.1.43.80 > 203.82.48.2.49194: Flags [.], ack 513, win 65535, length 0
1.049987 IP 203.82.48.2.49195 > 192.168.1.44.80: Flags [.], seq 1:513, ack 1, win 65535, length 512
1.050054 IP 203.82.48.2.49196 > 192.168.1.45.80: Flags [.], ack 1, win 65535, length 0
1.050101 IP 192.168.1.45.49153 > 192.168.1.1.9: UDP, length 3
1.050114 IP 192.168.1.44.80 > 203.82.48.2.49195: Flags [.], ack 513, win 65535, length 0
1.050940 IP 203.82.48.2.49196 > 192.168.1.45.80: Flags [.], seq 1:513, ack 1, win 65535, length 512
1.051007 IP 203.82.48.2.49197 > 192.168.1.46.80: Flags [.], ack 1, win 65535, length 0
1.051054 IP 192.168.1.46.49153 > 192.168.1.1.9: UDP, length 3
1.051068 IP 192.168.1.45.80 > 203.82.48.2.49196: Flags [.], ack 513, win 65535, length 0
1.051894 IP 203.82.48.2.49197 > 192.168.1.46.80: Flags [.], seq 1:513, ack 1, win 65535, length 512
1.051961 IP 203.82.48.2.49198 > 192.168.1.47.80: Flags [.], ack 1, win 65535, length 0
1.052008 IP 192.168.1.47.49153 > 192.168.1.1.9: UDP, length 3
1.052022 IP 192.168.1.46.80 > 203.82.48.2.49197: Flags [.], ack 513, win 65535, length 0
1.052847 IP 203.82.48.2.49198 > 192.168.1.47.80: Flags [.], seq 1:513, ack 1, win 65535, length 512
1.052915 IP 203.82.48.2.49200 > 192.168.1.49.80: Flags [.], ack 1, win 65535, length 0
1.052961 IP 192.168.1.49.49153 > 192.168.1.1.9: UDP, length 3
1.052975 IP 192.168.1.47.80 > 203.82.48.2.49198: Flags [.], ack 513, win 65535, length 0
1.053801 IP 203.82.48.2.49200 > 192.168.1.49.80: Flags [.], seq 1:513, ack 1, win 65535, length 512
1.053868 IP 203.82.48.2.49199 > 192.168.1.48.80: Flags [.], ack 1, win 65535, length 0
1.053915 IP 192.168.1.48.49153 > 192.168.1.1.9: UDP, length 3
1.053929 IP 192.168.1.49.80 > 203.82.48.2.49200: Flags [.], ack 513, win 65535, length 0
